rank,uri,artist_names,track_name,source,peak_rank,previous_rank,days_on_chart,streams
1,"spotify:track:2JvzF1RMd7lE3KmFlsyZD8","J. Cole","MIDDLE CHILD","Dreamville, Inc., Under exclusive license to Roc Nation Records",1,2,48,"1425616"
2,"spotify:track:4y3OI86AEP6PQoDE6olYhO","Jonas Brothers","Sucker","Jonas Brothers Recording",1,1,12,"1420792"
3,"spotify:track:6Hj9jySrnFppAI0sEMCZpJ","Juice WRLD","Robbery","Grade A Productions/Interscope Records",2,3,27,"1335809"
4,"spotify:track:6ocbgoVGwYJhOv1GgI9NsF","Ariana Grande","7 rings","Republic Records",1,4,54,"1328540"
5,"spotify:track:6MWtB6iiXyIwun0YzU6DFP","Post Malone","Wow.","Republic Records",1,6,79,"1303065"
6,"spotify:track:7eBqSVxrzQZtK2mmgRG6lC","YNW Melly","Murder On My Mind","P2018",4,5,168,"1281917"
7,"spotify:track:3KkXRkHbMCARz0aVfEt68P","Post Malone, Swae Lee","Sunflower - Spider-Man: Into the Spider-Verse","Universal Records",1,7,146,"1273509"
8,"spotify:track:4kV4N9D1iKVxx1KLvtTpjS","Ariana Grande","break up with your girlfriend, i'm bored","Republic Records",1,9,33,"1194185"
9,"spotify:track:6MjNilJCVKJq0LfFvo5jWJ","Juice WRLD","Fast","Grade A Productions/Interscope Records",6,8,5,"1188584"
10,"spotify:track:2IRZnDFmlqMuOrYOLnZZyc","Meek Mill, Drake","Going Bad (feat. Drake)","MMG/Atlantic",2,10,103,"1087474"
11,"spotify:track:2t8yVaLvJ0RenpXUIAC52d","21 Savage","a lot","Slaughter Gang, LLC/Epic Records",2,11,82,"857558"
12,"spotify:track:63cd4JkwGgYJrbOizbfmsp","Mustard, Migos","Pure Water (with Migos)","10 Summers Records/Interscope Records",12,15,54,"836545"
13,"spotify:track:1wJRveJZLSb1rjhnUHQiv6","A Boogie Wit da Hoodie, 6ix9ine","Swervin (feat. 6ix9ine)","Highbridge the Label / Atlantic Records",12,12,82,"835744"
14,"spotify:track:0rTV5WefWd1J3OwIheTzxM","Khalid, Disclosure","Talk","Right Hand Music Group, LLC/RCA Records",12,17,34,"831995"
15,"spotify:track:4txc3txsIt81diMzGhrVPS","Billie Eilish","wish you were gay","Darkroom/Interscope Records",10,13,9,"794575"
16,"spotify:track:41MCdlvXOl62B7Kv86Bb1v","Juice WRLD","Empty","Grade A Productions/Interscope Records",10,14,5,"775206"
17,"spotify:track:3oh6SCCeLuXhFpEyepla6G","Blueface","Thotiana","Fifth Amendment Entertainment/eOne Music",6,16,66,"774471"
18,"spotify:track:78QR3Wp35dqAhFEc2qAGjE","Lil Baby, Gunna","Drip Too Hard (Lil Baby & Gunna)","Quality Control Music/Young Stoner Life Records, a 300 Entertainment Label/Motown Records/Capitol Records",1,19,182,"762568"
19,"spotify:track:6vWEAOUSxohKxhp0K1BsxL","YNW Melly, Kanye West","Mixed Personalities (feat. Kanye West)","P2019",19,21,53,"760632"
20,"spotify:track:13ZyrkCDmRz5xY3seuAWYk","Juice WRLD","Hear Me Calling","Grade A Productions/Interscope Records",11,18,12,"754304"
21,"spotify:track:0PG9fbaaHFHfre2gUVo7AN","Cardi B, Bruno Mars","Please Me","Atlantic/KSR",10,23,26,"729666"
22,"spotify:track:3e9HZxeyfWwjeyPAMmWSSQ","Ariana Grande","thank u, next","Republic Records",1,22,129,"726195"
23,"spotify:track:3Ol2xnObFdKV9pmRD2t9x8","A Boogie Wit da Hoodie","Look Back at It","Highbridge the Label / Atlantic Records",8,25,96,"717804"
24,"spotify:track:2xLMifQCjDGFmkHkpNLD9h","Travis Scott","SICKO MODE","Cactus Jack / Epic / Grand Hustle",1,24,222,"716647"
25,"spotify:track:5p7ujcrUXASCNwRaWNHR1C","Halsey","Without Me","Capitol Records",5,28,160,"701236"
26,"spotify:track:0FZ4Dmg8jJJAPJnvBIzD9z","Kodak Black, Offset, Travis Scott","ZEZE (feat. Travis Scott & Offset)","Atlantic Records",1,29,152,"697353"
27,"spotify:track:4NzMOnvSJVNKF7nw5NkXIP","Billie Eilish","bury a friend","Darkroom/Interscope Records",3,26,42,"670361"
28,"spotify:track:6Qs4SXO9dwPj5GKvVOv8Ki","Sam Smith, Normani","Dancing With A Stranger (with Normani)","Capitol",10,27,61,"662354"
29,"spotify:track:2dpaYNEQHiRxtZbfNsse99","Marshmello, Bastille","Happier","Astralwerks",5,30,208,"650107"
30,"spotify:track:6eiztdXRkooWsBt2xToMWI","Juice WRLD","Make Believe","Grade A Productions/Interscope Records",20,20,5,"645686"
31,"spotify:track:5icOoE6VgqFKohjWWNp0Ac","Marshmello, CHVRCHES","Here With Me","Marshmello/Republic",31,38,5,"628862"
32,"spotify:track:4ZT9FnbFu1PaBfV3itxiqT","Lil Skies","I","All We Got Ent.",13,33,12,"622015"
33,"spotify:track:2VxeLyX666F8uXCJ0dZF8B","Lady Gaga, Bradley Cooper","Shallow","A Star is Born OST",6,32,164,"620080"
34,"spotify:track:4mUIe9gfsdtsVP2zFIl74x","Juice WRLD","Maze","Grade A Productions/Interscope Records",14,31,5,"597977"
35,"spotify:track:285pBltuF7vW8TeWk8hdRR","Juice WRLD","Lucid Dreams","Juice WRLD Mixtape / ISR P&D",1,35,310,"591998"
36,"spotify:track:1xzBco0xcoJEDXktl7Jxrr","Sheck Wes","Mo Bamba","Cactus Jack Records/ G.O.O.D. Music/ Interscope Records",1,37,229,"590652"
37,"spotify:track:6zeeWid2sgw4lap2jV61PZ","Khalid","Better","Right Hand Music Group, LLC/RCA Records",7,36,180,"587283"
38,"spotify:track:1DUSuNhF8P5vUGNPpQiZa5","Khalid","My Bad","Right Hand Music Group, LLC/RCA Records",16,34,6,"576105"
39,"spotify:track:7COXchtUOMd6uIT6HvmRaI","Lauv, Troye Sivan","i'm so tired...","Lauv",22,39,47,"574312"
40,"spotify:track:2pMl9Sx4glsuk5ikZtFBtX","Lil Nas X","Old Town Road","Columbia",40,43,11,"569726"
41,"spotify:track:7dt6x5M1jzdTEt8oCbisTK","Post Malone","Better Now","Republic Records",1,41,320,"553472"
42,"spotify:track:4TWflhgevIGo448fWc6mQq","Offset","Red Room","Quality Control Music/Motown Records",14,40,27,"531975"
43,"spotify:track:7FGq80cy8juXBCD2nrqdWU","benny blanco, Halsey, Khalid","Eastside (with Halsey & Khalid)","Friends Keep Secrets/Interscope Records",7,42,243,"531864"
44,"spotify:track:2G1tXoGBaEMJ7FKGnkf6ud","Gucci Mane, Bruno Mars, Kodak Black","Wake Up in the Sky","Guwop Enterprises/Atlantic",6,45,180,"524357"
45,"spotify:track:3ee8Jmje8o58CHK66QrVC2","XXXTENTACION","SAD!","Bad Vibes Forever, LLC",1,44,376,"519471"
46,"spotify:track:6ZRuF2n1CQxyxxAAWsKJOy","Kehlani, Ty Dolla $ign","Nights Like This (feat. Ty Dolla $ign)","TSNMI / Atlantic",19,50,61,"519433"
47,"spotify:track:2GGMabyHXnJmjY6CXhhB2e","Cardi B","Money","Atlantic/KSR",9,46,141,"519327"
48,"spotify:track:1WSGTYKLEpKfNQYYW5Oymt","benny blanco, Selena Gomez, J Balvin, Tainy","I Can’t Get Enough (benny blanco, Selena Gomez, J Balvin, Tainy)","NEON16/Friends Keep Secrets/Interscope Records",21,48,12,"513509"
49,"spotify:track:14mHfNsSHN0FbLftyjrV9g","Flipp Dinero","Leave Me Alone","Cinematic/Epic/We The Best",10,47,213,"512245"
50,"spotify:track:79OEIr4J4FHV0O3KrhaXRb","Rich The Kid","Splashin","Interscope Records",27,55,92,"504106"
51,"spotify:track:5wujBwqG7INdStqGd4tRMX","Juice WRLD","Armed And Dangerous","Juice WRLD Mixtape / ISR P&D",9,49,124,"497052"
52,"spotify:track:05t7JMip6JrLuSrMV5yYjX","Calboy","Envy Me","Polo Grounds Music/RCA Records",48,52,76,"494045"
53,"spotify:track:5kfNriitmkNE8mUbZ7gbq8","Khalid","Saturday Nights","Right Hand Music Group, LLC/RCA Records",13,56,139,"482897"
54,"spotify:track:1fewSx2d5KIZ04wsooEBOz","Metro Boomin, Gunna","Space Cadet (feat. Gunna)","Republic Records",15,61,131,"457294"
55,"spotify:track:1NJcg626wLln4pGHpiV7mf","Billie Eilish, Khalid","lovely (with Khalid)","Darkroom",18,57,327,"452026"
56,"spotify:track:2BSbCCbaSCzkOEZa6N5901","Juice WRLD","Flaws And Sins","Grade A Productions/Interscope Records",28,51,5,"448309"
57,"spotify:track:0JP9xo3adEtGSdUEISiszL","XXXTENTACION","Moonlight","Bad Vibes Forever, LLC",2,58,362,"447618"
58,"spotify:track:5w9c2J52mkdntKOmRLeM2m","Daddy Yankee, Snow","Con Calma","El Cartel Records (EC3)",50,66,33,"435898"
59,"spotify:track:4SPu0Ql902hTVXkBoNIYtq","Ariana Grande","NASA","Republic Records",3,59,33,"435547"
60,"spotify:track:14JzyD6FlBD5z0wV5P07YI","Billie Eilish","when the party's over","Darkroom/Interscope Records",10,60,147,"435351"
61,"spotify:track:2Jh3UqxnHJMyzMzku4uOtE","Juice WRLD","Feeling","Grade A Productions/Interscope Records",34,54,5,"430750"
62,"spotify:track:577YBGuskWkVDCxZrLRB4v","Lil Baby","Pure Cocaine","Quality Control Music/Motown Records/Capitol Records",21,67,101,"426551"
63,"spotify:track:2qxmye6gAegTMjLKEBoR3d","Alec Benjamin","Let Me Down Slowly","2018",40,64,67,"425352"
64,"spotify:track:6phY2gnvf9WwCiXlLMQOY3","Juice WRLD","HeMotions","Grade A Productions/Interscope Records",19,53,5,"424747"
65,"spotify:track:1rqqCSm0Qe4I9rUvWncaom","Panic! At The Disco","High Hopes","DCD2 / Fueled By Ramen",12,65,274,"421100"
66,"spotify:track:1TEL6MlSSVLSdhOSddidlJ","Ariana Grande","needy","Republic Records",3,62,33,"417890"
67,"spotify:track:0jAfdqv18goRTUxm3ilRjb","A Boogie Wit da Hoodie, Tyga, Offset","Startender (feat. Offset and Tyga)","Highbridge the Label / Atlantic Records",15,68,89,"404391"
68,"spotify:track:0e7ipj03S05BNilyu5bRzt","Post Malone, 21 Savage","rockstar (feat. 21 Savage)","Republic Records",1,71,544,"400682"
69,"spotify:track:4zxpssj8DyrfZcEUSUiNxG","Juice WRLD, Rvssian, Clever","Ring Ring (with Rvssian feat. Clever)","Grade A Productions/Interscope Records",44,63,5,"393416"
70,"spotify:track:1ThmUihH9dF8EV08ku5AXN","Ski Mask The Slump God","Faucet Failure","Republic Records",66,75,98,"391671"
71,"spotify:track:5IaHrVsrferBYDm0bDyABy","Tyga, Offset","Taste (feat. Offset)","Last Kings Music / EMPIRE",3,79,299,"391518"
72,"spotify:track:0i0wnv9UoFdZ5MfuFGQzMy","Bebe Rexha","Last Hurrah","Warner Records",56,74,23,"388953"
73,"spotify:track:7tFiyTwD0nx5a1eklYtX2J","Queen","Bohemian Rhapsody - Remastered 2011","Hollywood Records",36,73,141,"387839"
74,"spotify:track:116H0KvKr2Zl4RPuVBruDO","Bad Bunny, Drake","MIA (feat. Drake)","OVO Sound/Warner Records",2,76,153,"386826"
75,"spotify:track:0TlLq3lA83rQOYtrqBqSct","Drake","Nonstop","Cash Money/Drake LP6",1,80,257,"386381"
76,"spotify:track:7pMRoGLEJuFM2wl5pt0R99","Offset, Travis Scott, 21 Savage","Legacy (feat. Travis Scott & 21 Savage)","Quality Control Music/Motown Records",12,70,19,"383816"
77,"spotify:track:7m9OqQk4RVRkw9JJdeAw96","XXXTENTACION","Jocelyn Flores","Bad Vibes Forever / EMPIRE",2,77,565,"381004"
78,"spotify:track:11cDEev79fPKi6uJCjUhu8","The Chainsmokers, 5 Seconds of Summer","Who Do You Love","Disruptor Records/Columbia",28,82,33,"380718"
79,"spotify:track:6UTmrvq4nRmx1iQ6iMd1FD","Hozier","Almost (Sweet Music)","Columbia",75,78,26,"380643"
80,"spotify:track:14SaZBTjxlorHJQxXh01Hu","Summer Walker, Drake","Girls Need Love (with Drake) - Remix","LVRN/Interscope Records",40,72,13,"379617"
81,"spotify:track:25sgk305KZfyuqVBQIahim","Ava Max","Sweet but Psycho","Atlantic Records",30,81,155,"369341"
82,"spotify:track:4VXIryQMWpIdGgYR4TrjT1","Juice WRLD","All Girls Are The Same","Juice WRLD Mixtape / ISR P&D",12,83,326,"367705"
83,"spotify:track:7sO5G9EABYOXQKNPNiE9NR","Offset, Metro Boomin","Ric Flair Drip (with Metro Boomin)","Slaughter Gang, LLC/Epic/Quality Control Music/Motown/Capitol/Boominati Worldwide/Republic",4,94,497,"365153"
84,"spotify:track:2MShy1GSSgbmGUxADNIao5","Kodak Black","Calling My Spirit","Atlantic Records",27,95,103,"363839"
85,"spotify:track:58q2HKrzhC3ozto2nDdN4z","Cardi B, Bad Bunny, J Balvin","I Like It","Atlantic/KSR",2,90,341,"363629"
86,"spotify:track:7EQpvVujgytLVY8vKiDHAg","Ariana Grande","bad idea","Republic Records",5,87,33,"361370"
87,"spotify:track:3EPXxR3ImUwfayaurPi3cm","Dean Lewis","Be Alright","Universal Music Australia Pty. Ltd.",19,84,222,"360849"
88,"spotify:track:75ZvA4QfFiZvzhj2xkaWAh","Post Malone","I Fall Apart","Universal Records",2,88,543,"360382"
89,"spotify:track:2hloaUoRonYssMuqLCBLTX","Ariana Grande","bloodline","Republic Records",5,89,33,"358945"
90,"spotify:track:06LFFPPS7MylCZXps3cO4m","Juice WRLD","Who Shot Cupid?","Grade A Productions/Interscope Records",43,69,5,"358368"
91,"spotify:track:39LmTF9RgyakzSYX8txrow","Ariana Grande","imagine","Republic Records",2,86,89,"355890"
92,"spotify:track:6vN77lE9LK6HP2DewaN6HZ","Lil Baby, Drake","Yes Indeed","Quality Control Music, LLC",2,92,302,"355132"
93,"spotify:track:3swc6WTsr7rl9DqQKQA55C","Post Malone, Ty Dolla $ign","Psycho (feat. Ty Dolla $ign)","Republic Records",1,93,383,"352898"
94,"spotify:track:1JkrD47SDpAbyvqKtolcea","Blueface, Cardi B, YG","Thotiana (Remix)","eOne Urban",57,97,19,"350491"
95,"spotify:track:3npzogdOEiVsieXmmhBepL","Maren Morris","The Bones","Columbia Nashville",95,99,5,"346229"
96,"spotify:track:6JQvHMSaR8flFsN53ypOfP","Lil Mosey","Noticed","Mogul Vision/Interscope Records",17,96,208,"345422"
97,"spotify:track:40T5GIqQ1CegGm2PTEl8Bu","Billie Eilish","idontwannabeyouanymore","Darkroom",40,91,233,"345321"
98,"spotify:track:5JEx7HbmvHQQswJCsoo9rA","Ellie Goulding, Diplo, Swae Lee","Close To Me (with Diplo) (feat. Swae Lee)","Polydor Records",30,107,137,"333577"
99,"spotify:track:2iUXsYOEPhVqEBwsqP70rE","5 Seconds of Summer","Youngblood","Capitol",12,98,332,"330804"
100,"spotify:track:4rWC4tiO4NCwRHdh6vyu6b","Juice WRLD","Big","Grade A Productions/Interscope Records",32,85,5,"327648"
101,"spotify:track:4w8niZpiMy6qz1mntFA5uM","DJ Snake, Selena Gomez, Ozuna, Cardi B","Taki Taki (with Selena Gomez, Ozuna & Cardi B)","DJ Snake Music Productions Limited, under exclusive license to Geffen Records",4,103,166,"324557"
102,"spotify:track:7AQim7LbvFVZJE3O8TYgf2","XXXTENTACION, Trippie Redd","Fuck Love (feat. Trippie Redd)","Bad Vibes Forever / EMPIRE",5,101,565,"322667"
103,"spotify:track:5W83ErFkO3aKAIS1WMi6u0","Anuel AA, KAROL G","Secreto","Anuel AA & Karol G - Secreto",88,106,56,"321965"
104,"spotify:track:5WHTFyqSii0lmT9R21abT8","Mabel","Don't Call Me Up","Polydor Records",62,102,32,"321040"
105,"spotify:track:2P91MQbaiQOfbiz9VqhqKQ","Lauv","I Like Me Better","Lauv",30,114,637,"316197"
106,"spotify:track:4qKcDkK6siZ7Jp1Jb4m0aL","BlocBoy JB, Drake","Look Alive (feat. Drake)","OVO Sound/Warner Records",2,126,397,"315852"
107,"spotify:track:4OBZT9EnhYIV17t4pGw7ig","H.E.R., Daniel Caesar","Best Part (feat. Daniel Caesar)","MBK Entertainment/RCA Records",53,105,268,"310371"
108,"spotify:track:25F6MWrnFBCXVnpN4n76EK","Logic","Keanu Reeves","Def Jam Recordings",13,119,54,"309142"
109,"spotify:track:74lnM5V6ecvoTPV0fvptx9","Ski Mask The Slump God, Juice WRLD","Nuketown (feat. Juice WRLD)","Republic Records",13,110,103,"309080"
110,"spotify:track:3wFLWP0FcIqHK1wb1CPthQ","Ariana Grande","fake smile","Republic Records",7,104,33,"307502"
111,"spotify:track:6DCZcSspjsKoFjzjrWoCdn","Drake","God's Plan","Cash Money/Drake LP6",1,116,417,"305811"
112,"spotify:track:4NBTZtAt1F13VvlSKe6KTl","The Chainsmokers, Kelsea Ballerini","This Feeling","Disruptor Records/Columbia",21,124,160,"302276"
113,"spotify:track:1KVczjazCcCCgM3gXXUl47","benny blanco, Juice WRLD, Brendon Urie","Roses (with Juice WRLD feat. Brendon Urie)","Friends Keep Secrets/Interscope Records",41,117,96,"302222"
114,"spotify:track:0AluA5RNsa4Cx6XRhf2hWZ","Metro Boomin, 21 Savage","10 Freaky Girls (with 21 Savage)","Republic Records",7,127,131,"302162"
115,"spotify:track:2uIX8YMNjGMD7441kqyyNU","Billie Eilish","ocean eyes","Darkroom",61,111,257,"300201"
116,"spotify:track:7uH27oIt4a6cIFCA8ZPcyG","Ozuna","Baila Baila Baila","Aura Music Corp.",96,130,41,"299418"
117,"spotify:track:0rKtyWc8bvkriBthvHKY8d","Joji","SLOW DANCING IN THE DARK","88rising Music/Warner Records",26,113,172,"299357"
118,"spotify:track:51NFxnQvaosfDDutk0tams","Billie Eilish","bellyache","Darkroom",39,109,130,"298939"
119,"spotify:track:5274I4mUMnYczyeXkGDWZN","Future, Juice WRLD","Fine China","Epic/Freebandz/Grade A/Interscope",2,122,148,"298492"
120,"spotify:track:5T8EDUDqKcs6OSOwEsfqG7","Queen","Don't Stop Me Now - Remastered 2011","Hollywood Records",69,112,105,"295730"
121,"spotify:track:7GX5flRQZVHRAGd6B4TmDO","Lil Uzi Vert","XO Tour Llif3","Generation Now/Atlantic",1,128,719,"295456"
122,"spotify:track:4eIT2gZ0WZyJpgfmoD6saJ","City Girls","Act Up","Quality Control Music/Motown Records",121,125,10,"293958"
123,"spotify:track:3oDkdAySo1VQQG0ptV7uwa","Juice WRLD","Lean Wit Me","Juice WRLD Mixtape / ISR P&D",25,120,294,"293750"
124,"spotify:track:2rxQMGVafnNaRaXlRMWPde","Luke Combs","Beautiful Crazy","River House Artists/Columbia Nashville",100,123,244,"292756"
125,"spotify:track:7AFASza1mXqntmGtbxXprO","XXXTENTACION","changes","Bad Vibes Forever, LLC",4,129,376,"292670"
126,"spotify:track:3a1lNhkSLSkpJE4MSHpDu9","Post Malone, Quavo","Congratulations","Universal Records",5,133,800,"286945"
127,"spotify:track:4dOmgE4ULbySxpeGObN8RL","Juice WRLD","Syphilis","Grade A Productions/Interscope Records",45,100,5,"286252"
128,"spotify:track:4e4fqjx0Izh4svvTef1z7e","Bebe Rexha, Florida Georgia Line","Meant to Be (feat. Florida Georgia Line)","Warner Bros.",15,135,547,"285994"
129,"spotify:track:67fNrBUMc7iWMofdCaoJV9","Blueface","Bleed It","Cash Money Records Inc.",71,134,54,"283235"
130,"spotify:track:7lAK3oHbfEnvUQWosrMMpR","Travis Scott","YOSEMITE","Cactus Jack / Epic / Grand Hustle",7,139,222,"280246"
131,"spotify:track:4VUwkH455At9kENOfzTqmF","Bazzi, Camila Cabello","Beautiful (feat. Camila Cabello)","iamcosmic",28,148,221,"279069"
132,"spotify:track:0baYVkFX4vIXXmIuHRWXDN","Juice WRLD","Out My Way","Grade A Productions/Interscope Records",60,108,5,"278112"
133,"spotify:track:04MLEeAMuV9IlHEsD8vF6A","French Montana, Drake","No Stylist (feat. Drake)","Epic",14,149,173,"275587"
134,"spotify:track:5Z3GHaZ6ec9bsiI5BenrbY","Khalid","Young Dumb & Broke","Right Hand Music Group, LLC/RCA Records",5,141,699,"275092"
135,"spotify:track:62vpWI1CHwFy7tMIcSStl8","J. Cole","No Role Modelz","Roc Nation Records LLC",64,144,660,"274256"
136,"spotify:track:42fw0rxRO2xbesF6mJfd4Y","Dan + Shay","Tequila","Warner Records",48,138,372,"273948"
137,"spotify:track:4mGdjNMo0RonTlOEb7cYg4","YUNGBLUD, Halsey, Travis Barker","11 Minutes (with Halsey feat. Travis Barker)","Locomotion Recordings/Geffen Records",40,142,26,"271924"
138,"spotify:track:6gBFPUFcJLzWGx4lenP6h2","Travis Scott","goosebumps","Epic/Grand Hustle",16,147,799,"270864"
139,"spotify:track:3GJ4hzg4lrGwU51Y3VARbF","Dan + Shay","Speechless","Warner Records",77,137,203,"270768"
140,"spotify:track:4XiGKQqbmnMVxDzUj6j3f2","YK Osiris","Worth It","Def Jam Recordings",140,143,10,"270123"
141,"spotify:track:0hCHNYL8ApQCGNwJrYN1FY","Lil Skies, Gucci Mane","Bad Girls (feat. Gucci Mane)","All We Got Ent.",35,136,12,"269610"
142,"spotify:track:6PfI6EeLNiNGVAVg11nv7D","Gunna","Speed It Up","300 Entertainment",49,145,29,"268669"
143,"spotify:track:4QIyEq7TcTdAcxjI2AFlAK","6ix9ine, Nicki Minaj, Murda Beatz","FEFE","Scumgang Records/TenThousand Projects, LLC",2,150,234,"268526"
144,"spotify:track:572BChNcXOIvtfn2TGmTKc","Juice WRLD, Young Thug","ON GOD (feat. Young Thug)","Grade A Productions/Interscope Records",47,115,5,"267995"
145,"spotify:track:2qT1uLXPVPzGgFOx4jtEuo","Ariana Grande","no tears left to cry","Republic Records",6,151,326,"265128"
146,"spotify:track:4lD7gHKF1e8Y9stQuVezZB","Ariana Grande","ghostin","Republic Records",8,140,33,"264934"
147,"spotify:track:79esEXlqqmq0GPz0xQSZTV","Shawn Mendes","Lost In Japan","Island Records",16,167,105,"264880"
148,"spotify:track:6GSkLS2y4ZnnZsuRAj975K","Marshmello, Roddy Ricch","Project Dreams","Warner Records",72,158,77,"264072"
149,"spotify:track:15LOSQ3z91ZB2wMiMhiCjZ","Juice WRLD","Desire","Grade A Productions/Interscope Records",58,121,5,"262353"
150,"spotify:track:6Z4rmc0uujCpl8yXe3yjgI","2 Chainz, Travis Scott","Whip (feat. Travis Scott)","Gamebread, LLC / Def Jam Recordings",18,118,12,"261565"
151,"spotify:track:7KXjTSCq5nL1LoYtL7XAwS","Kendrick Lamar","HUMBLE.","Aftermath",1,159,710,"260220"
152,"spotify:track:6Gy7rXB6Ku5vIWC7WGWsl3","6ix9ine, Tory Lanez","KIKA","Scumgang Records/TenThousand Projects, LLC",2,156,106,"259309"
153,"spotify:track:152lZdxL1OR0ZMW6KquMif","Khalid","Location","Right Hand Music Group, LLC/RCA Records",9,152,790,"258062"
154,"spotify:track:6LkawpJyy0TZJ6Z41gMVyy","Juice WRLD","The Bees Knees","Grade A Productions/Interscope Records",62,131,5,"257034"
155,"spotify:track:7pdF27mSDuPWhppnHAmWHa","XXXTENTACION","whoa (mind in awe)","Bad Vibes Forever / EMPIRE",1,153,96,"255705"
156,"spotify:track:5ZOEulH7fvK4ZkMLTOyKL0","Juice WRLD, Brent Faiyaz","Demonz (feat. Brent Faiyaz) - Interlude","Grade A Productions/Interscope Records",38,132,5,"253870"
157,"spotify:track:7fa9MBXhVfQ8P8Df9OEbD8","Maroon 5, Cardi B","Girls Like You (feat. Cardi B) - Cardi B Version","Interscope Records*",6,154,283,"253009"
158,"spotify:track:7DHApOHsIFo7EyfieArYGE","P!nk","Walk Me Home","RCA Records Label",121,166,15,"252732"
159,"spotify:track:3WRIaWsws011vHMd9uzPjG","Future, Travis Scott","First Off (feat. Travis Scott)","Epic/Freebandz",9,160,53,"252344"
160,"spotify:track:6rz0dTA0PdhXImFV5EjM0w","Juice WRLD, Seezyn","Hide (feat. Seezyn)","Universal Records",90,155,86,"251047"
161,"spotify:track:1ZAyjvIk9YiD76yYy0TEG6","Rich The Kid","Plug Walk","Rich The Kid / (TDE/ISR PS)",6,181,394,"250423"
162,"spotify:track:51w9Jbat1pLeWINGCpnQUR","Tory Lanez, Rich The Kid, Lil Wayne","TAlk tO Me (with Rich The Kid feat. Lil Wayne) - Remix","Mad Love/Interscope Records",115,169,62,"249807"
163,"spotify:track:3CA9pLiwRIGtUBiMjbZmRw","Drake","Nice For What","Cash Money/Drake LP6",1,172,338,"248834"
164,"spotify:track:5iwz1NiezX7WWjnCgY5TH4","Pedro Capó, Farruko","Calma - Remix","Sony Music Latin",107,164,73,"248714"
165,"spotify:track:0ZNrc4kNeQYD9koZ3KvCsy","YG, 2 Chainz, Big Sean, Nicki Minaj","BIG BANK (feat. 2 Chainz, Big Sean, Nicki Minaj)","Def Jam Recordings",21,173,292,"247904"
166,"spotify:track:09IStsImFySgyp0pIQdqAc","Zedd, Maren Morris, Grey","The Middle","UMGRI Interscope",5,179,400,"247715"
167,"spotify:track:7uzmGiiJyRfuViKKK3lVmR","Bazzi","Mine","iamcosmic",3,161,417,"246113"
168,"spotify:track:4T652DlATVHe0jdLKaN3Bw","Ariana Grande","in my head","Republic Records",10,157,33,"244429"
169,"spotify:track:2G7V7zsVDxg1yRsu7Ew9RJ","Drake","In My Feelings","Cash Money/Drake LP6",1,170,257,"244285"
170,"spotify:track:4jvjzW7Hm0yK4LvvE0Paz9","Lil Peep, XXXTENTACION","Falling Down - Bonus Track","Columbia",1,163,175,"244081"
171,"spotify:track:45Egmo7icyopuzJN0oMEdk","Khalid, Normani","Love Lies (with Normani)","RCA Records Label",8,177,387,"243001"
172,"spotify:track:22An65gG31JLf9n18qjdhZ","XXXTENTACION","BAD!","Bad Vibes Forever / EMPIRE",2,162,124,"242842"
173,"spotify:track:3GVkPk8mqxz0itaAriG1L7","XXXTENTACION","Everybody Dies In Their Nightmares","Bad Vibes Forever / EMPIRE",6,165,560,"242557"
174,"spotify:track:60SdxE8apGAxMiRrpbmLY0","Eminem, Joyner Lucas","Lucky You (feat. Joyner Lucas)","Aftermath",1,182,189,"242539"
175,"spotify:track:5vdp5UmvTsnMEMESIF2Ym7","Queen","Another One Bites The Dust - Remastered 2011","Hollywood Records",88,168,55,"240571"
176,"spotify:track:4Z9cAwlkruSbWblPBthygg","Juice WRLD","10 Feet","Grade A Productions/Interscope Records",64,146,5,"239151"
177,"spotify:track:5SHhPFh68OhUmuRPymKX9d","FLETCHER","Undrunk","Capitol Records",177,193,2,"238633"
178,"spotify:track:1a7WZZZH7LzyvorhpOJFTe","Juice WRLD, Lil Uzi Vert","Wasted (feat. Lil Uzi Vert)","Juice WRLD Mixtape / ISR P&D",20,171,242,"237561"
179,"spotify:track:7oJrVhiTPZGBXWPwhxjy9S","Lil Skies","Lust","All We Got Ent.",75,178,398,"237472"
180,"spotify:track:1iPBD72u3nAyFEeardYuBV","Lil Mosey","Kamikaze","Mogul Vision/Interscope Records",73,174,138,"237383"
181,"spotify:track:6wWaVoUOzLQJHd3bWAUpdZ","Lil Baby, Gunna, Drake","Never Recover (Lil Baby & Gunna, Drake)","Quality Control Music/Young Stoner Life Records, a 300 Entertainment Label/Motown Records/Capitol Records",1,184,159,"237314"
182,"spotify:track:5aXgz1oKK8Q9z9xvTmSnrO","Trippie Redd","Topanga","TenThousand Projects, LLC",10,175,142,"236425"
183,"spotify:track:2qGfZAgDe1pV2y5xJAhi6R","YoungBoy Never Broke Again","Slime Belief","Never Broke Again, LLC",163,180,23,"235680"
184,"spotify:track:32lItqlMi4LBhb4k0BaSaC","Post Malone","Candy Paint","Republic Records",4,185,648,"235351"
185,"spotify:track:6CTWathupIiDs7U4InHnDA","Ella Mai","Trip","10 Summers / Interscope PS",35,190,190,"230103"
186,"spotify:track:3L19besdNQzd342qL78xqm","A Boogie Wit da Hoodie, Juice WRLD","Demons and Angels (feat. Juice WRLD)","Highbridge the Label / Atlantic Records",30,189,82,"229797"
187,"spotify:track:2v5JTeM6hSmi5wWy7jiwrI","Lil Peep, ILOVEMAKONNEN, Fall Out Boy","I've Been Waiting (w/ ILoveMakonnen & Fall Out Boy)","Columbia",75,188,26,"226782"
188,"spotify:track:2LskIZrCeLxRvCiGP8gxlh","XXXTENTACION, Lil Pump, Swae Lee, Maluma","Arms Around You (feat. Maluma & Swae Lee)","Warner Records",2,176,139,"226185"
189,"spotify:track:5uCax9HTNlzGybIStD3vDh","James Arthur","Say You Won't Let Go","Columbia",14,191,606,"225930"
190,"spotify:track:5nzhL67GpF9szXWg5y509A","Lil Baby","Close Friends (Lil Baby & Gunna)","Quality Control Music/Young Stoner Life Records, a 300 Entertainment Label/Motown Records/Capitol Records",41,192,136,"225547"
191,"spotify:track:2FUNBaa5DwItJtYEBgAblU","21 Savage","monster","Slaughter Gang, LLC/Epic Records",12,187,82,"224250"
192,"spotify:track:1R6VwZ8TuHRzxZUxe88n4I","2 Chainz, Ariana Grande","Rule The World (feat. Ariana Grande)","Gamebread, LLC / Def Jam Recordings",19,-1,9,"222311"
193,"spotify:track:2u7mxWSeoqTXndK5e08jMp","Lil Skies, Landon Cube","Nowadays (feat. Landon Cube)","All We Got Ent.",24,197,425,"221634"
194,"spotify:track:1ahVFh0ViDZr8LvkEVlq3B","Martin Garrix, Bonn","No Sleep (feat. Bonn)","Epic Amsterdam",157,-1,3,"219626"
195,"spotify:track:6Yx181fZzA0YE2EkUsYruq","Why Don't We","Big Plans","Atlantic Records",168,186,17,"218984"
196,"spotify:track:1zB4vmk8tFRmM9UULNzbLB","Imagine Dragons","Thunder","Kid Ina Korner / Interscope",16,-1,644,"218139"
197,"spotify:track:0FQhAHyHGsrbSHvDURmFPn","Billie Eilish","my boy","Darkroom",137,195,65,"217269"
198,"spotify:track:75lcPkAkUsKWHGBlGM476R","Trippie Redd, Juice WRLD","1400 / 999 Freestyle","TenThousand Projects, LLC",15,199,120,"215502"
199,"spotify:track:21kOVEG3bDCVphKhXL8XmQ","Comethazine","Walk","Alamo",109,-1,116,"215166"
200,"spotify:track:5tAa8Uaqr4VvA3693mbIhU","Zara Larsson","Ruin My Life","Epic/Record Company TEN",33,-1,131,"214615"
