rank,uri,artist_names,track_name,source,peak_rank,previous_rank,days_on_chart,streams
1,"spotify:track:7wGoVu4Dady5GV0Sv4UIsx","Post Malone, 21 Savage","rockstar (feat. 21 Savage)","Republic Records",1,1,81,"1714225"
2,"spotify:track:43ZyHQITOjhciSUUNPVRHc","Lil Pump","Gucci Gang","Warner Records",2,2,93,"1175011"
3,"spotify:track:75ZvA4QfFiZvzhj2xkaWAh","Post Malone","I Fall Apart","Universal Records",2,3,80,"1050486"
4,"spotify:track:42CeaId2XNlxugDvyqHfDf","Post Malone","Candy Paint","Republic Records",4,4,193,"986128"
5,"spotify:track:1bhUWB0zJMIKr9yVPrkEuI","Ed Sheeran, Beyoncé","Perfect Duet (Ed Sheeran & Beyoncé)","Atlantic Records UK",3,6,4,"948484"
6,"spotify:track:7sO5G9EABYOXQKNPNiE9NR","Offset, Metro Boomin","Ric Flair Drip (with Metro Boomin)","Slaughter Gang, LLC/Epic/Quality Control Music/Motown/Capitol/Boominati Worldwide/Republic",4,7,35,"947053"
7,"spotify:track:2Xqd0wUttjueBfdcltADOv","G-Eazy, A$AP Rocky, Cardi B","No Limit","BPG/RVG/RCA Records",4,8,88,"867139"
8,"spotify:track:3YU6vJbjYUG0tiJyXf9x5V","G-Eazy, Halsey","Him & I (with Halsey)","BPG/RVG/RCA Records",8,16,4,"840042"
9,"spotify:track:0bYg9bo50gSsH3LtXe2SQn","Mariah Carey","All I Want for Christmas Is You","Columbia",5,5,30,"837481"
10,"spotify:track:0ofbQMrRDsUaVKq2mGLEAb","Camila Cabello, Young Thug","Havana (feat. Young Thug)","Syco Music/Epic",3,9,122,"831527"
11,"spotify:track:1mXVgsBdtIVeCLJnSnmtdV","Sam Smith","Too Good At Goodbyes","Capitol",2,12,88,"828888"
12,"spotify:track:4dVpf9jZjcORqGTLUaeYj9","A$AP Ferg","Plain Jane","RCA Records Label",6,11,101,"802066"
13,"spotify:track:6mrKP2jyIQmM0rw6fQryjr","NF","Let You Down","NF Real Music",12,15,65,"780893"
14,"spotify:track:7EmGUiUaOSGDnUUQUDrOXC","Selena Gomez, Marshmello","Wolves","Selena Gomez PS",3,13,41,"768708"
15,"spotify:track:2fQrGHiQOvpL9UgPvtYy6G","21 Savage","Bank Account","Slaughter Gang, LLC/Epic Records",1,10,151,"768631"
16,"spotify:track:3ncgNpxLoBQ65ABk4djDyd","Famous Dex, A$AP Rocky","PICK IT UP (feat. A$AP Rocky)","300 Entertainment",16,21,39,"715066"
17,"spotify:track:5Z3GHaZ6ec9bsiI5BenrbY","Khalid","Young Dumb & Broke","Right Hand Music Group, LLC/RCA Records",5,18,244,"697832"
18,"spotify:track:7GX5flRQZVHRAGd6B4TmDO","Lil Uzi Vert","XO Tour Llif3","Generation Now/Atlantic",1,14,256,"685848"
19,"spotify:track:0tgVpDi06FyKpA1z0VMD4v","Ed Sheeran","Perfect","Atlantic Records UK",11,22,194,"679399"
20,"spotify:track:5tz69p7tJuGPeMGwNTxYuV","Logic, Alessia Cara, Khalid","1-800-273-8255","Def Jam Recordings",1,19,221,"672097"
21,"spotify:track:1XRgIKC5TPwo7nWGyKqgG0","Gucci Mane, Migos","I Get the Bag (feat. Migos)","Guwop Enterprises/Atlantic",7,17,109,"660636"
22,"spotify:track:6NWl2m8asvH83xjuXVNsuG","Lil Xan","Betrayed","Columbia",22,26,50,"655583"
23,"spotify:track:3hBBKuWJfxlIlnd9QFoC8k","Maroon 5, SZA","What Lovers Do (feat. SZA)","Interscope Records*",7,25,97,"646318"
24,"spotify:track:1YZfcVLbbJwfizR5cDOp3q","Migos, Nicki Minaj, Cardi B","MotorSport","Quality Control Music, LLC",8,20,39,"643176"
25,"spotify:track:7iDa6hUg2VgEL1o1HjmfBn","Bebe Rexha, Florida Georgia Line","Meant to Be (feat. Florida Georgia Line)","Warner Records",22,30,87,"639339"
26,"spotify:track:2ekn2ttSfGqwhhate0LSR0","Dua Lipa","New Rules","Warner Records",15,24,147,"629614"
27,"spotify:track:3a1lNhkSLSkpJE4MSHpDu9","Post Malone, Quavo","Congratulations","Universal Records",5,23,338,"618091"
28,"spotify:track:5AEtlRudpgdT5FtNiuly6Y","Hailee Steinfeld, Alesso, Florida Georgia Line, WATT","Let Me Go (with Alesso, Florida Georgia Line & watt)","Universal Records",20,28,88,"610681"
29,"spotify:track:7vGuf3Y35N4wmASOKLUVVU","Marshmello, Khalid","Silence","Joytime Collective/RCA Records",7,31,116,"593618"
30,"spotify:track:7y9iMe8SOB6z3NoHE2OfXl","Halsey","Bad At Love","Astralwerks (ASW)",22,32,113,"588635"
31,"spotify:track:3T7dNA7O8c3Axj5WyDNcH3","Brenda Lee","Rockin' Around The Christmas Tree","MCA Nashville",27,27,18,"561883"
32,"spotify:track:5u6vkDnOyaf8LsteDAj2ub","21 Savage, Offset, Metro Boomin, Travis Scott","Ghostface Killers (feat. Travis Scott)","Slaughter Gang, LLC/Epic/Quality Control Music/Motown/Capitol/Boominati Worldwide/Republic",2,33,35,"556231"
33,"spotify:track:4DTpngLjoHj5gFxEZFeD3J","Kodak Black, Lil Wayne","Codeine Dreaming (feat. Lil Wayne)","Atlantic Records",33,42,11,"538675"
34,"spotify:track:2771LMNxwf62FTAdpJMQfM","Cardi B","Bodak Yellow","Atlantic/KSR",2,29,137,"532148"
35,"spotify:track:40oKW22ZNNkEdZLJTScaQI","Kodak Black, XXXTENTACION","Roll in Peace (feat. XXXTENTACION)","Atlantic Records",22,36,109,"529617"
36,"spotify:track:1yxgsra98r3qAtxqiGZPiX","Travis Scott","BUTTERFLY EFFECT","Cactus Jack / Epic / Grand Hustle",9,34,199,"512079"
37,"spotify:track:790MhTXPFrYkrqCKvpg4t1","NAV, Lil Uzi Vert","Wanted You (feat. Lil Uzi Vert)","XO Records",33,46,25,"510464"
38,"spotify:track:7KXjTSCq5nL1LoYtL7XAwS","Kendrick Lamar","HUMBLE.","Aftermath",1,35,249,"508528"
39,"spotify:track:6PGoSes0D9eUDeeAafB2As","Kendrick Lamar, Zacari","LOVE. FEAT. ZACARI.","Aftermath",5,40,235,"504724"
40,"spotify:track:7m9OqQk4RVRkw9JJdeAw96","XXXTENTACION","Jocelyn Flores","Bad Vibes Forever / EMPIRE",3,44,102,"491618"
41,"spotify:track:6gBFPUFcJLzWGx4lenP6h2","Travis Scott","goosebumps","Epic/Grand Hustle",16,38,338,"489361"
42,"spotify:track:3m660poUr1chesgkkjQM7P","Demi Lovato","Sorry Not Sorry","Island Records",6,41,147,"483449"
43,"spotify:track:5WoaF1B5XIEnWfmb5NZikf","Miguel, Travis Scott","Sky Walker (feat. Travis Scott)","ByStorm Entertainment/RCA Records",43,53,102,"477281"
44,"spotify:track:7AQim7LbvFVZJE3O8TYgf2","XXXTENTACION, Trippie Redd","Fuck Love (feat. Trippie Redd)","Bad Vibes Forever / EMPIRE",7,48,102,"476031"
45,"spotify:track:152lZdxL1OR0ZMW6KquMif","Khalid","Location","Right Hand Music Group, LLC/RCA Records",9,49,337,"466457"
46,"spotify:track:2FRnf9qhLbvw8fu4IBXx78","Wham!","Last Christmas","Epic",37,37,16,"462139"
47,"spotify:track:3B54sVLJ402zGa6Xm4YGNe","French Montana, Swae Lee","Unforgettable","Bad Boy Entertainment/Epic Records",1,43,242,"455863"
48,"spotify:track:5hslUAKq9I9CG2bAulFkHN","Andy Williams","It's the Most Wonderful Time of the Year","Columbia/Legacy",47,47,16,"455587"
49,"spotify:track:0tKcYR2II1VCQWT79i5NrW","Imagine Dragons","Thunder","Kid Ina Korner / Interscope",16,45,221,"451031"
50,"spotify:track:4IdXngKo4g5exqZ0fQTecu","Bobby Helms","Jingle Bell Rock","Geffen",39,39,15,"448496"
51,"spotify:track:2eAZfqOm4EnOF9VvN50Tyc","Lil Uzi Vert, Oh Wonder","The Way Life Goes (feat. Oh Wonder)","Generation Now/Atlantic",4,52,102,"447331"
52,"spotify:track:2vjmyyAnDUzilFYxOlTdO1","6ix9ine","GUMMO","Strainge Entertainment",52,58,25,"428482"
53,"spotify:track:32DGGj6KlNuBr6WaqRxpxi","Charlie Puth","How Long","Artist Partner",36,56,60,"424080"
54,"spotify:track:2xmrfQpmS2iJExTlklLoAL","Clean Bandit, Julia Michaels","I Miss You (feat. Julia Michaels)","Atlantic Records UK",51,54,39,"423787"
55,"spotify:track:6p8NuHm8uCGnn2Dtbtf7zE","Migos, Gucci Mane","Slippery (feat. Gucci Mane)","Quality Control Music",17,50,312,"419437"
56,"spotify:track:0taOCiup4HNG9LmbduVlJj","YBN Nahmir","Rubbin off the Paint","2018",47,57,43,"401064"
57,"spotify:track:1P17dC1amhFzptugyAO7Il","Taylor Swift","Look What You Made Me Do","Big Machine Records, LLC",1,64,102,"394939"
58,"spotify:track:2yLa0QULdQr0qAIvVwN6B5","Taylor Swift","...Ready For It?","Big Machine Records, LLC",1,66,93,"389111"
59,"spotify:track:1j4kHkkpqZRBwE0A4CN4Yv","ZAYN, Sia","Dusk Till Dawn (feat. Sia) - Radio Edit","RCA Records Label",15,68,89,"388435"
60,"spotify:track:2x0WlnmfG39ZuDmstl9xfX","Taylor Swift, Ed Sheeran, Future","End Game","Big Machine Records, LLC",60,75,4,"388307"
61,"spotify:track:1f5cbQtDrykjarZVrShaDI","A Boogie Wit da Hoodie, Kodak Black","Drowning (feat. Kodak Black)","Highbridge The Label",18,60,263,"387450"
62,"spotify:track:65Q2mv3UlVi9eO70OpsmSe","Burl Ives","A Holly Jolly Christmas - Single Version","Geffen",51,51,13,"387446"
63,"spotify:track:0OI7AFifLSoGzpb8bdBLLV","Machine Gun Kelly, X Ambassadors, Bebe Rexha","Home (with Machine Gun Kelly, X Ambassadors & Bebe Rexha)","Atlantic Records",60,65,13,"383496"
64,"spotify:track:4pYZLpX23Vx8rwDpJCpPTA","Rich The Kid, Kendrick Lamar","New Freezer (feat. Kendrick Lamar)","Rich The Kid / (TDE/ISR PS)",62,79,69,"380398"
65,"spotify:track:1zsG4eaZmkA1dvjDDsAGLK","Luis Fonsi, Demi Lovato","Échame La Culpa","UMLE - Latino",47,55,18,"378545"
66,"spotify:track:5yuShbu70mtHXY0yLzCQLQ","Post Malone","Go Flex","Universal Records",19,69,338,"376494"
67,"spotify:track:4so0Wek9Ig1p6CRCHuINwW","Bing Crosby, Ken Darby Singers, John Scott Trotter & His Orchestra","White Christmas","Geffen",62,62,12,"366864"
68,"spotify:track:299lFlaAsNQdgbIZNPmIA0","Vince Guaraldi Trio","Christmas Time Is Here - Vocal","Craft Recordings",59,59,12,"362861"
69,"spotify:track:1Qg9jWGDkKAGZXj5v2OG59","Maroon 5","Wait","Interscope Records*",38,71,32,"361743"
70,"spotify:track:7inXu0Eaeg02VsM8kHNvzM","Frank Sinatra, B. Swanson Quartet","Let It Snow! Let It Snow! Let It Snow! (with The B. Swanson Quartet)","Columbia/Legacy",62,63,12,"358653"
71,"spotify:track:4svZDCRz4cJoneBpjpx8DJ","Taylor Swift","I Did Something Bad","Big Machine Records, LLC",71,96,4,"348311"
72,"spotify:track:4knL4iPxPOZjQzTUlELGSY","Yo Gotti, Nicki Minaj","Rake It Up (feat. Nicki Minaj)","Epic/CMG",17,61,167,"338903"
73,"spotify:track:5humEOJehpAwMJEJmb0JJ2","Nat King Cole","The Christmas Song (Merry Christmas To You)","Capitol Records",67,67,12,"338875"
74,"spotify:track:1R0a2iXumgCiFb7HEZ7gUE","Taylor Swift","Don’t Blame Me","Big Machine Records, LLC",74,101,4,"336631"
75,"spotify:track:6QgjcU0zLnzq5OrUoSZ3OK","Portugal. The Man","Feel It Still","Atlantic Records",13,73,172,"333542"
76,"spotify:track:1ZY1PqizIl78geGM4xWlEA","Taylor Swift","Gorgeous","Big Machine Records, LLC",2,97,39,"333305"
77,"spotify:track:6NFyWDv5CjfwuzoCkw47Xf","Taylor Swift","Delicate","Big Machine Records, LLC",77,105,4,"333154"
78,"spotify:track:3QiAAp20rPC3dcAtKtMaqQ","Elvis Presley","Blue Christmas","RCA Victor",74,74,12,"329809"
79,"spotify:track:5RCfvwDewu6p2x1mEI6smX","Tay-K","The Race","88 Classic",33,70,114,"327822"
80,"spotify:track:3whrwq4DtvucphBPUogRuJ","Camila Cabello, Daddy Yankee","Havana - Remix","Syco Music/Epic",50,77,20,"324859"
81,"spotify:track:1hvpDAxZPKjKztOc72sv06","Band Aid","Do They Know It's Christmas? - 1984 Version","EMI",72,72,12,"322559"
82,"spotify:track:3kxfsdsCpFgN412fpnW85Y","Childish Gambino","Redbone","Glassnote Entertainment Group LLC",8,80,338,"317639"
83,"spotify:track:5gx2E5aIXMRBellPZW1up5","Chris Brown, Yo Gotti, A Boogie Wit da Hoodie, Kodak Black","Pills & Automobiles (feat. Yo Gotti, A Boogie Wit Da Hoodie & Kodak Black)","RCA Records Label",70,78,69,"314809"
84,"spotify:track:6HZILIRieu8S0iqY8kIKhj","Kendrick Lamar","DNA.","Aftermath",2,89,235,"312800"
85,"spotify:track:4cxMGhkinTocPSVVKWIw0d","Russ","Losin Control","Columbia",58,107,319,"311564"
86,"spotify:track:0q75NwOoFiARAVp4EXU4Bs","SZA, Travis Scott","Love Galore (feat. Travis Scott)","Top Dawg Entertainment/RCA Records",23,100,215,"311080"
87,"spotify:track:25oOaleife6E2MIKmFkPvg","Young Thug, Future","Relationship (feat. Future)","Atlantic Records",53,91,172,"308661"
88,"spotify:track:6eT7xZZlB2mwyzJ2sUKG6w","Post Malone","White Iverson","Universal Records",56,93,338,"307758"
89,"spotify:track:7qiZfU4dY1lWllzX7mPBI3","Ed Sheeran","Shape of You","Atlantic Records UK",1,90,333,"306886"
90,"spotify:track:1WIZiOuNO3woKfdlSK2gNn","Kodak Black","Transportin'","Atlantic Records",30,88,107,"304807"
91,"spotify:track:4tHqQMWSqmL6YjXwsqthDI","Mykola Dmytrovych Leontovych, John Williams","Carol of the Bells","Masterworks",76,76,12,"304637"
92,"spotify:track:2z4pcBLQXF2BXKFvd0BuB6","Jason Derulo, French Montana","Tip Toe (feat. French Montana)","Beluga Heights/Warner Records",74,98,20,"304603"
93,"spotify:track:1GwMQaZz6Au3QLDbjbMdme","Taylor Swift","Call It What You Want","Big Machine Records, LLC",12,112,24,"304372"
94,"spotify:track:0CcQNd8CINkwQfe1RDtGV6","Imagine Dragons","Believer","Kid Ina Korner / Interscope",9,85,306,"303612"
95,"spotify:track:7Ed6BkggCS2KaKY5YlINaF","BTS, Desiigner, Steve Aoki","MIC Drop (feat. Desiigner) [Steve Aoki Remix]","BIGHIT MUSIC",74,95,11,"298477"
96,"spotify:track:1e1JKLEDKP7hEQzJfNAgPl","Playboi Carti","Magnolia","AWGE Label",10,83,228,"295322"
97,"spotify:track:1uL78kFWxhz3umTMWJu8n5","Lil Uzi Vert","Sauce It Up","Generation Now/Atlantic",6,94,102,"294900"
98,"spotify:track:5VEuraNSVxMTzDTtrmL3lQ","Bing Crosby","Winter Wonderland - Remastered","Geffen",82,82,11,"294758"
99,"spotify:track:0lLdorYw7lVrJydTINhWdI","Michael Bublé","It's Beginning to Look a Lot like Christmas","143/Reprise",91,102,12,"292030"
100,"spotify:track:6GNifiuBPrKFpwNBYnooFm","Lil Uzi Vert, Nicki Minaj, Oh Wonder","The Way Life Goes (feat. Nicki Minaj & Oh Wonder) - Remix","Generation Now/Atlantic",58,104,32,"285165"
101,"spotify:track:2nUJvBO87SkxCViQsLc9Zr","Big Shaq","Man's Not Hot","Universal-Island Records Ltd.",101,-1,16,"284156"
102,"spotify:track:0VgkVdmE4gld66l8iyGjgx","Future","Mask Off","Epic/Freebandz/A1",2,84,291,"282184"
103,"spotify:track:6IeK3Ap5m3HabwJxgI6eSE","Perry Como, The Fontane Sisters, Mitchell Ayres & His Orchestra","It's Beginning to Look a Lot Like Christmas (with Mitchell Ayres & His Orchestra)","RCA Records Label",81,81,12,"279141"
104,"spotify:track:4iLqG9SeJSnt0cSPICSjxv","Charlie Puth","Attention","Artist Partner",16,103,228,"277227"
105,"spotify:track:1ADjWm8QNhgNV8yCNNgQ1T","Ariana Grande","Santa Tell Me","Universal Records",86,86,11,"276353"
106,"spotify:track:3GVkPk8mqxz0itaAriG1L7","XXXTENTACION","Everybody Dies In Their Nightmares","Bad Vibes Forever / EMPIRE",15,115,102,"275631"
107,"spotify:track:7taXf5odg9xCAZERYfyOkS","José Feliciano","Feliz Navidad","RCA/BMG Heritage",87,87,12,"274666"
108,"spotify:track:7mldq42yDuxiUNn08nvzHO","Sam Hunt","Body Like A Back Road","MCA Nashville",12,111,307,"274169"
109,"spotify:track:2rb5MvYT7ZIxbKW5hfcHx8","J Balvin, Willy William","Mi Gente","UMLE - Latino",7,99,158,"269753"
110,"spotify:track:6gU9OKjOE7ghfEd55oRO57","SZA","The Weekend","Top Dawg Entertainment/RCA Records",82,118,152,"269227"
111,"spotify:track:5Htb1uFQ1KrkFXlefS8oGj","Demi Lovato","Tell Me You Love Me","Island Records",82,134,4,"268862"
112,"spotify:track:32OWobmyAz8J2qA8iWekyS","Justin Bieber","Mistletoe","RBMG/Def Jam",92,92,11,"268288"
113,"spotify:track:2Za1AlJNvksouPPWbXpR2X","Macklemore, Kesha","Good Old Days (feat. Kesha)","Bendo LLC",57,126,74,"265892"
114,"spotify:track:2pnPe4pJtq7689i5ydzvJJ","Chuck Berry","Run Rudolph Run - Single Version","Geffen*",108,108,11,"264246"
115,"spotify:track:0VE4kBnHJUgtMf0dy6DRmW","Taylor Swift","Getaway Car","Big Machine Records, LLC",115,144,4,"263619"
116,"spotify:track:6H0AwSQ20mo62jGlPGB8S6","2 Chainz, Ty Dolla $ign, Trey Songz, Jhené Aiko","It's A Vibe","2Chainz PS/Def Jam",35,110,241,"263340"
117,"spotify:track:5uCax9HTNlzGybIStD3vDh","James Arthur","Say You Won't Let Go","Columbia",14,128,338,"263153"
118,"spotify:track:6sn8WaooLLVhQvU96wtEAm","Lil Peep","Save That Shit","Lil Peep",34,133,19,"262261"
119,"spotify:track:5NT0aZqWImC9fTzkW4z48o","6ix9ine","KOODA","Scumgang Records",119,-1,1,"262057"
120,"spotify:track:0Zbbxnx4SGGHoIow4PpISP","Kygo, Justin Jesso","Stargazing","Kygo",47,131,70,"258234"
121,"spotify:track:07NxDD1iKCHbAldceD7QLP","Taylor Swift","This Is Why We Can't Have Nice Things","Big Machine Records, LLC",121,156,4,"250550"
122,"spotify:track:4eqne0oIdt9GW2ubiliny0","Judy Garland","Have Yourself A Merry Little Christmas","Geffen",109,109,4,"247999"
123,"spotify:track:4hXAK3mjFVFOOiJQ3rKAXi","Burl Ives","Rudolph The Red-Nosed Reindeer","Geffen",106,106,9,"247098"
124,"spotify:track:2rE9TX3VQ0WNt7kziFhKep","Lorde, Khalid, Post Malone, SZA","Homemade Dynamite (Feat. Khalid, Post Malone & SZA) - REMIX","Universal Music New Zealand Limited",32,142,81,"246206"
125,"spotify:track:1foCxQtxBweJtZmdxhEHVO","Eartha Kitt, Henri René and His Orchestra","Santa Baby (with Henri René & His Orchestra)","RCA Bluebird",119,119,11,"245901"
126,"spotify:track:7F5oktn5YOsR9eR5YsFtqb","Taylor Swift","New Year’s Day","Big Machine Records, LLC",126,171,4,"244026"
127,"spotify:track:2EEeOnHehOozLq4aS0n6SL","KYLE, Lil Yachty","iSpy (feat. Lil Yachty)","independently popular.",2,113,338,"243417"
128,"spotify:track:6oVxXO5oQ4pTpO8RSnkzvv","Taylor Swift","Dress","Big Machine Records, LLC",128,175,4,"243182"
129,"spotify:track:5b2QnYcT9rQIkhRWt4HztQ","Eminem, Beyoncé","Walk On Water (feat. Beyoncé)","Aftermath",4,141,25,"242746"
130,"spotify:track:7DsX5K72fewVGb47qj7Tbg","Sam Smith","Pray","Capitol",25,161,60,"242706"
131,"spotify:track:68m6iwhKElLTBaGRG1LLwE","Diplo, MØ","Get It Right","Mad Decent",93,151,13,"242457"
132,"spotify:track:15EPc80XuFrb2LmOzGjuRg","GoldLink, Brent Faiyaz, Shy Glizzy","Crew (feat. Brent Faiyaz & Shy Glizzy)","Squaaash Club/RCA Records",103,129,137,"242244"
133,"spotify:track:7zVCrzzEJU7u24sbJPXA5W","Kane Brown, Lauren Alaina","What Ifs (feat. Lauren Alaina)","RCA Records Label Nashville",45,149,189,"242177"
134,"spotify:track:62vpWI1CHwFy7tMIcSStl8","J. Cole","No Role Modelz","Roc Nation Records LLC",64,123,338,"241667"
135,"spotify:track:1wjzFQodRWrPcQ0AnYnvQ9","Lauv","I Like Me Better","Lauv",30,139,183,"241316"
136,"spotify:track:7HuBDWi18s4aJM8UFnNheH","Taylor Swift","King Of My Heart","Big Machine Records, LLC",136,177,4,"239493"
137,"spotify:track:0jdny0dhgjUwoIp5GkqEaA","Kesha","Praying","Kemosabe Records/RCA Records",15,148,152,"239091"
138,"spotify:track:3Ga6eKrUFf12ouh9Yw3v2D","Anitta, J Balvin","Downtown","WM Brazil",96,150,11,"238667"
139,"spotify:track:19EnyPZhNPbRoCxAuv5pKD","Miguel","Pineapple Skies","ByStorm Entertainment/RCA Records",139,162,5,"237784"
140,"spotify:track:4gavOCQdZ2g86gkvi17FM7","Paul McCartney","Wonderful Christmastime - Edited Version / Remastered 2011","Paul McCartney Catalog",116,116,11,"236708"
141,"spotify:track:4Q3N4Ct4zCuIHuZ65E3BD4","Kodak Black","Tunnel Vision","Atlantic Records",5,124,291,"236484"
142,"spotify:track:0SGkqnVQo9KPytSri1H6cF","Big Sean","Bounce Back","Getting Out Our Dreams Inc. (G.O.O.D.) Music / IDJ",3,127,338,"236297"
143,"spotify:track:6SwRhMLwNqEi6alNPVG00n","Kendrick Lamar, Rihanna","LOYALTY. FEAT. RIHANNA.","Aftermath",4,135,235,"234710"
144,"spotify:track:5CtI0qwDJkDQGwXD1H1cLb","Luis Fonsi, Daddy Yankee, Justin Bieber","Despacito - Remix","UMLE - Latino",1,114,232,"234485"
145,"spotify:track:2OALaHcDdKkjYEpAr0Qzab","Avicii, Rita Ora","Lonely Together (feat. Rita Ora)","Universal Music AB",52,160,116,"234272"
146,"spotify:track:6EpRaXYhGOB3fj4V2uDkMJ","Liam Payne, Quavo","Strip That Down (feat. Quavo)","Capitol",11,125,200,"234032"
147,"spotify:track:0ESJlaM8CE1jRWaNtwSNj8","Travis Scott","beibs in the trap","Epic/Grand Hustle",95,143,330,"233977"
148,"spotify:track:38yBBH2jacvDxrznF7h08J","Niall Horan","Slow Hands","Capitol Records (US1A)",24,147,215,"232618"
149,"spotify:track:59J5nzL1KniFHnU120dQzt","Playboi Carti, Lil Uzi Vert","wokeuplikethis*","AWGE Label",52,136,235,"231953"
150,"spotify:track:5PxFv9yJEg9dxvbZggykro","Taylor Swift","So It Goes...","Big Machine Records, LLC",142,189,4,"231700"
151,"spotify:track:7I7JbDv63ZJJsSi24DyJrz","Taylor Swift","Dancing With Our Hands Tied","Big Machine Records, LLC",151,196,4,"231392"
152,"spotify:track:3DXncPQOG4VBw3QHh3S817","DJ Khaled, Justin Bieber, Quavo, Chance the Rapper, Lil Wayne","I'm the One (feat. Justin Bieber, Quavo, Chance the Rapper & Lil Wayne)","Epic/We The Best",2,122,221,"231057"
153,"spotify:track:4Km5HrUvYTaSUfiSGPJeQR","Migos, Lil Uzi Vert","Bad and Boujee (feat. Lil Uzi Vert)","Quality Control Music",1,117,338,"230721"
154,"spotify:track:3zJw3rugfpVrmBeDDnUYzy","John Lennon, Yoko Ono","Happy Xmas (War Is Over) - Remastered 2010","EMI Catalogue",130,130,10,"230622"
155,"spotify:track:7hDc8b7IXETo14hHIHdnhd","Drake","Passionfruit","Cash Money Records/Young Money Ent./Universal Rec.",1,132,261,"230139"
156,"spotify:track:6M0IsaUX4GNyto4niSegfI","Post Malone","No Option","Universal Records",104,164,78,"224537"
157,"spotify:track:5xlS0QkVrSH7ssEbBgBzbM","The Beach Boys","Little Saint Nick - 1991 Remix","Capitol Records",120,120,4,"222926"
158,"spotify:track:1m8WpLYXEiNVZchsWEcCSy","Miguel, J. Cole, Salaam Remi","Come Through and Chill (feat. J. Cole & Salaam Remi)","ByStorm Entertainment/RCA Records",96,-1,3,"222316"
159,"spotify:track:550rQQCGkrTzvp4SfpOPzx","Pentatonix","Hallelujah","RCA Records Label",145,145,9,"220922"
160,"spotify:track:7EI6Iki24tBHAMxtb4xQN2","Rita Ora","Anywhere","Atlantic Records UK",119,140,15,"220463"
161,"spotify:track:22nyEAEM29tcBRhukR089b","Jaden","Icon","MSFTS/Roc Nation",97,183,11,"220312"
162,"spotify:track:2LBqCSwhJGcFQeTHMVGwy3","The Weeknd","Die For You","Universal Republic Records",75,190,109,"219790"
163,"spotify:track:7y4JznkAv2W3IKw9T1o2VK","Daya","New","UMGRI Interscope",85,193,47,"219591"
164,"spotify:track:4AtZRwSR8BOTTQg5ihSggt","6LACK","PRBLMS","LVRN Records",93,173,304,"218712"
165,"spotify:track:4QX5pZQpQTgVlkqfUTDim0","Dean Martin","Silver Bells","Legacy Recordings",121,121,5,"217913"
166,"spotify:track:7KOlJ92bu51cltsD9KU5I7","Migos","T-Shirt","Quality Control Music",6,146,326,"216643"
167,"spotify:track:0CokSRCu5hZgPxcZBaEzVE","Macklemore, Skylar Grey","Glorious (feat. Skylar Grey)","Bendo LLC",19,158,139,"215971"
168,"spotify:track:5uu28fUesZMl89lf9CLrgN","Cheat Codes, Fetty Wap, CVBZ","Feels Great (feat. Fetty Wap & CVBZ)","300 Entertainment",74,186,51,"215911"
169,"spotify:track:3Q3myFA7q4Op95DOpHplaY","blackbear","do re mi","Alamo",26,152,255,"215897"
170,"spotify:track:43PuMrRfbyyuz4QpZ3oAwN","Bryson Tiller","Exchange","TrapSoul/RCA Records",79,199,318,"213713"
171,"spotify:track:0KKkJNfGyhkQ5aFogxQAPU","Bruno Mars","That's What I Like","Atlantic Records",3,138,338,"213268"
172,"spotify:track:7floNISpH8VF4z4459Qo18","XXXTENTACION","Look At Me!","Bad Vibes Forever / EMPIRE",25,137,279,"211843"
173,"spotify:track:05nbZ1xxVNwUTcGwLbp7CN","NAV","Myself","XO Records",89,185,221,"211540"
174,"spotify:track:30MM5jWpUmOxtTNd9Ey5LZ","Thomas Rhett","Unforgettable","The Valory Music Co.",35,-1,129,"210646"
175,"spotify:track:0OlnLZY4cmQzT6ZGttvWBM","Martin Garrix, David Guetta, Jamie Scott, Romy Dya","So Far Away (feat. Jamie Scott & Romy Dya)","Epic Amsterdam",75,195,4,"207340"
176,"spotify:track:3muBQDekYAg7jm6hDu6R0Z","Tee Grizzley","First Day Out","300 Entertainment",67,166,297,"206957"
177,"spotify:track:0tdCy39PgWN8LFWu34ORn3","21 Savage, Offset, Metro Boomin, Quavo","Rap Saved Me (feat. Quavo)","Slaughter Gang, LLC/Epic/Quality Control Music/Motown/Capitol/Boominati Worldwide/Republic",13,-1,34,"206803"
178,"spotify:track:3pXF1nA74528Edde4of9CC","Bryson Tiller","Don't","TrapSoul/RCA Records",77,-1,331,"206677"
179,"spotify:track:5yFSF6qQA1rcLsQRnBsZgb","Alan Walker, Noah Cyrus, Digital Farm Animals, Juliander","All Falls Down (feat. Juliander)","MER Recordings",138,-1,12,"203422"
180,"spotify:track:4z8sz6E4YyFuEkv5o7IJni","Pentatonix","Mary, Did You Know?","RCA Records Label",172,172,2,"202829"
181,"spotify:track:6tUgfsOa8PLkoede5nOR7D","N.E.R.D, Rihanna, Pharrell Williams","Lemon","Columbia",45,169,33,"202817"
182,"spotify:track:1MQ8ydvrTnn2QJgXFATJvD","6LACK","Ex Calling","LVRN Records",58,200,168,"202323"
183,"spotify:track:5hcisvFMidkMJlElTO9Qmw","Bad Bunny, Prince Royce, J Balvin, Mambo Kingz, DJ Luian","Sensualidad","Hear This Music",159,188,16,"201367"
184,"spotify:track:1rsAFUCa6BVMgRQ3FCQQsi","Lil Pump","Boss","Warner Records",54,159,107,"201338"
185,"spotify:track:1OAh8uOEOvTDqkKFsKksCi","DJ Khaled, Rihanna, Bryson Tiller","Wild Thoughts (feat. Rihanna & Bryson Tiller)","Epic/We The Best",1,155,172,"200288"
186,"spotify:track:79cuOz3SPQTuFrp8WgftAu","Shawn Mendes","There's Nothing Holdin' Me Back","Island Records",26,182,229,"199215"
187,"spotify:track:3vWxQ6wOfMr8zH1u7pVFI6","Trippie Redd","Bust Down","Strainge Entertainment",119,191,65,"198802"
188,"spotify:track:1nX9KhK3Fff27SnrIor2Yb","2 Chainz, Travis Scott","4 AM","2Chainz PS/Def Jam",19,174,189,"198605"
189,"spotify:track:53mrVsi49rLHIaKBiSvElG","blackbear, Gucci Mane","do re mi (feat. Gucci Mane)","Alamo",55,187,127,"197428"
190,"spotify:track:5aAx2yezTd8zXrkmtKl66Z","The Weeknd, Daft Punk","Starboy","Universal Republic Records",3,178,338,"196317"
191,"spotify:track:1mMLMZYXkMueg65jRRWG1l","Luke Combs","When It Rains It Pours","River House Artists/Columbia Nashville",110,-1,111,"196018"
192,"spotify:track:0uxSUdBrJy9Un0EYoBowng","Lil Uzi Vert","20 Min","Generation Now/Atlantic",86,-1,10,"195294"
193,"spotify:track:1m69ELEgE6k5ZWsap40ozt","Ozuna","Se Preparó","VP Records Corp/Dimelo Vi",118,180,45,"194708"
194,"spotify:track:0kdiUZDcLIFw0Buo9r0Q4z","LANCO","Greatest Love Story","Arista Nashville",147,-1,56,"194598"
195,"spotify:track:5hTpBe8h35rJ67eAWHQsJx","Aminé","Caroline","Universal Records",6,168,338,"193829"
196,"spotify:track:7r6LNJT2LqpLpEyZQJPygt","Future, Young Thug, Offset","Patek Water (feat. Offset)","Epic/300/Atlantic Recording Corporation",16,197,46,"193359"
197,"spotify:track:7faDzZnZYqTyYThx2sbHVQ","Frank Sinatra","Mistletoe And Holly - Remastered 1999","Capitol Records",184,184,2,"192793"
198,"spotify:track:2nYwV62UABTH0NanrwVIdQ","Rae Sremmurd, Swae Lee, Slim Jxmmi","Perplexing Pegasus - From SR3MM","Mike WiLL Made-It",35,194,123,"192409"
199,"spotify:track:3pndPhlQWjuSoXhcIIdBjv","Russ","What They Want","Columbia",109,-1,329,"192240"
200,"spotify:track:5gIRPQWULwrvIt0F6pY7ph","Kygo, OneRepublic","Stranger Things (feat. OneRepublic)","Kygo",124,-1,17,"192196"
