rank,uri,artist_names,track_name,source,peak_rank,previous_rank,days_on_chart,streams
1,"spotify:track:5CtI0qwDJkDQGwXD1H1cLb","Luis Fonsi, Daddy Yankee, Justin Bieber","Despacito - Remix","UMLE - Latino",1,1,82,"1532529"
2,"spotify:track:2eMwDehkIC1j68U6FA3Eiq","Lil Uzi Vert","XO Tour Llif3","Generation Now/Atlantic",2,2,106,"1382493"
3,"spotify:track:1OAh8uOEOvTDqkKFsKksCi","DJ Khaled, Rihanna, Bryson Tiller","Wild Thoughts (feat. Rihanna & Bryson Tiller)","Epic/We The Best",3,3,22,"1319475"
4,"spotify:track:3DXncPQOG4VBw3QHh3S817","DJ Khaled, Justin Bieber, Quavo, Chance the Rapper, Lil Wayne","I'm the One (feat. Justin Bieber, Quavo, Chance the Rapper & Lil Wayne)","Epic/We The Best",2,4,71,"1259395"
5,"spotify:track:7KXjTSCq5nL1LoYtL7XAwS","Kendrick Lamar","HUMBLE.","Aftermath",1,5,99,"1195238"
6,"spotify:track:1F2HXIJrE2Xn81OzT2zZvW","French Montana, Swae Lee","Unforgettable","Bad Boy Entertainment/Epic Records",6,6,92,"1124147"
7,"spotify:track:3a1lNhkSLSkpJE4MSHpDu9","Post Malone, Quavo","Congratulations","Universal Records",5,7,188,"1017258"
8,"spotify:track:7tr2za8SQg2CI8EDgrdtNl","Calvin Harris, Frank Ocean, Migos, Funk Wav","Slide (feat. Frank Ocean & Migos)","Columbia",8,8,134,"907048"
9,"spotify:track:3kxfsdsCpFgN412fpnW85Y","Childish Gambino","Redbone","Glassnote Entertainment Group LLC",8,9,188,"885662"
10,"spotify:track:152lZdxL1OR0ZMW6KquMif","Khalid","Location","Right Hand Music Group, LLC/RCA Records",9,10,187,"838677"
11,"spotify:track:5bcTCxgc7xVfSaMV3RuVke","Calvin Harris, Pharrell Williams, Katy Perry, Big Sean, Funk Wav","Feels (feat. Pharrell Williams, Katy Perry & Big Sean)","Columbia",9,11,22,"823367"
12,"spotify:track:6HZILIRieu8S0iqY8kIKhj","Kendrick Lamar","DNA.","Aftermath",2,13,85,"793569"
13,"spotify:track:6Na5uKk5SsqZimk0hAWo8y","Drake","Signs","Cash Money Records/Young Money Ent./Universal Rec.",7,12,14,"785182"
14,"spotify:track:7mldq42yDuxiUNn08nvzHO","Sam Hunt","Body Like A Back Road","MCA Nashville",12,16,157,"739278"
15,"spotify:track:3rOSwuTsUlJp0Pu0MkN8r8","Future","Mask Off","Epic/Freebandz/A1",2,14,141,"736257"
16,"spotify:track:0CcQNd8CINkwQfe1RDtGV6","Imagine Dragons","Believer","Kid Ina Korner / Interscope",9,17,156,"727385"
17,"spotify:track:5eqK0tbzUPo2SoeZsov04s","21 Savage","Bank Account","Slaughter Gang, LLC/Epic Records",17,-1,1,"725893"
18,"spotify:track:1e1JKLEDKP7hEQzJfNAgPl","Playboi Carti","Magnolia","AWGE Label",10,15,78,"708936"
19,"spotify:track:3A7qX2QjDlPnazUsRk5y0M","David Guetta, Justin Bieber","2U","""2 U"" PS (Bieber/Guetta)",8,20,29,"706028"
20,"spotify:track:0lMbuWUpfTWhEmOKxppEau","Calvin Harris, Future, Khalid, Funk Wav","Rollin (feat. Future & Khalid)","Columbia",14,18,57,"702307"
21,"spotify:track:5tz69p7tJuGPeMGwNTxYuV","Logic, Alessia Cara, Khalid","1-800-273-8255","Def Jam Recordings",7,19,71,"695403"
22,"spotify:track:79NlESqzFSW0hdBWgls4FX","Kesha","Praying","Kemosabe Records/RCA Records",22,93,2,"693803"
23,"spotify:track:6EpRaXYhGOB3fj4V2uDkMJ","Liam Payne, Quavo","Strip That Down (feat. Quavo)","Capitol",19,23,50,"683346"
24,"spotify:track:1yxgsra98r3qAtxqiGZPiX","Travis Scott","BUTTERFLY EFFECT","Cactus Jack / Epic / Grand Hustle",19,21,49,"680312"
25,"spotify:track:4iLqG9SeJSnt0cSPICSjxv","Charlie Puth","Attention","Artist Partner",19,24,78,"666819"
26,"spotify:track:0KKkJNfGyhkQ5aFogxQAPU","Bruno Mars","That's What I Like","Atlantic Records",3,25,188,"656386"
27,"spotify:track:6gBFPUFcJLzWGx4lenP6h2","Travis Scott","goosebumps","Epic/Grand Hustle",16,26,188,"645387"
28,"spotify:track:6p8NuHm8uCGnn2Dtbtf7zE","Migos, Gucci Mane","Slippery (feat. Gucci Mane)","Quality Control Music",17,27,162,"644831"
29,"spotify:track:0dA2Mk56wEzDgegdC6R17g","Zedd, Alessia Cara","Stay","UMGRI Interscope",9,22,134,"613646"
30,"spotify:track:0Nhu3zSYbEz32IYiobV75e","Halsey","Now Or Never","Astralwerks (ASW)",12,28,94,"605556"
31,"spotify:track:0tKcYR2II1VCQWT79i5NrW","Imagine Dragons","Thunder","Kid Ina Korner / Interscope",16,29,71,"593738"
32,"spotify:track:1sCxVKWImDZSZKvG0U9B23","Selena Gomez","Bad Liar","Selena Gomez PS",6,31,51,"590831"
33,"spotify:track:7qiZfU4dY1lWllzX7mPBI3","Ed Sheeran","Shape of You","Atlantic Records UK",1,30,183,"588003"
34,"spotify:track:1CKd1PnqfYx0H12V9MSaIY","Zedd, Liam Payne","Get Low (with Liam Payne)","UMGRI Interscope",34,-1,1,"555524"
35,"spotify:track:167NczpNbRF7oWakJaY3Hh","Niall Horan","Slow Hands","Capitol Records (US1A)",33,33,65,"555360"
36,"spotify:track:6Q2FftbUG530lCtBI74bMH","A Boogie Wit da Hoodie, Kodak Black","Drowning (feat. Kodak Black)","Highbridge The Label",24,32,113,"553910"
37,"spotify:track:7hDc8b7IXETo14hHIHdnhd","Drake","Passionfruit","Cash Money Records/Young Money Ent./Universal Rec.",1,35,111,"553340"
38,"spotify:track:79cuOz3SPQTuFrp8WgftAu","Shawn Mendes","There's Nothing Holdin' Me Back","Island Records",26,36,79,"543417"
39,"spotify:track:6PGoSes0D9eUDeeAafB2As","Kendrick Lamar, Zacari","LOVE. FEAT. ZACARI.","Aftermath",5,34,85,"541470"
40,"spotify:track:1nX9KhK3Fff27SnrIor2Yb","2 Chainz, Travis Scott","4 AM","2Chainz PS/Def Jam",19,38,39,"517479"
41,"spotify:track:2EEeOnHehOozLq4aS0n6SL","KYLE, Lil Yachty","iSpy (feat. Lil Yachty)","independently popular.",2,37,188,"513237"
42,"spotify:track:6kig1UFggPUyZBCvXD3Wod","Metro Boomin, Offset, Drake","No Complaints (feat. Offset & Drake) (Bonus)","Republic Records",26,39,14,"486001"
43,"spotify:track:19HA9J80qZfIkAnp2g8N2S","21 Savage","Famous","Slaughter Gang, LLC/Epic Records",43,-1,1,"464550"
44,"spotify:track:1wjzFQodRWrPcQ0AnYnvQ9","Lauv","I Like Me Better","Lauv",42,45,33,"440054"
45,"spotify:track:6RUKPb4LETWmmr3iAEQktW","The Chainsmokers, Coldplay","Something Just Like This","Disruptor Records/Columbia",2,41,136,"437647"
46,"spotify:track:4aWmUDTfIPGksMNLV2rQP2","Luis Fonsi, Daddy Yankee","Despacito","UMLE - Latino",13,43,168,"436545"
47,"spotify:track:6SwRhMLwNqEi6alNPVG00n","Kendrick Lamar, Rihanna","LOYALTY. FEAT. RIHANNA.","Aftermath",4,42,85,"436050"
48,"spotify:track:2rb5MvYT7ZIxbKW5hfcHx8","J Balvin, Willy William","Mi Gente","UMLE - Latino",48,62,8,"435582"
49,"spotify:track:6jA8HL9i4QGzsj6fjoxp8Y","Martin Garrix, Troye Sivan","There for You","Epic Amsterdam",30,40,43,"433319"
50,"spotify:track:6H0AwSQ20mo62jGlPGB8S6","2 Chainz, Ty Dolla $ign, Trey Songz, Jhené Aiko","It's A Vibe","2Chainz PS/Def Jam",42,44,91,"432388"
51,"spotify:track:2bjwRfXMk4uRgOD9IBYl9h","Drake, Quavo, Travis Scott","Portland","Cash Money Records/Young Money Ent./Universal Rec.",2,46,111,"415469"
52,"spotify:track:1SJtlNRJDeYHioymcvsqev","Camila Cabello","Crying in the Club","Syco Music/Epic",50,50,50,"411999"
53,"spotify:track:4Q3N4Ct4zCuIHuZ65E3BD4","Kodak Black","Tunnel Vision","Atlantic Records",5,47,141,"410222"
54,"spotify:track:0G149jkGWKwrPXUGkEDgWM","21 Savage","Numb","Slaughter Gang, LLC/Epic Records",54,-1,1,"402038"
55,"spotify:track:0SGkqnVQo9KPytSri1H6cF","Big Sean","Bounce Back","Getting Out Our Dreams Inc. (G.O.O.D.) Music / IDJ",3,49,188,"396965"
56,"spotify:track:3Ytr1SUCUi6J3L9dRFx5iH","Major Lazer, Travis Scott, Camila Cabello, Quavo","Know No Better","Mad Decent",34,48,36,"390064"
57,"spotify:track:5Z3GHaZ6ec9bsiI5BenrbY","Khalid","Young Dumb & Broke","Right Hand Music Group, LLC/RCA Records",51,51,94,"385944"
58,"spotify:track:28mrq1UKIVItTbPqyub52b","21 Savage","Close My Eyes","Slaughter Gang, LLC/Epic Records",58,-1,1,"379322"
59,"spotify:track:2MnJoNVtf0pw7HUn3I1Tih","21 Savage","Bad Business","Slaughter Gang, LLC/Epic Records",59,-1,1,"372497"
60,"spotify:track:0q75NwOoFiARAVp4EXU4Bs","SZA, Travis Scott","Love Galore (feat. Travis Scott)","Top Dawg Entertainment/RCA Records",52,59,65,"369263"
61,"spotify:track:7BKLCZ1jbUBVqRi2FVlTVw","The Chainsmokers, Halsey","Closer","Disruptor Records/Columbia",4,52,188,"361606"
62,"spotify:track:1sXUWdKx03aP9Gmzft58rt","Julia Michaels","Issues","J/Republic",11,53,173,"351967"
63,"spotify:track:3eR23VReFzcdmS7TYCrhCe","Kygo, Selena Gomez","It Ain’t Me (with Selena Gomez)","Interscope",3,54,142,"349923"
64,"spotify:track:6zLdXcmvIxnAXpz9sXFnIE","Thomas Rhett, Maren Morris","Craving You","The Valory Music Co.",56,56,47,"338785"
65,"spotify:track:2habSXqcJGExM6JJyskY7O","Miley Cyrus","Malibu","RCA Records Label",7,55,58,"338152"
66,"spotify:track:5xVOqZL4oKJKcXgQvrfx2z","French Montana, Pharrell Williams","Bring Dem Things","Bad Boy Entertainment/Epic Records",66,-1,1,"336990"
67,"spotify:track:6mapJIPnQ23RTAevUoE0DL","Rae Sremmurd","Swang","Mike WiLL Made-It",21,63,188,"334596"
68,"spotify:track:7KOlJ92bu51cltsD9KU5I7","Migos","T-Shirt","Quality Control Music",6,58,176,"332178"
69,"spotify:track:4xlrALxuaCf9yZBHJeTSG6","Jonas Blue, William Singe","Mama","Positiva",54,61,52,"330489"
70,"spotify:track:6kex4EBAj0WHXDKZMEJaaF","Jason Derulo, Nicki Minaj, Ty Dolla $ign","Swalla (feat. Nicki Minaj & Ty Dolla $ign)","Beluga Heights/Warner Records",32,65,124,"329451"
71,"spotify:track:5uCax9HTNlzGybIStD3vDh","James Arthur","Say You Won't Let Go","Columbia",14,57,188,"328897"
72,"spotify:track:4Km5HrUvYTaSUfiSGPJeQR","Migos, Lil Uzi Vert","Bad and Boujee (feat. Lil Uzi Vert)","Quality Control Music",1,64,188,"325450"
73,"spotify:track:59J5nzL1KniFHnU120dQzt","Playboi Carti, Lil Uzi Vert","wokeuplikethis*","AWGE Label",52,60,85,"324133"
74,"spotify:track:4q8PHoRsPUB52LFylX8Ulz","Axwell /\ Ingrosso","More Than You Know","EMI",58,66,37,"321462"
75,"spotify:track:2mfUa8bLs2s5N4VaqJZ4lZ","Hailee Steinfeld","Most Girls","Universal Records",51,67,66,"319663"
76,"spotify:track:6sBB5CBuzKJhDooro1IraE","21 Savage","Baby Girl","Slaughter Gang, LLC/Epic Records",76,-1,1,"316806"
77,"spotify:track:1EaKU4dMbesXXd3BrLCtYG","Kendrick Lamar","ELEMENT.","Aftermath",3,69,85,"314039"
78,"spotify:track:1GFvYZ72Ca67UG9Kdjjk3C","21 Savage","Thug Life","Slaughter Gang, LLC/Epic Records",78,-1,1,"307272"
79,"spotify:track:4ARPvK8DHLwt4oX65ZAFMw","XXXTENTACION","Look At Me!","Bad Vibes Forever / EMPIRE",25,68,129,"306334"
80,"spotify:track:3Q3myFA7q4Op95DOpHplaY","blackbear","do re mi","Alamo",26,70,105,"305814"
81,"spotify:track:6gHWMJzCYkbDcsqKHoycJw","21 Savage","FaceTime","Slaughter Gang, LLC/Epic Records",81,-1,1,"302042"
82,"spotify:track:343YBumqHu19cGoGARUTsd","Drake","Fake Love","Cash Money Records/Young Money Ent./Universal Rec.",2,71,188,"293082"
83,"spotify:track:1NDxZ7cFAo481dtYWdrUnR","Maggie Lindemann, Cheat Codes, CADE","Pretty Girl - Cheat Codes X CADE Remix","300 Entertainment",58,74,98,"288377"
84,"spotify:track:0pSBuHjILhNEo55xK1zrRt","Ayo & Teo","Rolex","Columbia",31,73,154,"286753"
85,"spotify:track:2XaInsPPUkZRkY4uFJ3AHK","Gucci Mane, Offset","Met Gala (feat. Offset)","Guwop Enterprises/Atlantic",51,80,43,"283720"
86,"spotify:track:3muBQDekYAg7jm6hDu6R0Z","Tee Grizzley","First Day Out","300 Entertainment",67,75,147,"282764"
87,"spotify:track:7LEydI5NfjY6mZfKwYIptZ","Fifth Harmony, Gucci Mane","Down (feat. Gucci Mane)","Syco Music/Epic",49,76,36,"281956"
88,"spotify:track:7yyRTcZmCiyzzJlNzGC9Ol","Shelley FKA DRAM, Lil Yachty","Broccoli","EMPIRE / Atlantic Recording Corporation",6,77,188,"278498"
89,"spotify:track:2Gl0FzuLxflY6nPifJp5Dr","Kygo, Ellie Goulding","First Time","Kygo",35,72,71,"277443"
90,"spotify:track:6UjfByV1lDLW0SOVQA4NAi","Drake","Gyalchester","Cash Money Records/Young Money Ent./Universal Rec.",3,79,111,"276465"
91,"spotify:track:4IWAyPf1KMq7JCyGeCjTeH","Imagine Dragons","Whatever It Takes","Kid Ina Korner / Interscope",42,78,57,"272595"
92,"spotify:track:0qYTZCo5Bwh1nsUFGZP3zn","Maluma","Felices los 4","Sony Music Latin",92,99,66,"271445"
93,"spotify:track:4c2W3VKsOFoIg2SFaO6DY5","Rita Ora","Your Song","Atlantic Records UK",71,81,39,"270602"
94,"spotify:track:5aAx2yezTd8zXrkmtKl66Z","The Weeknd, Daft Punk","Starboy","Universal Republic Records",3,83,188,"269527"
95,"spotify:track:0v9Wz8o0BT8DU38R4ddjeH","Chance the Rapper, Lil Wayne, 2 Chainz","No Problem (feat. Lil Wayne & 2 Chainz)","Chance the Rapper",12,85,188,"264368"
96,"spotify:track:6DLSa36zH0cSTO7bWCCxx0","21 Savage","Nothin New","Slaughter Gang, LLC/Epic Records",96,-1,1,"263128"
97,"spotify:track:1xznGGDReH1oQq0xzbwXa3","Drake, WizKid, Kyla","One Dance","Cash Money Records/Young Money Ent./Universal Rec.",7,87,188,"260695"
98,"spotify:track:1louJpMmzEicAn7lzDalPW","Cheat Codes, Demi Lovato","No Promises (feat. Demi Lovato)","300 Entertainment",50,82,99,"260263"
99,"spotify:track:6xHI9KjUjYT0FPtGO8Mxa1","Luke Combs","Hurricane","River House Artists/Columbia Nashville",77,86,120,"253801"
100,"spotify:track:12o6dxWGk29uIAP3OWY0pM","Lorde","Homemade Dynamite","Universal Music New Zealand Limited",51,88,22,"249211"
101,"spotify:track:20dP2DaMHIAmwWAbp7peSr","Young Thug, Travis Scott","pick up the phone","Epic/Grand Hustle",39,94,188,"248725"
102,"spotify:track:3NdDpSvN911VPGivFlV5d0","ZAYN, Taylor Swift","I Don’t Wanna Live Forever (Fifty Shades Darker)","Big Machine Records, LLC",3,89,188,"248233"
103,"spotify:track:6eT7xZZlB2mwyzJ2sUKG6w","Post Malone","White Iverson","Universal Records",71,92,188,"248056"
104,"spotify:track:0B8QzDH7YWih85V5SEMnyJ","Lil Uzi Vert","Money Longer","Generation Now/Atlantic",61,96,188,"245037"
105,"spotify:track:6fwdbPMwP1zVStm8FybmkO","21 Savage, Metro Boomin, Future","X (feat. Future)","Slaughter Gang, LLC",14,108,188,"242078"
106,"spotify:track:0utlOiJy2weVl9WTkcEWHy","J. Cole","Neighbors","J. Cole P&D",36,104,170,"240528"
107,"spotify:track:2pmYug1wWd0WoK5tpbsbKL","21 Savage","Dead People","Slaughter Gang, LLC/Epic Records",107,-1,1,"237868"
108,"spotify:track:4cxMGhkinTocPSVVKWIw0d","Russ","Losin Control","Columbia",58,95,169,"236293"
109,"spotify:track:1pGAvZo2axYXAXYiSeYEqY","Tyler, The Creator, Frank Ocean, Steve Lacy","911 / Mr. Lonely (feat. Frank Ocean & Steve Lacy)","Columbia",48,102,8,"236275"
110,"spotify:track:5Ohxk2dO5COHF1krpoPigN","Harry Styles","Sign of the Times","Columbia",17,97,92,"236128"
111,"spotify:track:10M2Ex445zw585Ducldzkw","Brett Young","In Case You Didn't Know","Big Machine Label Group, LLC",94,98,104,"235439"
112,"spotify:track:5q5gzmbBS5yQzos2BvVr1t","MØ","Nights With You","Chess Club/RCA Victor",83,101,54,"234720"
113,"spotify:track:5yuShbu70mtHXY0yLzCQLQ","Post Malone","Go Flex","Universal Records",93,103,188,"234560"
114,"spotify:track:0ESJlaM8CE1jRWaNtwSNj8","Travis Scott","beibs in the trap","Epic/Grand Hustle",99,105,180,"233724"
115,"spotify:track:1U3XdjHLA6TgpVEGTikNcp","21 Savage","7 Min Freestyle","Slaughter Gang, LLC/Epic Records",115,-1,1,"232365"
116,"spotify:track:06RzVT7uWMYv2fPTyiOy1m","21 Savage","Money Convo","Slaughter Gang, LLC/Epic Records",116,-1,1,"231234"
117,"spotify:track:2wf9bp4MkChojtljddWpbO","6LACK","PRBLMS","LVRN Records",93,110,154,"229514"
118,"spotify:track:0tNLYxhxOlguHcRnDlhjWP","HAIM","Kept Me Crying","Columbia",118,-1,1,"227668"
119,"spotify:track:5GFDrUTLGJix84sNhjCG0g","Aminé","Caroline","Universal Records",6,107,188,"226730"
120,"spotify:track:4PzovBqgnSHKd8opsP7IVM","YFN Lucci, PnB Rock","Everyday We Lit (feat. PnB Rock)","Think It's A Game Records",102,111,104,"225860"
121,"spotify:track:0zcmVx57BsnlYaPu7k2e2e","21 Savage","Whole Lot","Slaughter Gang, LLC/Epic Records",121,-1,1,"222527"
122,"spotify:track:6XOYVSmNDjKUNMXooU4s4z","OneRepublic","No Vacancy","Mosley / Interscope",65,113,60,"220607"
123,"spotify:track:6b8Be6ljOzmkOmFslEb23P","Bruno Mars","24K Magic","Atlantic Records",12,124,188,"220070"
124,"spotify:track:2cnKEkpVUSV4wnjQiTWfH6","Wisin, Ozuna","Escápate Conmigo (feat. Ozuna)","Sony Music Latin",124,144,32,"219878"
125,"spotify:track:62vpWI1CHwFy7tMIcSStl8","J. Cole","No Role Modelz","Roc Nation Records LLC",64,115,188,"219484"
126,"spotify:track:2ANLarE8yHVsLWW21nj79M","Lil Uzi Vert","You Was Right","Generation Now/Atlantic",26,117,188,"219335"
127,"spotify:track:5GXAXm5YOmYT0kL5jHvYBt","The Weeknd, Daft Punk","I Feel It Coming","Universal Republic Records",10,114,188,"219333"
128,"spotify:track:72jbDTw1piOOj770jWNeaG","The Chainsmokers","Paris","Disruptor Records/Columbia",3,106,176,"219005"
129,"spotify:track:045SnNDjOfOLKM5OxARH4g","Dustin Lynch","Small Town Boy","Broken Bow Records",114,118,32,"218791"
130,"spotify:track:1tlBuoIRrtqFs9bE9dmli5","Future, YG","Extra Luv (feat. YG)","Epic/Freebandz/A1",74,100,8,"217365"
131,"spotify:track:2Ce5IyMlVRVvN997ZJjJJA","Future, Rihanna","Selfish (feat. Rihanna)","Epic/Freebandz/A1",21,136,134,"217260"
132,"spotify:track:3A2OHirUAlQp2x73BJlEDA","Mike WiLL Made-It, Kendrick Lamar, Gucci Mane, Rae Sremmurd","Perfect Pint (feat. Kendrick Lamar, Gucci Mane & Rae Sremmurd)","Mike WiLL Made-It",109,109,76,"217106"
133,"spotify:track:25oOaleife6E2MIKmFkPvg","Young Thug, Future","Relationship (feat. Future)","Atlantic Records",77,116,22,"216359"
134,"spotify:track:5de7ci7TFqbQ1PFgKAD7MR","PnB Rock, Kodak Black, A Boogie Wit da Hoodie","Horses (with PnB Rock, Kodak Black & A Boogie Wit da Hoodie)","Artist Partner",117,121,82,"215419"
135,"spotify:track:0QsvXIfqM0zZoerQfsI9lm","The Chainsmokers, Daya","Don't Let Me Down","Disruptor Records/Columbia",24,128,188,"215186"
136,"spotify:track:0VhgEqMTNZwYL1ARDLLNCX","James Arthur","Can I Be Him","Columbia",125,125,32,"211605"
137,"spotify:track:6PCUP3dWmTjcTtXY02oFdT","Ed Sheeran","Castle on the Hill","Atlantic Records UK",2,120,183,"211376"
138,"spotify:track:7zVCrzzEJU7u24sbJPXA5W","Kane Brown, Lauren Alaina","What Ifs (feat. Lauren Alaina)","RCA Records Label Nashville",129,129,39,"210504"
139,"spotify:track:1a0wEEHipnBR7WOHFA6ucQ","Tyler, The Creator, A$AP Rocky","Who Dat Boy (feat. A$AP Rocky)","Columbia",74,134,8,"209132"
140,"spotify:track:1839RWzPRZCVgvamu4sHSN","Cash Cash, Conor Maynard","All My Love (feat. Conor Maynard)","Big Beat Records",140,-1,1,"208952"
141,"spotify:track:23wcL7jlwSLVZ54V1qO7oO","Marc E. Bassy, KYLE","Plot Twist","Republic Records/Gee Roberson",141,-1,1,"208286"
142,"spotify:track:6QgjcU0zLnzq5OrUoSZ3OK","Portugal. The Man","Feel It Still","Atlantic Records",107,119,22,"208004"
143,"spotify:track:1jQsKN68yE94tMYml0wHMd","Big Sean","Jump Out The Window","Getting Out Our Dreams Inc. (G.O.O.D.) Music / IDJ",21,127,85,"207732"
144,"spotify:track:7EiZI6JVHllARrX9PUvAdX","Future, The Weeknd","Low Life (feat. The Weeknd)","Epic/Freebandz/A1",61,135,188,"207498"
145,"spotify:track:7rErmb9ztCh29H8nWmavQz","21 Savage","Special","Slaughter Gang, LLC/Epic Records",145,-1,1,"207139"
146,"spotify:track:3sJHkcxojoJD2Ytbo1yLLF","Moon Taxi","Two High","RCA Records Label",102,130,13,"206785"
147,"spotify:track:1qOLh0tI7trd1zdDKxYZTe","Hailee Steinfeld, Grey, Zedd","Starving","Universal Records",17,131,188,"205594"
148,"spotify:track:4wdZdkEugVVorAfzqRqC6N","Post Malone","Candy Paint","Artist Partner",123,123,43,"205574"
149,"spotify:track:6fujklziTHa8uoM5OQSfIo","Rae Sremmurd, Gucci Mane","Black Beatles","Mike WiLL Made-It",5,137,188,"204782"
150,"spotify:track:3pndPhlQWjuSoXhcIIdBjv","Russ","What They Want","Columbia",109,132,181,"202108"
151,"spotify:track:4KaIJ1FWXUoAAnOts1YWjD","Calvin Harris, Travis Scott, A-Trak, Funk Wav","Prayers Up (feat. Travis Scott & A-Trak)","Columbia",38,84,8,"200741"
152,"spotify:track:0Fv5N0cHBsl4bzCbollCAS","Big Sean","Moves","Getting Out Our Dreams Inc. (G.O.O.D.) Music / IDJ",8,139,188,"200332"
153,"spotify:track:0pJPdSVti6cTM1Q6xYGmcf","Calvin Harris, Kehlani, Lil Yachty, Funk Wav","Faking It (feat. Kehlani & Lil Yachty)","Columbia",51,122,8,"200056"
154,"spotify:track:4gmmRb6bZJffOOiww1JGTO","21 Savage, Metro Boomin","No Heart","Slaughter Gang, LLC",19,172,188,"198435"
155,"spotify:track:1sZUfl4muDcuWux6KlwaR8","The All-American Rejects","Sweat","Interscope",155,-1,1,"198402"
156,"spotify:track:39pS70eeDvyCAF3t8NAlVV","2 Chainz, Gucci Mane, Quavo","Good Drank","2Chainz PS/Def Jam",55,141,115,"197326"
157,"spotify:track:1x5sYLZiu9r5E43kMlt9f8","Clean Bandit, Zara Larsson","Symphony (feat. Zara Larsson)","Atlantic Records UK",40,133,111,"197302"
158,"spotify:track:4VFE6ZNqa8jHAmbYICoAFg","Florida Georgia Line, Backstreet Boys","God, Your Mama, And Me","Big Machine Label Group, LLC",112,112,57,"196285"
159,"spotify:track:07pJdL0L9XDGW0HBj0rIS2","MadeinTYO, Big Sean","Skateboard P (feat. Big Sean)","Commission Records",131,158,102,"196034"
160,"spotify:track:7cGFbx7MP0H23iHZTZpqMM","Logic","Everybody","Def Jam Recordings",17,142,99,"194187"
161,"spotify:track:51PIvodunv6NmX5250zxAh","Lady Gaga","The Cure","Interscope",36,143,83,"193732"
162,"spotify:track:4iYRa2btalAzPZoSYfROqF","Kendrick Lamar, U2","XXX. FEAT. U2.","Aftermath",6,126,85,"193112"
163,"spotify:track:4gqMQftUs22F8pOGVn5Acr","Shawn Hook, Vanessa Hudgens","Reminding Me","Hollywood Records",108,146,43,"192339"
164,"spotify:track:3E2Zh20GDCR9B1EYjfXWyv","AJR","Weak","S-Curve Records",26,140,188,"192128"
165,"spotify:track:2kVHAQKVtczchKctctzbtK","Katy Perry, Nicki Minaj","Swish Swish","Capitol Records (CAP)",52,91,50,"191914"
166,"spotify:track:3kkObn08oHrNmCFHSNR0jD","Lil Pump","Flex Like Ouu","Warner Records",135,153,47,"191912"
167,"spotify:track:5tFep7dXGd7vEJ668wTPux","Gucci Mane, Drake","Both (feat. Drake)","Guwop Enterprises/Atlantic",35,150,187,"191236"
168,"spotify:track:37F0uwRSrdzkBiuj0D5UHI","The Weeknd","Reminder","Universal Republic Records",64,147,150,"188323"
169,"spotify:track:0afhq8XCExXpqazXczTSve","Ed Sheeran","Galway Girl","Atlantic Records UK",2,148,126,"187867"
170,"spotify:track:2NyrXRn4tancYPW6JwtTl2","Tee Grizzley, Lil Yachty","From The D To The A (feat. Lil Yachty)","300 Entertainment",93,151,113,"187592"
171,"spotify:track:7qs2GAglLWfxEfmO8u2u0A","Loote","High Without Your Love","Island Records",112,168,24,"187069"
172,"spotify:track:5hYTyyh2odQKphUbMqc5gN","Alessia Cara","How Far I'll Go - Alessia Cara Version","Walt Disney Records",18,154,183,"186994"
173,"spotify:track:3pXF1nA74528Edde4of9CC","Bryson Tiller","Don't","TrapSoul/RCA Records",77,152,188,"186195"
174,"spotify:track:6dVZCbi9CYtD9LjAHXRjIG","Future, Kendrick Lamar","Mask Off (feat. Kendrick Lamar) - Remix","Epic/Freebandz/A1",23,138,45,"185925"
175,"spotify:track:6Pw3Gvw4wNMZfTYZa6IQal","Bebe Rexha, Lil Wayne","The Way I Are (Dance with Somebody) [feat. Lil Wayne]","Warner Records",98,160,37,"185307"
176,"spotify:track:05nbZ1xxVNwUTcGwLbp7CN","NAV","Myself","XO Records",89,157,71,"185055"
177,"spotify:track:5GG3knKdxKWrNboRijxeKF","Bryson Tiller","Run Me Dry","TrapSoul/RCA Records",60,166,43,"184825"
178,"spotify:track:6pwvH9LfroBLqd3dez9vBz","Coldplay","A L I E N S","Parlophone UK",178,-1,1,"183856"
179,"spotify:track:2YK01AIIWuywG24gsbuizE","Post Malone, Quavo, Future","Congratulations - Remix","Universal Records",90,171,22,"183013"
180,"spotify:track:2xbI8Vmyv3TkpTdywpPyNw","PnB Rock","Selfish","EMPIRE / Atlantic Recording Corporation",46,163,188,"180959"
181,"spotify:track:6mORGLOz79w6VsCRLWYYuK","Lord Huron","The Night We Met","IAMSOUND",43,156,88,"180809"
182,"spotify:track:2aksifNn5ph8igDOkPBA02","Rihanna","Love On The Brain","Roc Nation / Rihanna",35,164,188,"180787"
183,"spotify:track:1eVRnmGhDPATPxz6kqWuCP","Julia Michaels","Uh Huh","J/Republic",93,159,31,"180091"
184,"spotify:track:0w3Q14i073jLoew1hgJkwD","Jon Pardi","Heartache On The Dance Floor","Capitol Records Nashville",161,161,4,"180070"
185,"spotify:track:2of5xn0GU0TdFneR1saRLH","DJ Khaled, Drake","To the Max (feat. Drake)","Epic/We The Best",15,155,33,"179811"
186,"spotify:track:43PuMrRfbyyuz4QpZ3oAwN","Bryson Tiller","Exchange","TrapSoul/RCA Records",79,165,188,"179508"
187,"spotify:track:0BCy325UZyR9z0t0uxwn2N","Florida Georgia Line","H.O.L.Y.","Big Machine Label Group, LLC",150,176,51,"179313"
188,"spotify:track:2Z8WuEywRWYTKe1NybPQEW","Twenty One Pilots","Ride","Fueled By Ramen",61,174,161,"178267"
189,"spotify:track:5uDASfU19gDxSjW8cnCaBp","Rob $tone, J. Davi$, Spooks","Chill Bill (feat. J. Davi$ & Spooks)","RCA Records Label",17,173,188,"177698"
190,"spotify:track:2RwmsAOxtiRezQPmvyejb8","6LACK","Ex Calling","LVRN Records",164,177,20,"177106"
191,"spotify:track:248OFOZef6ShXv6DGgbnxU","Khalid","Saved","Right Hand Music Group, LLC/RCA Records",107,167,125,"176955"
192,"spotify:track:5qbcsZMwL0x46sX7VO37Ye","NAV","Up","XO Records",68,170,82,"176919"
193,"spotify:track:6mb6lVLNrcUgLnEN8QnDJd","Auli'i Cravalho","How Far I'll Go","Walt Disney Records",127,179,79,"174824"
194,"spotify:track:1HOUzEsetdIPSpAgRPhZQt","Trey Songz","Nobody Else but You","Atlantic Records",179,186,14,"174527"
195,"spotify:track:6JV2JOEocMgcZxYSZelKcc","Justin Timberlake","CAN'T STOP THE FEELING! (from DreamWorks Animation's ""TROLLS"")","Villa 40/RCA Records",29,189,168,"174522"
196,"spotify:track:0iTCmKvuU1ReULiQB0rI7n","Gucci Mane, Chris Brown","Tone It Down (feat. Chris Brown)","Guwop Enterprises/Atlantic",81,169,12,"174155"
197,"spotify:track:4vv1KjUzPwrtDbozizSfQc","DJ Khaled, Calvin Harris, Travis Scott, Jeremih","Don't Quit (feat. Travis Scott & Jeremih)","Epic/We The Best",19,90,15,"173779"
198,"spotify:track:56kXYt4KRoUq3rzkPdjquB","Smokepurpp","Audi.","Alamo",170,181,9,"172562"
199,"spotify:track:6kl1qtQXQsFiIWRBK24Cfp","A$AP Mob, A$AP Rocky, Playboi Carti, Quavo, Lil Uzi Vert, Frank Ocean","RAF (feat. A$AP Rocky, Playboi Carti, Quavo, Lil Uzi Vert & Frank Ocean)","A$AP Worldwide/Polo Grounds Music/RCA Records",199,-1,1,"172204"
200,"spotify:track:1aGOdZZE1uE0m3UYjcl3CP","Yo Gotti, Nicki Minaj","Rake It Up (feat. Nicki Minaj)","Epic/CMG",143,190,17,"171163"
