rank,uri,artist_names,track_name,source,peak_rank,previous_rank,days_on_chart,streams
1,"spotify:track:2XW4DbS6NddZxRPm5rMCeY","Drake","God's Plan","Cash Money/Drake LP6",1,1,27,"3020732"
2,"spotify:track:4qKcDkK6siZ7Jp1Jb4m0aL","BlocBoy JB, Drake","Look Alive (feat. Drake)","OVO Sound/Warner Records",2,2,7,"1700815"
3,"spotify:track:2Imq77E6CEJR5TPUxlJvTY","Kendrick Lamar, SZA","All The Stars (with SZA)","Black Panther (TDE/DMG) PS",2,3,43,"1519417"
4,"spotify:track:6tHWl8ows5JOZq9Yfaqn3M","Bazzi","Mine","iamcosmic",3,4,32,"1306027"
5,"spotify:track:2UVbBKQOdFAekPTRsnkzcf","Migos","Stir Fry","Quality Control Music, LLC",2,5,56,"1219088"
6,"spotify:track:4ofvoCdXq99vpMZO4Cfp8x","The Weeknd, Kendrick Lamar","Pray For Me","Universal Republic Records",3,6,14,"1128832"
7,"spotify:track:09IStsImFySgyp0pIQdqAc","Zedd, Maren Morris, Grey","The Middle","UMGRI Interscope",5,7,22,"1002371"
8,"spotify:track:1OmcAT5Y8eg5bUPv9qJT4R","Post Malone, 21 Savage","rockstar (feat. 21 Savage)","Republic Records",1,9,154,"1001482"
9,"spotify:track:75ZvA4QfFiZvzhj2xkaWAh","Post Malone","I Fall Apart","Universal Records",2,10,153,"944201"
10,"spotify:track:51rXHuKN8Loc4sUlKPODgH","Jay Rock, Kendrick Lamar, Future, James Blake","King's Dead (with Kendrick Lamar, Future & James Blake)","Black Panther (TDE/DMG) PS",7,8,35,"922641"
11,"spotify:track:7sO5G9EABYOXQKNPNiE9NR","Offset, Metro Boomin","Ric Flair Drip (with Metro Boomin)","Slaughter Gang, LLC/Epic/Quality Control Music/Motown/Capitol/Boominati Worldwide/Republic",4,13,108,"830014"
12,"spotify:track:3Vo4wInECJQuz9BIBMOu8i","Bruno Mars, Cardi B","Finesse - Remix; feat. Cardi B","Atlantic Records",2,14,43,"815041"
13,"spotify:track:4LmAnpjlhWTahvRkYR8xJa","ScHoolboy Q, 2 Chainz, Saudi","X (with 2 Chainz & Saudi)","Black Panther (TDE/DMG) PS",5,11,7,"814420"
14,"spotify:track:0wbnC9AUenxp613TYaJsGK","Migos","Narcos","Quality Control Music, LLC",2,12,21,"812258"
15,"spotify:track:5jyyPsIGM2yqkZN9R3TmvN","Khalid, Swae Lee","The Ways (with Swae Lee)","Black Panther (TDE/DMG) PS",9,16,7,"781665"
16,"spotify:track:6PGoSes0D9eUDeeAafB2As","Kendrick Lamar, Zacari","LOVE. FEAT. ZACARI.","Aftermath",5,15,308,"771547"
17,"spotify:track:7iDa6hUg2VgEL1o1HjmfBn","Bebe Rexha, Florida Georgia Line","Meant to Be (feat. Florida Georgia Line)","Warner Records",15,17,160,"733874"
18,"spotify:track:4eWQlBRaTjPPUlzacqEeoQ","Camila Cabello","Never Be the Same","Syco Music/Epic",5,18,70,"706387"
19,"spotify:track:08bNPGLD8AhKpnnERrAc6G","Marshmello, Anne-Marie","FRIENDS","Atlantic Records UK",19,21,7,"695847"
20,"spotify:track:3ncgNpxLoBQ65ABk4djDyd","Famous Dex, A$AP Rocky","PICK IT UP (feat. A$AP Rocky)","300 Entertainment",13,19,112,"666552"
21,"spotify:track:2tPcTFiQF9MbVUyjZ3zDhA","SOB X RBE","Paramedic!","Black Panther (TDE/DMG) PS",16,20,7,"654403"
22,"spotify:track:6NWl2m8asvH83xjuXVNsuG","Lil Xan","Betrayed","Columbia",22,23,123,"649356"
23,"spotify:track:5WoaF1B5XIEnWfmb5NZikf","Miguel, Travis Scott","Sky Walker (feat. Travis Scott)","ByStorm Entertainment/RCA Records",19,25,175,"634657"
24,"spotify:track:1rfofaqEpACxVEHIZBJe6W","Camila Cabello, Young Thug","Havana (feat. Young Thug)","Syco Music/Epic",2,27,195,"625508"
25,"spotify:track:2DQ1ITjI0YoLFzuADN1ZBW","G-Eazy, A$AP Rocky, Cardi B","No Limit","BPG/RVG/RCA Records",2,24,161,"624787"
26,"spotify:track:75FDPwaULRdYDn4StFN2rT","Cardi B, 21 Savage","Bartier Cardi (feat. 21 Savage)","Atlantic/KSR",3,22,56,"621612"
27,"spotify:track:7GX5flRQZVHRAGd6B4TmDO","Lil Uzi Vert","XO Tour Llif3","Generation Now/Atlantic",1,30,329,"619722"
28,"spotify:track:42CeaId2XNlxugDvyqHfDf","Post Malone","Candy Paint","Republic Records",4,34,266,"589616"
29,"spotify:track:4wFjTWCunQFKtukqrNijEt","Migos, Nicki Minaj, Cardi B","MotorSport","Quality Control Music, LLC",6,33,112,"582981"
30,"spotify:track:5k38wzpLb15YgncyWdTZE4","G-Eazy, Halsey","Him & I (with Halsey)","BPG/RVG/RCA Records",3,32,77,"579492"
31,"spotify:track:5AEtlRudpgdT5FtNiuly6Y","Hailee Steinfeld, Alesso, Florida Georgia Line, WATT","Let Me Go (with Alesso, Florida Georgia Line & watt)","Universal Records",17,29,161,"579263"
32,"spotify:track:76cy1WJvNGJTj78UqeA5zr","Dua Lipa","IDGAF","Warner Records",21,31,51,"571145"
33,"spotify:track:6mrKP2jyIQmM0rw6fQryjr","NF","Let You Down","NF Real Music",9,26,138,"570628"
34,"spotify:track:5cXg9IQS34FzLVdHhp7hu7","Kendrick Lamar, Travis Scott","Big Shot (with Travis Scott)","Black Panther (TDE/DMG) PS",17,28,7,"565314"
35,"spotify:track:4dVpf9jZjcORqGTLUaeYj9","A$AP Ferg","Plain Jane","RCA Records Label",6,35,174,"549964"
36,"spotify:track:7KXjTSCq5nL1LoYtL7XAwS","Kendrick Lamar","HUMBLE.","Aftermath",1,36,322,"548773"
37,"spotify:track:2u7mxWSeoqTXndK5e08jMp","Lil Skies, Landon Cube","Nowadays (feat. Landon Cube)","All We Got Ent.",34,38,48,"536905"
38,"spotify:track:2fQrGHiQOvpL9UgPvtYy6G","21 Savage","Bank Account","Slaughter Gang, LLC/Epic Records",1,40,224,"533278"
39,"spotify:track:0tgVpDi06FyKpA1z0VMD4v","Ed Sheeran","Perfect","Atlantic Records UK",11,37,267,"524641"
40,"spotify:track:3a1lNhkSLSkpJE4MSHpDu9","Post Malone, Quavo","Congratulations","Universal Records",5,42,411,"519853"
41,"spotify:track:5UEnHoDYpsxlfzWLZIc7LD","Eminem, Ed Sheeran","River (feat. Ed Sheeran)","Aftermath",2,46,63,"513849"
42,"spotify:track:6n4U3TlzUGhdSFbUUhTvLP","Migos, Drake","Walk It Talk It","Quality Control Music, LLC",3,39,21,"509278"
43,"spotify:track:5Z3GHaZ6ec9bsiI5BenrbY","Khalid","Young Dumb & Broke","Right Hand Music Group, LLC/RCA Records",5,44,317,"506552"
44,"spotify:track:1LhMopPAallLeaeNutqbgS","Justin Timberlake, Chris Stapleton","Say Something (feat. Chris Stapleton)","RCA Records Label",13,43,22,"501400"
45,"spotify:track:5CLGzJsGqhCEECcpnFQA8x","Rudimental, Jess Glynne, Macklemore, Dan Caplen","These Days (feat. Jess Glynne, Macklemore & Dan Caplen)","Atlantic Records UK",41,45,23,"496742"
46,"spotify:track:4DTpngLjoHj5gFxEZFeD3J","Kodak Black, Lil Wayne","Codeine Dreaming (feat. Lil Wayne)","Atlantic Records",10,41,84,"494246"
47,"spotify:track:4pYZLpX23Vx8rwDpJCpPTA","Rich The Kid, Kendrick Lamar","New Freezer (feat. Kendrick Lamar)","Rich The Kid / (TDE/ISR PS)",47,47,142,"487855"
48,"spotify:track:5lZsh9Qf7CbHI9Fcc7Zcsq","YBN Nahmir","Bounce Out With That","2018",48,49,14,"466124"
49,"spotify:track:7EmGUiUaOSGDnUUQUDrOXC","Selena Gomez, Marshmello","Wolves","Selena Gomez PS",3,50,114,"442259"
50,"spotify:track:5qN4HFkapdAOV94XPryVof","Kendrick Lamar","Black Panther","Black Panther (TDE/DMG) PS",11,48,7,"441226"
51,"spotify:track:2ekn2ttSfGqwhhate0LSR0","Dua Lipa","New Rules","Warner Records",11,51,220,"438685"
52,"spotify:track:3towKHKVOXCCcL1fHv6xFO","Hailee Steinfeld, BloodPop®","Capital Letters","Republic/Universal/FSF",52,57,27,"438051"
53,"spotify:track:790MhTXPFrYkrqCKvpg4t1","NAV, Lil Uzi Vert","Wanted You (feat. Lil Uzi Vert)","XO Records",23,52,98,"436359"
54,"spotify:track:1XRgIKC5TPwo7nWGyKqgG0","Gucci Mane, Migos","I Get the Bag (feat. Migos)","Guwop Enterprises/Atlantic",7,56,182,"432124"
55,"spotify:track:152lZdxL1OR0ZMW6KquMif","Khalid","Location","Right Hand Music Group, LLC/RCA Records",9,55,410,"427287"
56,"spotify:track:40oKW22ZNNkEdZLJTScaQI","Kodak Black, XXXTENTACION","Roll in Peace (feat. XXXTENTACION)","Atlantic Records",22,58,182,"426205"
57,"spotify:track:5tz69p7tJuGPeMGwNTxYuV","Logic, Alessia Cara, Khalid","1-800-273-8255","Def Jam Recordings",1,59,294,"425404"
58,"spotify:track:630sXRhIcfwr2e4RdNtjKN","Zac Efron, Zendaya","Rewrite The Stars","Atlantic Records",16,53,51,"421154"
59,"spotify:track:2771LMNxwf62FTAdpJMQfM","Cardi B","Bodak Yellow","Atlantic/KSR",2,61,210,"411975"
60,"spotify:track:6gBFPUFcJLzWGx4lenP6h2","Travis Scott","goosebumps","Epic/Grand Hustle",16,64,411,"410482"
61,"spotify:track:7jqDzXJS0K0Re8uphYNit0","The Chainsmokers","Sick Boy","Disruptor Records/Columbia",10,60,29,"409885"
62,"spotify:track:7m9OqQk4RVRkw9JJdeAw96","XXXTENTACION","Jocelyn Flores","Bad Vibes Forever / EMPIRE",3,65,175,"409424"
63,"spotify:track:1mXVgsBdtIVeCLJnSnmtdV","Sam Smith","Too Good At Goodbyes","Capitol",2,62,161,"406474"
64,"spotify:track:7bUcBztfGqO7cSI2gMZeCI","Vince Staples, Yugen Blakrok","Opps (with Yugen Blakrok)","Black Panther (TDE/DMG) PS",21,54,7,"397761"
65,"spotify:track:3ZhTT6yjZwpPph5MIJ53XY","Lil Skies, Landon Cube","Red Roses (feat. Landon Cube)","All We Got Ent.",56,66,45,"396865"
66,"spotify:track:0tKcYR2II1VCQWT79i5NrW","Imagine Dragons","Thunder","Kid Ina Korner / Interscope",16,69,294,"392888"
67,"spotify:track:7AQim7LbvFVZJE3O8TYgf2","XXXTENTACION, Trippie Redd","Fuck Love (feat. Trippie Redd)","Bad Vibes Forever / EMPIRE",7,67,175,"387654"
68,"spotify:track:1yxgsra98r3qAtxqiGZPiX","Travis Scott","BUTTERFLY EFFECT","Cactus Jack / Epic / Grand Hustle",9,68,272,"386186"
69,"spotify:track:4QfNOZN7vrQCQKK1ZJ3XPb","Julia Michaels","Heaven","UMG Recordings, Inc.",69,70,8,"379698"
70,"spotify:track:43ZyHQITOjhciSUUNPVRHc","Lil Pump","Gucci Gang","Warner Records",2,71,166,"378794"
71,"spotify:track:7vGuf3Y35N4wmASOKLUVVU","Marshmello, Khalid","Silence","Joytime Collective/RCA Records",7,75,189,"376629"
72,"spotify:track:3B54sVLJ402zGa6Xm4YGNe","French Montana, Swae Lee","Unforgettable","Bad Boy Entertainment/Epic Records",1,77,315,"370815"
73,"spotify:track:0DJBgBiYeSn6n1AXAkFVE8","Jorja Smith","I Am","Black Panther (TDE/DMG) PS",28,63,7,"369711"
74,"spotify:track:5hM6sP0Gh1jD57drszNueC","Liam Payne, Rita Ora","For You (With Rita Ora)","Capitol",69,72,42,"365477"
75,"spotify:track:2eAZfqOm4EnOF9VvN50Tyc","Lil Uzi Vert, Oh Wonder","The Way Life Goes (feat. Oh Wonder)","Generation Now/Atlantic",4,79,175,"364806"
76,"spotify:track:1QRJb5VY3sIkCKcTuIKCrk","YBN Nahmir","Rubbin off the Paint","M.M.M.",47,78,116,"359304"
77,"spotify:track:7y9iMe8SOB6z3NoHE2OfXl","Halsey","Bad At Love","Astralwerks (ASW)",22,85,186,"357278"
78,"spotify:track:2xGjteMU3E1tkEPVFBO08U","Keala Settle, The Greatest Showman Ensemble","This Is Me","Atlantic Records",37,76,51,"354292"
79,"spotify:track:2xmrfQpmS2iJExTlklLoAL","Clean Bandit, Julia Michaels","I Miss You (feat. Julia Michaels)","Atlantic Records UK",50,74,111,"350557"
80,"spotify:track:6HZILIRieu8S0iqY8kIKhj","Kendrick Lamar","DNA.","Aftermath",2,86,308,"348719"
81,"spotify:track:3m660poUr1chesgkkjQM7P","Demi Lovato","Sorry Not Sorry","Island Records",6,83,220,"344219"
82,"spotify:track:3OnOomd79OjqSYHchCQ6ht","Migos, Post Malone","Notice Me","Quality Control Music, LLC",16,80,21,"342710"
83,"spotify:track:0zl3PdjIl320fK0pxBGWNR","6ix9ine, Fetty Wap, A Boogie Wit da Hoodie","KEKE","Scumgang Records",32,87,32,"338431"
84,"spotify:track:5Htb1uFQ1KrkFXlefS8oGj","Demi Lovato","Tell Me You Love Me","Island Records",35,81,77,"338155"
85,"spotify:track:7qiZfU4dY1lWllzX7mPBI3","Ed Sheeran","Shape of You","Atlantic Records UK",1,88,406,"335314"
86,"spotify:track:0gD6lWJhbXHWNVwQziSVvl","Rich The Kid","Plug Walk","Rich The Kid / (TDE/ISR PS)",77,84,7,"334346"
87,"spotify:track:1f5cbQtDrykjarZVrShaDI","A Boogie Wit da Hoodie, Kodak Black","Drowning (feat. Kodak Black)","Highbridge The Label",18,90,336,"331679"
88,"spotify:track:4KXwFI9pgJLpUIAc9oSL8j","Ab-Soul, Anderson .Paak, James Blake","Bloody Waters (with Anderson .Paak & James Blake)","Black Panther (TDE/DMG) PS",37,82,7,"324252"
89,"spotify:track:1bhUWB0zJMIKr9yVPrkEuI","Ed Sheeran, Beyoncé","Perfect Duet (Ed Sheeran & Beyoncé)","Atlantic Records UK",3,73,77,"321318"
90,"spotify:track:3hBBKuWJfxlIlnd9QFoC8k","Maroon 5, SZA","What Lovers Do (feat. SZA)","Interscope Records*",7,89,170,"321109"
91,"spotify:track:3kxfsdsCpFgN412fpnW85Y","Childish Gambino","Redbone","Glassnote Entertainment Group LLC",8,93,411,"319935"
92,"spotify:track:6p8NuHm8uCGnn2Dtbtf7zE","Migos, Gucci Mane","Slippery (feat. Gucci Mane)","Quality Control Music",17,97,385,"319537"
93,"spotify:track:4BHzHISX21PYwGXiBEUQ70","Migos, 21 Savage","BBO (Bad Bitches Only)","Quality Control Music, LLC",5,95,21,"309719"
94,"spotify:track:5yuShbu70mtHXY0yLzCQLQ","Post Malone","Go Flex","Universal Records",19,100,411,"301523"
95,"spotify:track:5uCax9HTNlzGybIStD3vDh","James Arthur","Say You Won't Let Go","Columbia",14,94,410,"297301"
96,"spotify:track:0q75NwOoFiARAVp4EXU4Bs","SZA, Travis Scott","Love Galore (feat. Travis Scott)","Top Dawg Entertainment/RCA Records",23,98,288,"295095"
97,"spotify:track:6QgjcU0zLnzq5OrUoSZ3OK","Portugal. The Man","Feel It Still","Atlantic Records",13,108,245,"291111"
98,"spotify:track:2vjmyyAnDUzilFYxOlTdO1","6ix9ine","GUMMO","Strainge Entertainment",50,102,98,"289773"
99,"spotify:track:0CcQNd8CINkwQfe1RDtGV6","Imagine Dragons","Believer","Kid Ina Korner / Interscope",9,105,379,"288270"
100,"spotify:track:2j2fIJGh4PMdXt9ULI5Tlc","Daddy Yankee","Dura","El Cartel Records (EC3)",100,131,13,"287668"
101,"spotify:track:76iVOVsliCHlWqKuDnCfhE","Zacari, Babes Wodumo","Redemption (with Babes Wodumo)","Black Panther (TDE/DMG) PS",49,99,7,"284940"
102,"spotify:track:0as7lPxkBPctZ7uVmchRNM","Cashmere Cat, Major Lazer, Tory Lanez","Miss You (with Major Lazer & Tory Lanez)","Benny Blanco Major",66,106,27,"282895"
103,"spotify:track:0OWZFobGSIW9GrSlQ9C5pc","Thomas Rhett","Marry Me","The Valory Music Co.",83,107,63,"282128"
104,"spotify:track:5HwnezK198pJCEj1l2Adjy","Camila Cabello","She Loves Control","Syco Music/Epic",68,104,35,"281383"
105,"spotify:track:3wdfLVUhmX64lIyWIIEW8s","Quality Control, Quavo, Lil Yachty","Ice Tray","Quality Control Music, LLC",67,110,66,"279347"
106,"spotify:track:3YeJXuRSNS5FYwOsDu44kD","Trippie Redd, Travis Scott","Dark Knight Dummo (Feat. Travis Scott)","Elliot Grainge Entertainment, LLC",53,109,71,"276179"
107,"spotify:track:5goGDc74vVREyN8al8CkPh","Drake","Diplomatic Immunity","Republic Records",2,92,27,"276108"
108,"spotify:track:4cxMGhkinTocPSVVKWIw0d","Russ","Losin Control","Columbia",58,111,392,"274180"
109,"spotify:track:2x0WlnmfG39ZuDmstl9xfX","Taylor Swift, Ed Sheeran, Future","End Game","Big Machine Records, LLC",21,96,77,"273709"
110,"spotify:track:365wwIjijQdlRJEjUWTidq","2 Chainz, YG, Offset","PROUD","2Chainz PS/Def Jam",81,101,7,"271520"
111,"spotify:track:0P6AWOA4LG1XOctzaVu5tt","SZA, Calvin Harris, Funk Wav","The Weekend - Funk Wav Remix","Top Dawg Entertainment/RCA Records",88,113,50,"268638"
112,"spotify:track:2ZxTjs4EdJl4Y9YByIiNoo","Jason Aldean","You Make It Easy","Broken Bow Records",87,115,19,"267868"
113,"spotify:track:5mCPDVBb16L4XQwDdbRUpz","Drake","Passionfruit","Cash Money Records/Young Money Ent./Universal Rec.",1,116,333,"265952"
114,"spotify:track:6eT7xZZlB2mwyzJ2sUKG6w","Post Malone","White Iverson","Universal Records",56,118,411,"263455"
115,"spotify:track:7mldq42yDuxiUNn08nvzHO","Sam Hunt","Body Like A Back Road","MCA Nashville",12,123,379,"259590"
116,"spotify:track:5u6vkDnOyaf8LsteDAj2ub","21 Savage, Offset, Metro Boomin, Travis Scott","Ghostface Killers (feat. Travis Scott)","Slaughter Gang, LLC/Epic/Quality Control Music/Motown/Capitol/Boominati Worldwide/Republic",2,122,108,"258346"
117,"spotify:track:6H0AwSQ20mo62jGlPGB8S6","2 Chainz, Ty Dolla $ign, Trey Songz, Jhené Aiko","It's A Vibe","2Chainz PS/Def Jam",35,119,313,"257318"
118,"spotify:track:0SGkqnVQo9KPytSri1H6cF","Big Sean","Bounce Back","Getting Out Our Dreams Inc. (G.O.O.D.) Music / IDJ",3,129,410,"256989"
119,"spotify:track:4knL4iPxPOZjQzTUlELGSY","Yo Gotti, Nicki Minaj","Rake It Up (feat. Nicki Minaj)","Epic/CMG",17,120,240,"256950"
120,"spotify:track:0VgkVdmE4gld66l8iyGjgx","Future","Mask Off","Epic/Freebandz/A1",2,124,364,"255666"
121,"spotify:track:1e1JKLEDKP7hEQzJfNAgPl","Playboi Carti","Magnolia","AWGE Label",10,125,301,"252363"
122,"spotify:track:3GVkPk8mqxz0itaAriG1L7","XXXTENTACION","Everybody Dies In Their Nightmares","Bad Vibes Forever / EMPIRE",15,130,175,"251979"
123,"spotify:track:62vpWI1CHwFy7tMIcSStl8","J. Cole","No Role Modelz","Roc Nation Records LLC",64,137,409,"251571"
124,"spotify:track:15EPc80XuFrb2LmOzGjuRg","GoldLink, Brent Faiyaz, Shy Glizzy","Crew (feat. Brent Faiyaz & Shy Glizzy)","Squaaash Club/RCA Records",103,126,208,"251414"
125,"spotify:track:1wjzFQodRWrPcQ0AnYnvQ9","Lauv","I Like Me Better","Lauv",30,128,253,"249090"
126,"spotify:track:1uL78kFWxhz3umTMWJu8n5","Lil Uzi Vert","Sauce It Up","Generation Now/Atlantic",6,138,175,"249070"
127,"spotify:track:6EpRaXYhGOB3fj4V2uDkMJ","Liam Payne, Quavo","Strip That Down (feat. Quavo)","Capitol",11,134,271,"248912"
128,"spotify:track:0SvxydoxEEkXt9aMAqTfpB","Maroon 5, A Boogie Wit da Hoodie","Wait (feat. A Boogie Wit da Hoodie)","Interscope Records*",38,127,104,"248457"
129,"spotify:track:32DGGj6KlNuBr6WaqRxpxi","Charlie Puth","How Long","Artist Partner",36,133,131,"248331"
130,"spotify:track:6RKkHI2fkmgZq7uQPPav8f","Migos","Gang Gang","Quality Control Music, LLC",21,121,21,"247948"
131,"spotify:track:25oOaleife6E2MIKmFkPvg","Young Thug, Future","Relationship (feat. Future)","Atlantic Records",53,132,245,"247803"
132,"spotify:track:35cOyocq8Gb6UcT0NWeTwn","Mozzy, Sjava, REASON","Seasons (with Sjava & Reason)","Black Panther (TDE/DMG) PS",59,117,7,"244516"
133,"spotify:track:0KKkJNfGyhkQ5aFogxQAPU","Bruno Mars","That's What I Like","Atlantic Records",3,139,410,"243077"
134,"spotify:track:2EEeOnHehOozLq4aS0n6SL","KYLE, Lil Yachty","iSpy (feat. Lil Yachty)","independently popular.",2,144,411,"242732"
135,"spotify:track:2mfahQ0EaaZWq4cFNg6A1o","Devin Dawson","All On Me","Atlantic/Warner Music Nashville",128,136,14,"241994"
136,"spotify:track:7zFXmv6vqI4qOt4yGf3jYZ","Daniel Caesar, Kali Uchis","Get You (feat. Kali Uchis)","Golden Child Recordings",136,141,17,"238107"
137,"spotify:track:4iLqG9SeJSnt0cSPICSjxv","Charlie Puth","Attention","Artist Partner",16,140,300,"237365"
138,"spotify:track:45w70aQhNwke1yrQZO0ffm","Glades","Do Right","Glades",138,-1,11,"236921"
139,"spotify:track:43ay9lQZ5rfNcOOHhRF2cM","Hugh Jackman, Keala Settle, Zac Efron, Zendaya, The Greatest Showman Ensemble","The Greatest Show","Atlantic Records",63,143,51,"232716"
140,"spotify:track:0AICBlLzFCTpUqmAbtzB2z","Trippie Redd","Love Scars","Strainge Entertainment",128,146,144,"231683"
141,"spotify:track:6RSNKGdv3nDTHqgw4bdzyF","Russell Dickerson","Yours","Sony Music Entertainment",141,148,55,"231429"
142,"spotify:track:2CvOqDpQIMw69cCzWqr5yr","Beyoncé","Halo","Music World Music/Columbia",63,91,8,"231349"
143,"spotify:track:7zVCrzzEJU7u24sbJPXA5W","Kane Brown, Lauren Alaina","What Ifs (feat. Lauren Alaina)","RCA Records Label Nashville",45,151,260,"230651"
144,"spotify:track:4FpfU1O7WCLBnmwu5XAFk4","Zacari","Redemption Interlude","Black Panther (TDE/DMG) PS",61,135,7,"229627"
145,"spotify:track:343YBumqHu19cGoGARUTsd","Drake","Fake Love","Cash Money Records/Young Money Ent./Universal Rec.",2,155,406,"229394"
146,"spotify:track:1WIZiOuNO3woKfdlSK2gNn","Kodak Black","Transportin'","Atlantic Records",30,159,180,"229017"
147,"spotify:track:6gU9OKjOE7ghfEd55oRO57","SZA","The Weekend","Top Dawg Entertainment/RCA Records",75,145,225,"227606"
148,"spotify:track:5537GkcZu99NDs1gH9iCOY","AJR, Rivers Cuomo","Sober Up (feat. Rivers Cuomo)","S-Curve Records",95,147,13,"227473"
149,"spotify:track:6SwRhMLwNqEi6alNPVG00n","Kendrick Lamar, Rihanna","LOYALTY. FEAT. RIHANNA.","Aftermath",4,157,307,"227463"
150,"spotify:track:2Tq2R8sRftNEqdgJK5HadO","Troye Sivan","My My My!","EMI Recorded Music Australia Pty Ltd",13,152,36,"227123"
151,"spotify:track:3Q3myFA7q4Op95DOpHplaY","blackbear","do re mi","Alamo",26,161,326,"226185"
152,"spotify:track:2z4pcBLQXF2BXKFvd0BuB6","Jason Derulo, French Montana","Tip Toe (feat. French Montana)","Beluga Heights/Warner Records",74,158,90,"225824"
153,"spotify:track:1xznGGDReH1oQq0xzbwXa3","Drake, WizKid, Kyla","One Dance","Cash Money Records/Young Money Ent./Universal Rec.",7,160,376,"225748"
154,"spotify:track:7vu0JkJh0ldukEYbTVcqd0","Julia Michaels","Issues","J/Republic",11,142,382,"224852"
155,"spotify:track:0jdny0dhgjUwoIp5GkqEaA","Kesha","Praying","Kemosabe Records/RCA Records",15,154,217,"224658"
156,"spotify:track:1HXy5I3HTWq8OvxCn0z7G7","Kane Brown","Heaven","RCA Records Label Nashville",133,163,32,"224444"
157,"spotify:track:22nyEAEM29tcBRhukR089b","Jaden","Icon","MSFTS/Roc Nation",97,162,57,"224274"
158,"spotify:track:3pXF1nA74528Edde4of9CC","Bryson Tiller","Don't","TrapSoul/RCA Records",77,169,396,"223877"
159,"spotify:track:7oJrVhiTPZGBXWPwhxjy9S","Lil Skies","Lust","All We Got Ent.",137,167,29,"223677"
160,"spotify:track:30MM5jWpUmOxtTNd9Ey5LZ","Thomas Rhett","Unforgettable","The Valory Music Co.",35,166,193,"223540"
161,"spotify:track:2LBqCSwhJGcFQeTHMVGwy3","The Weeknd","Die For You","Universal Republic Records",75,150,165,"223225"
162,"spotify:track:6mORGLOz79w6VsCRLWYYuK","Lord Huron","The Night We Met","IAMSOUND",43,153,160,"221480"
163,"spotify:track:0RoA7ObU6phWpqhlC9zH4Z","Ziv Zaifman, Hugh Jackman, Michelle Williams","A Million Dreams","Atlantic Records",71,156,49,"221230"
164,"spotify:track:4Q3N4Ct4zCuIHuZ65E3BD4","Kodak Black","Tunnel Vision","Atlantic Records",5,173,364,"220952"
165,"spotify:track:5Qx9hngUBr30JFrNua7yp4","YoungBoy Never Broke Again","Outside Today","Never Broke Again, LLC",156,175,12,"220813"
166,"spotify:track:3wGXyJGsCf1myH5MooQIqE","Tay-K","The Race","88 Classic",33,176,187,"219613"
167,"spotify:track:6waqLPcT6ruMhmd36OhmFO","Chris Young","Losing Sleep","RCA Records Label Nashville",158,172,45,"218110"
168,"spotify:track:0Gl5s8IhMmQE5YQwM8Qx1J","Loren Allred","Never Enough","Atlantic Records",72,164,50,"215363"
169,"spotify:track:3NdDpSvN911VPGivFlV5d0","ZAYN, Taylor Swift","I Don’t Wanna Live Forever (Fifty Shades Darker)","Big Machine Records, LLC",3,149,364,"214572"
170,"spotify:track:3DXncPQOG4VBw3QHh3S817","DJ Khaled, Justin Bieber, Quavo, Chance the Rapper, Lil Wayne","I'm the One (feat. Justin Bieber, Quavo, Chance the Rapper & Lil Wayne)","Epic/We The Best",2,181,293,"213683"
171,"spotify:track:4OBZT9EnhYIV17t4pGw7ig","H.E.R., Daniel Caesar","Best Part (feat. Daniel Caesar)","MBK Entertainment/RCA Records",171,178,17,"213613"
172,"spotify:track:1LXbv9jiTtdBdHadZ317Gt","Lil Pump","Designer","Warner Records",41,168,44,"213362"
173,"spotify:track:7foypmc7KZyU716Yv63BPe","Huncho Jack, Travis Scott, Quavo","Saint","Quality Control Music - Epic",15,174,56,"212823"
174,"spotify:track:5jZF1nvKORdaHNjNNMRbFl","Walker Hayes","You Broke Up with Me","Monument Records",152,183,19,"212192"
175,"spotify:track:4Km5HrUvYTaSUfiSGPJeQR","Migos, Lil Uzi Vert","Bad and Boujee (feat. Lil Uzi Vert)","Quality Control Music",1,185,410,"211254"
176,"spotify:track:10M2Ex445zw585Ducldzkw","Brett Young","In Case You Didn't Know","Big Machine Label Group, LLC",94,182,299,"209855"
177,"spotify:track:1Qg9jWGDkKAGZXj5v2OG59","Maroon 5","Wait","Interscope Records*",38,127,104,"208968"
178,"spotify:track:5CtI0qwDJkDQGwXD1H1cLb","Luis Fonsi, Daddy Yankee, Justin Bieber","Despacito - Remix","UMLE - Latino",1,188,305,"208804"
179,"spotify:track:7BKLCZ1jbUBVqRi2FVlTVw","The Chainsmokers, Halsey","Closer","Disruptor Records/Columbia",4,186,406,"208746"
180,"spotify:track:3I7krC8kr0gFR7P6vInR1I","Billy Currington","Do I Make You Wanna","Mercury Nashville",143,190,69,"208549"
181,"spotify:track:5aAx2yezTd8zXrkmtKl66Z","The Weeknd, Daft Punk","Starboy","Universal Republic Records",3,194,409,"207701"
182,"spotify:track:43PuMrRfbyyuz4QpZ3oAwN","Bryson Tiller","Exchange","TrapSoul/RCA Records",79,187,376,"207643"
183,"spotify:track:59J5nzL1KniFHnU120dQzt","Playboi Carti, Lil Uzi Vert","wokeuplikethis*","AWGE Label",52,191,306,"205876"
184,"spotify:track:2bjwRfXMk4uRgOD9IBYl9h","Drake, Quavo, Travis Scott","Portland","Cash Money Records/Young Money Ent./Universal Rec.",2,198,310,"205649"
185,"spotify:track:0w3Q14i073jLoew1hgJkwD","Jon Pardi","Heartache On The Dance Floor","Capitol Records Nashville",109,197,181,"205639"
186,"spotify:track:2cKovq3l6OJjhVVDbVKOsr","Hugh Jackman, Zac Efron","The Other Side","Atlantic Records",81,184,48,"204984"
187,"spotify:track:248OFOZef6ShXv6DGgbnxU","Khalid","Saved","Right Hand Music Group, LLC/RCA Records",107,193,307,"204264"
188,"spotify:track:7Il2yWQmsqKgSkLQvHTPUI","Dan + Shay","Tequila","Warner Records",166,177,5,"204097"
189,"spotify:track:1zsG4eaZmkA1dvjDDsAGLK","Luis Fonsi, Demi Lovato","Échame La Culpa","UMLE - Latino",47,189,90,"203938"
190,"spotify:track:1mMLMZYXkMueg65jRRWG1l","Luke Combs","When It Rains It Pours","River House Artists/Columbia Nashville",110,-1,161,"203622"
191,"spotify:track:4AtZRwSR8BOTTQg5ihSggt","6LACK","PRBLMS","LVRN Records",93,192,371,"203572"
192,"spotify:track:5hcisvFMidkMJlElTO9Qmw","Bad Bunny, Prince Royce, J Balvin, Mambo Kingz, DJ Luian","Sensualidad","Hear This Music",85,-1,83,"202106"
193,"spotify:track:1Slwb6dOYkBlWal1PGtnNg","Ed Sheeran","Thinking out Loud","Atlantic Records UK",47,103,75,"202053"
194,"spotify:track:4fC5jw1TI59GH1emfN1wtk","Trippie Redd, 6ix9ine","Poles 1469","Strainge Entertainment",146,-1,34,"201026"
195,"spotify:track:0uxSUdBrJy9Un0EYoBowng","Lil Uzi Vert","20 Min","Generation Now/Atlantic",86,195,57,"200622"
196,"spotify:track:5gx2E5aIXMRBellPZW1up5","Chris Brown, Yo Gotti, A Boogie Wit da Hoodie, Kodak Black","Pills & Automobiles (feat. Yo Gotti, A Boogie Wit Da Hoodie & Kodak Black)","RCA Records Label",70,-1,139,"200481"
197,"spotify:track:5NT0aZqWImC9fTzkW4z48o","6ix9ine","KOODA","Scumgang Records",77,200,67,"199072"
198,"spotify:track:6RUKPb4LETWmmr3iAEQktW","The Chainsmokers, Coldplay","Something Just Like This","Disruptor Records/Columbia",2,-1,349,"198810"
199,"spotify:track:0B8QzDH7YWih85V5SEMnyJ","Lil Uzi Vert","Money Longer","Generation Now/Atlantic",61,-1,390,"197860"
200,"spotify:track:6yr8GiTHWvFfi4o6Q5ebdT","Eminem, Nate Dogg","'Till I Collapse","Aftermath",112,199,233,"197780"
