rank,uri,artist_names,track_name,source,peak_rank,previous_rank,days_on_chart,streams
1,"spotify:track:0TK2YIli7K1leLovkQiNik","Shawn Mendes, Camila Cabello","Señorita","Island Records",1,1,27,"1550772"
2,"spotify:track:6vBdBCoOhKHiYDDOcorfNo","Post Malone, Young Thug","Goodbyes (feat. Young Thug)","Republic Records",1,2,13,"1480527"
3,"spotify:track:5ry2OE6R2zPQFDO85XkgRb","Drake, Rick Ross","Money In The Grave (Drake ft. Rick Ross)","Republic Records",1,3,33,"1295563"
4,"spotify:track:5qmq61DAAOUaW8AUo8xKhh","Lizzo","Truth Hurts","Nice Life/Atlantic",4,4,88,"1237793"
5,"spotify:track:6fTt0CH2t0mdeB2N9XFG5r","Lil Nas X","Panini","Columbia",1,5,28,"1231807"
6,"spotify:track:1kBbgxAUc4HQv7cgIayIDH","Lil Tecca","Ransom","Republic Records",6,8,55,"1148492"
7,"spotify:track:70eFcWOvlMObDhURTqT4Fv","Ed Sheeran, Khalid","Beautiful People (feat. Khalid)","Atlantic Records UK",3,6,20,"1146272"
8,"spotify:track:1DhRbox3xkceP64k3JeYfW","Ed Sheeran, Travis Scott","Antisocial (with Travis Scott)","Atlantic Records UK",5,7,6,"1073741"
9,"spotify:track:3KkXRkHbMCARz0aVfEt68P","Post Malone, Swae Lee","Sunflower - Spider-Man: Into the Spider-Verse","Universal Records",1,10,273,"964544"
10,"spotify:track:0hVXuCcriWRGvwMV1r5Yn9","Ed Sheeran, Justin Bieber","I Don't Care (with Justin Bieber)","Atlantic Records UK",1,9,69,"949382"
11,"spotify:track:2gwkD6igEhQbDQegRCcdoB","DaBaby","Suge","South Coast Music Group/Interscope Records",3,11,110,"877206"
12,"spotify:track:2Fxmhks0bxGSBdJ92vM42m","Billie Eilish","bad guy","Darkroom/Interscope Records",1,12,111,"834680"
13,"spotify:track:7DcvwMAiqKJQD1rrdfxSDx","Young Thug, J. Cole, Travis Scott","The London (feat. J. Cole & Travis Scott)","300 Entertainment/Atl",1,13,56,"822587"
14,"spotify:track:4hPpVbbakQNv8YTHYaOJP4","Marshmello, Kane Brown","One Thing Right","RCA Records Label Nashville",14,15,27,"781054"
15,"spotify:track:3yNZ5r3LKfdmjoS3gkhUCT","Billie Eilish, Justin Bieber","bad guy (with Justin Bieber)","Darkroom/Interscope Records",3,14,6,"759814"
16,"spotify:track:4ak7xjvBeBOcJGWFDX9w5n","Lil Nas X, Cardi B","Rodeo","Columbia",7,17,27,"720615"
17,"spotify:track:6u7jPi22kF8CTQ3rb9DHE7","Lil Nas X, Billy Ray Cyrus","Old Town Road - Remix","Columbia",1,18,104,"702231"
18,"spotify:track:6uFn47ACjqYkc0jADwEdj1","Polo G, Lil Tjay","Pop Out (feat. Lil Tjay)","Columbia",8,19,117,"701699"
19,"spotify:track:4vUmTMuQqjdnvlZmAH61Qk","Ed Sheeran, Camila Cabello, Cardi B","South of the Border (feat. Camila Cabello & Cardi B)","Atlantic Records UK",9,16,6,"694084"
20,"spotify:track:51Fjme0JiitpyXKuyQiCDo","Y2K, bbno$","Lalala","Columbia",15,21,32,"682770"
21,"spotify:track:6XHVuErjQ4XNm6nDPVCxVX","Chris Brown, Drake","No Guidance (feat. Drake)","Chris Brown Entertainment/RCA Records",3,20,40,"676066"
22,"spotify:track:6TqXcAFInzjp0bODyvrWEq","Khalid, Disclosure","Talk (feat. Disclosure)","Right Hand Music Group, LLC/RCA Records",5,22,161,"658906"
23,"spotify:track:4wuCQX7JvAZLlrcmH4AeZF","Ed Sheeran, Chance the Rapper, PnB Rock","Cross Me (feat. Chance the Rapper & PnB Rock)","Atlantic Records UK",8,24,55,"608222"
24,"spotify:track:5hVghJ4KaYES3BFUATCYn0","Tyler, The Creator","EARFQUAKE","Columbia",1,25,62,"598533"
25,"spotify:track:6moU77g9RQyMzHNuKEaQKq","Ali Gatie","It's You","Warner Records",15,26,34,"597098"
26,"spotify:track:0AtP8EkGPn6SwxKDaUuXec","Ed Sheeran, Eminem, 50 Cent","Remember The Name (feat. Eminem & 50 Cent)","Atlantic Records UK",13,23,6,"595070"
27,"spotify:track:1kK6DwzyXJSp58u5HYWwuD","YG, Tyga, Jon Z","Go Loko (feat. Tyga, Jon Z)","Def Jam Recordings",14,27,76,"586133"
28,"spotify:track:2JvzF1RMd7lE3KmFlsyZD8","J. Cole","MIDDLE CHILD","Dreamville, Inc., Under exclusive license to Roc Nation Records",1,29,175,"578709"
29,"spotify:track:29fRTIKsJhLUJoldM89GZS","Taylor Swift","You Need To Calm Down","Taylor Swift",1,28,34,"577177"
30,"spotify:track:6MWtB6iiXyIwun0YzU6DFP","Post Malone","Wow.","Republic Records",1,30,206,"574670"
31,"spotify:track:6LsAAHotRLMOHfCsSfYCsz","Shawn Mendes","If I Can't Have You","Island Records",3,31,76,"546119"
32,"spotify:track:7qEHsqek33rTcFNT9PFqLf","Lewis Capaldi","Someone You Loved","Vertigo Berlin",30,34,80,"540555"
33,"spotify:track:05CwHjIk71RXVU40boRMnR","The Chainsmokers, Bebe Rexha","Call You Mine","Disruptor Records/Columbia",20,33,48,"534720"
34,"spotify:track:6jmZlyf9DxcIoRrjw02YXm","Lil Nas X, Billy Ray Cyrus, Mason Ramsey, Young Thug","Old Town Road - Remix","Columbia",18,32,6,"520816"
35,"spotify:track:2zjGJ0dChMR0KxBZS15aqo","Mustard, NAV, Playboi Carti, A Boogie Wit da Hoodie","Baguettes in the Face (feat. NAV, Playboi Carti & A Boogie Wit da Hoodie)","10 Summers Records/Interscope Records",35,36,20,"504660"
36,"spotify:track:3XiNC94b4Tq1xwv70sQJGN","Lil Uzi Vert","Sanguine Paradise","Generation Now/Atlantic",6,35,99,"504392"
37,"spotify:track:67XyC1GdSkKb9sbRRkUDXS","NLE Choppa, Blueface","Shotta Flow (Feat. Blueface) [Remix]","No Love Entertainment",37,37,16,"503899"
38,"spotify:track:22vgEDb5hykfaTwLuskFGD","Jonas Brothers","Sucker","Jonas Brothers Recording",1,38,139,"488185"
39,"spotify:track:5PYQUBXc7NYeI1obMKSJK0","Katy Perry","Never Really Over","Capitol Records",10,39,48,"485302"
40,"spotify:track:6uAm7pG66O1XesXS9bpHSF","Lizzo","Good as Hell","Nice Life/Atlantic",40,42,33,"481683"
41,"spotify:track:43zdsphuZLzwA9k4DJhU0I","Billie Eilish","when the party's over","Darkroom/Interscope Records",5,40,274,"479883"
42,"spotify:track:0qc4QlcCxVTGyShurEv1UU","Sam Feldt, RANI","Post Malone (feat. RANI)","Spinnin' Records",34,41,28,"474587"
43,"spotify:track:1wJRveJZLSb1rjhnUHQiv6","A Boogie Wit da Hoodie, 6ix9ine","Swervin (feat. 6ix9ine)","Highbridge the Label / Atlantic Records",6,43,209,"470231"
44,"spotify:track:5dW1VZPcFqB4n0P08rGDgm","Blanco Brown","The Git Up","Broken Bow Records",34,47,35,"462006"
45,"spotify:track:2IRZnDFmlqMuOrYOLnZZyc","Meek Mill, Drake","Going Bad (feat. Drake)","MMG/Atlantic",2,46,230,"460496"
46,"spotify:track:6ocbgoVGwYJhOv1GgI9NsF","Ariana Grande","7 rings","Republic Records",1,44,181,"454812"
47,"spotify:track:2gTdDMpNxIRFSiu7HutMCg","Machine Gun Kelly, YUNGBLUD, Travis Barker","I Think I'm OKAY (with YUNGBLUD & Travis Barker)","Bad Boy/Interscope Records",29,45,41,"451268"
48,"spotify:track:3j84U36KvLeXNDPv4t5pI8","Mustard, Migos","Pure Water (with Migos)","10 Summers Records/Interscope Records",11,50,181,"445629"
49,"spotify:track:2TH65lNHgvLxCKXM3apjxI","Bad Bunny, Tainy","Callaita","Rimas Entertainment LLC",37,48,48,"443494"
50,"spotify:track:56JyMaElW79S7TDWh1Zw1m","Ashley O","On A Roll","RCA Records Label",27,49,33,"434461"
51,"spotify:track:5rU6kDNXZLXIinFezpbWbO","NAV, Meek Mill","Tap (feat. Meek Mill)","XO Records, LLC and Republic Records",48,52,85,"423025"
52,"spotify:track:5WnfnSpuNEGXyEt78PBA6d","Dreamville, Bas, JID, Guapdad 4000, Reese LAFLARE, Jace, Mez, Smokepurpp, Buddy, Ski Mask The Slump God","Costa Rica (with Bas & JID feat. Guapdad 4000, Reese LAFLARE, Jace, Mez, Smokepurpp, Buddy & Ski Mask The Slump God)","Dreamville/Interscope Records",20,90,15,"414183"
53,"spotify:track:0u2P5u6lvoDfwTYjAADbn4","Billie Eilish, Khalid","lovely (with Khalid)","Darkroom",18,54,454,"410858"
54,"spotify:track:78QR3Wp35dqAhFEc2qAGjE","Lil Baby, Gunna","Drip Too Hard (Lil Baby & Gunna)","Quality Control Music/Young Stoner Life Records, a 300 Entertainment Label/Motown Records/Capitol Records",1,55,309,"408860"
55,"spotify:track:0DiDStADDVh3SvAsoJAFMk","Jonas Brothers","Only Human","Jonas Brothers Recording",6,53,41,"403179"
56,"spotify:track:7eBqSVxrzQZtK2mmgRG6lC","YNW Melly","Murder On My Mind","P2018",4,57,295,"400430"
57,"spotify:track:7ILEWkpfdK6AjH2D7jppWk","Chris Brown, Justin Bieber, Ink","Don't Check On Me (feat. Justin Bieber & Ink)","Chris Brown Entertainment/RCA Records",20,56,21,"393966"
58,"spotify:track:6zeeWid2sgw4lap2jV61PZ","Khalid","Better","Right Hand Music Group, LLC/RCA Records",7,59,307,"389933"
59,"spotify:track:7FGq80cy8juXBCD2nrqdWU","benny blanco, Halsey, Khalid","Eastside (with Halsey & Khalid)","Friends Keep Secrets/Interscope Records",7,64,370,"389379"
60,"spotify:track:6oJ6le65B3SEqPwMRNXWjY","Kygo, Whitney Houston","Higher Love","Kygo/RCA Records",22,62,20,"386494"
61,"spotify:track:6CcJMwBtXByIz4zQLzFkKc","Billie Eilish","i love you","Darkroom/Interscope Records",14,61,111,"386413"
62,"spotify:track:2xLMifQCjDGFmkHkpNLD9h","Travis Scott","SICKO MODE","Cactus Jack / Epic / Grand Hustle",1,63,349,"386410"
63,"spotify:track:7njKgVl3AnLflRad38o7AG","Bazzi","Paradise","iamcosmic",18,60,104,"384266"
64,"spotify:track:4SSnFejRGlZikf02HLewEF","Billie Eilish","bury a friend","Darkroom/Interscope Records",3,65,169,"383483"
65,"spotify:track:6MF4tRr5lU8qok8IKaFOBE","Dreamville, J. Cole, Lute, DaBaby","Under The Sun (with J. Cole & Lute feat. DaBaby)","Dreamville/Interscope Records",10,51,13,"381584"
66,"spotify:track:285pBltuF7vW8TeWk8hdRR","Juice WRLD","Lucid Dreams","Juice WRLD Mixtape / ISR P&D",1,68,437,"380837"
67,"spotify:track:7rvyVWja33WG9R97oeJAjx","Calboy","Envy Me","Polo Grounds Music/RCA Records",22,69,203,"379761"
68,"spotify:track:2dpaYNEQHiRxtZbfNsse99","Marshmello, Bastille","Happier","Astralwerks",5,71,335,"373881"
69,"spotify:track:40OMBMYRk5IQL6xCzGM0JA","Martin Garrix, Macklemore, Fall Out Boy","Summer Days (feat. Macklemore & Patrick Stump of Fall Out Boy)","Epic Amsterdam",27,66,79,"370258"
70,"spotify:track:36J0iaPDGbYGsHvYpaYs3k","Dreamville, JID, Bas, J. Cole, EARTHGANG, Young Nudy","Down Bad (feat. JID, Bas, J. Cole, EARTHGANG & Young Nudy)","Dreamville/Interscope Records",12,70,35,"362659"
71,"spotify:track:6kls8cSlUyHW2BUOkDJIZE","Ellie Goulding, Juice WRLD","Hate Me (with Juice WRLD)","Polydor Records",46,75,20,"361239"
72,"spotify:track:7dt6x5M1jzdTEt8oCbisTK","Post Malone","Better Now","Republic Records",1,73,447,"355383"
73,"spotify:track:53CJANUxooaqGOtdsBTh7O","Lil Nas X","Old Town Road","Columbia",1,72,138,"353973"
74,"spotify:track:6Hj9jySrnFppAI0sEMCZpJ","Juice WRLD","Robbery","Grade A Productions/Interscope Records",2,74,154,"353654"
75,"spotify:track:0VsGaRXR5WAzpu51unJTis","Ed Sheeran, Yebba","Best Part of Me (feat. YEBBA)","Atlantic Records UK",25,58,13,"352494"
76,"spotify:track:5KBARWIxeMGkvUax9VtVC9","Saweetie","My Type","ICY/Artistry Records/Warner Records",76,83,14,"338007"
77,"spotify:track:0e7ipj03S05BNilyu5bRzt","Post Malone, 21 Savage","rockstar (feat. 21 Savage)","Republic Records",1,77,671,"336458"
78,"spotify:track:1AI7UPw3fgwAFkvAlZWhE0","Ed Sheeran, Stormzy","Take Me Back to London (feat. Stormzy)","Atlantic Records UK",35,67,6,"336366"
79,"spotify:track:5p7ujcrUXASCNwRaWNHR1C","Halsey","Without Me","Capitol Records",5,84,287,"336090"
80,"spotify:track:25ZAibhr3bdlMCLmubZDVt","J Balvin, Bad Bunny","QUE PRETENDES","Universal Music Latino / Rimas",16,80,20,"334042"
81,"spotify:track:3Fj47GNK2kUF0uaEDgXLaD","Billie Eilish","wish you were gay","Darkroom/Interscope Records",2,78,136,"332023"
82,"spotify:track:3e9HZxeyfWwjeyPAMmWSSQ","Ariana Grande","thank u, next","Republic Records",1,82,256,"330507"
83,"spotify:track:1dyxS3YzBbL0t8rEVwVQ1K","Blake Shelton","God's Country","Warner Records",59,86,73,"325901"
84,"spotify:track:59ywHNwwchG4nZJMLyxSzd","Offset, Cardi B","Clout (feat. Cardi B)","Quality Control Music/Motown Records",41,85,97,"324697"
85,"spotify:track:4XiGKQqbmnMVxDzUj6j3f2","YK Osiris","Worth It","Def Jam Recordings",68,89,137,"323886"
86,"spotify:track:3TpBefRZ1vFcOH6z57PQRI","Bryce Vine, YG","La La Land (feat. YG)","Sire",73,81,48,"320721"
87,"spotify:track:3Ol2xnObFdKV9pmRD2t9x8","A Boogie Wit da Hoodie","Look Back at It","Highbridge the Label / Atlantic Records",8,91,223,"319708"
88,"spotify:track:7f1zjZG77S891Uv4O68yfk","DaBaby, Offset","Baby Sitter (feat. Offset)","South Coast Music Group/Interscope Records",55,88,68,"318436"
89,"spotify:track:6G0FACzGN80Dj2v4ass5rq","iann dior, Trippie Redd","gone girl","TenThousand Projects, LLC",89,92,6,"317173"
90,"spotify:track:6Qs4SXO9dwPj5GKvVOv8Ki","Sam Smith, Normani","Dancing With A Stranger (with Normani)","Capitol",10,93,188,"317076"
91,"spotify:track:3ee8Jmje8o58CHK66QrVC2","XXXTENTACION","SAD!","Bad Vibes Forever, LLC",1,94,503,"316101"
92,"spotify:track:2nKYHpmwjLaEOXS3o7QMiz","Quality Control, Lil Baby, DaBaby","Baby","Quality Control Music/Motown Records",92,-1,1,"313666"
93,"spotify:track:4kV4N9D1iKVxx1KLvtTpjS","Ariana Grande","break up with your girlfriend, i'm bored","Republic Records",1,95,160,"308815"
94,"spotify:track:2WyRfGeHo97VC5mP1BBSzr","Miley Cyrus","Mother's Daughter","RCA Records Label",9,96,48,"308742"
95,"spotify:track:2wZjsbwmWfNVslgV5afl1L","Lil Baby, Future","Out The Mud","Quality Control/Motown Records",41,97,27,"307536"
96,"spotify:track:0k664IuFwVP557Gnx7RhIl","Lizzo","Juice","Nice Life/Atlantic",57,100,90,"306448"
97,"spotify:track:3WyRgi8CzQnhzO0xw79tTS","DaBaby","Goin Baby","South Coast Music Group/Interscope Records",59,104,90,"306012"
98,"spotify:track:3GJ4hzg4lrGwU51Y3VARbF","Dan + Shay","Speechless","Warner Records",77,107,330,"304493"
99,"spotify:track:4tNXntkAzQ5A2dfYRYGIIQ","5 Seconds of Summer","Easier","5 Seconds Of Summer/Interscope",18,99,55,"304355"
100,"spotify:track:2t8yVaLvJ0RenpXUIAC52d","21 Savage","a lot","Slaughter Gang, LLC/Epic Records",2,103,209,"303811"
101,"spotify:track:5Uw7Dut2lZfexn3Y09swpf","Mark Ronson, Camila Cabello","Find U Again (feat. Camila Cabello)","Columbia",21,98,48,"302782"
102,"spotify:track:7hvO2qCwJVZxiyoA7c9i5d","Ed Sheeran, Chris Stapleton, Bruno Mars","BLOW (with Chris Stapleton & Bruno Mars)","Atlantic Records UK",33,76,13,"301202"
103,"spotify:track:1c0hsvHLELX6y8qymnpLKL","Lunay, Daddy Yankee, Bad Bunny","Soltera - Remix","La Familia",52,105,69,"298790"
104,"spotify:track:2rxQMGVafnNaRaXlRMWPde","Luke Combs","Beautiful Crazy","River House Artists/Columbia Nashville",54,106,371,"297629"
105,"spotify:track:4MsUsFfWseB9M2plGJyuIw","Taylor Swift, Brendon Urie, Panic! At The Disco","ME! (feat. Brendon Urie of Panic! At The Disco)","Taylor Swift",1,101,83,"297443"
106,"spotify:track:7M2tXmeS15NAzEn7ABFeBg","Logic, Eminem","Homicide (feat. Eminem)","Def Jam Recordings",1,102,76,"297076"
107,"spotify:track:5T03itPFOPGGkvVPvPiyla","Ed Sheeran, Ella Mai","Put It All on Me (feat. Ella Mai)","Atlantic Records UK",38,79,6,"294799"
108,"spotify:track:6foY66mWZN0pSRjZ408c00","Morgan Wallen","Whiskey Glasses","Big Loud Records",58,110,126,"294764"
109,"spotify:track:2iUXsYOEPhVqEBwsqP70rE","5 Seconds of Summer","Youngblood","Capitol",12,115,459,"291743"
110,"spotify:track:1rqqCSm0Qe4I9rUvWncaom","Panic! At The Disco","High Hopes","DCD2 / Fueled By Ramen",12,111,401,"290534"
111,"spotify:track:4vIKzWqtn44umal5jXq4wE","Ed Sheeran, Meek Mill, A Boogie Wit da Hoodie","1000 Nights (feat. Meek Mill & A Boogie Wit da Hoodie)","Atlantic Records UK",40,87,6,"288658"
112,"spotify:track:0fea68AdmYNygeTGI4RC18","J Balvin, Bad Bunny","LA CANCIÓN","Universal Music Latino / Rimas",30,117,20,"286596"
113,"spotify:track:5kfNriitmkNE8mUbZ7gbq8","Khalid","Saturday Nights","Right Hand Music Group, LLC/RCA Records",13,112,266,"286199"
114,"spotify:track:4dAMdQ6g4kGmnc1MDHsg77","NLE Choppa","Shotta Flow","No Love Entertainment",43,118,121,"285522"
115,"spotify:track:1Ej96GIBCTvgH7tNX1r3qr","Sech, Darell","Otro Trago","Rich Music/Ingrooves Records",64,114,62,"284651"
116,"spotify:track:0rKtyWc8bvkriBthvHKY8d","Joji","SLOW DANCING IN THE DARK","88rising Music/Warner Records",26,121,299,"284302"
117,"spotify:track:6XkLPzkKzPhpr3hrvl1TUq","Blueface, Rich The Kid","Daddy (feat. Rich The Kid)","Cash Money Records Inc.",117,125,12,"282324"
118,"spotify:track:3XF5xLJHOQQRbWya6hBp7d","Billie Eilish","you should see me in a crown","Darkroom/Interscope Records",7,116,266,"282101"
119,"spotify:track:75ZvA4QfFiZvzhj2xkaWAh","Post Malone","I Fall Apart","Universal Records",2,120,670,"281918"
120,"spotify:track:2VxeLyX666F8uXCJ0dZF8B","Lady Gaga, Bradley Cooper","Shallow","A Star is Born OST",6,122,291,"280338"
121,"spotify:track:3xaugmCyXrVkrDTXbFkMW3","Joji","Sanctuary","88rising Music/Warner Records",17,124,34,"279638"
122,"spotify:track:7nfmK6oHPDlAd68A11d7AN","Luke Combs","Beer Never Broke My Heart","River House Artists/Columbia Nashville",32,123,71,"278898"
123,"spotify:track:3pZO6GoVPeSYDxxsH6vCdj","Dreamville, J. Cole, Young Nudy","Sunset (with J. Cole feat. Young Nudy)","Dreamville/Interscope Records",28,108,13,"278765"
124,"spotify:track:0JP9xo3adEtGSdUEISiszL","XXXTENTACION","Moonlight","Bad Vibes Forever, LLC",2,126,489,"275072"
125,"spotify:track:0FZ4Dmg8jJJAPJnvBIzD9z","Kodak Black, Offset, Travis Scott","ZEZE (feat. Travis Scott & Offset)","Atlantic Records",1,131,279,"274274"
126,"spotify:track:4e4fqjx0Izh4svvTef1z7e","Bebe Rexha, Florida Georgia Line","Meant to Be (feat. Florida Georgia Line)","Warner Bros.",15,132,674,"271537"
127,"spotify:track:7COXchtUOMd6uIT6HvmRaI","Lauv, Troye Sivan","i'm so tired...","Lauv",22,139,174,"270581"
128,"spotify:track:58q2HKrzhC3ozto2nDdN4z","Cardi B, Bad Bunny, J Balvin","I Like It","Atlantic/KSR",2,129,468,"268451"
129,"spotify:track:22oEJW6r2rMb9z4IntfyEa","Panic! At The Disco","Hey Look Ma, I Made It","DCD2 / Fueled By Ramen",47,130,103,"267903"
130,"spotify:track:1f38Gx6xQz6r4H1jGVNBJo","DJ Snake, J Balvin, Tyga","Loco Contigo (feat. J. Balvin & Tyga)","DJ Snake Music Productions Limited",53,140,34,"267409"
131,"spotify:track:7m9OqQk4RVRkw9JJdeAw96","XXXTENTACION","Jocelyn Flores","Bad Vibes Forever / EMPIRE",2,134,692,"266840"
132,"spotify:track:2uIX8YMNjGMD7441kqyyNU","Billie Eilish","ocean eyes","Darkroom",61,135,384,"266438"
133,"spotify:track:2P91MQbaiQOfbiz9VqhqKQ","Lauv","I Like Me Better","Lauv",30,138,764,"265476"
134,"spotify:track:2Jh3UqxnHJMyzMzku4uOtE","Juice WRLD","Feeling","Grade A Productions/Interscope Records",34,128,113,"264837"
135,"spotify:track:2j7mcsEz4n5XxMMqqjjB6p","Future, Doe Boy, Meek Mill","100 Shooters (feat. Meek Mill)","Epic/Freebandz",82,133,6,"264358"
136,"spotify:track:3A2yGHWIzmGEIolwonU69h","City Girls","Act Up","Quality Control Music/Motown Records",61,142,137,"262407"
137,"spotify:track:0TlLq3lA83rQOYtrqBqSct","Drake","Nonstop","Cash Money/Drake LP6",1,141,384,"261817"
138,"spotify:track:5Z3GHaZ6ec9bsiI5BenrbY","Khalid","Young Dumb & Broke","Right Hand Music Group, LLC/RCA Records",5,137,826,"261545"
139,"spotify:track:4dV3okcjbQwTcg4ObIGr4N","Shordie Shordie","Bitchuary","Warner Records",137,144,18,"259973"
140,"spotify:track:4u7EnebtmKWzUH433cf5Qv","Queen","Bohemian Rhapsody - Remastered 2011","Hollywood Records",36,143,268,"259799"
141,"spotify:track:3swc6WTsr7rl9DqQKQA55C","Post Malone, Ty Dolla $ign","Psycho (feat. Ty Dolla $ign)","Republic Records",1,145,510,"257427"
142,"spotify:track:2rMAtCaTj16NptyVfEIeAC","Megan Thee Stallion, DaBaby","Cash Shit (feat. DaBaby)","300 Entertainment",128,146,23,"257215"
143,"spotify:track:1ThmUihH9dF8EV08ku5AXN","Ski Mask The Slump God","Faucet Failure","Republic Records",25,148,225,"256762"
144,"spotify:track:40T5GIqQ1CegGm2PTEl8Bu","Billie Eilish","idontwannabeyouanymore","Darkroom",40,147,360,"256440"
145,"spotify:track:42fw0rxRO2xbesF6mJfd4Y","Dan + Shay","Tequila","Warner Records",48,154,499,"253579"
146,"spotify:track:1Bdptrvb7nQkq8kCw3siE9","Ed Sheeran, Young Thug, J Hus","Feels (feat. Young Thug & J Hus)","Atlantic Records UK",45,109,6,"253171"
147,"spotify:track:6vN77lE9LK6HP2DewaN6HZ","Lil Baby, Drake","Yes Indeed","Quality Control Music, LLC",2,156,429,"252963"
148,"spotify:track:3FHXUqaUer9o231Je1zxIN","Ed Sheeran, H.E.R.","I Don't Want Your Money (feat. H.E.R.)","Atlantic Records UK",58,113,6,"251422"
149,"spotify:track:2toVe5hfuIi97ytDPDbQFt","Tyga, Offset","Taste (feat. Offset)","Last Kings Music / EMPIRE",3,158,426,"250449"
150,"spotify:track:4VXIryQMWpIdGgYR4TrjT1","Juice WRLD","All Girls Are The Same","Juice WRLD Mixtape / ISR P&D",12,157,453,"249599"
151,"spotify:track:5w9c2J52mkdntKOmRLeM2m","Daddy Yankee, Snow","Con Calma","El Cartel Records (EC3)",43,153,160,"249092"
152,"spotify:track:3a1lNhkSLSkpJE4MSHpDu9","Post Malone, Quavo","Congratulations","Universal Records",5,150,927,"249061"
153,"spotify:track:68Vm2W4oURsPV3121vUZgB","NF","Time - Edit","NF Real Music",60,136,6,"248728"
154,"spotify:track:25sgk305KZfyuqVBQIahim","Ava Max","Sweet but Psycho","Atlantic Records",30,152,282,"248681"
155,"spotify:track:35rozLoS6QLE8HX8qswM3k","Marshmello, A Day To Remember","Rescue Me","Joytime Collective",65,151,20,"246584"
156,"spotify:track:14mHfNsSHN0FbLftyjrV9g","Flipp Dinero","Leave Me Alone","Cinematic/Epic/We The Best",10,166,340,"246369"
157,"spotify:track:2qRN7PWiHRLprw4FpDeI9N","Ed Sheeran, Paulo Londra, Dave","Nothing On You (feat. Paulo Londra & Dave)","Atlantic Records UK",59,119,6,"246274"
158,"spotify:track:12iDo4Kdw9vA2X1lN3UTVu","Bazzi, 21 Savage","Focus (feat. 21 Savage)","iamcosmic",35,160,34,"244502"
159,"spotify:track:6vWEAOUSxohKxhp0K1BsxL","YNW Melly, Kanye West","Mixed Personalities (feat. Kanye West)","P2019",12,162,180,"244053"
160,"spotify:track:56eGOeSsqdg3FLxdo83TwV","Lee Brice","Rumor","Curb Records",115,167,61,"243884"
161,"spotify:track:2tOOcDDYkh0PSjr6GwPEAJ","MAX, Quinn XCII","Love Me Less (feat. Quinn XCII)","Colour Vision Records/Sony Music Entertainment",61,155,72,"243821"
162,"spotify:track:1ZDmxwg7Lywlx68b7SsJjj","Nicki Minaj","MEGATRON","Young Money/Cash Money Records",21,149,26,"243035"
163,"spotify:track:6ERR6e7h6wCqGoz1TjiUJb","Luke Bryan","Knockin' Boots","Capitol Records Nashville",143,165,17,"242809"
164,"spotify:track:7AQim7LbvFVZJE3O8TYgf2","XXXTENTACION, Trippie Redd","Fuck Love (feat. Trippie Redd)","Bad Vibes Forever / EMPIRE",5,163,692,"242021"
165,"spotify:track:0mjAU3yKR1QnXnHtjGJqTM","OneRepublic","Rescue Me","Mosley Music/Interscope Records",51,161,62,"241784"
166,"spotify:track:5icOoE6VgqFKohjWWNp0Ac","Marshmello, CHVRCHES","Here With Me","Marshmello/Republic",15,159,132,"241771"
167,"spotify:track:0yFvWTLs3iIwDbc91noXGT","Chance the Rapper, TisaKorean, Murda Beatz","GRoCERIES","Chance the Rapper",35,164,62,"240560"
168,"spotify:track:09IStsImFySgyp0pIQdqAc","Zedd, Maren Morris, Grey","The Middle","UMGRI Interscope",5,168,527,"239564"
169,"spotify:track:5d1rmWWF1725tnYjq6rMDB","Ed Sheeran, Skrillex","Way To Break My Heart (feat. Skrillex)","Atlantic Records UK",57,127,6,"238633"
170,"spotify:track:6DCZcSspjsKoFjzjrWoCdn","Drake","God's Plan","Cash Money/Drake LP6",1,170,544,"238556"
171,"spotify:track:7GX5flRQZVHRAGd6B4TmDO","Lil Uzi Vert","XO Tour Llif3","Generation Now/Atlantic",1,169,846,"238374"
172,"spotify:track:4R8BJggjosTswLxtkw8V7P","Jhay Cortez, J Balvin, Bad Bunny","No Me Conoce - Remix","N&E Entertainment LLC",155,172,36,"237307"
173,"spotify:track:4ZT9FnbFu1PaBfV3itxiqT","Lil Skies","I","All We Got Ent.",13,173,139,"236640"
174,"spotify:track:4qQwGRtGT7l6ckQtdPEFd4","Florida Georgia Line","Talk You Out Of It","BMLG Records",140,171,60,"236485"
175,"spotify:track:1xzBco0xcoJEDXktl7Jxrr","Sheck Wes","Mo Bamba","Cactus Jack Records/ G.O.O.D. Music/ Interscope Records",1,176,356,"235042"
176,"spotify:track:7zLYKWcXnYeHHWidalz7rj","Lil Mosey","Noticed","Mogul Vision/Interscope Records",17,174,335,"234450"
177,"spotify:track:5qrSlOut2rNAWv3ubArkNy","Dean Lewis","Be Alright","Universal Music Australia Pty. Ltd.",19,177,345,"234141"
178,"spotify:track:2G1tXoGBaEMJ7FKGnkf6ud","Gucci Mane, Bruno Mars, Kodak Black","Wake Up in the Sky","Guwop Enterprises/Atlantic",6,182,307,"232785"
179,"spotify:track:5wujBwqG7INdStqGd4tRMX","Juice WRLD","Armed And Dangerous","Juice WRLD Mixtape / ISR P&D",9,178,251,"230445"
180,"spotify:track:3AEgic4yp82NxMWUjHtxnO","Ambjaay","Uno","Columbia",173,179,10,"230217"
181,"spotify:track:7KXjTSCq5nL1LoYtL7XAwS","Kendrick Lamar","HUMBLE.","Aftermath",1,180,837,"229579"
182,"spotify:track:36TO60sxDduIsO3xH8IcUh","Joyner Lucas, Logic","Isis","Twenty Nine Music Group (Joyner Lucas)",13,175,55,"228875"
183,"spotify:track:152lZdxL1OR0ZMW6KquMif","Khalid","Location","Right Hand Music Group, LLC/RCA Records",9,181,917,"227819"
184,"spotify:track:6gBFPUFcJLzWGx4lenP6h2","Travis Scott","goosebumps","Epic/Grand Hustle",16,185,922,"224619"
185,"spotify:track:340UVheS8z3ncW9TTUhAbc","Halsey","Nightmare","Capitol Records",10,188,60,"224205"
186,"spotify:track:02itaCXOdC54J0ISjqqFAp","R3HAB, A Touch Of Class","All Around The World (La La La)","Casablanca Records",132,184,28,"223580"
187,"spotify:track:3Tc57t9l2O8FwQZtQOvPXK","Billie Eilish","my strange addiction","Darkroom/Interscope Records",9,183,109,"222690"
188,"spotify:track:2qGfZAgDe1pV2y5xJAhi6R","YoungBoy Never Broke Again","Slime Belief","Never Broke Again, LLC",138,186,140,"221330"
189,"spotify:track:4OBZT9EnhYIV17t4pGw7ig","H.E.R., Daniel Caesar","Best Part (feat. Daniel Caesar)","MBK Entertainment/RCA Records",53,189,375,"220637"
190,"spotify:track:4pCEIQ6wBVuaJdER5bALtO","Lil Uzi Vert","That's a Rack","Generation Now/Atlantic",33,187,98,"220125"
191,"spotify:track:7sO5G9EABYOXQKNPNiE9NR","Offset, Metro Boomin","Ric Flair Drip (with Metro Boomin)","Slaughter Gang, LLC/Epic/Quality Control Music/Motown/Capitol/Boominati Worldwide/Republic",4,190,624,"219963"
192,"spotify:track:2KqJC0koTBUyDlsMt5ok1V","Thomas Rhett","Look What God Gave Her","The Valory Music Co.",57,196,76,"218658"
193,"spotify:track:5QiNbIilmMiMBXvaAlf7lN","The Chainsmokers, 5 Seconds of Summer","Who Do You Love","Disruptor Records/Columbia",28,191,152,"216004"
194,"spotify:track:2GGMabyHXnJmjY6CXhhB2e","Cardi B","Money","Atlantic/KSR",9,-1,261,"215436"
195,"spotify:track:51NFxnQvaosfDDutk0tams","Billie Eilish","bellyache","Darkroom",39,192,253,"215050"
196,"spotify:track:6dPyzkyZwoj9LqjQXOFdVv","Cardi B","Press","Atlantic/KSR",7,-1,47,"213909"
197,"spotify:track:5T8EDUDqKcs6OSOwEsfqG7","Queen","Don't Stop Me Now - Remastered 2011","Hollywood Records",69,199,211,"211912"
198,"spotify:track:116H0KvKr2Zl4RPuVBruDO","Bad Bunny, Drake","MIA (feat. Drake)","OVO Sound/Warner Records",2,197,278,"211862"
199,"spotify:track:5KawlOMHjWeUjQtnuRs22c","BTS, Halsey","Boy With Luv (feat. Halsey)","BIGHIT MUSIC",4,193,93,"209741"
