rank,uri,artist_names,track_name,source,peak_rank,previous_rank,days_on_chart,streams
1,"spotify:track:0TK2YIli7K1leLovkQiNik","Shawn Mendes, Camila Cabello","Señorita","Island Records",1,1,32,"1429896"
2,"spotify:track:6vBdBCoOhKHiYDDOcorfNo","Post Malone, Young Thug","Goodbyes (feat. Young Thug)","Republic Records",1,2,18,"1344026"
3,"spotify:track:5qmq61DAAOUaW8AUo8xKhh","Lizzo","Truth Hurts","Nice Life/Atlantic",3,3,93,"1232037"
4,"spotify:track:5ry2OE6R2zPQFDO85XkgRb","Drake, Rick Ross","Money In The Grave (Drake ft. Rick Ross)","Republic Records",1,4,38,"1192414"
5,"spotify:track:6fTt0CH2t0mdeB2N9XFG5r","Lil Nas X","Panini","Columbia",1,5,33,"1182951"
6,"spotify:track:1kBbgxAUc4HQv7cgIayIDH","Lil Tecca","Ransom","Republic Records",6,6,60,"1173410"
7,"spotify:track:70eFcWOvlMObDhURTqT4Fv","Ed Sheeran, Khalid","Beautiful People (feat. Khalid)","Atlantic Records UK",3,8,25,"959577"
8,"spotify:track:3KkXRkHbMCARz0aVfEt68P","Post Malone, Swae Lee","Sunflower - Spider-Man: Into the Spider-Verse","Universal Records",1,7,278,"937300"
9,"spotify:track:2gwkD6igEhQbDQegRCcdoB","DaBaby","Suge","South Coast Music Group/Interscope Records",3,9,115,"885237"
10,"spotify:track:6b2RcmUt1g9N9mQ3CbjX2Y","Sam Smith","How Do You Sleep?","Capitol",10,14,4,"804972"
11,"spotify:track:2Fxmhks0bxGSBdJ92vM42m","Billie Eilish","bad guy","Darkroom/Interscope Records",1,10,116,"786268"
12,"spotify:track:7DcvwMAiqKJQD1rrdfxSDx","Young Thug, J. Cole, Travis Scott","The London (feat. J. Cole & Travis Scott)","300 Entertainment/Atl",1,11,61,"771828"
13,"spotify:track:1DhRbox3xkceP64k3JeYfW","Ed Sheeran, Travis Scott","Antisocial (with Travis Scott)","Atlantic Records UK",5,13,11,"761440"
14,"spotify:track:51Fjme0JiitpyXKuyQiCDo","Y2K, bbno$","Lalala","Columbia",12,12,37,"754522"
15,"spotify:track:4hPpVbbakQNv8YTHYaOJP4","Marshmello, Kane Brown","One Thing Right","RCA Records Label Nashville",14,15,32,"739467"
16,"spotify:track:0hVXuCcriWRGvwMV1r5Yn9","Ed Sheeran, Justin Bieber","I Don't Care (with Justin Bieber)","Atlantic Records UK",1,17,74,"693851"
17,"spotify:track:3yNZ5r3LKfdmjoS3gkhUCT","Billie Eilish, Justin Bieber","bad guy (with Justin Bieber)","Darkroom/Interscope Records",3,19,11,"690243"
18,"spotify:track:6uFn47ACjqYkc0jADwEdj1","Polo G, Lil Tjay","Pop Out (feat. Lil Tjay)","Columbia",8,18,122,"676210"
19,"spotify:track:6u7jPi22kF8CTQ3rb9DHE7","Lil Nas X, Billy Ray Cyrus","Old Town Road - Remix","Columbia",1,16,109,"664551"
20,"spotify:track:6XHVuErjQ4XNm6nDPVCxVX","Chris Brown, Drake","No Guidance (feat. Drake)","Chris Brown Entertainment/RCA Records",3,20,45,"641056"
21,"spotify:track:6TqXcAFInzjp0bODyvrWEq","Khalid, Disclosure","Talk (feat. Disclosure)","Right Hand Music Group, LLC/RCA Records",5,22,166,"634243"
22,"spotify:track:4ak7xjvBeBOcJGWFDX9w5n","Lil Nas X, Cardi B","Rodeo","Columbia",7,21,32,"633290"
23,"spotify:track:6moU77g9RQyMzHNuKEaQKq","Ali Gatie","It's You","Warner Records",15,24,39,"610157"
24,"spotify:track:2nKYHpmwjLaEOXS3o7QMiz","Quality Control, Lil Baby, DaBaby","Baby","Quality Control Music/Motown Records",24,25,6,"599184"
25,"spotify:track:1kK6DwzyXJSp58u5HYWwuD","YG, Tyga, Jon Z","Go Loko (feat. Tyga, Jon Z)","Def Jam Recordings",14,23,81,"579159"
26,"spotify:track:5hVghJ4KaYES3BFUATCYn0","Tyler, The Creator","EARFQUAKE","Columbia",1,26,67,"560388"
27,"spotify:track:67XyC1GdSkKb9sbRRkUDXS","NLE Choppa, Blueface","Shotta Flow (Feat. Blueface) [Remix]","No Love Entertainment",27,29,21,"557959"
28,"spotify:track:2JvzF1RMd7lE3KmFlsyZD8","J. Cole","MIDDLE CHILD","Dreamville, Inc., Under exclusive license to Roc Nation Records",1,28,180,"538838"
29,"spotify:track:7qEHsqek33rTcFNT9PFqLf","Lewis Capaldi","Someone You Loved","Vertigo Berlin",29,31,85,"533963"
30,"spotify:track:6MWtB6iiXyIwun0YzU6DFP","Post Malone","Wow.","Republic Records",1,27,211,"531085"
31,"spotify:track:6uAm7pG66O1XesXS9bpHSF","Lizzo","Good as Hell","Nice Life/Atlantic",30,30,38,"519116"
32,"spotify:track:6LsAAHotRLMOHfCsSfYCsz","Shawn Mendes","If I Can't Have You","Island Records",3,32,81,"509730"
33,"spotify:track:29fRTIKsJhLUJoldM89GZS","Taylor Swift","You Need To Calm Down","Taylor Swift",1,34,39,"505194"
34,"spotify:track:2zjGJ0dChMR0KxBZS15aqo","Mustard, NAV, Playboi Carti, A Boogie Wit da Hoodie","Baguettes in the Face (feat. NAV, Playboi Carti & A Boogie Wit da Hoodie)","10 Summers Records/Interscope Records",34,35,25,"487214"
35,"spotify:track:3XiNC94b4Tq1xwv70sQJGN","Lil Uzi Vert","Sanguine Paradise","Generation Now/Atlantic",6,37,104,"479516"
36,"spotify:track:7oqftogUN82Q7VNy2TmTJW","Beyoncé, JAY-Z, Childish Gambino, Oumou Sangaré","MOOD 4 EVA (feat. Oumou Sangaré)","Parkwood Entertainment/Columbia",22,36,4,"475316"
37,"spotify:track:5dW1VZPcFqB4n0P08rGDgm","Blanco Brown","The Git Up","Broken Bow Records",33,33,40,"475206"
38,"spotify:track:1wJRveJZLSb1rjhnUHQiv6","A Boogie Wit da Hoodie, 6ix9ine","Swervin (feat. 6ix9ine)","Highbridge the Label / Atlantic Records",6,39,214,"456515"
39,"spotify:track:22vgEDb5hykfaTwLuskFGD","Jonas Brothers","Sucker","Jonas Brothers Recording",1,42,144,"452881"
40,"spotify:track:4vUmTMuQqjdnvlZmAH61Qk","Ed Sheeran, Camila Cabello, Cardi B","South of the Border (feat. Camila Cabello & Cardi B)","Atlantic Records UK",9,46,11,"447272"
41,"spotify:track:43zdsphuZLzwA9k4DJhU0I","Billie Eilish","when the party's over","Darkroom/Interscope Records",5,45,279,"445933"
42,"spotify:track:05CwHjIk71RXVU40boRMnR","The Chainsmokers, Bebe Rexha","Call You Mine","Disruptor Records/Columbia",20,47,53,"443274"
43,"spotify:track:2IRZnDFmlqMuOrYOLnZZyc","Meek Mill, Drake","Going Bad (feat. Drake)","MMG/Atlantic",2,41,235,"441853"
44,"spotify:track:4wuCQX7JvAZLlrcmH4AeZF","Ed Sheeran, Chance the Rapper, PnB Rock","Cross Me (feat. Chance the Rapper & PnB Rock)","Atlantic Records UK",8,44,60,"441136"
45,"spotify:track:6jmZlyf9DxcIoRrjw02YXm","Lil Nas X, Billy Ray Cyrus, Mason Ramsey, Young Thug","Old Town Road - Remix","Columbia",18,38,11,"432412"
46,"spotify:track:2TH65lNHgvLxCKXM3apjxI","Bad Bunny, Tainy","Callaita","Rimas Entertainment LLC",37,40,53,"428395"
47,"spotify:track:3j84U36KvLeXNDPv4t5pI8","Mustard, Migos","Pure Water (with Migos)","10 Summers Records/Interscope Records",11,43,186,"424016"
48,"spotify:track:5rU6kDNXZLXIinFezpbWbO","NAV, Meek Mill","Tap (feat. Meek Mill)","XO Records, LLC and Republic Records",48,48,90,"421674"
49,"spotify:track:6ocbgoVGwYJhOv1GgI9NsF","Ariana Grande","7 rings","Republic Records",1,49,186,"418836"
50,"spotify:track:78QR3Wp35dqAhFEc2qAGjE","Lil Baby, Gunna","Drip Too Hard (Lil Baby & Gunna)","Quality Control Music/Young Stoner Life Records, a 300 Entertainment Label/Motown Records/Capitol Records",1,50,314,"405709"
51,"spotify:track:2gTdDMpNxIRFSiu7HutMCg","Machine Gun Kelly, YUNGBLUD, Travis Barker","I Think I'm OKAY (with YUNGBLUD & Travis Barker)","Bad Boy/Interscope Records",29,55,46,"404070"
52,"spotify:track:6CcJMwBtXByIz4zQLzFkKc","Billie Eilish","i love you","Darkroom/Interscope Records",14,52,116,"402548"
53,"spotify:track:6kls8cSlUyHW2BUOkDJIZE","Ellie Goulding, Juice WRLD","Hate Me (with Juice WRLD)","Polydor Records",46,63,25,"399801"
54,"spotify:track:5PYQUBXc7NYeI1obMKSJK0","Katy Perry","Never Really Over","Capitol Records",10,58,53,"395734"
55,"spotify:track:56JyMaElW79S7TDWh1Zw1m","Ashley O","On A Roll","RCA Records Label",27,59,38,"395285"
56,"spotify:track:0u2P5u6lvoDfwTYjAADbn4","Billie Eilish, Khalid","lovely (with Khalid)","Darkroom",18,54,459,"394526"
57,"spotify:track:2ksOAxtIxY8yElEWw8RhgK","Anuel AA, Daddy Yankee, KAROL G, J Balvin, Ozuna","China","2019 Real Hasta La Muerte, LLC.",57,81,4,"391969"
58,"spotify:track:7eBqSVxrzQZtK2mmgRG6lC","YNW Melly","Murder On My Mind","P2018",4,51,300,"390855"
59,"spotify:track:7ILEWkpfdK6AjH2D7jppWk","Chris Brown, Justin Bieber, Ink","Don't Check On Me (feat. Justin Bieber & Ink)","Chris Brown Entertainment/RCA Records",20,60,26,"389636"
60,"spotify:track:4R9ATNRRl1uth17i5qDCc0","Bazzi","I.F.L.Y.","iamcosmic",54,72,4,"388425"
61,"spotify:track:0B3FovCVaGKS5w1FTidEUP","Blue Ivy, SAINt JHN, Beyoncé, WizKid","BROWN SKIN GIRL","Parkwood Entertainment/Columbia",32,56,4,"386887"
62,"spotify:track:0qc4QlcCxVTGyShurEv1UU","Sam Feldt, RANI","Post Malone (feat. RANI)","Spinnin' Records",34,53,33,"385501"
63,"spotify:track:6zeeWid2sgw4lap2jV61PZ","Khalid","Better","Right Hand Music Group, LLC/RCA Records",7,65,312,"381546"
64,"spotify:track:5WnfnSpuNEGXyEt78PBA6d","Dreamville, Bas, JID, Guapdad 4000, Reese LAFLARE, Jace, Mez, Smokepurpp, Buddy, Ski Mask The Slump God","Costa Rica (with Bas & JID feat. Guapdad 4000, Reese LAFLARE, Jace, Mez, Smokepurpp, Buddy & Ski Mask The Slump God)","Dreamville/Interscope Records",20,62,20,"378698"
65,"spotify:track:285pBltuF7vW8TeWk8hdRR","Juice WRLD","Lucid Dreams","Juice WRLD Mixtape / ISR P&D",1,57,442,"376208"
66,"spotify:track:7FGq80cy8juXBCD2nrqdWU","benny blanco, Halsey, Khalid","Eastside (with Halsey & Khalid)","Friends Keep Secrets/Interscope Records",7,66,375,"366105"
67,"spotify:track:7rvyVWja33WG9R97oeJAjx","Calboy","Envy Me","Polo Grounds Music/RCA Records",22,64,208,"361542"
68,"spotify:track:4SSnFejRGlZikf02HLewEF","Billie Eilish","bury a friend","Darkroom/Interscope Records",3,68,174,"360596"
69,"spotify:track:2xLMifQCjDGFmkHkpNLD9h","Travis Scott","SICKO MODE","Cactus Jack / Epic / Grand Hustle",1,61,354,"360055"
70,"spotify:track:2dpaYNEQHiRxtZbfNsse99","Marshmello, Bastille","Happier","Astralwerks",5,71,340,"359676"
71,"spotify:track:6Hj9jySrnFppAI0sEMCZpJ","Juice WRLD","Robbery","Grade A Productions/Interscope Records",2,67,159,"351123"
72,"spotify:track:7njKgVl3AnLflRad38o7AG","Bazzi","Paradise","iamcosmic",18,69,109,"348826"
73,"spotify:track:6oJ6le65B3SEqPwMRNXWjY","Kygo, Whitney Houston","Higher Love","Kygo/RCA Records",22,76,25,"343893"
74,"spotify:track:0DiDStADDVh3SvAsoJAFMk","Jonas Brothers","Only Human","Jonas Brothers Recording",6,78,46,"342482"
75,"spotify:track:7dt6x5M1jzdTEt8oCbisTK","Post Malone","Better Now","Republic Records",1,74,452,"339366"
76,"spotify:track:0AtP8EkGPn6SwxKDaUuXec","Ed Sheeran, Eminem, 50 Cent","Remember The Name (feat. Eminem & 50 Cent)","Atlantic Records UK",13,77,11,"333219"
77,"spotify:track:5KBARWIxeMGkvUax9VtVC9","Saweetie","My Type","ICY/Artistry Records/Warner Records",67,73,19,"330337"
78,"spotify:track:68Vm2W4oURsPV3121vUZgB","NF","Time - Edit","NF Real Music",60,94,11,"328966"
79,"spotify:track:53CJANUxooaqGOtdsBTh7O","Lil Nas X","Old Town Road","Columbia",1,70,143,"323511"
80,"spotify:track:0e7ipj03S05BNilyu5bRzt","Post Malone, 21 Savage","rockstar (feat. 21 Savage)","Republic Records",1,79,676,"320974"
81,"spotify:track:40OMBMYRk5IQL6xCzGM0JA","Martin Garrix, Macklemore, Fall Out Boy","Summer Days (feat. Macklemore & Patrick Stump of Fall Out Boy)","Epic Amsterdam",27,75,84,"319541"
82,"spotify:track:3TpBefRZ1vFcOH6z57PQRI","Bryce Vine, YG","La La Land (feat. YG)","Sire",73,91,53,"317374"
83,"spotify:track:5p7ujcrUXASCNwRaWNHR1C","Halsey","Without Me","Capitol Records",5,83,292,"315829"
84,"spotify:track:3ee8Jmje8o58CHK66QrVC2","XXXTENTACION","SAD!","Bad Vibes Forever, LLC",1,84,508,"313621"
85,"spotify:track:6G0FACzGN80Dj2v4ass5rq","iann dior, Trippie Redd","gone girl","TenThousand Projects, LLC",85,107,11,"311416"
86,"spotify:track:3AEgic4yp82NxMWUjHtxnO","Ambjaay","Uno","Columbia",82,82,15,"311250"
87,"spotify:track:6MF4tRr5lU8qok8IKaFOBE","Dreamville, J. Cole, Lute, DaBaby","Under The Sun (with J. Cole & Lute feat. DaBaby)","Dreamville/Interscope Records",10,86,18,"308828"
88,"spotify:track:4XiGKQqbmnMVxDzUj6j3f2","YK Osiris","Worth It","Def Jam Recordings",68,88,142,"308657"
89,"spotify:track:3Ol2xnObFdKV9pmRD2t9x8","A Boogie Wit da Hoodie","Look Back at It","Highbridge the Label / Atlantic Records",8,85,228,"308374"
90,"spotify:track:6Qs4SXO9dwPj5GKvVOv8Ki","Sam Smith, Normani","Dancing With A Stranger (with Normani)","Capitol",10,100,193,"307292"
91,"spotify:track:3GJ4hzg4lrGwU51Y3VARbF","Dan + Shay","Speechless","Warner Records",77,102,335,"306194"
92,"spotify:track:3e9HZxeyfWwjeyPAMmWSSQ","Ariana Grande","thank u, next","Republic Records",1,103,261,"303072"
93,"spotify:track:59ywHNwwchG4nZJMLyxSzd","Offset, Cardi B","Clout (feat. Cardi B)","Quality Control Music/Motown Records",41,87,102,"300304"
94,"spotify:track:2rxQMGVafnNaRaXlRMWPde","Luke Combs","Beautiful Crazy","River House Artists/Columbia Nashville",54,97,376,"298980"
95,"spotify:track:3Fj47GNK2kUF0uaEDgXLaD","Billie Eilish","wish you were gay","Darkroom/Interscope Records",2,89,141,"298493"
96,"spotify:track:7f1zjZG77S891Uv4O68yfk","DaBaby, Offset","Baby Sitter (feat. Offset)","South Coast Music Group/Interscope Records",55,92,73,"298145"
97,"spotify:track:3WyRgi8CzQnhzO0xw79tTS","DaBaby","Goin Baby","South Coast Music Group/Interscope Records",59,95,95,"296178"
98,"spotify:track:36J0iaPDGbYGsHvYpaYs3k","Dreamville, JID, Bas, J. Cole, EARTHGANG, Young Nudy","Down Bad (feat. JID, Bas, J. Cole, EARTHGANG & Young Nudy)","Dreamville/Interscope Records",12,99,40,"295227"
99,"spotify:track:1c0hsvHLELX6y8qymnpLKL","Lunay, Daddy Yankee, Bad Bunny","Soltera - Remix","La Familia",52,80,74,"294788"
100,"spotify:track:6foY66mWZN0pSRjZ408c00","Morgan Wallen","Whiskey Glasses","Big Loud Records",58,93,131,"294051"
101,"spotify:track:6XkLPzkKzPhpr3hrvl1TUq","Blueface, Rich The Kid","Daddy (feat. Rich The Kid)","Cash Money Records Inc.",101,105,17,"292635"
102,"spotify:track:0k664IuFwVP557Gnx7RhIl","Lizzo","Juice","Nice Life/Atlantic",57,98,95,"290089"
103,"spotify:track:2wZjsbwmWfNVslgV5afl1L","Lil Baby, Future","Out The Mud","Quality Control/Motown Records",41,106,32,"285837"
104,"spotify:track:2t8yVaLvJ0RenpXUIAC52d","21 Savage","a lot","Slaughter Gang, LLC/Epic Records",2,101,214,"285154"
105,"spotify:track:1Ej96GIBCTvgH7tNX1r3qr","Sech, Darell","Otro Trago","Rich Music/Ingrooves Records",64,90,67,"284649"
106,"spotify:track:0rKtyWc8bvkriBthvHKY8d","Joji","SLOW DANCING IN THE DARK","88rising Music/Warner Records",26,112,304,"282557"
107,"spotify:track:7M2tXmeS15NAzEn7ABFeBg","Logic, Eminem","Homicide (feat. Eminem)","Def Jam Recordings",1,117,81,"281297"
108,"spotify:track:4kV4N9D1iKVxx1KLvtTpjS","Ariana Grande","break up with your girlfriend, i'm bored","Republic Records",1,113,165,"280850"
109,"spotify:track:4dAMdQ6g4kGmnc1MDHsg77","NLE Choppa","Shotta Flow","No Love Entertainment",43,111,126,"279291"
110,"spotify:track:75ZvA4QfFiZvzhj2xkaWAh","Post Malone","I Fall Apart","Universal Records",2,118,675,"278362"
111,"spotify:track:5kfNriitmkNE8mUbZ7gbq8","Khalid","Saturday Nights","Right Hand Music Group, LLC/RCA Records",13,120,271,"278338"
112,"spotify:track:0fea68AdmYNygeTGI4RC18","J Balvin, Bad Bunny","LA CANCIÓN","Universal Music Latino / Rimas",30,110,25,"277364"
113,"spotify:track:7nfmK6oHPDlAd68A11d7AN","Luke Combs","Beer Never Broke My Heart","River House Artists/Columbia Nashville",32,96,76,"276097"
114,"spotify:track:4MsUsFfWseB9M2plGJyuIw","Taylor Swift, Brendon Urie, Panic! At The Disco","ME! (feat. Brendon Urie of Panic! At The Disco)","Taylor Swift",1,133,88,"275420"
115,"spotify:track:1rqqCSm0Qe4I9rUvWncaom","Panic! At The Disco","High Hopes","DCD2 / Fueled By Ramen",12,124,406,"274816"
116,"spotify:track:1f38Gx6xQz6r4H1jGVNBJo","DJ Snake, J Balvin, Tyga","Loco Contigo (feat. J. Balvin & Tyga)","DJ Snake Music Productions Limited",53,125,39,"274682"
117,"spotify:track:4tNXntkAzQ5A2dfYRYGIIQ","5 Seconds of Summer","Easier","5 Seconds Of Summer/Interscope",18,129,60,"273831"
118,"spotify:track:0JP9xo3adEtGSdUEISiszL","XXXTENTACION","Moonlight","Bad Vibes Forever, LLC",2,116,494,"271586"
119,"spotify:track:3A2yGHWIzmGEIolwonU69h","City Girls","Act Up","Quality Control Music/Motown Records",61,104,142,"271204"
120,"spotify:track:1dyxS3YzBbL0t8rEVwVQ1K","Blake Shelton","God's Country","Warner Records",59,114,78,"270509"
121,"spotify:track:2WyRfGeHo97VC5mP1BBSzr","Miley Cyrus","Mother's Daughter","RCA Records Label",9,136,53,"270405"
122,"spotify:track:2VxeLyX666F8uXCJ0dZF8B","Lady Gaga, Bradley Cooper","Shallow","A Star is Born OST",6,122,296,"268806"
123,"spotify:track:2rMAtCaTj16NptyVfEIeAC","Megan Thee Stallion, DaBaby","Cash Shit (feat. DaBaby)","300 Entertainment",117,123,28,"267036"
124,"spotify:track:2iUXsYOEPhVqEBwsqP70rE","5 Seconds of Summer","Youngblood","Capitol",12,130,464,"266685"
125,"spotify:track:0FZ4Dmg8jJJAPJnvBIzD9z","Kodak Black, Offset, Travis Scott","ZEZE (feat. Travis Scott & Offset)","Atlantic Records",1,115,284,"263875"
126,"spotify:track:7m9OqQk4RVRkw9JJdeAw96","XXXTENTACION","Jocelyn Flores","Bad Vibes Forever / EMPIRE",2,126,697,"263269"
127,"spotify:track:4u7EnebtmKWzUH433cf5Qv","Queen","Bohemian Rhapsody - Remastered 2011","Hollywood Records",36,109,273,"260149"
128,"spotify:track:0oVxGuRMnawFgA8aduocfc","Tory Lanez","Forever","Mad Love/Interscope Records",82,135,4,"258809"
129,"spotify:track:3XF5xLJHOQQRbWya6hBp7d","Billie Eilish","you should see me in a crown","Darkroom/Interscope Records",7,134,271,"258236"
130,"spotify:track:25ZAibhr3bdlMCLmubZDVt","J Balvin, Bad Bunny","QUE PRETENDES","Universal Music Latino / Rimas",16,121,25,"258232"
131,"spotify:track:5Uw7Dut2lZfexn3Y09swpf","Mark Ronson, Camila Cabello","Find U Again (feat. Camila Cabello)","Columbia",21,145,53,"257934"
132,"spotify:track:22oEJW6r2rMb9z4IntfyEa","Panic! At The Disco","Hey Look Ma, I Made It","DCD2 / Fueled By Ramen",47,140,108,"255858"
133,"spotify:track:2uIX8YMNjGMD7441kqyyNU","Billie Eilish","ocean eyes","Darkroom",61,138,389,"254125"
134,"spotify:track:58q2HKrzhC3ozto2nDdN4z","Cardi B, Bad Bunny, J Balvin","I Like It","Atlantic/KSR",2,119,473,"253416"
135,"spotify:track:5Z3GHaZ6ec9bsiI5BenrbY","Khalid","Young Dumb & Broke","Right Hand Music Group, LLC/RCA Records",5,131,831,"253359"
136,"spotify:track:0OTBOHjEaoqroFlfut1ZsH","XXXTENTACION, Ky-Mani Marley, Stefflon Don, Vybz Kartel","Royalty (feat. Ky-Mani Marley, Stefflon Don & Vybz Kartel)","Bad Vibes Forever / EMPIRE",44,108,4,"253268"
137,"spotify:track:0TlLq3lA83rQOYtrqBqSct","Drake","Nonstop","Cash Money/Drake LP6",1,128,389,"252681"
138,"spotify:track:1ThmUihH9dF8EV08ku5AXN","Ski Mask The Slump God","Faucet Failure","Republic Records",25,127,230,"252213"
139,"spotify:track:4VXIryQMWpIdGgYR4TrjT1","Juice WRLD","All Girls Are The Same","Juice WRLD Mixtape / ISR P&D",12,142,458,"252042"
140,"spotify:track:42fw0rxRO2xbesF6mJfd4Y","Dan + Shay","Tequila","Warner Records",48,137,504,"251955"
141,"spotify:track:4e4fqjx0Izh4svvTef1z7e","Bebe Rexha, Florida Georgia Line","Meant to Be (feat. Florida Georgia Line)","Warner Bros.",15,141,679,"251507"
142,"spotify:track:2Jh3UqxnHJMyzMzku4uOtE","Juice WRLD","Feeling","Grade A Productions/Interscope Records",34,150,118,"251166"
143,"spotify:track:3swc6WTsr7rl9DqQKQA55C","Post Malone, Ty Dolla $ign","Psycho (feat. Ty Dolla $ign)","Republic Records",1,132,515,"250225"
144,"spotify:track:7COXchtUOMd6uIT6HvmRaI","Lauv, Troye Sivan","i'm so tired...","Lauv",22,165,179,"243806"
145,"spotify:track:2P91MQbaiQOfbiz9VqhqKQ","Lauv","I Like Me Better","Lauv",30,162,769,"243710"
146,"spotify:track:4qQwGRtGT7l6ckQtdPEFd4","Florida Georgia Line","Talk You Out Of It","BMLG Records",140,147,65,"243299"
147,"spotify:track:6vN77lE9LK6HP2DewaN6HZ","Lil Baby, Drake","Yes Indeed","Quality Control Music, LLC",2,144,434,"242975"
148,"spotify:track:5w9c2J52mkdntKOmRLeM2m","Daddy Yankee, Snow","Con Calma","El Cartel Records (EC3)",43,143,165,"242227"
149,"spotify:track:3a1lNhkSLSkpJE4MSHpDu9","Post Malone, Quavo","Congratulations","Universal Records",5,148,932,"241960"
150,"spotify:track:40T5GIqQ1CegGm2PTEl8Bu","Billie Eilish","idontwannabeyouanymore","Darkroom",40,158,365,"239763"
151,"spotify:track:7AQim7LbvFVZJE3O8TYgf2","XXXTENTACION, Trippie Redd","Fuck Love (feat. Trippie Redd)","Bad Vibes Forever / EMPIRE",5,154,697,"239585"
152,"spotify:track:18uwL0vNUanqZH0ro2QcOP","Jeremy Zucker","comethru","Republic Records",148,172,31,"239001"
153,"spotify:track:4dV3okcjbQwTcg4ObIGr4N","Shordie Shordie","Bitchuary","Warner Records",137,149,23,"238766"
154,"spotify:track:7GX5flRQZVHRAGd6B4TmDO","Lil Uzi Vert","XO Tour Llif3","Generation Now/Atlantic",1,152,851,"238264"
155,"spotify:track:4ZT9FnbFu1PaBfV3itxiqT","Lil Skies","I","All We Got Ent.",13,156,144,"237853"
156,"spotify:track:14mHfNsSHN0FbLftyjrV9g","Flipp Dinero","Leave Me Alone","Cinematic/Epic/We The Best",10,151,345,"236688"
157,"spotify:track:2j7mcsEz4n5XxMMqqjjB6p","Future, Doe Boy, Meek Mill","100 Shooters (feat. Meek Mill)","Epic/Freebandz",82,167,11,"236533"
158,"spotify:track:7zLYKWcXnYeHHWidalz7rj","Lil Mosey","Noticed","Mogul Vision/Interscope Records",17,160,340,"236476"
159,"spotify:track:2toVe5hfuIi97ytDPDbQFt","Tyga, Offset","Taste (feat. Offset)","Last Kings Music / EMPIRE",3,139,431,"236122"
160,"spotify:track:4R8BJggjosTswLxtkw8V7P","Jhay Cortez, J Balvin, Bad Bunny","No Me Conoce - Remix","N&E Entertainment LLC",134,146,41,"234535"
161,"spotify:track:6vWEAOUSxohKxhp0K1BsxL","YNW Melly, Kanye West","Mixed Personalities (feat. Kanye West)","P2019",12,155,185,"234361"
162,"spotify:track:56eGOeSsqdg3FLxdo83TwV","Lee Brice","Rumor","Curb Records",115,163,66,"234296"
163,"spotify:track:25sgk305KZfyuqVBQIahim","Ava Max","Sweet but Psycho","Atlantic Records",30,166,287,"232390"
164,"spotify:track:5wujBwqG7INdStqGd4tRMX","Juice WRLD","Armed And Dangerous","Juice WRLD Mixtape / ISR P&D",9,161,256,"230531"
165,"spotify:track:5qrSlOut2rNAWv3ubArkNy","Dean Lewis","Be Alright","Universal Music Australia Pty. Ltd.",19,177,350,"230118"
166,"spotify:track:1xzBco0xcoJEDXktl7Jxrr","Sheck Wes","Mo Bamba","Cactus Jack Records/ G.O.O.D. Music/ Interscope Records",1,153,361,"228005"
167,"spotify:track:6DCZcSspjsKoFjzjrWoCdn","Drake","God's Plan","Cash Money/Drake LP6",1,159,549,"226274"
168,"spotify:track:152lZdxL1OR0ZMW6KquMif","Khalid","Location","Right Hand Music Group, LLC/RCA Records",9,170,922,"225984"
169,"spotify:track:2tOOcDDYkh0PSjr6GwPEAJ","MAX, Quinn XCII","Love Me Less (feat. Quinn XCII)","Colour Vision Records/Sony Music Entertainment",61,183,77,"224769"
170,"spotify:track:0yFvWTLs3iIwDbc91noXGT","Chance the Rapper, TisaKorean, Murda Beatz","GRoCERIES","Chance the Rapper",35,171,67,"223975"
171,"spotify:track:09IStsImFySgyp0pIQdqAc","Zedd, Maren Morris, Grey","The Middle","UMGRI Interscope",5,181,532,"223325"
172,"spotify:track:0mjAU3yKR1QnXnHtjGJqTM","OneRepublic","Rescue Me","Mosley Music/Interscope Records",51,-1,65,"223212"
173,"spotify:track:2KqJC0koTBUyDlsMt5ok1V","Thomas Rhett","Look What God Gave Her","The Valory Music Co.",57,157,81,"223148"
174,"spotify:track:6gBFPUFcJLzWGx4lenP6h2","Travis Scott","goosebumps","Epic/Grand Hustle",16,169,927,"222490"
175,"spotify:track:4pCEIQ6wBVuaJdER5bALtO","Lil Uzi Vert","That's a Rack","Generation Now/Atlantic",33,176,103,"221540"
176,"spotify:track:7KXjTSCq5nL1LoYtL7XAwS","Kendrick Lamar","HUMBLE.","Aftermath",1,179,842,"219545"
177,"spotify:track:5icOoE6VgqFKohjWWNp0Ac","Marshmello, CHVRCHES","Here With Me","Marshmello/Republic",15,182,137,"218531"
178,"spotify:track:2G1tXoGBaEMJ7FKGnkf6ud","Gucci Mane, Bruno Mars, Kodak Black","Wake Up in the Sky","Guwop Enterprises/Atlantic",6,164,312,"217090"
179,"spotify:track:6ERR6e7h6wCqGoz1TjiUJb","Luke Bryan","Knockin' Boots","Capitol Records Nashville",143,168,22,"216986"
180,"spotify:track:08tq1XcHwVt5PHXUo87i0D","Dan + Shay","All To Myself","Warner Records",126,186,20,"216781"
181,"spotify:track:3pZO6GoVPeSYDxxsH6vCdj","Dreamville, J. Cole, Young Nudy","Sunset (with J. Cole feat. Young Nudy)","Dreamville/Interscope Records",28,180,18,"215510"
182,"spotify:track:7sO5G9EABYOXQKNPNiE9NR","Offset, Metro Boomin","Ric Flair Drip (with Metro Boomin)","Slaughter Gang, LLC/Epic/Quality Control Music/Motown/Capitol/Boominati Worldwide/Republic",4,173,629,"215484"
183,"spotify:track:0VsGaRXR5WAzpu51unJTis","Ed Sheeran, Yebba","Best Part of Me (feat. YEBBA)","Atlantic Records UK",25,-1,17,"212786"
184,"spotify:track:4OBZT9EnhYIV17t4pGw7ig","H.E.R., Daniel Caesar","Best Part (feat. Daniel Caesar)","MBK Entertainment/RCA Records",53,195,378,"211862"
185,"spotify:track:340UVheS8z3ncW9TTUhAbc","Halsey","Nightmare","Capitol Records",10,199,65,"209147"
186,"spotify:track:36TO60sxDduIsO3xH8IcUh","Joyner Lucas, Logic","Isis","Twenty Nine Music Group (Joyner Lucas)",13,197,60,"209147"
187,"spotify:track:5T8EDUDqKcs6OSOwEsfqG7","Queen","Don't Stop Me Now - Remastered 2011","Hollywood Records",69,175,216,"208445"
188,"spotify:track:1gGhqfs2pDTOI30AEXMXrn","Oliver Tree","Alien Boy","Atlantic Records",188,-1,1,"208384"
189,"spotify:track:3Tc57t9l2O8FwQZtQOvPXK","Billie Eilish","my strange addiction","Darkroom/Interscope Records",9,192,112,"206872"
190,"spotify:track:1ZDmxwg7Lywlx68b7SsJjj","Nicki Minaj","MEGATRON","Young Money/Cash Money Records",21,187,31,"206397"
191,"spotify:track:7mldq42yDuxiUNn08nvzHO","Sam Hunt","Body Like A Back Road","MCA Nashville",12,174,602,"206175"
192,"spotify:track:4bHsxqR3GMrXTxEPLuK5ue","Journey","Don't Stop Believin'","Columbia",157,178,36,"205164"
193,"spotify:track:79esEXlqqmq0GPz0xQSZTV","Shawn Mendes","Lost In Japan","Island Records",16,-1,167,"205142"
194,"spotify:track:6ucmgsair6pvRYfwgvI6e0","Beyoncé","SPIRIT - From Disney's ""The Lion King""","Parkwood Entertainment/Columbia",85,-1,5,"204849"
195,"spotify:track:51NFxnQvaosfDDutk0tams","Billie Eilish","bellyache","Darkroom",39,200,256,"204709"
196,"spotify:track:7AFASza1mXqntmGtbxXprO","XXXTENTACION","changes","Bad Vibes Forever, LLC",4,-1,488,"204428"
197,"spotify:track:62vpWI1CHwFy7tMIcSStl8","J. Cole","No Role Modelz","Roc Nation Records LLC",64,-1,765,"202884"
198,"spotify:track:37AGgp9VP8TVJBfEat74Bj","Machine Gun Kelly, Trippie Redd","Candy (feat. Trippie Redd)","Bad Boy/Interscope Records",167,-1,7,"202156"
199,"spotify:track:116H0KvKr2Zl4RPuVBruDO","Bad Bunny, Drake","MIA (feat. Drake)","OVO Sound/Warner Records",2,184,281,"201505"
200,"spotify:track:5uCax9HTNlzGybIStD3vDh","James Arthur","Say You Won't Let Go","Columbia",14,-1,672,"201256"
