rank,uri,artist_names,track_name,source,peak_rank,previous_rank,days_on_chart,streams
1,"spotify:track:7wGoVu4Dady5GV0Sv4UIsx","Post Malone, 21 Savage","rockstar (feat. 21 Savage)","Republic Records",1,10,103,"1346401"
2,"spotify:track:43ZyHQITOjhciSUUNPVRHc","Lil Pump","Gucci Gang","Warner Records",2,23,115,"848523"
3,"spotify:track:75ZvA4QfFiZvzhj2xkaWAh","Post Malone","I Fall Apart","Universal Records",2,34,102,"814008"
4,"spotify:track:75FDPwaULRdYDn4StFN2rT","Cardi B, 21 Savage","Bartier Cardi (feat. 21 Savage)","Atlantic/KSR",4,38,5,"807779"
5,"spotify:track:2DQ1ITjI0YoLFzuADN1ZBW","G-Eazy, A$AP Rocky, Cardi B","No Limit","BPG/RVG/RCA Records",3,40,110,"732107"
6,"spotify:track:7sO5G9EABYOXQKNPNiE9NR","Offset, Metro Boomin","Ric Flair Drip (with Metro Boomin)","Slaughter Gang, LLC/Epic/Quality Control Music/Motown/Capitol/Boominati Worldwide/Republic",4,39,57,"731327"
7,"spotify:track:5k38wzpLb15YgncyWdTZE4","G-Eazy, Halsey","Him & I (with Halsey)","BPG/RVG/RCA Records",3,49,26,"689756"
8,"spotify:track:42CeaId2XNlxugDvyqHfDf","Post Malone","Candy Paint","Republic Records",4,44,215,"686492"
9,"spotify:track:0ofbQMrRDsUaVKq2mGLEAb","Camila Cabello, Young Thug","Havana (feat. Young Thug)","Syco Music/Epic",3,45,144,"676128"
10,"spotify:track:7GX5flRQZVHRAGd6B4TmDO","Lil Uzi Vert","XO Tour Llif3","Generation Now/Atlantic",1,47,278,"655294"
11,"spotify:track:2fQrGHiQOvpL9UgPvtYy6G","21 Savage","Bank Account","Slaughter Gang, LLC/Epic Records",1,46,173,"639068"
12,"spotify:track:1mXVgsBdtIVeCLJnSnmtdV","Sam Smith","Too Good At Goodbyes","Capitol",2,59,110,"601851"
13,"spotify:track:5UEnHoDYpsxlfzWLZIc7LD","Eminem, Ed Sheeran","River (feat. Ed Sheeran)","Aftermath",2,65,12,"590928"
14,"spotify:track:6mrKP2jyIQmM0rw6fQryjr","NF","Let You Down","NF Real Music",9,71,87,"572406"
15,"spotify:track:0tgVpDi06FyKpA1z0VMD4v","Ed Sheeran","Perfect","Atlantic Records UK",11,70,216,"571378"
16,"spotify:track:3ncgNpxLoBQ65ABk4djDyd","Famous Dex, A$AP Rocky","PICK IT UP (feat. A$AP Rocky)","300 Entertainment",13,58,61,"565964"
17,"spotify:track:1YZfcVLbbJwfizR5cDOp3q","Migos, Nicki Minaj, Cardi B","MotorSport","Quality Control Music, LLC",8,56,61,"558509"
18,"spotify:track:3a1lNhkSLSkpJE4MSHpDu9","Post Malone, Quavo","Congratulations","Universal Records",5,67,360,"553954"
19,"spotify:track:4DTpngLjoHj5gFxEZFeD3J","Kodak Black, Lil Wayne","Codeine Dreaming (feat. Lil Wayne)","Atlantic Records",19,79,33,"529027"
20,"spotify:track:5tz69p7tJuGPeMGwNTxYuV","Logic, Alessia Cara, Khalid","1-800-273-8255","Def Jam Recordings",1,73,243,"516041"
21,"spotify:track:7KXjTSCq5nL1LoYtL7XAwS","Kendrick Lamar","HUMBLE.","Aftermath",1,87,271,"512826"
22,"spotify:track:6PGoSes0D9eUDeeAafB2As","Kendrick Lamar, Zacari","LOVE. FEAT. ZACARI.","Aftermath",5,81,257,"505606"
23,"spotify:track:4dVpf9jZjcORqGTLUaeYj9","A$AP Ferg","Plain Jane","RCA Records Label",6,83,123,"501128"
24,"spotify:track:7EmGUiUaOSGDnUUQUDrOXC","Selena Gomez, Marshmello","Wolves","Selena Gomez PS",3,94,63,"496893"
25,"spotify:track:5Z3GHaZ6ec9bsiI5BenrbY","Khalid","Young Dumb & Broke","Right Hand Music Group, LLC/RCA Records",5,88,266,"482761"
26,"spotify:track:2ekn2ttSfGqwhhate0LSR0","Dua Lipa","New Rules","Warner Records",15,98,169,"478672"
27,"spotify:track:7iDa6hUg2VgEL1o1HjmfBn","Bebe Rexha, Florida Georgia Line","Meant to Be (feat. Florida Georgia Line)","Warner Records",22,110,109,"478004"
28,"spotify:track:2771LMNxwf62FTAdpJMQfM","Cardi B","Bodak Yellow","Atlantic/KSR",2,86,159,"475886"
29,"spotify:track:5WoaF1B5XIEnWfmb5NZikf","Miguel, Travis Scott","Sky Walker (feat. Travis Scott)","ByStorm Entertainment/RCA Records",27,97,124,"467542"
30,"spotify:track:0bYg9bo50gSsH3LtXe2SQn","Mariah Carey","All I Want for Christmas Is You","Columbia",1,1,52,"465291"
31,"spotify:track:1XRgIKC5TPwo7nWGyKqgG0","Gucci Mane, Migos","I Get the Bag (feat. Migos)","Guwop Enterprises/Atlantic",7,91,131,"461836"
32,"spotify:track:790MhTXPFrYkrqCKvpg4t1","NAV, Lil Uzi Vert","Wanted You (feat. Lil Uzi Vert)","XO Records",23,93,47,"455402"
33,"spotify:track:6NWl2m8asvH83xjuXVNsuG","Lil Xan","Betrayed","Columbia",22,95,72,"448985"
34,"spotify:track:7foypmc7KZyU716Yv63BPe","Huncho Jack, Travis Scott, Quavo","Saint","Quality Control Music - Epic",15,92,5,"440733"
35,"spotify:track:7y9iMe8SOB6z3NoHE2OfXl","Halsey","Bad At Love","Astralwerks (ASW)",22,111,135,"439875"
36,"spotify:track:7vGuf3Y35N4wmASOKLUVVU","Marshmello, Khalid","Silence","Joytime Collective/RCA Records",7,113,138,"439185"
37,"spotify:track:6urLjX35oXXRYtcH1b3dCh","Huncho Jack, Travis Scott, Quavo, Offset","Dubai Shit","Quality Control Music - Epic",10,96,5,"414094"
38,"spotify:track:2x0WlnmfG39ZuDmstl9xfX","Taylor Swift, Ed Sheeran, Future","End Game","Big Machine Records, LLC",37,129,26,"414021"
39,"spotify:track:5AEtlRudpgdT5FtNiuly6Y","Hailee Steinfeld, Alesso, Florida Georgia Line, WATT","Let Me Go (with Alesso, Florida Georgia Line & watt)","Universal Records",20,124,110,"413879"
40,"spotify:track:1yxgsra98r3qAtxqiGZPiX","Travis Scott","BUTTERFLY EFFECT","Cactus Jack / Epic / Grand Hustle",9,106,221,"411911"
41,"spotify:track:3hBBKuWJfxlIlnd9QFoC8k","Maroon 5, SZA","What Lovers Do (feat. SZA)","Interscope Records*",7,119,119,"404076"
42,"spotify:track:6gBFPUFcJLzWGx4lenP6h2","Travis Scott","goosebumps","Epic/Grand Hustle",16,109,360,"403857"
43,"spotify:track:40oKW22ZNNkEdZLJTScaQI","Kodak Black, XXXTENTACION","Roll in Peace (feat. XXXTENTACION)","Atlantic Records",22,104,131,"396587"
44,"spotify:track:152lZdxL1OR0ZMW6KquMif","Khalid","Location","Right Hand Music Group, LLC/RCA Records",9,116,359,"395398"
45,"spotify:track:7J6bnDDitOwfelaJNixHhL","Huncho Jack, Travis Scott, Quavo","Modern Slavery","Quality Control Music - Epic",2,100,5,"389687"
46,"spotify:track:0tKcYR2II1VCQWT79i5NrW","Imagine Dragons","Thunder","Kid Ina Korner / Interscope",16,118,243,"387537"
47,"spotify:track:2eAZfqOm4EnOF9VvN50Tyc","Lil Uzi Vert, Oh Wonder","The Way Life Goes (feat. Oh Wonder)","Generation Now/Atlantic",4,112,124,"384764"
48,"spotify:track:0taOCiup4HNG9LmbduVlJj","YBN Nahmir","Rubbin off the Paint","2018",47,108,65,"381038"
49,"spotify:track:7m9OqQk4RVRkw9JJdeAw96","XXXTENTACION","Jocelyn Flores","Bad Vibes Forever / EMPIRE",3,107,124,"380179"
50,"spotify:track:628Ueb4sRiXApObhcU9iPU","Huncho Jack, Travis Scott, Quavo","Black & Chinese","Quality Control Music - Epic",5,103,5,"378236"
51,"spotify:track:1bhUWB0zJMIKr9yVPrkEuI","Ed Sheeran, Beyoncé","Perfect Duet (Ed Sheeran & Beyoncé)","Atlantic Records UK",3,130,26,"375649"
52,"spotify:track:3B54sVLJ402zGa6Xm4YGNe","French Montana, Swae Lee","Unforgettable","Bad Boy Entertainment/Epic Records",1,131,264,"373643"
53,"spotify:track:5Htb1uFQ1KrkFXlefS8oGj","Demi Lovato","Tell Me You Love Me","Island Records",53,148,26,"364968"
54,"spotify:track:7AQim7LbvFVZJE3O8TYgf2","XXXTENTACION, Trippie Redd","Fuck Love (feat. Trippie Redd)","Bad Vibes Forever / EMPIRE",7,115,124,"358628"
55,"spotify:track:6VpQdig9pdpTSIFItgkJV5","Camila Cabello","Never Be the Same","Syco Music/Epic",41,150,19,"357641"
56,"spotify:track:3m660poUr1chesgkkjQM7P","Demi Lovato","Sorry Not Sorry","Island Records",6,144,169,"356969"
57,"spotify:track:6p8NuHm8uCGnn2Dtbtf7zE","Migos, Gucci Mane","Slippery (feat. Gucci Mane)","Quality Control Music",17,127,334,"353460"
58,"spotify:track:1f5cbQtDrykjarZVrShaDI","A Boogie Wit da Hoodie, Kodak Black","Drowning (feat. Kodak Black)","Highbridge The Label",18,123,285,"352254"
59,"spotify:track:7qiZfU4dY1lWllzX7mPBI3","Ed Sheeran","Shape of You","Atlantic Records UK",1,149,355,"340554"
60,"spotify:track:4vwfOiyWxXeEdx4ejAJgdx","Huncho Jack, Travis Scott, Quavo, Takeoff","Eye 2 Eye","Quality Control Music - Epic",4,117,5,"339716"
61,"spotify:track:5u6vkDnOyaf8LsteDAj2ub","21 Savage, Offset, Metro Boomin, Travis Scott","Ghostface Killers (feat. Travis Scott)","Slaughter Gang, LLC/Epic/Quality Control Music/Motown/Capitol/Boominati Worldwide/Republic",2,132,57,"335006"
62,"spotify:track:0OI7AFifLSoGzpb8bdBLLV","Machine Gun Kelly, X Ambassadors, Bebe Rexha","Home (with Machine Gun Kelly, X Ambassadors & Bebe Rexha)","Atlantic Records",56,163,35,"314936"
63,"spotify:track:5yuShbu70mtHXY0yLzCQLQ","Post Malone","Go Flex","Universal Records",19,146,360,"314556"
64,"spotify:track:6HZILIRieu8S0iqY8kIKhj","Kendrick Lamar","DNA.","Aftermath",2,155,257,"312958"
65,"spotify:track:7g7raxdQpiLZT7aOlib4S1","Huncho Jack, Travis Scott, Quavo","Motorcycle Patches","Quality Control Music - Epic",9,128,5,"312349"
66,"spotify:track:0CcQNd8CINkwQfe1RDtGV6","Imagine Dragons","Believer","Kid Ina Korner / Interscope",9,156,328,"311454"
67,"spotify:track:3T7dNA7O8c3Axj5WyDNcH3","Brenda Lee","Rockin' Around The Christmas Tree","MCA Nashville",2,2,40,"310710"
68,"spotify:track:4fndbjoz1qJyK6JcLdKfzm","Migos","Stir Fry","Quality Control Music, LLC",68,153,5,"307057"
69,"spotify:track:2vjmyyAnDUzilFYxOlTdO1","6ix9ine","GUMMO","Strainge Entertainment",50,137,47,"301198"
70,"spotify:track:32DGGj6KlNuBr6WaqRxpxi","Charlie Puth","How Long","Artist Partner",36,162,80,"300373"
71,"spotify:track:3qk4wRMDlaeagZGjSYbsOV","G-Eazy, Charlie Puth","Sober","BPG/RVG/RCA Records",50,173,15,"300143"
72,"spotify:track:2FRnf9qhLbvw8fu4IBXx78","Wham!","Last Christmas","Epic",4,4,38,"296612"
73,"spotify:track:0VgkVdmE4gld66l8iyGjgx","Future","Mask Off","Epic/Freebandz/A1",2,158,313,"293745"
74,"spotify:track:7Ed6BkggCS2KaKY5YlINaF","BTS, Desiigner, Steve Aoki","MIC Drop (feat. Desiigner) [Steve Aoki Remix]","BIGHIT MUSIC",64,181,33,"287313"
75,"spotify:track:7mldq42yDuxiUNn08nvzHO","Sam Hunt","Body Like A Back Road","MCA Nashville",12,-1,328,"286047"
76,"spotify:track:5vuiHi3QYbwcm1OKJOYnrf","Huncho Jack, Travis Scott, Quavo","Huncho Jack","Quality Control Music - Epic",11,143,5,"281352"
77,"spotify:track:3kxfsdsCpFgN412fpnW85Y","Childish Gambino","Redbone","Glassnote Entertainment Group LLC",8,167,360,"279457"
78,"spotify:track:4knL4iPxPOZjQzTUlELGSY","Yo Gotti, Nicki Minaj","Rake It Up (feat. Nicki Minaj)","Epic/CMG",17,168,189,"271067"
79,"spotify:track:6eT7xZZlB2mwyzJ2sUKG6w","Post Malone","White Iverson","Universal Records",56,169,360,"270530"
80,"spotify:track:6QgjcU0zLnzq5OrUoSZ3OK","Portugal. The Man","Feel It Still","Atlantic Records",13,198,194,"269326"
81,"spotify:track:4V6MRo0CEAC9MwAm7dkPuL","Camila Cabello","Real Friends","Syco Music/Epic",57,-1,18,"267839"
82,"spotify:track:3wdfLVUhmX64lIyWIIEW8s","Quality Control, Quavo, Lil Yachty","Ice Tray","Quality Control Music, LLC",82,179,15,"267416"
83,"spotify:track:5hslUAKq9I9CG2bAulFkHN","Andy Williams","It's the Most Wonderful Time of the Year","Columbia/Legacy",5,5,38,"265194"
84,"spotify:track:3wAI7MIQtTgwcRmwchPZBc","Big Sean, Metro Boomin, Travis Scott","Go Legend (& Metro Boomin)","Republic/MB/Big Sean",7,174,19,"264780"
85,"spotify:track:0q75NwOoFiARAVp4EXU4Bs","SZA, Travis Scott","Love Galore (feat. Travis Scott)","Top Dawg Entertainment/RCA Records",23,180,237,"263149"
86,"spotify:track:1e1JKLEDKP7hEQzJfNAgPl","Playboi Carti","Magnolia","AWGE Label",10,166,250,"263006"
87,"spotify:track:5CtI0qwDJkDQGwXD1H1cLb","Luis Fonsi, Daddy Yankee, Justin Bieber","Despacito - Remix","UMLE - Latino",1,190,254,"262976"
88,"spotify:track:1cImYkHOQMFE7AZC9aOk4y","Bobby Helms","Jingle Bell Rock","Geffen",3,3,37,"260854"
89,"spotify:track:1uL78kFWxhz3umTMWJu8n5","Lil Uzi Vert","Sauce It Up","Generation Now/Atlantic",6,160,124,"260150"
90,"spotify:track:2EEeOnHehOozLq4aS0n6SL","KYLE, Lil Yachty","iSpy (feat. Lil Yachty)","independently popular.",2,188,360,"260105"
91,"spotify:track:4iLqG9SeJSnt0cSPICSjxv","Charlie Puth","Attention","Artist Partner",16,-1,249,"259489"
92,"spotify:track:1P17dC1amhFzptugyAO7Il","Taylor Swift","Look What You Made Me Do","Big Machine Records, LLC",1,-1,123,"256383"
93,"spotify:track:3DXncPQOG4VBw3QHh3S817","DJ Khaled, Justin Bieber, Quavo, Chance the Rapper, Lil Wayne","I'm the One (feat. Justin Bieber, Quavo, Chance the Rapper & Lil Wayne)","Epic/We The Best",2,-1,242,"253296"
94,"spotify:track:5uCax9HTNlzGybIStD3vDh","James Arthur","Say You Won't Let Go","Columbia",14,-1,359,"252419"
95,"spotify:track:299lFlaAsNQdgbIZNPmIA0","Vince Guaraldi Trio","Christmas Time Is Here - Vocal","Craft Recordings",6,6,34,"250907"
96,"spotify:track:25oOaleife6E2MIKmFkPvg","Young Thug, Future","Relationship (feat. Future)","Atlantic Records",53,183,194,"250779"
97,"spotify:track:4cxMGhkinTocPSVVKWIw0d","Russ","Losin Control","Columbia",58,186,341,"250393"
98,"spotify:track:4pYZLpX23Vx8rwDpJCpPTA","Rich The Kid, Kendrick Lamar","New Freezer (feat. Kendrick Lamar)","Rich The Kid / (TDE/ISR PS)",59,182,91,"250222"
99,"spotify:track:2xmrfQpmS2iJExTlklLoAL","Clean Bandit, Julia Michaels","I Miss You (feat. Julia Michaels)","Atlantic Records UK",51,-1,60,"249588"
100,"spotify:track:6gU9OKjOE7ghfEd55oRO57","SZA","The Weekend","Top Dawg Entertainment/RCA Records",82,191,174,"248302"
101,"spotify:track:1zsG4eaZmkA1dvjDDsAGLK","Luis Fonsi, Demi Lovato","Échame La Culpa","UMLE - Latino",47,-1,39,"248266"
102,"spotify:track:7JGyxh8G8QZnu4AMJuCqlj","Huncho Jack, Travis Scott, Quavo","Saint Laurent Mask","Quality Control Music - Epic",17,164,5,"246835"
103,"spotify:track:7zVCrzzEJU7u24sbJPXA5W","Kane Brown, Lauren Alaina","What Ifs (feat. Lauren Alaina)","RCA Records Label Nashville",45,-1,209,"243829"
104,"spotify:track:4Km5HrUvYTaSUfiSGPJeQR","Migos, Lil Uzi Vert","Bad and Boujee (feat. Lil Uzi Vert)","Quality Control Music",1,-1,359,"243376"
105,"spotify:track:3wGXyJGsCf1myH5MooQIqE","Tay-K","The Race","88 Classic",33,176,136,"239843"
106,"spotify:track:1WIZiOuNO3woKfdlSK2gNn","Kodak Black","Transportin'","Atlantic Records",30,189,129,"239821"
107,"spotify:track:4so0Wek9Ig1p6CRCHuINwW","Bing Crosby, Ken Darby Singers, John Scott Trotter & His Orchestra","White Christmas","Geffen",8,8,34,"239710"
108,"spotify:track:6NFyWDv5CjfwuzoCkw47Xf","Taylor Swift","Delicate","Big Machine Records, LLC",77,-1,23,"238182"
109,"spotify:track:65Q2mv3UlVi9eO70OpsmSe","Burl Ives","A Holly Jolly Christmas - Single Version","Geffen",7,7,35,"237967"
110,"spotify:track:2rb5MvYT7ZIxbKW5hfcHx8","J Balvin, Willy William","Mi Gente","UMLE - Latino",7,185,180,"237456"
111,"spotify:track:4Q3N4Ct4zCuIHuZ65E3BD4","Kodak Black","Tunnel Vision","Atlantic Records",5,199,313,"236981"
112,"spotify:track:0KKkJNfGyhkQ5aFogxQAPU","Bruno Mars","That's What I Like","Atlantic Records",3,-1,359,"236882"
113,"spotify:track:1hvpDAxZPKjKztOc72sv06","Band Aid","Do They Know It's Christmas? - 1984 Version","EMI",9,9,34,"235946"
114,"spotify:track:2YzmfPLqUx5CJOaw5ThsBV","A$AP Ferg, Nicki Minaj","Plain Jane REMIX (feat. Nicki Minaj)","A$AP Worldwide/Polo Grounds Music/RCA Records",114,-1,10,"233255"
115,"spotify:track:5hcisvFMidkMJlElTO9Qmw","Bad Bunny, Prince Royce, J Balvin, Mambo Kingz, DJ Luian","Sensualidad","Hear This Music",110,-1,35,"232789"
116,"spotify:track:1Qg9jWGDkKAGZXj5v2OG59","Maroon 5","Wait","Interscope Records*",38,-1,53,"232394"
117,"spotify:track:2yLa0QULdQr0qAIvVwN6B5","Taylor Swift","...Ready For It?","Big Machine Records, LLC",1,-1,113,"231529"
118,"spotify:track:0SGkqnVQo9KPytSri1H6cF","Big Sean","Bounce Back","Getting Out Our Dreams Inc. (G.O.O.D.) Music / IDJ",3,-1,359,"231090"
119,"spotify:track:6EpRaXYhGOB3fj4V2uDkMJ","Liam Payne, Quavo","Strip That Down (feat. Quavo)","Capitol",11,-1,220,"226030"
120,"spotify:track:7inXu0Eaeg02VsM8kHNvzM","Frank Sinatra, B. Swanson Quartet","Let It Snow! Let It Snow! Let It Snow! (with The B. Swanson Quartet)","Columbia/Legacy",12,12,34,"225925"
121,"spotify:track:5humEOJehpAwMJEJmb0JJ2","Nat King Cole","The Christmas Song (Merry Christmas To You)","Capitol Records",11,11,34,"225393"
122,"spotify:track:3GVkPk8mqxz0itaAriG1L7","XXXTENTACION","Everybody Dies In Their Nightmares","Bad Vibes Forever / EMPIRE",15,194,124,"223353"
123,"spotify:track:7hDc8b7IXETo14hHIHdnhd","Drake","Passionfruit","Cash Money Records/Young Money Ent./Universal Rec.",1,-1,282,"221731"
124,"spotify:track:1j4kHkkpqZRBwE0A4CN4Yv","ZAYN, Sia","Dusk Till Dawn (feat. Sia) - Radio Edit","RCA Records Label",15,-1,109,"220581"
125,"spotify:track:4RgoqOBE34Q6zZj8K7RUAx","Huncho Jack, Travis Scott, Quavo","Go","Quality Control Music - Epic",20,195,5,"219153"
126,"spotify:track:6eYxmK9fdL4hwLnXG2zY3s","XXXTENTACION","Look At Me!","Bad Vibes Forever / EMPIRE",25,-1,300,"218550"
127,"spotify:track:7bTH8LgGSwyNNE4r1k95Zp","Huncho Jack, Travis Scott, Quavo","Moon Rock","Quality Control Music - Epic",23,197,5,"218118"
128,"spotify:track:6H0AwSQ20mo62jGlPGB8S6","2 Chainz, Ty Dolla $ign, Trey Songz, Jhené Aiko","It's A Vibe","2Chainz PS/Def Jam",35,-1,262,"217082"
129,"spotify:track:7CWiWkccuRRdrmaW6AjVEf","Huncho Jack, Travis Scott, Quavo","How U Feel","Quality Control Music - Epic",26,196,5,"216057"
130,"spotify:track:0OlnLZY4cmQzT6ZGttvWBM","Martin Garrix, David Guetta, Jamie Scott, Romy Dya","So Far Away (feat. Jamie Scott & Romy Dya)","Epic Amsterdam",75,-1,22,"215172"
131,"spotify:track:11cCVYamncF0ezwjj1irQ0","Huncho Jack, Travis Scott, Quavo","Where U From","Quality Control Music - Epic",32,-1,4,"214238"
132,"spotify:track:7KOlJ92bu51cltsD9KU5I7","Migos","T-Shirt","Quality Control Music",6,-1,346,"211946"
133,"spotify:track:6RUKPb4LETWmmr3iAEQktW","The Chainsmokers, Coldplay","Something Just Like This","Disruptor Records/Columbia",2,-1,300,"211920"
134,"spotify:track:4lESS6vuruP6a79KWRaQou","Maluma, Nego do Borel","Corazón (feat. Nego do Borel)","Sony Music Latin",134,-1,7,"211255"
135,"spotify:track:6SwRhMLwNqEi6alNPVG00n","Kendrick Lamar, Rihanna","LOYALTY. FEAT. RIHANNA.","Aftermath",4,-1,256,"210894"
136,"spotify:track:62vpWI1CHwFy7tMIcSStl8","J. Cole","No Role Modelz","Roc Nation Records LLC",64,-1,358,"210403"
137,"spotify:track:0OWZFobGSIW9GrSlQ9C5pc","Thomas Rhett","Marry Me","The Valory Music Co.",134,-1,12,"209447"
138,"spotify:track:3YeJXuRSNS5FYwOsDu44kD","Trippie Redd, Travis Scott","Dark Knight Dummo (Feat. Travis Scott)","Elliot Grainge Entertainment, LLC",53,-1,20,"205839"
139,"spotify:track:3Q3myFA7q4Op95DOpHplaY","blackbear","do re mi","Alamo",26,-1,275,"205773"
140,"spotify:track:3QiAAp20rPC3dcAtKtMaqQ","Elvis Presley","Blue Christmas","RCA Victor",14,14,34,"205389"
141,"spotify:track:3whrwq4DtvucphBPUogRuJ","Camila Cabello, Daddy Yankee","Havana - Remix","Syco Music/Epic",50,-1,38,"204547"
142,"spotify:track:38yBBH2jacvDxrznF7h08J","Niall Horan","Slow Hands","Capitol Records (US1A)",24,-1,234,"204019"
143,"spotify:track:1wjzFQodRWrPcQ0AnYnvQ9","Lauv","I Like Me Better","Lauv",30,-1,202,"202912"
144,"spotify:track:2z4pcBLQXF2BXKFvd0BuB6","Jason Derulo, French Montana","Tip Toe (feat. French Montana)","Beluga Heights/Warner Records",74,-1,39,"201213"
145,"spotify:track:1OAh8uOEOvTDqkKFsKksCi","DJ Khaled, Rihanna, Bryson Tiller","Wild Thoughts (feat. Rihanna & Bryson Tiller)","Epic/We The Best",1,-1,192,"200989"
146,"spotify:track:59J5nzL1KniFHnU120dQzt","Playboi Carti, Lil Uzi Vert","wokeuplikethis*","AWGE Label",52,-1,255,"200396"
147,"spotify:track:15EPc80XuFrb2LmOzGjuRg","GoldLink, Brent Faiyaz, Shy Glizzy","Crew (feat. Brent Faiyaz & Shy Glizzy)","Squaaash Club/RCA Records",103,-1,157,"199378"
148,"spotify:track:5aAx2yezTd8zXrkmtKl66Z","The Weeknd, Daft Punk","Starboy","Universal Republic Records",3,-1,358,"199204"
149,"spotify:track:7BKLCZ1jbUBVqRi2FVlTVw","The Chainsmokers, Halsey","Closer","Disruptor Records/Columbia",4,-1,355,"197616"
150,"spotify:track:2m2ZGfJcs3lHWNPzhWH3XH","Ozuna, Cardi B","La Modelo","VP Records Corp/Dimelo Vi",150,-1,2,"197384"
151,"spotify:track:2nUJvBO87SkxCViQsLc9Zr","Big Shaq","Man's Not Hot","Universal-Island Records Ltd.",84,-1,37,"196959"
152,"spotify:track:6GNifiuBPrKFpwNBYnooFm","Lil Uzi Vert, Nicki Minaj, Oh Wonder","The Way Life Goes (feat. Nicki Minaj & Oh Wonder) - Remix","Generation Now/Atlantic",58,-1,52,"196645"
153,"spotify:track:30MM5jWpUmOxtTNd9Ey5LZ","Thomas Rhett","Unforgettable","The Valory Music Co.",35,-1,143,"196635"
154,"spotify:track:79cuOz3SPQTuFrp8WgftAu","Shawn Mendes","There's Nothing Holdin' Me Back","Island Records",26,-1,246,"196619"
155,"spotify:track:7taXf5odg9xCAZERYfyOkS","José Feliciano","Feliz Navidad","RCA/BMG Heritage",15,15,34,"195645"
156,"spotify:track:7vu0JkJh0ldukEYbTVcqd0","Julia Michaels","Issues","J/Republic",11,-1,331,"194630"
157,"spotify:track:5VEuraNSVxMTzDTtrmL3lQ","Bing Crosby","Winter Wonderland - Remastered","Geffen",13,13,33,"192523"
158,"spotify:track:0jdny0dhgjUwoIp5GkqEaA","Kesha","Praying","Kemosabe Records/RCA Records",15,-1,170,"192442"
159,"spotify:track:0ESJlaM8CE1jRWaNtwSNj8","Travis Scott","beibs in the trap","Epic/Grand Hustle",95,-1,348,"191798"
160,"spotify:track:0kdiUZDcLIFw0Buo9r0Q4z","LANCO","Greatest Love Story","Arista Nashville",147,-1,64,"190603"
161,"spotify:track:6M0IsaUX4GNyto4niSegfI","Post Malone","No Option","Universal Records",104,-1,97,"189507"
162,"spotify:track:5gx2E5aIXMRBellPZW1up5","Chris Brown, Yo Gotti, A Boogie Wit da Hoodie, Kodak Black","Pills & Automobiles (feat. Yo Gotti, A Boogie Wit Da Hoodie & Kodak Black)","RCA Records Label",70,-1,89,"188292"
163,"spotify:track:343YBumqHu19cGoGARUTsd","Drake","Fake Love","Cash Money Records/Young Money Ent./Universal Rec.",2,-1,355,"187585"
164,"spotify:track:22nyEAEM29tcBRhukR089b","Jaden","Icon","MSFTS/Roc Nation",97,-1,18,"186722"
165,"spotify:track:0AICBlLzFCTpUqmAbtzB2z","Trippie Redd","Love Scars","Strainge Entertainment",128,-1,93,"186560"
166,"spotify:track:0B8QzDH7YWih85V5SEMnyJ","Lil Uzi Vert","Money Longer","Generation Now/Atlantic",61,-1,345,"184496"
167,"spotify:track:10M2Ex445zw585Ducldzkw","Brett Young","In Case You Didn't Know","Big Machine Label Group, LLC",94,-1,256,"184138"
168,"spotify:track:5hTpBe8h35rJ67eAWHQsJx","Aminé","Caroline","Universal Records",6,-1,356,"184104"
169,"spotify:track:5NT0aZqWImC9fTzkW4z48o","6ix9ine","KOODA","Scumgang Records",77,-1,21,"183970"
170,"spotify:track:7yyRTcZmCiyzzJlNzGC9Ol","Shelley FKA DRAM, Lil Yachty","Broccoli","EMPIRE / Atlantic Recording Corporation",6,-1,354,"183392"
171,"spotify:track:3NdDpSvN911VPGivFlV5d0","ZAYN, Taylor Swift","I Don’t Wanna Live Forever (Fifty Shades Darker)","Big Machine Records, LLC",3,-1,341,"181353"
172,"spotify:track:0w3Q14i073jLoew1hgJkwD","Jon Pardi","Heartache On The Dance Floor","Capitol Records Nashville",109,-1,148,"179961"
173,"spotify:track:4AtZRwSR8BOTTQg5ihSggt","6LACK","PRBLMS","LVRN Records",93,-1,322,"179576"
174,"spotify:track:3muBQDekYAg7jm6hDu6R0Z","Tee Grizzley","First Day Out","300 Entertainment",67,-1,314,"179347"
175,"spotify:track:0dA2Mk56wEzDgegdC6R17g","Zedd, Alessia Cara","Stay","UMGRI Interscope",9,-1,285,"179304"
176,"spotify:track:3pXF1nA74528Edde4of9CC","Bryson Tiller","Don't","TrapSoul/RCA Records",77,-1,346,"178437"
177,"spotify:track:1m69ELEgE6k5ZWsap40ozt","Ozuna","Se Preparó","VP Records Corp/Dimelo Vi",118,-1,47,"177758"
178,"spotify:track:43PuMrRfbyyuz4QpZ3oAwN","Bryson Tiller","Exchange","TrapSoul/RCA Records",79,-1,326,"177184"
179,"spotify:track:05nbZ1xxVNwUTcGwLbp7CN","NAV","Myself","XO Records",89,-1,235,"176835"
180,"spotify:track:0CokSRCu5hZgPxcZBaEzVE","Macklemore, Skylar Grey","Glorious (feat. Skylar Grey)","Bendo LLC",19,-1,150,"176660"
181,"spotify:track:3zJw3rugfpVrmBeDDnUYzy","John Lennon, Yoko Ono","Happy Xmas (War Is Over) - Remastered 2010","EMI Catalogue",21,21,32,"175425"
182,"spotify:track:4tHqQMWSqmL6YjXwsqthDI","Mykola Dmytrovych Leontovych, John Williams","Carol of the Bells","Masterworks",16,16,34,"174737"
183,"spotify:track:1ADjWm8QNhgNV8yCNNgQ1T","Ariana Grande","Santa Tell Me","Universal Records",24,35,33,"174414"
184,"spotify:track:6fwdbPMwP1zVStm8FybmkO","21 Savage, Metro Boomin, Future","X (feat. Future)","Slaughter Gang, LLC",14,-1,349,"173983"
185,"spotify:track:1foCxQtxBweJtZmdxhEHVO","Eartha Kitt, Henri René and His Orchestra","Santa Baby (with Henri René & His Orchestra)","RCA Bluebird",22,22,33,"173261"
186,"spotify:track:1mMLMZYXkMueg65jRRWG1l","Luke Combs","When It Rains It Pours","River House Artists/Columbia Nashville",110,-1,114,"173255"
187,"spotify:track:5PIBgH1cUFwu5IiUk9tnN9","Eminem, Beyoncé","Walk On Water (feat. Beyoncé)","Aftermath",4,-1,45,"173178"
188,"spotify:track:6RSNKGdv3nDTHqgw4bdzyF","Russell Dickerson","Yours","Sony Music Entertainment",188,-1,8,"172814"
189,"spotify:track:6mapJIPnQ23RTAevUoE0DL","Rae Sremmurd","Swang","Mike WiLL Made-It",21,-1,345,"172412"
190,"spotify:track:2pnPe4pJtq7689i5ydzvJJ","Chuck Berry","Run Rudolph Run - Single Version","Geffen*",18,18,33,"172290"
191,"spotify:track:4PpuH4mxL0rD35mOWaLoKS","N.E.R.D, Rihanna, Pharrell Williams","Lemon","Columbia",45,-1,44,"170408"
192,"spotify:track:1ZY1PqizIl78geGM4xWlEA","Taylor Swift","Gorgeous","Big Machine Records, LLC",2,-1,57,"169707"
193,"spotify:track:1xznGGDReH1oQq0xzbwXa3","Drake, WizKid, Kyla","One Dance","Cash Money Records/Young Money Ent./Universal Rec.",7,-1,328,"169471"
194,"spotify:track:3eR23VReFzcdmS7TYCrhCe","Kygo, Selena Gomez","It Ain’t Me (with Selena Gomez)","Interscope",3,-1,266,"168810"
195,"spotify:track:6IeK3Ap5m3HabwJxgI6eSE","Perry Como, The Fontane Sisters, Mitchell Ayres & His Orchestra","It's Beginning to Look a Lot Like Christmas (with Mitchell Ayres & His Orchestra)","RCA Records Label",17,17,34,"168152"
196,"spotify:track:0lLdorYw7lVrJydTINhWdI","Michael Bublé","It's Beginning to Look a Lot like Christmas","143/Reprise",25,26,34,"167943"
197,"spotify:track:2XDhuJvvx2wcIROXbfTTYr","Eminem","Believe","Aftermath",10,-1,10,"167772"
198,"spotify:track:1rsAFUCa6BVMgRQ3FCQQsi","Lil Pump","Boss","Warner Records",54,-1,114,"167192"
199,"spotify:track:7tr2za8SQg2CI8EDgrdtNl","Calvin Harris, Frank Ocean, Migos, Funk Wav","Slide (feat. Frank Ocean & Migos)","Columbia",8,-1,271,"167170"
200,"spotify:track:0afhq8XCExXpqazXczTSve","Ed Sheeran","Galway Girl","Atlantic Records UK",2,-1,162,"166801"
