rank,uri,artist_names,track_name,source,peak_rank,previous_rank,days_on_chart,streams
1,"spotify:track:2XW4DbS6NddZxRPm5rMCeY","Drake","God's Plan","Cash Money/Drake LP6",1,1,42,"3257136"
2,"spotify:track:65NwOZqoXny4JxqAPlfxRF","Post Malone, Ty Dolla $ign","Psycho (feat. Ty Dolla $ign)","Republic Records",1,2,8,"2685884"
3,"spotify:track:4qKcDkK6siZ7Jp1Jb4m0aL","BlocBoy JB, Drake","Look Alive (feat. Drake)","OVO Sound/Warner Records",2,3,22,"1678493"
4,"spotify:track:3GCdLUSnKSMJhs4Tj6CV3s","Kendrick Lamar, SZA","All The Stars (with SZA)","Black Panther (TDE/DMG) PS",2,4,58,"1530464"
5,"spotify:track:2UVbBKQOdFAekPTRsnkzcf","Migos","Stir Fry","Quality Control Music, LLC",2,5,71,"1273495"
6,"spotify:track:35ieKju5aLWFN5UgfJ27mL","XXXTENTACION","SAD!","Bad Vibes Forever, LLC",6,-1,1,"1256857"
7,"spotify:track:6tHWl8ows5JOZq9Yfaqn3M","Bazzi","Mine","iamcosmic",3,6,47,"1201767"
8,"spotify:track:51rXHuKN8Loc4sUlKPODgH","Jay Rock, Kendrick Lamar, Future, James Blake","King's Dead (with Kendrick Lamar, Future & James Blake)","Black Panther (TDE/DMG) PS",7,9,50,"1124211"
9,"spotify:track:4ofvoCdXq99vpMZO4Cfp8x","The Weeknd, Kendrick Lamar","Pray For Me","Universal Republic Records",3,7,29,"1121969"
10,"spotify:track:2ARqIya5NAuvFVHSN3bL0m","Zedd, Maren Morris, Grey","The Middle","UMGRI Interscope",5,8,37,"1086233"
11,"spotify:track:2U7Hu2RaNQNRi7izoJyZaX","Post Malone, 21 Savage","rockstar (feat. 21 Savage)","Republic Records",1,12,169,"1015464"
12,"spotify:track:45Egmo7icyopuzJN0oMEdk","Khalid, Normani","Love Lies (with Normani)","RCA Records Label",9,10,15,"1013837"
13,"spotify:track:75ZvA4QfFiZvzhj2xkaWAh","Post Malone","I Fall Apart","Universal Records",2,11,168,"996039"
14,"spotify:track:7sO5G9EABYOXQKNPNiE9NR","Offset, Metro Boomin","Ric Flair Drip (with Metro Boomin)","Slaughter Gang, LLC/Epic/Quality Control Music/Motown/Capitol/Boominati Worldwide/Republic",4,14,123,"952745"
15,"spotify:track:6zOhgKfbMiQWToE6K13s2s","Logic, Marshmello","Everyday","Def Jam Recordings",15,-1,1,"913737"
16,"spotify:track:6iyp6udVpLuq3MCUulZT4h","Logic","44 More","Def Jam Recordings",6,13,8,"876743"
17,"spotify:track:0wbnC9AUenxp613TYaJsGK","Migos","Narcos","Quality Control Music, LLC",2,15,36,"789888"
18,"spotify:track:7iDa6hUg2VgEL1o1HjmfBn","Bebe Rexha, Florida Georgia Line","Meant to Be (feat. Florida Georgia Line)","Warner Records",15,16,175,"751898"
19,"spotify:track:3Vo4wInECJQuz9BIBMOu8i","Bruno Mars, Cardi B","Finesse - Remix; feat. Cardi B","Atlantic Records",2,17,58,"728309"
20,"spotify:track:1W6wxOOYyJyyok8fqYSZ3m","DJ Khaled, JAY-Z, Future, Beyoncé","Top Off (feat. JAY Z, Future & Beyoncé)","Epic/We The Best",20,-1,1,"728020"
21,"spotify:track:6PGoSes0D9eUDeeAafB2As","Kendrick Lamar, Zacari","LOVE. FEAT. ZACARI.","Aftermath",5,19,323,"695154"
22,"spotify:track:08bNPGLD8AhKpnnERrAc6G","Marshmello, Anne-Marie","FRIENDS","Atlantic Records UK",16,18,22,"689191"
23,"spotify:track:4PANCoXZX3RaT2D6mqSdEU","XXXTENTACION","changes","Bad Vibes Forever, LLC",23,-1,1,"655769"
24,"spotify:track:4eWQlBRaTjPPUlzacqEeoQ","Camila Cabello","Never Be the Same","Syco Music/Epic",5,22,85,"642570"
25,"spotify:track:6NWl2m8asvH83xjuXVNsuG","Lil Xan","Betrayed","Columbia",21,21,138,"641539"
26,"spotify:track:5WoaF1B5XIEnWfmb5NZikf","Miguel, Travis Scott","Sky Walker (feat. Travis Scott)","ByStorm Entertainment/RCA Records",19,20,190,"634296"
27,"spotify:track:3ncgNpxLoBQ65ABk4djDyd","Famous Dex, A$AP Rocky","PICK IT UP (feat. A$AP Rocky)","300 Entertainment",13,29,127,"628769"
28,"spotify:track:7GX5flRQZVHRAGd6B4TmDO","Lil Uzi Vert","XO Tour Llif3","Generation Now/Atlantic",1,27,344,"622740"
29,"spotify:track:5lZsh9Qf7CbHI9Fcc7Zcsq","YBN Nahmir","Bounce Out With That","2018",27,28,29,"621033"
30,"spotify:track:2u7mxWSeoqTXndK5e08jMp","Lil Skies, Landon Cube","Nowadays (feat. Landon Cube)","All We Got Ent.",24,24,63,"618275"
31,"spotify:track:4LmAnpjlhWTahvRkYR8xJa","ScHoolboy Q, 2 Chainz, Saudi","X (with 2 Chainz & Saudi)","Black Panther (TDE/DMG) PS",5,26,22,"613671"
32,"spotify:track:2yUbCEiaolfSMluDo9RMmG","Rae Sremmurd, Swae Lee, Slim Jxmmi, Juicy J","Powerglide (feat. Juicy J) - From SR3MM","Mike WiLL Made-It",32,130,2,"613510"
33,"spotify:track:42CeaId2XNlxugDvyqHfDf","Post Malone","Candy Paint","Republic Records",4,30,281,"602531"
34,"spotify:track:76cy1WJvNGJTj78UqeA5zr","Dua Lipa","IDGAF","Warner Records",21,25,66,"590831"
35,"spotify:track:3a1lNhkSLSkpJE4MSHpDu9","Post Malone, Quavo","Congratulations","Universal Records",5,31,426,"589518"
36,"spotify:track:4pYZLpX23Vx8rwDpJCpPTA","Rich The Kid, Kendrick Lamar","New Freezer (feat. Kendrick Lamar)","Rich The Kid / (TDE/ISR PS)",32,32,157,"586562"
37,"spotify:track:1rfofaqEpACxVEHIZBJe6W","Camila Cabello, Young Thug","Havana (feat. Young Thug)","Syco Music/Epic",2,35,210,"584988"
38,"spotify:track:2DQ1ITjI0YoLFzuADN1ZBW","G-Eazy, A$AP Rocky, Cardi B","No Limit","BPG/RVG/RCA Records",2,33,176,"570304"
39,"spotify:track:5AEtlRudpgdT5FtNiuly6Y","Hailee Steinfeld, Alesso, Florida Georgia Line, WATT","Let Me Go (with Alesso, Florida Georgia Line & watt)","Universal Records",17,36,176,"547848"
40,"spotify:track:7KXjTSCq5nL1LoYtL7XAwS","Kendrick Lamar","HUMBLE.","Aftermath",1,38,337,"546692"
41,"spotify:track:75FDPwaULRdYDn4StFN2rT","Cardi B, 21 Savage","Bartier Cardi (feat. 21 Savage)","Atlantic/KSR",3,34,71,"544826"
42,"spotify:track:2fQrGHiQOvpL9UgPvtYy6G","21 Savage","Bank Account","Slaughter Gang, LLC/Epic Records",1,41,239,"544299"
43,"spotify:track:5jyyPsIGM2yqkZN9R3TmvN","Khalid, Swae Lee","The Ways (with Swae Lee)","Black Panther (TDE/DMG) PS",9,23,22,"540029"
44,"spotify:track:6mrKP2jyIQmM0rw6fQryjr","NF","Let You Down","NF Real Music",9,40,153,"530266"
45,"spotify:track:4wFjTWCunQFKtukqrNijEt","Migos, Nicki Minaj, Cardi B","MotorSport","Quality Control Music, LLC",6,46,127,"528947"
46,"spotify:track:4dVpf9jZjcORqGTLUaeYj9","A$AP Ferg","Plain Jane","RCA Records Label",6,44,189,"527150"
47,"spotify:track:5Z3GHaZ6ec9bsiI5BenrbY","Khalid","Young Dumb & Broke","Right Hand Music Group, LLC/RCA Records",5,45,332,"523976"
48,"spotify:track:5CLGzJsGqhCEECcpnFQA8x","Rudimental, Jess Glynne, Macklemore, Dan Caplen","These Days (feat. Jess Glynne, Macklemore & Dan Caplen)","Atlantic Records UK",34,37,38,"523387"
49,"spotify:track:5k38wzpLb15YgncyWdTZE4","G-Eazy, Halsey","Him & I (with Halsey)","BPG/RVG/RCA Records",3,39,92,"522328"
50,"spotify:track:2tPcTFiQF9MbVUyjZ3zDhA","SOB X RBE","Paramedic!","Black Panther (TDE/DMG) PS",16,43,22,"521570"
51,"spotify:track:7m9OqQk4RVRkw9JJdeAw96","XXXTENTACION","Jocelyn Flores","Bad Vibes Forever / EMPIRE",3,63,190,"492493"
52,"spotify:track:6n4U3TlzUGhdSFbUUhTvLP","Migos, Drake","Walk It Talk It","Quality Control Music, LLC",3,48,36,"490567"
53,"spotify:track:4QfNOZN7vrQCQKK1ZJ3XPb","Julia Michaels","Heaven","UMG Recordings, Inc.",41,42,23,"482804"
54,"spotify:track:1LhMopPAallLeaeNutqbgS","Justin Timberlake, Chris Stapleton","Say Something (feat. Chris Stapleton)","RCA Records Label",13,47,37,"459340"
55,"spotify:track:40oKW22ZNNkEdZLJTScaQI","Kodak Black, XXXTENTACION","Roll in Peace (feat. XXXTENTACION)","Atlantic Records",22,56,197,"455202"
56,"spotify:track:4DTpngLjoHj5gFxEZFeD3J","Kodak Black, Lil Wayne","Codeine Dreaming (feat. Lil Wayne)","Atlantic Records",10,50,99,"452587"
57,"spotify:track:0tgVpDi06FyKpA1z0VMD4v","Ed Sheeran","Perfect","Atlantic Records UK",11,52,282,"433138"
58,"spotify:track:1XRgIKC5TPwo7nWGyKqgG0","Gucci Mane, Migos","I Get the Bag (feat. Migos)","Guwop Enterprises/Atlantic",7,57,197,"424278"
59,"spotify:track:3ZhTT6yjZwpPph5MIJ53XY","Lil Skies, Landon Cube","Red Roses (feat. Landon Cube)","All We Got Ent.",54,54,60,"424051"
60,"spotify:track:152lZdxL1OR0ZMW6KquMif","Khalid","Location","Right Hand Music Group, LLC/RCA Records",9,55,425,"420616"
61,"spotify:track:5UEnHoDYpsxlfzWLZIc7LD","Eminem, Ed Sheeran","River (feat. Ed Sheeran)","Aftermath",2,51,78,"418108"
62,"spotify:track:5tz69p7tJuGPeMGwNTxYuV","Logic, Alessia Cara, Khalid","1-800-273-8255","Def Jam Recordings",1,60,309,"416702"
63,"spotify:track:2ekn2ttSfGqwhhate0LSR0","Dua Lipa","New Rules","Warner Records",11,58,235,"409660"
64,"spotify:track:6gBFPUFcJLzWGx4lenP6h2","Travis Scott","goosebumps","Epic/Grand Hustle",16,61,426,"401945"
65,"spotify:track:7AQim7LbvFVZJE3O8TYgf2","XXXTENTACION, Trippie Redd","Fuck Love (feat. Trippie Redd)","Bad Vibes Forever / EMPIRE",7,71,190,"399209"
66,"spotify:track:3towKHKVOXCCcL1fHv6xFO","Hailee Steinfeld, BloodPop®","Capital Letters","Republic/Universal/FSF",47,53,42,"394616"
67,"spotify:track:1Y500yrabUJY2mIQS3RDt4","6ix9ine, Tory Lanez, Young Thug","RONDO","ScumGang Records / TenThousand Projects",23,49,8,"390082"
68,"spotify:track:3ITvHA9zhZZdBJsOsAUegF","Bad Bunny","Amorfoda","Rimas Entertainment LLC",67,70,13,"389894"
69,"spotify:track:1yxgsra98r3qAtxqiGZPiX","Travis Scott","BUTTERFLY EFFECT","Cactus Jack / Epic / Grand Hustle",9,65,287,"389326"
70,"spotify:track:7q1ikCoQLytPP5TTzDy7JK","6ix9ine, Fetty Wap, A Boogie Wit da Hoodie","KEKE","ScumGang Records / TenThousand Projects",32,62,47,"389097"
71,"spotify:track:7bRRHQelMfrP86QYQlCsAq","6ix9ine","BILLY","ScumGang Records / TenThousand Projects",24,59,8,"385024"
72,"spotify:track:26gceVsA1ybT8qsX3aYLEn","Imagine Dragons","Thunder","Kid Ina Korner / Interscope",16,69,309,"382625"
73,"spotify:track:5cXg9IQS34FzLVdHhp7hu7","Kendrick Lamar, Travis Scott","Big Shot (with Travis Scott)","Black Panther (TDE/DMG) PS",17,64,22,"382255"
74,"spotify:track:07VJGBnywGutMZ72kRyEop","Rae Sremmurd, Swae Lee, Slim Jxmmi","Hurt To Look - From Swaecation","Mike WiLL Made-It",74,-1,1,"375954"
75,"spotify:track:2771LMNxwf62FTAdpJMQfM","Cardi B","Bodak Yellow","Atlantic/KSR",2,76,225,"375190"
76,"spotify:track:7vGuf3Y35N4wmASOKLUVVU","Marshmello, Khalid","Silence","Joytime Collective/RCA Records",7,75,204,"370745"
77,"spotify:track:7EmGUiUaOSGDnUUQUDrOXC","Selena Gomez, Marshmello","Wolves","Selena Gomez PS",3,74,129,"366965"
78,"spotify:track:0VtxQUpwnkeedz0QhhuOgA","6ix9ine","GUMMO","ScumGang Records / TenThousand Projects",48,73,113,"366733"
79,"spotify:track:3B54sVLJ402zGa6Xm4YGNe","French Montana, Swae Lee","Unforgettable","Bad Boy Entertainment/Epic Records",1,78,330,"366557"
80,"spotify:track:1QRJb5VY3sIkCKcTuIKCrk","YBN Nahmir","Rubbin off the Paint","M.M.M.",47,72,131,"364974"
81,"spotify:track:2j2fIJGh4PMdXt9ULI5Tlc","Daddy Yankee","Dura","El Cartel Records (EC3)",76,84,28,"364944"
82,"spotify:track:2eAZfqOm4EnOF9VvN50Tyc","Lil Uzi Vert, Oh Wonder","The Way Life Goes (feat. Oh Wonder)","Generation Now/Atlantic",4,77,190,"364337"
83,"spotify:track:3YeJXuRSNS5FYwOsDu44kD","Trippie Redd, Travis Scott","Dark Knight Dummo (Feat. Travis Scott)","Elliot Grainge Entertainment, LLC",53,83,86,"360274"
84,"spotify:track:790MhTXPFrYkrqCKvpg4t1","NAV, Lil Uzi Vert","Wanted You (feat. Lil Uzi Vert)","XO Records",23,66,113,"358009"
85,"spotify:track:5yuShbu70mtHXY0yLzCQLQ","Post Malone","Go Flex","Universal Records",19,79,426,"356866"
86,"spotify:track:0gD6lWJhbXHWNVwQziSVvl","Rich The Kid","Plug Walk","Rich The Kid / (TDE/ISR PS)",77,80,22,"354975"
87,"spotify:track:1mXVgsBdtIVeCLJnSnmtdV","Sam Smith","Too Good At Goodbyes","Capitol",2,81,176,"354924"
88,"spotify:track:1USJRpWDFhxwhCajPXBeel","The Chainsmokers","You Owe Me","Disruptor Records/Columbia",52,67,15,"350098"
89,"spotify:track:2IKZkwHI5zsZf70STuhvOX","The Chainsmokers","Sick Boy","Disruptor Records/Columbia",10,68,44,"346793"
90,"spotify:track:6HZILIRieu8S0iqY8kIKhj","Kendrick Lamar","DNA.","Aftermath",2,86,323,"340312"
91,"spotify:track:43ZyHQITOjhciSUUNPVRHc","Lil Pump","Gucci Gang","Warner Records",2,92,181,"336911"
92,"spotify:track:39N9RPD9MRb5WmoLzNzPeA","Nicky Jam, J Balvin","X","Sony Music Latin",92,-1,1,"336538"
93,"spotify:track:1f5cbQtDrykjarZVrShaDI","A Boogie Wit da Hoodie, Kodak Black","Drowning (feat. Kodak Black)","Highbridge The Label",18,91,351,"335371"
94,"spotify:track:5mTdAqporE8e0dEk1U8Pkx","Tory Lanez","B.I.D","Benny Blanco Major",94,174,15,"331573"
95,"spotify:track:3m660poUr1chesgkkjQM7P","Demi Lovato","Sorry Not Sorry","Island Records",6,90,235,"329992"
96,"spotify:track:5HwnezK198pJCEj1l2Adjy","Camila Cabello","She Loves Control","Syco Music/Epic",62,82,50,"328860"
97,"spotify:track:3DxZfFYJLwKDJtUwnLEhkL","Gucci Mane, Migos, Lil Yachty","Solitaire (feat. Migos & Lil Yachty)","Guwop Enterprises/Atlantic",97,-1,1,"328576"
98,"spotify:track:3kxfsdsCpFgN412fpnW85Y","Childish Gambino","Redbone","Glassnote Entertainment Group LLC",8,94,426,"328196"
99,"spotify:track:2xGjteMU3E1tkEPVFBO08U","Keala Settle, The Greatest Showman Ensemble","This Is Me","Atlantic Records",37,87,66,"327201"
100,"spotify:track:3OnOomd79OjqSYHchCQ6ht","Migos, Post Malone","Notice Me","Quality Control Music, LLC",16,96,36,"316044"
101,"spotify:track:7y9iMe8SOB6z3NoHE2OfXl","Halsey","Bad At Love","Astralwerks (ASW)",22,95,201,"315893"
102,"spotify:track:1OilOIju6R9ia8vilNjChh","Bazzi","Beautiful","iamcosmic",86,88,7,"315198"
103,"spotify:track:3GVkPk8mqxz0itaAriG1L7","XXXTENTACION","Everybody Dies In Their Nightmares","Bad Vibes Forever / EMPIRE",15,135,190,"313101"
104,"spotify:track:1uL78kFWxhz3umTMWJu8n5","Lil Uzi Vert","Sauce It Up","Generation Now/Atlantic",6,97,190,"312920"
105,"spotify:track:0q75NwOoFiARAVp4EXU4Bs","SZA, Travis Scott","Love Galore (feat. Travis Scott)","Top Dawg Entertainment/RCA Records",23,93,303,"312431"
106,"spotify:track:6eT7xZZlB2mwyzJ2sUKG6w","Post Malone","White Iverson","Universal Records",56,98,426,"310575"
107,"spotify:track:6p8NuHm8uCGnn2Dtbtf7zE","Migos, Gucci Mane","Slippery (feat. Gucci Mane)","Quality Control Music",17,100,400,"308690"
108,"spotify:track:7qiZfU4dY1lWllzX7mPBI3","Ed Sheeran","Shape of You","Atlantic Records UK",1,101,421,"305412"
109,"spotify:track:5hM6sP0Gh1jD57drszNueC","Liam Payne, Rita Ora","For You (With Rita Ora)","Capitol",69,89,57,"304654"
110,"spotify:track:2Pvr8rYuh5J8V7QglJhH6W","5 Seconds of Summer","Want You Back","Capitol",16,105,8,"303975"
111,"spotify:track:7Izh7zLJGw1Nscd62Exxj4","Imagine Dragons","Believer","Kid Ina Korner / Interscope",9,103,394,"300970"
112,"spotify:track:630sXRhIcfwr2e4RdNtjKN","Zac Efron, Zendaya","Rewrite The Stars","Atlantic Records",16,85,66,"297637"
113,"spotify:track:2zLIP4R6Yt3afkyh7uhmar","Cheat Codes, Kiiara","Put Me Back Together (feat. Kiiara)","300 Entertainment",113,-1,1,"291356"
114,"spotify:track:5Qx9hngUBr30JFrNua7yp4","YoungBoy Never Broke Again","Outside Today","Never Broke Again, LLC",114,114,27,"285752"
115,"spotify:track:0OWZFobGSIW9GrSlQ9C5pc","Thomas Rhett","Marry Me","The Valory Music Co.",83,106,78,"280675"
116,"spotify:track:3hBBKuWJfxlIlnd9QFoC8k","Maroon 5, SZA","What Lovers Do (feat. SZA)","Interscope Records*",7,110,185,"280653"
117,"spotify:track:1nO2NjuFkGaAWcMdJ1pNrp","A$AP Rocky, Gucci Mane, 21 Savage, London On Da Track","Cocky (feat. London On Da Track)","RCA Records Label",53,107,15,"278695"
118,"spotify:track:6QgjcU0zLnzq5OrUoSZ3OK","Portugal. The Man","Feel It Still","Atlantic Records",13,108,260,"278676"
119,"spotify:track:28GUlwvVnkkx8AmzeoJumT","Tory Lanez","Shooters","Benny Blanco Major",119,-1,8,"278176"
120,"spotify:track:0as7lPxkBPctZ7uVmchRNM","Cashmere Cat, Major Lazer, Tory Lanez","Miss You (with Major Lazer & Tory Lanez)","Benny Blanco Major",66,104,42,"276458"
121,"spotify:track:4cxMGhkinTocPSVVKWIw0d","Russ","Losin Control","Columbia",58,109,407,"276240"
122,"spotify:track:0SvxydoxEEkXt9aMAqTfpB","Maroon 5, A Boogie Wit da Hoodie","Wait (feat. A Boogie Wit da Hoodie)","Interscope Records*",38,102,119,"274113"
123,"spotify:track:5uCax9HTNlzGybIStD3vDh","James Arthur","Say You Won't Let Go","Columbia",14,113,425,"266375"
124,"spotify:track:7mldq42yDuxiUNn08nvzHO","Sam Hunt","Body Like A Back Road","MCA Nashville",12,120,394,"266032"
125,"spotify:track:5mCPDVBb16L4XQwDdbRUpz","Drake","Passionfruit","Cash Money Records/Young Money Ent./Universal Rec.",1,116,348,"263934"
126,"spotify:track:1HXy5I3HTWq8OvxCn0z7G7","Kane Brown","Heaven","RCA Records Label Nashville",108,118,47,"259495"
127,"spotify:track:0P6AWOA4LG1XOctzaVu5tt","SZA, Calvin Harris, Funk Wav","The Weekend - Funk Wav Remix","Top Dawg Entertainment/RCA Records",88,111,65,"259331"
128,"spotify:track:62vpWI1CHwFy7tMIcSStl8","J. Cole","No Role Modelz","Roc Nation Records LLC",64,119,424,"258362"
129,"spotify:track:0VgkVdmE4gld66l8iyGjgx","Future","Mask Off","Epic/Freebandz/A1",2,123,379,"258075"
130,"spotify:track:1e1JKLEDKP7hEQzJfNAgPl","Playboi Carti","Magnolia","AWGE Label",10,122,316,"257398"
131,"spotify:track:25oOaleife6E2MIKmFkPvg","Young Thug, Future","Relationship (feat. Future)","Atlantic Records",53,124,260,"256586"
132,"spotify:track:4knL4iPxPOZjQzTUlELGSY","Yo Gotti, Nicki Minaj","Rake It Up (feat. Nicki Minaj)","Epic/CMG",17,136,255,"254417"
133,"spotify:track:6H0AwSQ20mo62jGlPGB8S6","2 Chainz, Ty Dolla $ign, Trey Songz, Jhené Aiko","It's A Vibe","2Chainz PS/Def Jam",35,128,328,"253669"
134,"spotify:track:7bUcBztfGqO7cSI2gMZeCI","Vince Staples, Yugen Blakrok","Opps (with Yugen Blakrok)","Black Panther (TDE/DMG) PS",21,115,22,"253121"
135,"spotify:track:5u6vkDnOyaf8LsteDAj2ub","21 Savage, Offset, Metro Boomin, Travis Scott","Ghostface Killers (feat. Travis Scott)","Slaughter Gang, LLC/Epic/Quality Control Music/Motown/Capitol/Boominati Worldwide/Republic",2,132,123,"252600"
136,"spotify:track:2EEeOnHehOozLq4aS0n6SL","KYLE, Lil Yachty","iSpy (feat. Lil Yachty)","independently popular.",2,133,426,"252160"
137,"spotify:track:5Htb1uFQ1KrkFXlefS8oGj","Demi Lovato","Tell Me You Love Me","Island Records",35,121,92,"251419"
138,"spotify:track:2ZxTjs4EdJl4Y9YByIiNoo","Jason Aldean","You Make It Easy","Broken Bow Records",87,125,34,"249722"
139,"spotify:track:1wjzFQodRWrPcQ0AnYnvQ9","Lauv","I Like Me Better","Lauv",30,129,268,"248314"
140,"spotify:track:5537GkcZu99NDs1gH9iCOY","AJR, Rivers Cuomo","Sober Up (feat. Rivers Cuomo)","S-Curve Records",95,117,28,"247719"
141,"spotify:track:0SGkqnVQo9KPytSri1H6cF","Big Sean","Bounce Back","Getting Out Our Dreams Inc. (G.O.O.D.) Music / IDJ",3,138,425,"247483"
142,"spotify:track:34I0nBvoE0ZXmqbKiJ5BWS","Joyner Lucas, Chris Brown","Stranger Things","Dead Silence/Atlantic",142,-1,2,"246276"
143,"spotify:track:1xznGGDReH1oQq0xzbwXa3","Drake, WizKid, Kyla","One Dance","Cash Money Records/Young Money Ent./Universal Rec.",7,142,391,"245571"
144,"spotify:track:2xmrfQpmS2iJExTlklLoAL","Clean Bandit, Julia Michaels","I Miss You (feat. Julia Michaels)","Atlantic Records UK",50,99,126,"244586"
145,"spotify:track:3CE20FnHS1mbTeySpQNx6f","Tory Lanez","Old Friends x New Foes","Benny Blanco Major",145,-1,1,"242588"
146,"spotify:track:6eYxmK9fdL4hwLnXG2zY3s","XXXTENTACION","Look At Me!","Bad Vibes Forever / EMPIRE",25,-1,344,"242117"
147,"spotify:track:6RSNKGdv3nDTHqgw4bdzyF","Russell Dickerson","Yours","Sony Music Entertainment",125,134,70,"241347"
148,"spotify:track:4BHzHISX21PYwGXiBEUQ70","Migos, 21 Savage","BBO (Bad Bitches Only)","Quality Control Music, LLC",5,141,36,"240703"
149,"spotify:track:7oJrVhiTPZGBXWPwhxjy9S","Lil Skies","Lust","All We Got Ent.",137,140,44,"237550"
150,"spotify:track:15EPc80XuFrb2LmOzGjuRg","GoldLink, Brent Faiyaz, Shy Glizzy","Crew (feat. Brent Faiyaz & Shy Glizzy)","Squaaash Club/RCA Records",103,131,223,"237493"
151,"spotify:track:25HNUThG21gxTSMe3pXFKD","Tory Lanez, 50 Cent","Pieces (feat. 50 Cent)","Benny Blanco Major",151,-1,1,"236761"
152,"spotify:track:7zVCrzzEJU7u24sbJPXA5W","Kane Brown, Lauren Alaina","What Ifs (feat. Lauren Alaina)","RCA Records Label Nashville",45,143,275,"235545"
153,"spotify:track:3wdfLVUhmX64lIyWIIEW8s","Quality Control, Quavo, Lil Yachty","Ice Tray","Quality Control Music, LLC",67,126,81,"234968"
154,"spotify:track:1ob7M7lGdLSE0IWi2ymy6x","6ix9ine","KOODA","ScumGang Records / TenThousand Projects",77,139,78,"234635"
155,"spotify:track:7Il2yWQmsqKgSkLQvHTPUI","Dan + Shay","Tequila","Warner Records",139,147,12,"234500"
156,"spotify:track:2BNkTvg1kHAAfGvqh56x5a","Lauv","Getting Over You","Lauv",79,112,9,"233525"
157,"spotify:track:0w3Q14i073jLoew1hgJkwD","Jon Pardi","Heartache On The Dance Floor","Capitol Records Nashville",109,146,190,"232964"
158,"spotify:track:0AICBlLzFCTpUqmAbtzB2z","Trippie Redd","Love Scars","Strainge Entertainment",128,150,159,"232587"
159,"spotify:track:5qN4HFkapdAOV94XPryVof","Kendrick Lamar","Black Panther","Black Panther (TDE/DMG) PS",11,137,22,"232091"
160,"spotify:track:0KKkJNfGyhkQ5aFogxQAPU","Bruno Mars","That's What I Like","Atlantic Records",3,158,425,"231530"
161,"spotify:track:10M2Ex445zw585Ducldzkw","Brett Young","In Case You Didn't Know","Big Machine Label Group, LLC",94,145,310,"231258"
162,"spotify:track:6gU9OKjOE7ghfEd55oRO57","SZA","The Weekend","Top Dawg Entertainment/RCA Records",75,144,240,"228896"
163,"spotify:track:365wwIjijQdlRJEjUWTidq","2 Chainz, YG, Offset","PROUD","2Chainz PS/Def Jam",81,165,22,"228320"
164,"spotify:track:6EpRaXYhGOB3fj4V2uDkMJ","Liam Payne, Quavo","Strip That Down (feat. Quavo)","Capitol",11,153,286,"227524"
165,"spotify:track:5hcisvFMidkMJlElTO9Qmw","Bad Bunny, Prince Royce, J Balvin, Mambo Kingz, DJ Luian","Sensualidad","Hear This Music",85,162,98,"227123"
166,"spotify:track:343YBumqHu19cGoGARUTsd","Drake","Fake Love","Cash Money Records/Young Money Ent./Universal Rec.",2,149,421,"226324"
167,"spotify:track:3wGXyJGsCf1myH5MooQIqE","Tay-K","The Race","88 Classic",33,163,202,"226212"
168,"spotify:track:6M0IsaUX4GNyto4niSegfI","Post Malone","No Option","Universal Records",104,148,138,"225478"
169,"spotify:track:32DGGj6KlNuBr6WaqRxpxi","Charlie Puth","How Long","Artist Partner",36,152,146,"224956"
170,"spotify:track:4Q3N4Ct4zCuIHuZ65E3BD4","Kodak Black","Tunnel Vision","Atlantic Records",5,161,379,"223943"
171,"spotify:track:2A69wys3S9uiPSmn6UZWJn","Old Dominion","Written in the Sand","RCA Records Label Nashville",146,155,18,"222965"
172,"spotify:track:3Q3myFA7q4Op95DOpHplaY","blackbear","do re mi","Alamo",26,156,341,"222939"
173,"spotify:track:1WIZiOuNO3woKfdlSK2gNn","Kodak Black","Transportin'","Atlantic Records",30,167,195,"222658"
174,"spotify:track:4OBZT9EnhYIV17t4pGw7ig","H.E.R., Daniel Caesar","Best Part (feat. Daniel Caesar)","MBK Entertainment/RCA Records",127,127,27,"221263"
175,"spotify:track:3DXncPQOG4VBw3QHh3S817","DJ Khaled, Justin Bieber, Quavo, Chance the Rapper, Lil Wayne","I'm the One (feat. Justin Bieber, Quavo, Chance the Rapper & Lil Wayne)","Epic/We The Best",2,170,308,"220514"
176,"spotify:track:4iLqG9SeJSnt0cSPICSjxv","Charlie Puth","Attention","Artist Partner",16,164,315,"220350"
177,"spotify:track:0DJBgBiYeSn6n1AXAkFVE8","Jorja Smith","I Am","Black Panther (TDE/DMG) PS",28,151,22,"215978"
178,"spotify:track:7zFXmv6vqI4qOt4yGf3jYZ","Daniel Caesar, Kali Uchis","Get You (feat. Kali Uchis)","Golden Child Recordings",136,157,28,"215702"
179,"spotify:track:59J5nzL1KniFHnU120dQzt","Playboi Carti, Lil Uzi Vert","wokeuplikethis*","AWGE Label",52,171,321,"215043"
180,"spotify:track:7BKLCZ1jbUBVqRi2FVlTVw","The Chainsmokers, Halsey","Closer","Disruptor Records/Columbia",4,177,421,"213952"
181,"spotify:track:6SwRhMLwNqEi6alNPVG00n","Kendrick Lamar, Rihanna","LOYALTY. FEAT. RIHANNA.","Aftermath",4,160,322,"213938"
182,"spotify:track:43PuMrRfbyyuz4QpZ3oAwN","Bryson Tiller","Exchange","TrapSoul/RCA Records",79,172,387,"213832"
183,"spotify:track:30MM5jWpUmOxtTNd9Ey5LZ","Thomas Rhett","Unforgettable","The Valory Music Co.",35,169,208,"213305"
184,"spotify:track:7vu0JkJh0ldukEYbTVcqd0","Julia Michaels","Issues","J/Republic",11,176,397,"212808"
185,"spotify:track:22nyEAEM29tcBRhukR089b","Jaden","Icon","MSFTS/Roc Nation",97,159,72,"212725"
186,"spotify:track:7foypmc7KZyU716Yv63BPe","Huncho Jack, Travis Scott, Quavo","Saint","Quality Control Music - Epic",15,181,71,"211740"
187,"spotify:track:1mMLMZYXkMueg65jRRWG1l","Luke Combs","When It Rains It Pours","River House Artists/Columbia Nashville",110,182,176,"211330"
188,"spotify:track:1Qg9jWGDkKAGZXj5v2OG59","Maroon 5","Wait","Interscope Records*",38,102,119,"210775"
189,"spotify:track:5CtI0qwDJkDQGwXD1H1cLb","Luis Fonsi, Daddy Yankee, Justin Bieber","Despacito - Remix","UMLE - Latino",1,184,319,"210767"
190,"spotify:track:1pQ7Z3oMyJXnHydstuxL7F","CHVRCHES, Matt Berninger","My Enemy","Glassnote Entertainment Group LLC",190,-1,1,"210655"
191,"spotify:track:4Km5HrUvYTaSUfiSGPJeQR","Migos, Lil Uzi Vert","Bad and Boujee (feat. Lil Uzi Vert)","Quality Control Music",1,190,425,"209141"
192,"spotify:track:6RKkHI2fkmgZq7uQPPav8f","Migos","Gang Gang","Quality Control Music, LLC",21,173,36,"208504"
193,"spotify:track:6Za3190Sbw39BBC77WSS1C","Natti Natasha, Ozuna","Criminal","Pina Records",164,191,48,"208221"
194,"spotify:track:1zsG4eaZmkA1dvjDDsAGLK","Luis Fonsi, Demi Lovato","Échame La Culpa","UMLE - Latino",47,195,104,"208200"
195,"spotify:track:3pXF1nA74528Edde4of9CC","Bryson Tiller","Don't","TrapSoul/RCA Records",77,175,411,"207809"
196,"spotify:track:5aAx2yezTd8zXrkmtKl66Z","The Weeknd, Daft Punk","Starboy","Universal Republic Records",3,186,424,"207688"
197,"spotify:track:5goGDc74vVREyN8al8CkPh","Drake","Diplomatic Immunity","Republic Records",2,166,42,"207232"
198,"spotify:track:4fC5jw1TI59GH1emfN1wtk","Trippie Redd, 6ix9ine","Poles 1469","Strainge Entertainment",146,188,46,"207103"
199,"spotify:track:4AtZRwSR8BOTTQg5ihSggt","6LACK","PRBLMS","LVRN Records",93,178,384,"206303"
200,"spotify:track:7fCNUWi6uflDTQ08srxMZk","Meghan Trainor","No Excuses","Epic",200,-1,1,"205911"
