rank,uri,artist_names,track_name,source,peak_rank,previous_rank,days_on_chart,streams
1,"spotify:track:6vBdBCoOhKHiYDDOcorfNo","Post Malone, Young Thug","Goodbyes (feat. Young Thug)","Republic Records",1,-1,1,"1839077"
2,"spotify:track:0TK2YIli7K1leLovkQiNik","Shawn Mendes, Camila Cabello","Señorita","Island Records",1,1,15,"1743039"
3,"spotify:track:6fTt0CH2t0mdeB2N9XFG5r","Lil Nas X","Panini","Columbia",1,3,16,"1421759"
4,"spotify:track:5ry2OE6R2zPQFDO85XkgRb","Drake, Rick Ross","Money In The Grave (Drake ft. Rick Ross)","Republic Records",1,2,21,"1353764"
5,"spotify:track:5qmq61DAAOUaW8AUo8xKhh","Lizzo","Truth Hurts","Nice Life/Atlantic",4,4,76,"1222756"
6,"spotify:track:2Fxmhks0bxGSBdJ92vM42m","Billie Eilish","bad guy","Darkroom/Interscope Records",1,6,99,"1080111"
7,"spotify:track:4evmHXcjt3bTUHD1cvny97","Ed Sheeran, Khalid","Beautiful People (feat. Khalid)","Atlantic Records UK",3,9,8,"1078700"
8,"spotify:track:6u7jPi22kF8CTQ3rb9DHE7","Lil Nas X, Billy Ray Cyrus","Old Town Road - Remix","Columbia",1,5,92,"1042440"
9,"spotify:track:3KkXRkHbMCARz0aVfEt68P","Post Malone, Swae Lee","Sunflower - Spider-Man: Into the Spider-Verse","Universal Records",1,7,261,"1011066"
10,"spotify:track:6MF4tRr5lU8qok8IKaFOBE","Dreamville, J. Cole, Lute, DaBaby","Under The Sun (with J. Cole & Lute feat. DaBaby)","Dreamville/Interscope Records",10,-1,1,"1006961"
11,"spotify:track:1kBbgxAUc4HQv7cgIayIDH","Lil Tecca","Ransom","Republic Records",7,8,43,"999300"
12,"spotify:track:36J0iaPDGbYGsHvYpaYs3k","Dreamville, JID, Bas, J. Cole, EARTHGANG, Young Nudy","Down Bad (feat. JID, Bas, J. Cole, EARTHGANG & Young Nudy)","Dreamville/Interscope Records",12,122,23,"896036"
13,"spotify:track:7DcvwMAiqKJQD1rrdfxSDx","Young Thug, J. Cole, Travis Scott","The London (feat. J. Cole & Travis Scott)","300 Entertainment/Atl",1,11,44,"855160"
14,"spotify:track:3HVWdVOQ0ZA45FuZGSfvns","Ed Sheeran, Justin Bieber","I Don't Care (with Justin Bieber)","Atlantic Records UK",1,13,57,"850652"
15,"spotify:track:2gwkD6igEhQbDQegRCcdoB","DaBaby","Suge","South Coast Music Group/Interscope Records",3,12,98,"843883"
16,"spotify:track:4ak7xjvBeBOcJGWFDX9w5n","Lil Nas X, Cardi B","Rodeo","Columbia",7,10,15,"809699"
17,"spotify:track:4hPpVbbakQNv8YTHYaOJP4","Marshmello, Kane Brown","One Thing Right","RCA Records Label Nashville",15,15,15,"787063"
18,"spotify:track:29fRTIKsJhLUJoldM89GZS","Taylor Swift","You Need To Calm Down","Taylor Swift",1,14,22,"746815"
19,"spotify:track:2JvzF1RMd7lE3KmFlsyZD8","J. Cole","MIDDLE CHILD","Dreamville, Inc., Under exclusive license to Roc Nation Records",1,28,163,"727422"
20,"spotify:track:5WnfnSpuNEGXyEt78PBA6d","Dreamville, Bas, JID, Guapdad 4000, Reese LAFLARE, Jace, Mez, Smokepurpp, Buddy, Ski Mask The Slump God","Costa Rica (with Bas & JID feat. Guapdad 4000, Reese LAFLARE, Jace, Mez, Smokepurpp, Buddy & Ski Mask The Slump God)","Dreamville/Interscope Records",20,-1,3,"717365"
21,"spotify:track:6uFn47ACjqYkc0jADwEdj1","Polo G, Lil Tjay","Pop Out (feat. Lil Tjay)","Columbia",8,16,105,"691331"
22,"spotify:track:6TqXcAFInzjp0bODyvrWEq","Khalid, Disclosure","Talk (feat. Disclosure)","Right Hand Music Group, LLC/RCA Records",5,17,149,"660484"
23,"spotify:track:05CwHjIk71RXVU40boRMnR","The Chainsmokers, Bebe Rexha","Call You Mine","Disruptor Records/Columbia",20,25,36,"635861"
24,"spotify:track:1kK6DwzyXJSp58u5HYWwuD","YG, Tyga, Jon Z","Go Loko (feat. Tyga, Jon Z)","Def Jam Recordings",14,21,64,"623989"
25,"spotify:track:51Fjme0JiitpyXKuyQiCDo","Y2K, bbno$","Lalala","Columbia",21,22,20,"623774"
26,"spotify:track:6moU77g9RQyMzHNuKEaQKq","Ali Gatie","It's You","Warner Records",15,19,22,"619647"
27,"spotify:track:1OS9fNE87zO4Z696lBXriv","Dreamville, Cozz, REASON, Childish Major","LamboTruck (with Cozz feat. REASON & Childish Major)","Dreamville/Interscope Records",27,-1,1,"615549"
28,"spotify:track:56JyMaElW79S7TDWh1Zw1m","Ashley O","On A Roll","RCA Records Label",27,30,21,"611800"
29,"spotify:track:6XHVuErjQ4XNm6nDPVCxVX","Chris Brown, Drake","No Guidance (feat. Drake)","Chris Brown Entertainment/RCA Records",3,18,28,"611275"
30,"spotify:track:5hVghJ4KaYES3BFUATCYn0","Tyler, The Creator","EARFQUAKE","Columbia",1,20,50,"605614"
31,"spotify:track:6MWtB6iiXyIwun0YzU6DFP","Post Malone","Wow.","Republic Records",1,23,194,"578441"
32,"spotify:track:5PYQUBXc7NYeI1obMKSJK0","Katy Perry","Never Really Over","Capitol Records",10,29,36,"570888"
33,"spotify:track:2gtFMLjQpCTGekMi4oXZxN","Dreamville, JID, EARTHGANG, Buddy, Guapdad 4000","Wells Fargo (with JID & EARTHGANG feat. Buddy & Guapdad 4000) - Interlude","Dreamville/Interscope Records",33,-1,1,"567429"
34,"spotify:track:6LsAAHotRLMOHfCsSfYCsz","Shawn Mendes","If I Can't Have You","Island Records",3,27,64,"539589"
35,"spotify:track:7wxDKfgFtRTbupcG4xDhtj","Dreamville, J. Cole, Zoink Gang, KEY!, Maxo Kream","Oh Wow...Swerve (with J. Cole feat. Zoink Gang, KEY! & Maxo Kream)","Dreamville/Interscope Records",35,-1,1,"530782"
36,"spotify:track:1wJRveJZLSb1rjhnUHQiv6","A Boogie Wit da Hoodie, 6ix9ine","Swervin (feat. 6ix9ine)","Highbridge the Label / Atlantic Records",6,24,197,"522239"
37,"spotify:track:5dW1VZPcFqB4n0P08rGDgm","Blanco Brown","The Git Up","Broken Bow Records",37,37,23,"521344"
38,"spotify:track:3XiNC94b4Tq1xwv70sQJGN","Lil Uzi Vert","Sanguine Paradise","Generation Now/Atlantic",6,32,87,"498101"
39,"spotify:track:3pZO6GoVPeSYDxxsH6vCdj","Dreamville, J. Cole, Young Nudy","Sunset (with J. Cole feat. Young Nudy)","Dreamville/Interscope Records",39,-1,1,"497156"
40,"spotify:track:03XfngWwNfhEjrnEga73Rg","Dreamville, EARTHGANG","Swivel (with EARTHGANG) - From The Album ""Mirrorland""","Dreamville/Interscope Records",40,-1,1,"491292"
41,"spotify:track:22vgEDb5hykfaTwLuskFGD","Jonas Brothers","Sucker","Jonas Brothers Recording",1,34,127,"481716"
42,"spotify:track:2gTdDMpNxIRFSiu7HutMCg","Machine Gun Kelly, YUNGBLUD, Travis Barker","I Think I'm OKAY (with YUNGBLUD & Travis Barker)","Bad Boy/Interscope Records",42,156,29,"471591"
43,"spotify:track:0qc4QlcCxVTGyShurEv1UU","Sam Feldt, RANI","Post Malone (feat. RANI)","Spinnin' Records",39,39,16,"471271"
44,"spotify:track:6oJ6le65B3SEqPwMRNXWjY","Kygo, Whitney Houston","Higher Love","Kygo/RCA Records",22,26,8,"465779"
45,"spotify:track:0DiDStADDVh3SvAsoJAFMk","Jonas Brothers","Only Human","Jonas Brothers Recording",6,40,29,"461793"
46,"spotify:track:53CJANUxooaqGOtdsBTh7O","Lil Nas X","Old Town Road","Columbia",1,31,126,"461638"
47,"spotify:track:4no0eHn4fEB7tN1yZSXMma","Lil Nas X","C7osure (You Like)","Columbia",42,42,11,"460570"
48,"spotify:track:5ug4vqGZ3eisGhY1IsziNX","Ed Sheeran, Yebba","Best Part of Me (feat. YEBBA)","Atlantic Records UK",48,-1,1,"459001"
49,"spotify:track:7ILEWkpfdK6AjH2D7jppWk","Chris Brown, Justin Bieber, Ink","Don't Check On Me (feat. Justin Bieber & Ink)","Chris Brown Entertainment/RCA Records",20,46,9,"447164"
50,"spotify:track:4ChD9wq9iakg5UdeSzmgPE","Dreamville, Bas, Cozz, Baby Tate, Guapdad 4000, Buddy","Don't Hit Me Right Now (with Bas & Cozz feat. Yung Baby Tate, Guapdad 4000 & Buddy)","Dreamville/Interscope Records",50,-1,1,"447083"
51,"spotify:track:7Feaw9WAEREY0DUOSXJLOM","Martin Garrix, Macklemore, Fall Out Boy","Summer Days (feat. Macklemore & Patrick Stump of Fall Out Boy)","Epic Amsterdam",27,36,67,"442544"
52,"spotify:track:6ocbgoVGwYJhOv1GgI9NsF","Ariana Grande","7 rings","Republic Records",1,43,169,"442288"
53,"spotify:track:2TH65lNHgvLxCKXM3apjxI","Bad Bunny, Tainy","Callaita","Rimas Entertainment LLC",37,44,36,"442126"
54,"spotify:track:3j84U36KvLeXNDPv4t5pI8","Mustard, Migos","Pure Water (with Migos)","10 Summers Records/Interscope Records",11,38,169,"441622"
55,"spotify:track:25ZAibhr3bdlMCLmubZDVt","J Balvin, Bad Bunny","QUE PRETENDES","Universal Music Latino / Rimas",16,35,8,"438992"
56,"spotify:track:2IRZnDFmlqMuOrYOLnZZyc","Meek Mill, Drake","Going Bad (feat. Drake)","MMG/Atlantic",2,41,218,"433911"
57,"spotify:track:43zdsphuZLzwA9k4DJhU0I","Billie Eilish","when the party's over","Darkroom/Interscope Records",5,47,262,"427529"
58,"spotify:track:1KbCc89SxYma4BnBChkJBs","Dreamville, J. Cole, JID, Cozz, EARTHGANG, Smino, Buddy","1993 (with J. Cole, JID, Cozz & EARTHGANG feat. Smino & Buddy)","Dreamville/Interscope Records",58,-1,1,"425995"
59,"spotify:track:6n3q5ybuUQFT97ddyuxsFh","Dreamville, Lute, Omen, Mez, DaVionne","Sleep Deprived (with Lute & Omen feat. Mez & DaVionne)","Dreamville/Interscope Records",59,-1,1,"417461"
60,"spotify:track:78QR3Wp35dqAhFEc2qAGjE","Lil Baby, Gunna","Drip Too Hard (Lil Baby & Gunna)","Quality Control Music/Young Stoner Life Records, a 300 Entertainment Label/Motown Records/Capitol Records",1,48,297,"413045"
61,"spotify:track:7qEHsqek33rTcFNT9PFqLf","Lewis Capaldi","Someone You Loved","Vertigo Berlin",30,70,68,"404282"
62,"spotify:track:2DjLLLV2r88a8TO0hVTVrS","Dreamville, JID, J. Cole, Vince Staples","Rembrandt...Run It Back (with JID & J. Cole feat. Vince Staples)","Dreamville/Interscope Records",62,-1,1,"399377"
63,"spotify:track:7eBqSVxrzQZtK2mmgRG6lC","YNW Melly","Murder On My Mind","P2018",4,50,283,"396765"
64,"spotify:track:4nw0S8MtvcLSpXCS9M8ciL","Dreamville, Ari Lennox, Omen, Ty Dolla $ign, Dreezy","Got Me (with Ari Lennox & Omen feat. Ty Dolla $ign & Dreezy)","Dreamville/Interscope Records",64,-1,3,"392825"
65,"spotify:track:6zeeWid2sgw4lap2jV61PZ","Khalid","Better","Right Hand Music Group, LLC/RCA Records",7,51,295,"380683"
66,"spotify:track:3QBnJDkME3teXvf52Sfslk","Dreamville, JID, T.I.","Ladies, Ladies, Ladies (with JID feat. T.I.)","Dreamville/Interscope Records",66,-1,1,"380654"
67,"spotify:track:543bCW2ruMPmxUBWirQ3MR","Ed Sheeran, Chance the Rapper, PnB Rock","Cross Me (feat. Chance the Rapper & PnB Rock)","Atlantic Records UK",8,45,43,"379703"
68,"spotify:track:2zjGJ0dChMR0KxBZS15aqo","Mustard, NAV, Playboi Carti, A Boogie Wit da Hoodie","Baguettes in the Face (feat. NAV, Playboi Carti & A Boogie Wit da Hoodie)","10 Summers Records/Interscope Records",48,52,8,"378400"
69,"spotify:track:4dAMdQ6g4kGmnc1MDHsg77","NLE Choppa","Shotta Flow","No Love Entertainment",43,49,109,"376043"
70,"spotify:track:6kls8cSlUyHW2BUOkDJIZE","Ellie Goulding, Juice WRLD","Hate Me (with Juice WRLD)","Polydor Records",46,61,8,"375655"
71,"spotify:track:2dpaYNEQHiRxtZbfNsse99","Marshmello, Bastille","Happier","Astralwerks",5,60,323,"372502"
72,"spotify:track:7FGq80cy8juXBCD2nrqdWU","benny blanco, Halsey, Khalid","Eastside (with Halsey & Khalid)","Friends Keep Secrets/Interscope Records",7,58,358,"372136"
73,"spotify:track:3E7dfMvvCLUddWissuqMwr","Miley Cyrus","Party In The U.S.A.","Hollywood Records",26,33,7,"371428"
74,"spotify:track:0u2P5u6lvoDfwTYjAADbn4","Billie Eilish, Khalid","lovely (with Khalid)","Darkroom",18,57,442,"370528"
75,"spotify:track:5rU6kDNXZLXIinFezpbWbO","NAV, Meek Mill","Tap (feat. Meek Mill)","XO Records, LLC and Republic Records",48,54,73,"366338"
76,"spotify:track:6uAm7pG66O1XesXS9bpHSF","Lizzo","Good as Hell","Nice Life/Atlantic",66,66,21,"365094"
77,"spotify:track:2xLMifQCjDGFmkHkpNLD9h","Travis Scott","SICKO MODE","Cactus Jack / Epic / Grand Hustle",1,56,337,"364394"
78,"spotify:track:7dnSXaCjLdFiWZa8s5wP1n","Dreamville, Ari Lennox, Bas, Baby Rose","Self Love (with Ari Lennox & Bas feat. Baby Rose)","Dreamville/Interscope Records",78,-1,1,"363762"
79,"spotify:track:6EbduYTr62sSzvl36wWiFM","Ed Sheeran, Chris Stapleton, Bruno Mars","BLOW (with Chris Stapleton & Bruno Mars)","Atlantic Records UK",79,-1,1,"358441"
80,"spotify:track:285pBltuF7vW8TeWk8hdRR","Juice WRLD","Lucid Dreams","Juice WRLD Mixtape / ISR P&D",1,62,425,"357891"
81,"spotify:track:1dyxS3YzBbL0t8rEVwVQ1K","Blake Shelton","God's Country","Warner Records",59,59,61,"357259"
82,"spotify:track:4SSnFejRGlZikf02HLewEF","Billie Eilish","bury a friend","Darkroom/Interscope Records",3,65,157,"353404"
83,"spotify:track:7njKgVl3AnLflRad38o7AG","Bazzi","Paradise","iamcosmic",18,55,92,"351709"
84,"spotify:track:6Hj9jySrnFppAI0sEMCZpJ","Juice WRLD","Robbery","Grade A Productions/Interscope Records",2,68,142,"341468"
85,"spotify:track:7wTA0NKIm6T7nP2kaymU2a","Dreamville, EARTHGANG, J. Cole, Smino, Saba","Sacrifices (with EARTHGANG & J. Cole feat. Smino & Saba)","Dreamville/Interscope Records",85,-1,1,"338566"
86,"spotify:track:7rvyVWja33WG9R97oeJAjx","Calboy","Envy Me","Polo Grounds Music/RCA Records",22,64,191,"337887"
87,"spotify:track:7dt6x5M1jzdTEt8oCbisTK","Post Malone","Better Now","Republic Records",1,78,435,"337700"
88,"spotify:track:0e7ipj03S05BNilyu5bRzt","Post Malone, 21 Savage","rockstar (feat. 21 Savage)","Republic Records",1,83,659,"329039"
89,"spotify:track:5eDvChP4WAPPrtaQeI9MhT","Luke Combs","Beer Never Broke My Heart","River House Artists/Columbia Nashville",32,79,59,"328148"
90,"spotify:track:59ywHNwwchG4nZJMLyxSzd","Offset, Cardi B","Clout (feat. Cardi B)","Quality Control Music/Motown Records",41,63,85,"323459"
91,"spotify:track:0fea68AdmYNygeTGI4RC18","J Balvin, Bad Bunny","LA CANCIÓN","Universal Music Latino / Rimas",30,69,8,"320552"
92,"spotify:track:2wZjsbwmWfNVslgV5afl1L","Lil Baby, Future","Out The Mud","Quality Control/Motown Records",41,71,15,"319769"
93,"spotify:track:1c0hsvHLELX6y8qymnpLKL","Lunay, Daddy Yankee, Bad Bunny","Soltera - Remix","La Familia",52,76,57,"319667"
94,"spotify:track:3Ol2xnObFdKV9pmRD2t9x8","A Boogie Wit da Hoodie","Look Back at It","Highbridge the Label / Atlantic Records",8,75,211,"319288"
95,"spotify:track:5p7ujcrUXASCNwRaWNHR1C","Halsey","Without Me","Capitol Records",5,81,275,"315781"
96,"spotify:track:7f1zjZG77S891Uv4O68yfk","DaBaby, Offset","Baby Sitter (feat. Offset)","South Coast Music Group/Interscope Records",55,77,56,"314939"
97,"spotify:track:4YXKVaWzHaVyDq2pVS5cgR","Marshmello","Proud","Joytime Collective",97,-1,1,"311187"
98,"spotify:track:2WyRfGeHo97VC5mP1BBSzr","Miley Cyrus","Mother's Daughter","RCA Records Label",9,91,36,"309320"
99,"spotify:track:2MuMD298IpYqKF367wegUd","Logic, Eminem","Homicide (feat. Eminem)","Def Jam Recordings",1,80,64,"308595"
100,"spotify:track:2t8yVaLvJ0RenpXUIAC52d","21 Savage","a lot","Slaughter Gang, LLC/Epic Records",2,84,197,"307752"
101,"spotify:track:3e9HZxeyfWwjeyPAMmWSSQ","Ariana Grande","thank u, next","Republic Records",1,87,244,"307710"
102,"spotify:track:0k664IuFwVP557Gnx7RhIl","Lizzo","Juice","Nice Life/Atlantic",57,73,78,"305018"
103,"spotify:track:3Fj47GNK2kUF0uaEDgXLaD","Billie Eilish","wish you were gay","Darkroom/Interscope Records",2,94,124,"303627"
104,"spotify:track:3ee8Jmje8o58CHK66QrVC2","XXXTENTACION","SAD!","Bad Vibes Forever, LLC",1,90,491,"302902"
105,"spotify:track:6foY66mWZN0pSRjZ408c00","Morgan Wallen","Whiskey Glasses","Big Loud Records",58,86,114,"300730"
106,"spotify:track:3TpBefRZ1vFcOH6z57PQRI","Bryce Vine, YG","La La Land (feat. YG)","Sire",92,107,36,"300176"
107,"spotify:track:4MsUsFfWseB9M2plGJyuIw","Taylor Swift, Brendon Urie, Panic! At The Disco","ME! (feat. Brendon Urie of Panic! At The Disco)","Taylor Swift",1,96,71,"300070"
108,"spotify:track:4kV4N9D1iKVxx1KLvtTpjS","Ariana Grande","break up with your girlfriend, i'm bored","Republic Records",1,92,148,"299396"
109,"spotify:track:6Qs4SXO9dwPj5GKvVOv8Ki","Sam Smith, Normani","Dancing With A Stranger (with Normani)","Capitol",10,93,176,"298770"
110,"spotify:track:3xaugmCyXrVkrDTXbFkMW3","Joji","Sanctuary","88rising Music/Warner Records",17,108,22,"298343"
111,"spotify:track:35rozLoS6QLE8HX8qswM3k","Marshmello, A Day To Remember","Rescue Me","Joytime Collective",65,153,8,"296578"
112,"spotify:track:1Ej96GIBCTvgH7tNX1r3qr","Sech, Darell","Otro Trago","Rich Music/Ingrooves Records",64,97,50,"295757"
113,"spotify:track:2rxQMGVafnNaRaXlRMWPde","Luke Combs","Beautiful Crazy","River House Artists/Columbia Nashville",54,102,359,"294617"
114,"spotify:track:5w9c2J52mkdntKOmRLeM2m","Daddy Yankee, Snow","Con Calma","El Cartel Records (EC3)",43,104,148,"293721"
115,"spotify:track:3A2yGHWIzmGEIolwonU69h","City Girls","Act Up","Quality Control Music/Motown Records",61,82,125,"292860"
116,"spotify:track:3WyRgi8CzQnhzO0xw79tTS","DaBaby","Goin Baby","South Coast Music Group/Interscope Records",59,101,78,"290477"
117,"spotify:track:4XiGKQqbmnMVxDzUj6j3f2","YK Osiris","Worth It","Def Jam Recordings",68,95,125,"290461"
118,"spotify:track:4tNXntkAzQ5A2dfYRYGIIQ","5 Seconds of Summer","Easier","5 Seconds Of Summer/Interscope",18,111,43,"288356"
119,"spotify:track:58q2HKrzhC3ozto2nDdN4z","Cardi B, Bad Bunny, J Balvin","I Like It","Atlantic/KSR",2,99,456,"284297"
120,"spotify:track:1f38Gx6xQz6r4H1jGVNBJo","DJ Snake, J Balvin, Tyga","Loco Contigo (feat. J. Balvin & Tyga)","DJ Snake Music Productions Limited",53,115,22,"284006"
121,"spotify:track:1ThmUihH9dF8EV08ku5AXN","Ski Mask The Slump God","Faucet Failure","Republic Records",25,100,213,"278762"
122,"spotify:track:0FZ4Dmg8jJJAPJnvBIzD9z","Kodak Black, Offset, Travis Scott","ZEZE (feat. Travis Scott & Offset)","Atlantic Records",1,103,267,"276472"
123,"spotify:track:1rqqCSm0Qe4I9rUvWncaom","Panic! At The Disco","High Hopes","DCD2 / Fueled By Ramen",12,109,389,"275733"
124,"spotify:track:12iDo4Kdw9vA2X1lN3UTVu","Bazzi, 21 Savage","Focus (feat. 21 Savage)","iamcosmic",35,132,22,"275051"
125,"spotify:track:2VxeLyX666F8uXCJ0dZF8B","Lady Gaga, Bradley Cooper","Shallow","A Star is Born OST",6,112,279,"271832"
126,"spotify:track:0TlLq3lA83rQOYtrqBqSct","Drake","Nonstop","Cash Money/Drake LP6",1,106,372,"267129"
127,"spotify:track:4e4fqjx0Izh4svvTef1z7e","Bebe Rexha, Florida Georgia Line","Meant to Be (feat. Florida Georgia Line)","Warner Bros.",15,110,662,"266916"
128,"spotify:track:3GJ4hzg4lrGwU51Y3VARbF","Dan + Shay","Speechless","Warner Records",77,129,318,"263988"
129,"spotify:track:0JP9xo3adEtGSdUEISiszL","XXXTENTACION","Moonlight","Bad Vibes Forever, LLC",2,116,477,"263868"
130,"spotify:track:4u7EnebtmKWzUH433cf5Qv","Queen","Bohemian Rhapsody - Remastered 2011","Hollywood Records",36,127,256,"261296"
131,"spotify:track:75ZvA4QfFiZvzhj2xkaWAh","Post Malone","I Fall Apart","Universal Records",2,145,658,"258830"
132,"spotify:track:3swc6WTsr7rl9DqQKQA55C","Post Malone, Ty Dolla $ign","Psycho (feat. Ty Dolla $ign)","Republic Records",1,151,498,"258157"
133,"spotify:track:5kfNriitmkNE8mUbZ7gbq8","Khalid","Saturday Nights","Right Hand Music Group, LLC/RCA Records",13,124,254,"257718"
134,"spotify:track:7mldq42yDuxiUNn08nvzHO","Sam Hunt","Body Like A Back Road","MCA Nashville",12,98,588,"257229"
135,"spotify:track:0hWzB4dR1zwcokPvccww0k","NF","When I Grow Up","NF Real Music",48,105,8,"257203"
136,"spotify:track:2toVe5hfuIi97ytDPDbQFt","Tyga, Offset","Taste (feat. Offset)","Last Kings Music / EMPIRE",3,118,414,"256936"
137,"spotify:track:6vWEAOUSxohKxhp0K1BsxL","YNW Melly, Kanye West","Mixed Personalities (feat. Kanye West)","P2019",12,119,168,"256935"
138,"spotify:track:3XF5xLJHOQQRbWya6hBp7d","Billie Eilish","you should see me in a crown","Darkroom/Interscope Records",7,135,254,"256792"
139,"spotify:track:7e89621JPkKaeDSTQ3avtg","Lynyrd Skynyrd","Sweet Home Alabama","Geffen*",67,67,5,"256724"
140,"spotify:track:2iUXsYOEPhVqEBwsqP70rE","5 Seconds of Summer","Youngblood","Capitol",12,133,447,"254970"
141,"spotify:track:22oEJW6r2rMb9z4IntfyEa","Panic! At The Disco","Hey Look Ma, I Made It","DCD2 / Fueled By Ramen",47,123,91,"254203"
142,"spotify:track:5KUciA17ZXudpvWAc3mLHs","Dreamville, Omen, Mereba, Deante' Hitchcock, St. Beauty","PTSD (with Omen feat. Mereba, Deante' Hitchcock & St. Beauty)","Dreamville/Interscope Records",142,-1,1,"254110"
143,"spotify:track:2KqJC0koTBUyDlsMt5ok1V","Thomas Rhett","Look What God Gave Her","The Valory Music Co.",57,136,64,"254087"
144,"spotify:track:2Jh3UqxnHJMyzMzku4uOtE","Juice WRLD","Feeling","Grade A Productions/Interscope Records",34,120,101,"252427"
145,"spotify:track:36TO60sxDduIsO3xH8IcUh","Joyner Lucas, Logic","Isis","Twenty Nine Music Group (Joyner Lucas)",13,128,43,"252411"
146,"spotify:track:7m9OqQk4RVRkw9JJdeAw96","XXXTENTACION","Jocelyn Flores","Bad Vibes Forever / EMPIRE",2,130,680,"251748"
147,"spotify:track:6dPyzkyZwoj9LqjQXOFdVv","Cardi B","Press","Atlantic/KSR",7,113,36,"251616"
148,"spotify:track:1ZDmxwg7Lywlx68b7SsJjj","Nicki Minaj","MEGATRON","Young Money/Cash Money Records",21,117,15,"251249"
149,"spotify:track:0mjAU3yKR1QnXnHtjGJqTM","OneRepublic","Rescue Me","Mosley Music/Interscope Records",51,180,50,"250708"
150,"spotify:track:0rKtyWc8bvkriBthvHKY8d","Joji","SLOW DANCING IN THE DARK","88rising Music/Warner Records",26,142,287,"250011"
151,"spotify:track:42fw0rxRO2xbesF6mJfd4Y","Dan + Shay","Tequila","Warner Records",48,141,487,"248084"
152,"spotify:track:79JBjIq90BrQ8Ws0pUhlzD","Mabel","Mad Love","Polydor Records",92,125,23,"247398"
153,"spotify:track:7COXchtUOMd6uIT6HvmRaI","Lauv, Troye Sivan","i'm so tired...","Lauv",22,137,162,"246456"
154,"spotify:track:5icOoE6VgqFKohjWWNp0Ac","Marshmello, CHVRCHES","Here With Me","Marshmello/Republic",15,134,120,"245185"
155,"spotify:track:4dGJf1SER1T6ooX46vwzRB","Zac Brown Band","Chicken Fried","Home Grown Music",74,74,4,"243698"
156,"spotify:track:6CcJMwBtXByIz4zQLzFkKc","Billie Eilish","i love you","Darkroom/Interscope Records",14,160,99,"241269"
157,"spotify:track:5Uw7Dut2lZfexn3Y09swpf","Mark Ronson, Camila Cabello","Find U Again (feat. Camila Cabello)","Columbia",21,168,36,"239961"
158,"spotify:track:25sgk305KZfyuqVBQIahim","Ava Max","Sweet but Psycho","Atlantic Records",30,146,270,"239859"
159,"spotify:track:5Z3GHaZ6ec9bsiI5BenrbY","Khalid","Young Dumb & Broke","Right Hand Music Group, LLC/RCA Records",5,149,814,"238268"
160,"spotify:track:0yFvWTLs3iIwDbc91noXGT","Chance the Rapper, TisaKorean, Murda Beatz","GRoCERIES","Chance the Rapper",35,138,50,"238131"
161,"spotify:track:3a1lNhkSLSkpJE4MSHpDu9","Post Malone, Quavo","Congratulations","Universal Records",5,170,915,"236892"
162,"spotify:track:1xzBco0xcoJEDXktl7Jxrr","Sheck Wes","Mo Bamba","Cactus Jack Records/ G.O.O.D. Music/ Interscope Records",1,144,344,"236193"
163,"spotify:track:6DCZcSspjsKoFjzjrWoCdn","Drake","God's Plan","Cash Money/Drake LP6",1,147,532,"235403"
164,"spotify:track:56eGOeSsqdg3FLxdo83TwV","Lee Brice","Rumor","Curb Records",115,143,49,"234952"
165,"spotify:track:6vN77lE9LK6HP2DewaN6HZ","Lil Baby, Drake","Yes Indeed","Quality Control Music, LLC",2,150,417,"233732"
166,"spotify:track:5T8EDUDqKcs6OSOwEsfqG7","Queen","Don't Stop Me Now - Remastered 2011","Hollywood Records",69,114,204,"233606"
167,"spotify:track:4R8BJggjosTswLxtkw8V7P","Jhay Cortez, J Balvin, Bad Bunny","No Me Conoce - Remix","N&E Entertainment LLC",155,155,24,"232993"
168,"spotify:track:4bHsxqR3GMrXTxEPLuK5ue","Journey","Don't Stop Believin'","Columbia",157,157,26,"231447"
169,"spotify:track:2uIX8YMNjGMD7441kqyyNU","Billie Eilish","ocean eyes","Darkroom",61,169,372,"230439"
170,"spotify:track:7GX5flRQZVHRAGd6B4TmDO","Lil Uzi Vert","XO Tour Llif3","Generation Now/Atlantic",1,163,834,"229928"
171,"spotify:track:67XyC1GdSkKb9sbRRkUDXS","NLE Choppa, Blueface","Shotta Flow (Feat. Blueface) [Remix]","No Love Entertainment",171,171,4,"229145"
172,"spotify:track:02itaCXOdC54J0ISjqqFAp","R3HAB, A Touch Of Class","All Around The World (La La La)","Casablanca Records",132,148,16,"228776"
173,"spotify:track:0YP8kt3sAYTj6eEyesreQH","Machine Gun Kelly, Naomi Wild","Glass House (feat. Naomi Wild)","Bad Boy/Interscope Records",173,-1,1,"227839"
174,"spotify:track:5KBARWIxeMGkvUax9VtVC9","Saweetie","My Type","ICY/Artistry Records/Warner Records",174,176,2,"227157"
175,"spotify:track:116H0KvKr2Zl4RPuVBruDO","Bad Bunny, Drake","MIA (feat. Drake)","OVO Sound/Warner Records",2,154,268,"226836"
176,"spotify:track:1mMLMZYXkMueg65jRRWG1l","Luke Combs","When It Rains It Pours","River House Artists/Columbia Nashville",110,152,322,"226519"
177,"spotify:track:2G1tXoGBaEMJ7FKGnkf6ud","Gucci Mane, Bruno Mars, Kodak Black","Wake Up in the Sky","Guwop Enterprises/Atlantic",6,161,295,"226010"
178,"spotify:track:0vrmHPfoBadXVr2n0m1aqZ","Avicii","Heaven","Universal Music AB",12,139,29,"225949"
179,"spotify:track:7oK9VyNzrYvRFo7nQEYkWN","The Killers","Mr. Brightside","Island Records",83,159,59,"225218"
180,"spotify:track:2P91MQbaiQOfbiz9VqhqKQ","Lauv","I Like Me Better","Lauv",30,182,752,"224732"
181,"spotify:track:4VXIryQMWpIdGgYR4TrjT1","Juice WRLD","All Girls Are The Same","Juice WRLD Mixtape / ISR P&D",12,172,441,"223809"
182,"spotify:track:14mHfNsSHN0FbLftyjrV9g","Flipp Dinero","Leave Me Alone","Cinematic/Epic/We The Best",10,165,328,"223685"
183,"spotify:track:1fDsrQ23eTAVFElUMaf38X","Don McLean","American Pie","Capitol Records",85,85,2,"223113"
184,"spotify:track:40T5GIqQ1CegGm2PTEl8Bu","Billie Eilish","idontwannabeyouanymore","Darkroom",40,186,348,"222785"
185,"spotify:track:7AQim7LbvFVZJE3O8TYgf2","XXXTENTACION, Trippie Redd","Fuck Love (feat. Trippie Redd)","Bad Vibes Forever / EMPIRE",5,167,680,"221864"
186,"spotify:track:7zLYKWcXnYeHHWidalz7rj","Lil Mosey","Noticed","Mogul Vision/Interscope Records",17,185,323,"221772"
187,"spotify:track:0dOg1ySSI7NkpAe89Zo0b9","Bruce Springsteen","Born in the U.S.A.","Columbia",53,53,4,"221699"
188,"spotify:track:09IStsImFySgyp0pIQdqAc","Zedd, Maren Morris, Grey","The Middle","UMGRI Interscope",5,174,515,"221142"
189,"spotify:track:5wujBwqG7INdStqGd4tRMX","Juice WRLD","Armed And Dangerous","Juice WRLD Mixtape / ISR P&D",9,183,239,"220666"
190,"spotify:track:2rMAtCaTj16NptyVfEIeAC","Megan Thee Stallion, DaBaby","Cash Shit (feat. DaBaby)","300 Entertainment",128,179,11,"220428"
191,"spotify:track:7qiZfU4dY1lWllzX7mPBI3","Ed Sheeran","Shape of You","Atlantic Records UK",1,140,615,"216781"
192,"spotify:track:7KXjTSCq5nL1LoYtL7XAwS","Kendrick Lamar","HUMBLE.","Aftermath",1,184,825,"215676"
193,"spotify:track:4ZT9FnbFu1PaBfV3itxiqT","Lil Skies","I","All We Got Ent.",13,190,127,"214906"
194,"spotify:track:152lZdxL1OR0ZMW6KquMif","Khalid","Location","Right Hand Music Group, LLC/RCA Records",9,189,905,"214696"
195,"spotify:track:1zB4vmk8tFRmM9UULNzbLB","Imagine Dragons","Thunder","Kid Ina Korner / Interscope",16,177,724,"214224"
196,"spotify:track:1mqlc0vEP9mU1kZgTi6LIQ","Earth, Wind & Fire","September","Columbia/Legacy",32,121,13,"213999"
