rank,uri,artist_names,track_name,source,peak_rank,previous_rank,days_on_chart,streams
1,"spotify:track:7l3E7lcozEodtVsSTCkcaA","Kodak Black, Offset, Travis Scott","ZEZE (feat. Travis Scott & Offset)","Atlantic Records",1,1,2,"2266668"
2,"spotify:track:116H0KvKr2Zl4RPuVBruDO","Bad Bunny, Drake","MIA (feat. Drake)","OVO Sound/Warner Records",2,2,3,"1750645"
3,"spotify:track:78QR3Wp35dqAhFEc2qAGjE","Lil Baby, Gunna","Drip Too Hard (Lil Baby & Gunna)","Quality Control Music/Young Stoner Life Records, a 300 Entertainment Label/Motown Records/Capitol Records",1,4,32,"1290267"
4,"spotify:track:1xzBco0xcoJEDXktl7Jxrr","Sheck Wes","Mo Bamba","Cactus Jack Records/ G.O.O.D. Music/ Interscope Records",3,5,79,"1269099"
5,"spotify:track:2xLMifQCjDGFmkHkpNLD9h","Travis Scott","SICKO MODE","Cactus Jack / Epic / Grand Hustle",1,6,72,"1233032"
6,"spotify:track:4w8niZpiMy6qz1mntFA5uM","DJ Snake, Selena Gomez, Ozuna, Cardi B","Taki Taki (with Selena Gomez, Ozuna & Cardi B)","DJ Snake Music Productions Limited, under exclusive license to Geffen Records",4,7,16,"1084251"
7,"spotify:track:0s3nnoMeVWz3989MkNQiRf","Juice WRLD","Lucid Dreams","Juice WRLD Mixtape / ISR P&D",1,11,160,"1062423"
8,"spotify:track:2dpaYNEQHiRxtZbfNsse99","Marshmello, Bastille","Happier","Astralwerks",5,10,58,"983111"
9,"spotify:track:3edzl4zvKFi0D3iuF6cs2f","Quavo, 21 Savage","PASS OUT (feat. 21 Savage)","Quality Control Music/Motown Records/Capitol Records",3,3,2,"982918"
10,"spotify:track:5p7ujcrUXASCNwRaWNHR1C","Halsey","Without Me","Capitol Records",8,9,10,"981626"
11,"spotify:track:6wWaVoUOzLQJHd3bWAUpdZ","Lil Baby, Gunna, Drake","Never Recover (Lil Baby & Gunna, Drake)","Quality Control Music/Young Stoner Life Records, a 300 Entertainment Label/Motown Records/Capitol Records",1,8,9,"969957"
12,"spotify:track:4S8d14HvHb70ImctNgVzQQ","Kanye West, Lil Pump","I Love It (& Lil Pump)","Getting Out Our Dreams, Inc./Def Jam Recordings",1,14,37,"967459"
13,"spotify:track:0JP9xo3adEtGSdUEISiszL","XXXTENTACION","Moonlight","Bad Vibes Forever, LLC",2,16,212,"884469"
14,"spotify:track:0Dn40gxVCMo5TkgS8Ik18Q","Lil Peep, XXXTENTACION","Falling Down - Bonus Track","Columbia",1,15,25,"879316"
15,"spotify:track:0dbTQYW3Ad1FTzIA9t90E8","Lil Wayne, Kendrick Lamar","Mona Lisa (feat. Kendrick Lamar)","Young Money Records, Inc.",1,13,16,"875885"
16,"spotify:track:2E124GmJRnBJuXbTb4cPUB","6ix9ine, Nicki Minaj, Murda Beatz","FEFE","Scumgang Records/TenThousand Projects, LLC",2,20,84,"861385"
17,"spotify:track:3ee8Jmje8o58CHK66QrVC2","XXXTENTACION","SAD!","Bad Vibes Forever, LLC",1,19,226,"853230"
18,"spotify:track:2VxeLyX666F8uXCJ0dZF8B","Lady Gaga, Bradley Cooper","Shallow","A Star is Born OST",16,18,16,"848347"
19,"spotify:track:1jQvUmf16VE9WQCPuK2e8K","6ix9ine, Bobby Shmurda","STOOPID","Scumgang Records/TenThousand Projects, LLC",5,17,9,"822320"
20,"spotify:track:0TlLq3lA83rQOYtrqBqSct","Drake","Nonstop","Cash Money/Drake LP6",1,22,107,"822084"
21,"spotify:track:04MLEeAMuV9IlHEsD8vF6A","French Montana, Drake","No Stylist (feat. Drake)","Epic",14,21,23,"772027"
22,"spotify:track:7dt6x5M1jzdTEt8oCbisTK","Post Malone","Better Now","Republic Records",1,26,170,"738118"
23,"spotify:track:4T3fNx3CgwDRRYgmFCbD4J","Khalid","Better","Right Hand Music Group, LLC/RCA Records",8,24,30,"736175"
24,"spotify:track:2G7V7zsVDxg1yRsu7Ew9RJ","Drake","In My Feelings","Cash Money/Drake LP6",1,33,107,"725947"
25,"spotify:track:15kQGEy89K8deJcZVFEn0N","The Chainsmokers, Kelsea Ballerini","This Feeling","Disruptor Records/Columbia",21,25,23,"718867"
26,"spotify:track:0QIjsbm2fh1cJ45XO9eGqq","Gucci Mane, Bruno Mars, Kodak Black","Wake Up in the Sky","Guwop Enterprises/Atlantic",6,29,30,"715489"
27,"spotify:track:5IaHrVsrferBYDm0bDyABy","Tyga, Offset","Taste (feat. Offset)","Last Kings Music / EMPIRE",3,35,149,"653711"
28,"spotify:track:6vN77lE9LK6HP2DewaN6HZ","Lil Baby, Drake","Yes Indeed","Quality Control Music, LLC",2,32,152,"653421"
29,"spotify:track:7d6XJZjnm7iWcKwYL9z5kC","Lil Mosey","Noticed","Mogul Vision/Interscope Records",17,30,58,"652368"
30,"spotify:track:0d2iYfpKoM0QCKvcLCkBao","benny blanco, Halsey, Khalid","Eastside (with Halsey & Khalid)","Benny Blanco Solo Album PS",7,31,93,"647202"
31,"spotify:track:0Fpen1PTuEnCmOJtUU9Iud","Lil Uzi Vert","New Patek","Generation Now/Atlantic",1,34,26,"638149"
32,"spotify:track:4MAsYGSgxsaj73dC2lvFC4","Quavo","WORKIN ME","Quality Control Music/Motown Records/Capitol Records",27,27,65,"609456"
33,"spotify:track:58q2HKrzhC3ozto2nDdN4z","Cardi B, Bad Bunny, J Balvin","I Like It","Atlantic/KSR",2,40,191,"608423"
34,"spotify:track:1rlIrbWboTRGeKfHhgbJRZ","Quavo, Drake","FLIP THE SWITCH (feat. Drake)","Quality Control Music/Motown Records/Capitol Records",12,12,2,"590125"
35,"spotify:track:3wScL5W8H40zzCKN0atfBk","Lil Wayne, Swizz Beatz","Uproar","Young Money Records, Inc.",3,38,16,"572952"
36,"spotify:track:7m9OqQk4RVRkw9JJdeAw96","XXXTENTACION","Jocelyn Flores","Bad Vibes Forever / EMPIRE",2,42,415,"565508"
37,"spotify:track:5BQrp63SHCVf4bzCzJePne","Lil Wayne, XXXTENTACION","Don't Cry (feat. XXXTENTACION)","Young Money Records, Inc.",2,39,16,"546475"
38,"spotify:track:60SdxE8apGAxMiRrpbmLY0","Eminem, Joyner Lucas","Lucky You (feat. Joyner Lucas)","Aftermath",1,41,44,"545071"
39,"spotify:track:14mHfNsSHN0FbLftyjrV9g","Flipp Dinero","Leave Me Alone","Cinematic/Epic/We The Best",29,45,63,"531829"
40,"spotify:track:6CTWathupIiDs7U4InHnDA","Ella Mai","Trip","10 Summers / Interscope PS",40,44,45,"525693"
41,"spotify:track:0ZNrc4kNeQYD9koZ3KvCsy","YG, 2 Chainz, Big Sean, Nicki Minaj","BIG BANK (feat. 2 Chainz, Big Sean, Nicki Minaj)","Def Jam Recordings",21,47,142,"506222"
42,"spotify:track:7AQim7LbvFVZJE3O8TYgf2","XXXTENTACION, Trippie Redd","Fuck Love (feat. Trippie Redd)","Bad Vibes Forever / EMPIRE",5,46,415,"501340"
43,"spotify:track:3swc6WTsr7rl9DqQKQA55C","Post Malone, Ty Dolla $ign","Psycho (feat. Ty Dolla $ign)","Republic Records",1,48,233,"495928"
44,"spotify:track:0XySogm94T51XF5F2jumXm","Juice WRLD","All Girls Are The Same","Juice WRLD Mixtape / ISR P&D",12,50,176,"492582"
45,"spotify:track:6DCZcSspjsKoFjzjrWoCdn","Drake","God's Plan","Cash Money/Drake LP6",1,56,267,"484841"
46,"spotify:track:0e7ipj03S05BNilyu5bRzt","Post Malone, 21 Savage","rockstar (feat. 21 Savage)","Republic Records",1,52,394,"482116"
47,"spotify:track:29tc0GbW0pTSBZSCZF3NWk","Juice WRLD","Lean Wit Me","Juice WRLD Mixtape / ISR P&D",25,51,144,"474286"
48,"spotify:track:7AFASza1mXqntmGtbxXprO","XXXTENTACION","changes","Bad Vibes Forever, LLC",4,53,226,"470601"
49,"spotify:track:5qHirGR7M9tdm6C17DlzSY","Aminé","REEL IT IN","Republic Records",49,59,38,"453587"
50,"spotify:track:7fa9MBXhVfQ8P8Df9OEbD8","Maroon 5, Cardi B","Girls Like You (feat. Cardi B) - Cardi B Version","Interscope Records*",6,64,135,"445394"
51,"spotify:track:2iUXsYOEPhVqEBwsqP70rE","5 Seconds of Summer","Youngblood","Capitol",12,58,183,"444117"
52,"spotify:track:69PkhA9q3xCWU2CzoZnLAu","Quavo, Lil Baby","LOSE IT (feat. Lil Baby)","Quality Control Music/Motown Records/Capitol Records",36,36,2,"438810"
53,"spotify:track:4zIO3ilp5HvTeK3HJHxhMP","Imagine Dragons","Natural","Kid Ina Korner / Interscope",21,61,86,"428334"
54,"spotify:track:7wBJfHzpfI3032CSD7CE2m","Travis Scott","STARGAZING","Cactus Jack / Epic / Grand Hustle",1,63,72,"425293"
55,"spotify:track:0CBQ0m3mufWH75LTYB3s6h","Lil Wayne, Travis Scott","Let It Fly (feat. Travis Scott)","Young Money Records, Inc.",3,54,16,"422861"
56,"spotify:track:3CA9pLiwRIGtUBiMjbZmRw","Drake","Nice For What","Cash Money/Drake LP6",1,74,190,"414464"
57,"spotify:track:1jo3TwNGCXfNdB5uba3ZVv","Eminem","Killshot","Aftermath",16,57,25,"411935"
58,"spotify:track:3obgSF06ki98lYNLNq5vCB","Juice WRLD, Lil Uzi Vert","Wasted (feat. Lil Uzi Vert)","Juice WRLD Mixtape / ISR P&D",20,67,96,"409862"
59,"spotify:track:1Jl21sidRpEdlVBvYbssLx","Young Thug, Jaden","Sin (feat. Jaden Smith)","300 Entertainment/Atl",24,65,20,"409531"
60,"spotify:track:4qKcDkK6siZ7Jp1Jb4m0aL","BlocBoy JB, Drake","Look Alive (feat. Drake)","OVO Sound/Warner Records",2,70,247,"408712"
61,"spotify:track:75ZvA4QfFiZvzhj2xkaWAh","Post Malone","I Fall Apart","Universal Records",2,66,393,"404727"
62,"spotify:track:6Q36XucqrejMId3RydVhch","Quavo","BIGGEST ALLEY OOP","Quality Control Music/Motown Records/Capitol Records",23,23,2,"404152"
63,"spotify:track:0JYAsQJWIuaYUvZGF1qapT","Quavo, Travis Scott","RERUN (feat. Travis Scott)","Quality Control Music/Motown Records/Capitol Records",28,28,2,"391888"
64,"spotify:track:2SL6oP2YAEQbqsrkOzRGO4","Eminem","Venom - Music From The Motion Picture","Aftermath",17,79,44,"390207"
65,"spotify:track:4VUwkH455At9kENOfzTqmF","Bazzi, Camila Cabello","Beautiful (feat. Camila Cabello)","iamcosmic",28,75,72,"386168"
66,"spotify:track:5N5k9nd479b1xpDZ4usjrg","Calvin Harris, Sam Smith, Jessie Reyez","Promises (with Sam Smith)","Columbia",18,78,58,"369990"
67,"spotify:track:7lAK3oHbfEnvUQWosrMMpR","Travis Scott","YOSEMITE","Cactus Jack / Epic / Grand Hustle",7,76,72,"369535"
68,"spotify:track:5OCJzvD7sykQEKHH7qAC3C","Ariana Grande","God is a woman","Republic Records",4,77,93,"368142"
69,"spotify:track:3GVkPk8mqxz0itaAriG1L7","XXXTENTACION","Everybody Dies In Their Nightmares","Bad Vibes Forever / EMPIRE",6,81,410,"362646"
70,"spotify:track:4OafepJy2teCjYJbvFE60J","Ariana Grande","breathin","Republic Records",4,80,58,"359884"
71,"spotify:track:74iZuPGwyL33VlTr6jTnab","Lady Gaga","Always Remember Us This Way","A Star is Born OST",71,106,7,"359845"
72,"spotify:track:5N4erncE7kuUccm7zEmwzk","Silk City, Dua Lipa, Diplo, Mark Ronson","Electricity (with Dua Lipa)","Columbia",25,87,37,"358705"
73,"spotify:track:3V8UKqhEK5zBkBb6d6ub8i","Nio Garcia, Casper Magico, Bad Bunny, Darell, Ozuna, Nicky Jam","Te Boté - Remix","2018 Flow La Movie, Inc.",35,89,181,"351032"
74,"spotify:track:0Y7di9ZCmB6Elad5WISaPc","Lil Wayne","Dedicate","Young Money Records, Inc.",4,73,16,"348587"
75,"spotify:track:5nzhL67GpF9szXWg5y509A","Lil Baby","Close Friends (Lil Baby & Gunna)","Quality Control Music/Young Stoner Life Records, a 300 Entertainment Label/Motown Records/Capitol Records",41,72,9,"347340"
76,"spotify:track:7GX5flRQZVHRAGd6B4TmDO","Lil Uzi Vert","XO Tour Llif3","Generation Now/Atlantic",1,92,569,"346438"
77,"spotify:track:7sO5G9EABYOXQKNPNiE9NR","Offset, Metro Boomin","Ric Flair Drip (with Metro Boomin)","Slaughter Gang, LLC/Epic/Quality Control Music/Motown/Capitol/Boominati Worldwide/Republic",4,93,348,"340212"
78,"spotify:track:45Egmo7icyopuzJN0oMEdk","Khalid, Normani","Love Lies (with Normani)","RCA Records Label",8,85,240,"337837"
79,"spotify:track:2qT1uLXPVPzGgFOx4jtEuo","Ariana Grande","no tears left to cry","Republic Records",6,94,177,"332651"
80,"spotify:track:6eYxmK9fdL4hwLnXG2zY3s","XXXTENTACION","Look At Me!","Bad Vibes Forever / EMPIRE",20,100,484,"327122"
81,"spotify:track:2ZRo7axmMPeSVUvDbGkJah","XXXTENTACION","Hope","Bad Vibes Forever, LLC",10,107,153,"323459"
82,"spotify:track:5WvAo7DNuPRmk4APhdPzi8","DJ Khaled, Justin Bieber, Quavo, Chance the Rapper","No Brainer","Epic/We The Best",3,96,79,"323020"
83,"spotify:track:7pVzUPjJ83QojsVcOthmxP","Quavo","HUNCHO DREAMS","Quality Control Music/Motown Records/Capitol Records",37,37,2,"320658"
84,"spotify:track:0UyljEbX9dqI1K0sqdv6B6","Joji","SLOW DANCING IN THE DARK","88rising Music/Warner Records",26,84,32,"320119"
85,"spotify:track:1rqqCSm0Qe4I9rUvWncaom","Panic! At The Disco","High Hopes","DCD2 / Fueled By Ramen",33,95,124,"320038"
86,"spotify:track:6xtcFXSo8H9BZN637BMVKS","Rita Ora","Let You Love Me","Atlantic Records UK",86,101,10,"319745"
87,"spotify:track:3EPXxR3ImUwfayaurPi3cm","Dean Lewis","Be Alright","Universal Music Australia Pty. Ltd.",19,90,76,"317748"
88,"spotify:track:1ZAyjvIk9YiD76yYy0TEG6","Rich The Kid","Plug Walk","Rich The Kid / (TDE/ISR PS)",6,104,247,"316622"
89,"spotify:track:0OgGn1ofaj55l2PcihQQGV","Bryce Vine","Drew Barrymore","Sire",45,82,58,"313150"
90,"spotify:track:0u2P5u6lvoDfwTYjAADbn4","Billie Eilish, Khalid","lovely (with Khalid)","Darkroom",18,97,177,"310842"
91,"spotify:track:3JX0dOCIAiaR8MP3ryXWuM","Lil Wayne, Sosamann","What About Me (feat. Sosamann)","Young Money Records, Inc.",7,88,16,"305857"
92,"spotify:track:3a1lNhkSLSkpJE4MSHpDu9","Post Malone, Quavo","Congratulations","Universal Records",5,110,651,"302786"
93,"spotify:track:5cGpjfgAvidLy6znwkCxkP","Lil Wayne","Can't Be Broken","Young Money Records, Inc.",6,91,16,"302030"
94,"spotify:track:5bJ1DrEM4hNCafcDd1oxHx","Mac Miller","Self Care","Warner Records",4,103,52,"299093"
95,"spotify:track:7ycWLEP1GsNjVvcjawXz3z","A$AP Rocky, Skepta","Praise The Lord (Da Shine) (feat. Skepta)","A$AP Worldwide/Polo Grounds Music/RCA Records",5,105,142,"296039"
96,"spotify:track:4UKCKdYiLN6IMA5ZESUTL7","XXXTENTACION","the remedy for a broken heart (why am I so in love)","Bad Vibes Forever, LLC",8,113,179,"295674"
97,"spotify:track:7oJrVhiTPZGBXWPwhxjy9S","Lil Skies","Lust","All We Got Ent.",75,121,251,"293935"
98,"spotify:track:2P91MQbaiQOfbiz9VqhqKQ","Lauv","I Like Me Better","Lauv",30,109,492,"292993"
99,"spotify:track:2uMTscYuCT3BZ0OCzH3MwN","Kodak Black","If I'm Lyin', I'm Flyin'","Atlantic Records",39,102,16,"291929"
100,"spotify:track:48zFZh27QU5qsrBjn4C2FA","Ozuna, Manuel Turizo","Vaina Loca","VP Records Corp/Dimelo Vi",49,125,54,"289911"
101,"spotify:track:25sgk305KZfyuqVBQIahim","Ava Max","Sweet but Psycho","Atlantic Records",80,99,12,"286975"
102,"spotify:track:4mHgYpuGHu99Mw69E83CP2","Trippie Redd","Taking A Walk","TenThousand Projects, LLC",6,108,69,"284125"
103,"spotify:track:7IBSffWIu7P2MC7kMwy2FM","Wiz Khalifa, Swae Lee","Hopeless Romantic (feat. Swae Lee)","Taylor Gang/Atlantic",29,117,102,"284104"
104,"spotify:track:7KXjTSCq5nL1LoYtL7XAwS","Kendrick Lamar","HUMBLE.","Aftermath",1,127,562,"283162"
105,"spotify:track:0ibOcbkp2XG46Do8jcy0bL","Smokepurpp, Lil Pump","Nephew (feat. Lil Pump)","Alamo",75,130,78,"282746"
106,"spotify:track:7rC5Pl8rQSX4myONQHYPBK","Drake","Mob Ties","Cash Money/Drake LP6",5,141,107,"281851"
107,"spotify:track:5a8RPWgKSmcGBGcffmIrUi","Sia, Diplo, Labrinth, LSD","Thunderclouds (feat. Sia, Diplo, and Labrinth)","Records/Columbia",41,116,65,"281157"
108,"spotify:track:7ATATJztoWLcqDAcVVof0C","6ix9ine, Anuel AA","BEBE","Scumgang Records/TenThousand Projects, LLC",34,124,44,"280717"
109,"spotify:track:4kWO6O1BUXcZmaxitpVUwp","Tiësto, Dzeko, Preme, Post Malone","Jackie Chan","Universal Music, a division of Universal International Music BV",18,133,149,"279928"
110,"spotify:track:1kvt3N2KmoSAunaEJNrgNM","Quavo, Saweetie","GIVE IT TO EM (feat. Saweetie)","Quality Control Music/Motown Records/Capitol Records",43,43,2,"278184"
111,"spotify:track:6Hgh47WXVKtXN5zGOu0hjI","Khalid, 6LACK, Ty Dolla $ign","OTW","Right Hand Music Group, LLC/RCA Records",17,115,177,"277360"
112,"spotify:track:4e4fqjx0Izh4svvTef1z7e","Bebe Rexha, Florida Georgia Line","Meant to Be (feat. Florida Georgia Line)","Warner Bros.",15,120,400,"275104"
113,"spotify:track:2jt2WxXMCD4zjACthkJQVE","Eminem","The Ringer","Aftermath",2,112,44,"275083"
114,"spotify:track:5PTG6rrL6EPFD9E2QMI2pl","Famous Dex","JAPAN","300 Entertainment",11,131,212,"271994"
115,"spotify:track:7q8cy4uoA2itYATsKeXhcq","Lil Pump, Lil Uzi Vert","Multi Millionaire (feat. Lil Uzi Vert)","Warner Records",51,123,9,"271460"
116,"spotify:track:32lItqlMi4LBhb4k0BaSaC","Post Malone","Candy Paint","Republic Records",4,129,506,"270316"
117,"spotify:track:40oKW22ZNNkEdZLJTScaQI","Kodak Black, XXXTENTACION","Roll in Peace (feat. XXXTENTACION)","Atlantic Records",21,126,413,"269162"
118,"spotify:track:5Z3GHaZ6ec9bsiI5BenrbY","Khalid","Young Dumb & Broke","Right Hand Music Group, LLC/RCA Records",5,128,557,"268376"
119,"spotify:track:2hnxrRNzF74mdDzpQZQukQ","Lauv, Julia Michaels","There's No Way (feat. Julia Michaels)","Lauv",110,132,13,"266698"
120,"spotify:track:3qN5qMTKyEEmiTZD38BNTT","Drake","I'm Upset","Cash Money/Drake LP6",4,148,140,"264290"
121,"spotify:track:0At2qAoaVjIwWNAqrscXli","Ella Mai","Boo'd Up","10 Summers / Interscope PS",24,136,155,"264195"
122,"spotify:track:6gBFPUFcJLzWGx4lenP6h2","Travis Scott","goosebumps","Epic/Grand Hustle",16,140,651,"263286"
123,"spotify:track:7uzmGiiJyRfuViKKK3lVmR","Bazzi","Mine","iamcosmic",3,138,272,"263240"
124,"spotify:track:2u7mxWSeoqTXndK5e08jMp","Lil Skies, Landon Cube","Nowadays (feat. Landon Cube)","All We Got Ent.",24,143,288,"262856"
125,"spotify:track:6rrTr2HEAzlpC4KWZxF3S1","Little Mix, Nicki Minaj","Woman Like Me (feat. Nicki Minaj)","Syco Music",71,71,2,"261066"
126,"spotify:track:7eBqSVxrzQZtK2mmgRG6lC","YNW Melly","Murder On My Mind","P2018",111,144,23,"259269"
127,"spotify:track:6IaieqiCVvsNvEt6Y7yOFa","Post Malone, Nicki Minaj","Ball For Me (feat. Nicki Minaj)","Republic Records",8,134,170,"258668"
128,"spotify:track:1yHdfeCpeKPmSzQdfqHtq8","Quavo","SHINE","Quality Control Music/Motown Records/Capitol Records",49,49,2,"257441"
129,"spotify:track:1Knctxx9vGZxpZfF66BIEa","Juice WRLD","Legends","Juice WRLD / Interscope PS",67,147,114,"255632"
130,"spotify:track:09IStsImFySgyp0pIQdqAc","Zedd, Maren Morris, Grey","The Middle","UMGRI Interscope",5,146,262,"254677"
131,"spotify:track:1zB4vmk8tFRmM9UULNzbLB","Imagine Dragons","Thunder","Kid Ina Korner / Interscope",16,159,534,"253822"
132,"spotify:track:6n4U3TlzUGhdSFbUUhTvLP","Migos, Drake","Walk It Talk It","Quality Control Music, LLC",3,156,261,"253253"
133,"spotify:track:6yz0Jndhv0QjKdpcEMbOjz","Trippie Redd","Shake It Up","TenThousand Projects, LLC",42,139,65,"252960"
134,"spotify:track:23OXdR7YuUBVWh5hSnYJau","Twenty One Pilots","Chlorine","Fueled By Ramen",45,111,9,"251929"
135,"spotify:track:2i4WKnGYntsN4jEvDjkKBE","Quavo, Madonna, Cardi B","CHAMPAGNE ROSÉ (feat. Madonna & Cardi B)","Quality Control Music/Motown Records/Capitol Records",60,60,2,"245844"
136,"spotify:track:5HeKOKc4phmLn8e4I7EkzD","Twenty One Pilots","My Blood","Fueled By Ramen",50,122,13,"244531"
137,"spotify:track:0kCBorRrKZkSztd9m0QI3r","Young Thug, Young Stoner Life, Gunna, Lil Baby","Chanel (Go Get It) [feat. Gunna & Lil Baby]","300 Entertainment/Atl",30,152,58,"243074"
138,"spotify:track:1R0Ig5KYrSGWvIoPzY4T3l","Juice WRLD","Black & White","Juice WRLD Mixtape / ISR P&D",126,149,111,"240833"
139,"spotify:track:152lZdxL1OR0ZMW6KquMif","Khalid","Location","Right Hand Music Group, LLC/RCA Records",9,155,650,"240331"
140,"spotify:track:4hQ6UGyWQIGJmHSo0J88JW","Selena Gomez","Back To You - From 13 Reasons Why – Season 2 Soundtrack","UMGRI Interscope",15,158,156,"238923"
141,"spotify:track:0pqnGHJpmpxLKifKRmU6WP","Imagine Dragons","Believer","Kid Ina Korner / Interscope",9,168,619,"237184"
142,"spotify:track:1rfofaqEpACxVEHIZBJe6W","Camila Cabello, Young Thug","Havana (feat. Young Thug)","Syco Music/Epic",2,169,434,"235933"
143,"spotify:track:6xcJyGpfZbuuiequtnlKt4","Travis Scott","BUTTERFLY EFFECT","Cactus Jack / Epic / Grand Hustle",9,157,512,"234765"
144,"spotify:track:2rxQMGVafnNaRaXlRMWPde","Luke Combs","Beautiful Crazy","River House Artists/Columbia Nashville",103,151,129,"234678"
145,"spotify:track:01vv2AjxgP4uUyb8waYO5Y","Twenty One Pilots","Morph","Fueled By Ramen",22,119,9,"232403"
146,"spotify:track:5gQcxYXqnofyocKgEbGYKt","YBN Nahmir","Bounce Out With That","2018",27,154,254,"231413"
147,"spotify:track:05r1GGg1Rhs0RcUg27C82a","Lil Wayne, Reginae Carter","Famous (feat. Reginae Carter)","Young Money Records, Inc.",12,142,16,"230740"
148,"spotify:track:0dSIrRkA4PadGll16TgbnV","Famous Dex, A$AP Rocky","PICK IT UP (feat. A$AP Rocky)","300 Entertainment",13,160,352,"230553"
149,"spotify:track:2QApWGconWQE8BjaNfh7ik","Quavo, Takeoff","KEEP THAT SHIT (feat. Takeoff)","Quality Control Music/Motown Records/Capitol Records",55,55,2,"230239"
150,"spotify:track:2fQrGHiQOvpL9UgPvtYy6G","21 Savage","Bank Account","Slaughter Gang, LLC/Epic Records",1,173,464,"228618"
151,"spotify:track:6PoKfDY78ih5OveWirggRX","Lil Baby, Gunna, Lil Durk, NAV","Off White VLONE (Lil Baby & Gunna feat. Lil Durk & NAV)","Quality Control Music/Young Stoner Life Records, a 300 Entertainment Label/Motown Records/Capitol Records",16,137,9,"227570"
152,"spotify:track:1HXy5I3HTWq8OvxCn0z7G7","Kane Brown","Heaven","RCA Records Label Nashville",51,163,270,"227085"
153,"spotify:track:3ZhTT6yjZwpPph5MIJ53XY","Lil Skies, Landon Cube","Red Roses (feat. Landon Cube)","All We Got Ent.",36,165,285,"226524"
154,"spotify:track:1BuZAIO8WZpavWVbbq3Lci","Rae Sremmurd, Swae Lee, Slim Jxmmi, Juicy J","Powerglide (feat. Juicy J) - From SR3MM","Mike WiLL Made-It",15,181,227,"223178"
155,"spotify:track:2Yer0p7uB2lVBUAtANuuQp","Social House, Lil Yachty","Magic In The Hamptons (feat. Lil Yachty)","Silent Records / Social House",76,145,59,"221301"
156,"spotify:track:42fw0rxRO2xbesF6mJfd4Y","Dan + Shay","Tequila","Warner Records",48,162,232,"220924"
157,"spotify:track:04ZTP5KsCypmtCmQg5tH9R","Bebe Rexha","I'm a Mess","Warner Bros.",63,178,114,"220148"
158,"spotify:track:2UVbBKQOdFAekPTRsnkzcf","Migos","Stir Fry","Quality Control Music, LLC",2,189,293,"219627"
159,"spotify:track:6f5i916F3jU6BhOOD7iGqf","MadeinTYO, A$AP Ferg","Ned Flanders (feat. A$AP Ferg)","Commission/BMG",64,167,92,"218182"
160,"spotify:track:6jreFSOTUAViWjKyzOC4Kg","Alesso","REMEDY","10:22 pm",58,177,38,"218174"
161,"spotify:track:6KBYefIoo7KydImq1uUQlL","Cardi B","Bodak Yellow","Atlantic/KSR",2,-1,436,"218042"
162,"spotify:track:2jBQmxZpQxF8jJfEdjJ9Qv","Quavo, Offset","FUCK 12 (feat. Offset)","Quality Control Music/Motown Records/Capitol Records",62,62,2,"217145"
163,"spotify:track:1gm616Plq4ScqNi7TVkZ5N","The Weeknd","Call Out My Name","Universal Republic Records",1,170,198,"216133"
164,"spotify:track:5NBIdxTKECGFHJIkiNhBJB","Quavo","LAMB TALK","Quality Control Music/Motown Records/Capitol Records",98,98,11,"216039"
165,"spotify:track:52okn5MNA47tk87PeZJLEL","NF","Let You Down","NF Real Music",9,180,370,"216026"
166,"spotify:track:28FGV3ORH14MYORd7s5dlU","Eminem, Royce Da 5'9""","Not Alike (feat. Royce Da 5'9)","Aftermath",5,175,44,"214875"
167,"spotify:track:2BJSMvOGABRxokHKB0OI8i","Playboi Carti, Lil Uzi Vert","Shoota (feat. Lil Uzi Vert)","AWGE Label",23,166,156,"214638"
168,"spotify:track:2H5CLUmtvo2VHEeWzMtUqW","Quavo, Kid Cudi","LOST (feat. Kid Cudi)","Quality Control Music/Motown Records/Capitol Records",69,69,2,"213932"
169,"spotify:track:2374M0fQpWi3dLnB54qaLX","TOTO","Africa","Columbia",126,197,169,"213864"
170,"spotify:track:2bSk87AVkCIIC3Bcligq1z","Lil Baby, Gunna, Lil Uzi Vert","Life Goes On","Quality Control Music, LLC",87,164,149,"213656"
171,"spotify:track:0wbnC9AUenxp613TYaJsGK","Migos","Narcos","Quality Control Music, LLC",2,-1,220,"213618"
172,"spotify:track:55GiOwtxNajXVbpjjIzMnD","Tyga","SWISH","Last Kings Music / EMPIRE",23,200,80,"213582"
173,"spotify:track:7H0NHzIEzCoIENLC2o8Obj","Quavo","HOW BOUT THAT?","Quality Control Music/Motown Records/Capitol Records",68,68,2,"213034"
174,"spotify:track:58QhkbaAkLFnn7JwAnAato","Eminem","Fall","Aftermath",8,172,44,"210553"
175,"spotify:track:2eAZfqOm4EnOF9VvN50Tyc","Lil Uzi Vert, Oh Wonder","The Way Life Goes (feat. Oh Wonder)","Generation Now/Atlantic",4,187,408,"210266"
176,"spotify:track:7K7MUBCnzgBAvMVW2RTWNs","Loud Luxury, Brando","Body","Armada Music",22,186,121,"208548"
177,"spotify:track:1YLfaRr3QIW1fF3nvDO0gX","Ella Mai, Chris Brown","Whatchamacallit (feat. Chris Brown)","10 Summers / Interscope PS",150,150,2,"208272"
178,"spotify:track:3GCdLUSnKSMJhs4Tj6CV3s","Kendrick Lamar, SZA","All The Stars (with SZA)","Black Panther (TDE/DMG) PS",2,193,282,"208010"
179,"spotify:track:5tz69p7tJuGPeMGwNTxYuV","Logic, Alessia Cara, Khalid","1-800-273-8255","Def Jam Recordings",1,196,532,"205798"
180,"spotify:track:3GJ4hzg4lrGwU51Y3VARbF","Dan + Shay","Speechless","Warner Records",132,176,57,"205580"
181,"spotify:track:5BbdKBZO0TH0GhfxUfyhL9","Lil Baby","Freestyle","Quality Control Music (Caroline)",138,185,17,"204533"
182,"spotify:track:0tgVpDi06FyKpA1z0VMD4v","Ed Sheeran","Perfect","Atlantic Records UK",11,-1,471,"204335"
183,"spotify:track:51rXHuKN8Loc4sUlKPODgH","Jay Rock, Kendrick Lamar, Future, James Blake","King's Dead (with Kendrick Lamar, Future & James Blake)","Black Panther (TDE/DMG) PS",7,194,275,"203869"
184,"spotify:track:7vGuf3Y35N4wmASOKLUVVU","Marshmello, Khalid","Silence","Joytime Collective/RCA Records",7,192,390,"202878"
185,"spotify:track:575NJxNUVDqwJGdzBrlLbv","Shawn Mendes, Zedd","Lost In Japan - Remix","Island Records",16,190,62,"202651"
186,"spotify:track:5IvdLxVB8gwwcgnEkXSSW2","Lil Wayne, Nicki Minaj","Dark Side Of The Moon (feat. Nicki Minaj)","Young Money Records, Inc.",7,174,16,"201901"
187,"spotify:track:3B54sVLJ402zGa6Xm4YGNe","French Montana, Swae Lee","Unforgettable","Bad Boy Entertainment/Epic Records",1,-1,498,"201165"
188,"spotify:track:2AwyHlbA6f641SEkizD5JG","Lil Wayne, Snoop Dogg","Dope Niggaz (feat. Snoop Dogg)","Young Money Records, Inc.",11,184,16,"200544"
189,"spotify:track:4vaxvNDaLSoD36iZX515ug","Lil Xan","Betrayed","Columbia",21,-1,361,"200124"
190,"spotify:track:5Xn4IyTtW6FUGIUyWjbUHG","Jason Derulo, David Guetta, Nicki Minaj, Willy William","Goodbye (feat. Nicki Minaj & Willy William)","Beluga Heights/Warner Records",85,-1,33,"199748"
191,"spotify:track:43TP6JCWXgkc2D7Xjz5hBr","Machine Gun Kelly","RAP DEVIL","Bad Boy / Interscope",36,-1,34,"198937"
192,"spotify:track:4dVpf9jZjcORqGTLUaeYj9","A$AP Ferg","Plain Jane","RCA Records Label",6,-1,404,"198899"
193,"spotify:track:3qnoOm4fwZPBS116f5hpgF","Kanye West","All Mine","Getting Out Our Dreams, Inc./Def Jam Recordings",1,-1,132,"198804"
194,"spotify:track:7BKLCZ1jbUBVqRi2FVlTVw","The Chainsmokers, Halsey","Closer","Disruptor Records/Columbia",4,-1,510,"198799"
195,"spotify:track:5EOF6DK6p9KycvqZwGcQzh","Quavo","GO ALL THE WAY","Quality Control Music/Motown Records/Capitol Records",83,83,2,"198656"
196,"spotify:track:08bNPGLD8AhKpnnERrAc6G","Marshmello, Anne-Marie","FRIENDS","Atlantic Records UK",15,-1,219,"197496"
197,"spotify:track:4OBZT9EnhYIV17t4pGw7ig","H.E.R., Daniel Caesar","Best Part (feat. Daniel Caesar)","MBK Entertainment/RCA Records",127,-1,132,"197148"
