rank,uri,artist_names,track_name,source,peak_rank,previous_rank,days_on_chart,streams
1,"spotify:track:2JvzF1RMd7lE3KmFlsyZD8","J. Cole","MIDDLE CHILD","Dreamville, Inc., Under exclusive license to Roc Nation Records",1,1,58,"1376167"
2,"spotify:track:3KkXRkHbMCARz0aVfEt68P","Post Malone, Swae Lee","Sunflower - Spider-Man: Into the Spider-Verse","Universal Records",1,2,156,"1324255"
3,"spotify:track:6ocbgoVGwYJhOv1GgI9NsF","Ariana Grande","7 rings","Republic Records",1,3,64,"1304977"
4,"spotify:track:7eBqSVxrzQZtK2mmgRG6lC","YNW Melly","Murder On My Mind","P2018",4,4,178,"1215215"
5,"spotify:track:6MWtB6iiXyIwun0YzU6DFP","Post Malone","Wow.","Republic Records",1,6,89,"1164467"
6,"spotify:track:4y3OI86AEP6PQoDE6olYhO","Jonas Brothers","Sucker","Jonas Brothers Recording",1,5,22,"1150895"
7,"spotify:track:53CJANUxooaqGOtdsBTh7O","Lil Nas X","Old Town Road","Columbia",7,8,21,"1084423"
8,"spotify:track:2IRZnDFmlqMuOrYOLnZZyc","Meek Mill, Drake","Going Bad (feat. Drake)","MMG/Atlantic",2,7,113,"1059924"
9,"spotify:track:4kV4N9D1iKVxx1KLvtTpjS","Ariana Grande","break up with your girlfriend, i'm bored","Republic Records",1,10,43,"1031146"
10,"spotify:track:1wJRveJZLSb1rjhnUHQiv6","A Boogie Wit da Hoodie, 6ix9ine","Swervin (feat. 6ix9ine)","Highbridge the Label / Atlantic Records",10,11,92,"1019788"
11,"spotify:track:6Hj9jySrnFppAI0sEMCZpJ","Juice WRLD","Robbery","Grade A Productions/Interscope Records",2,9,37,"984787"
12,"spotify:track:5CE0V7z1ePOZQNJNpWxYGA","Logic","Confessions of a Dangerous Mind","Def Jam Recordings",12,-1,1,"895616"
13,"spotify:track:6vWEAOUSxohKxhp0K1BsxL","YNW Melly, Kanye West","Mixed Personalities (feat. Kanye West)","P2019",12,12,63,"850061"
14,"spotify:track:2t8yVaLvJ0RenpXUIAC52d","21 Savage","a lot","Slaughter Gang, LLC/Epic Records",2,13,92,"808797"
15,"spotify:track:63cd4JkwGgYJrbOizbfmsp","Mustard, Migos","Pure Water (with Migos)","10 Summers Records/Interscope Records",11,14,64,"807056"
16,"spotify:track:78QR3Wp35dqAhFEc2qAGjE","Lil Baby, Gunna","Drip Too Hard (Lil Baby & Gunna)","Quality Control Music/Young Stoner Life Records, a 300 Entertainment Label/Motown Records/Capitol Records",1,15,192,"782141"
17,"spotify:track:4RbbzNY4MEcgzewYWkIsGu","NAV, The Weeknd","Price On My Head (feat. The Weeknd)","XO Records, LLC and Republic Records",17,-1,1,"776501"
18,"spotify:track:3oh6SCCeLuXhFpEyepla6G","Blueface","Thotiana","Fifth Amendment Entertainment/eOne Music",6,16,76,"762972"
19,"spotify:track:3e9HZxeyfWwjeyPAMmWSSQ","Ariana Grande","thank u, next","Republic Records",1,17,139,"742789"
20,"spotify:track:5icOoE6VgqFKohjWWNp0Ac","Marshmello, CHVRCHES","Here With Me","Marshmello/Republic",15,23,15,"731199"
21,"spotify:track:2xLMifQCjDGFmkHkpNLD9h","Travis Scott","SICKO MODE","Cactus Jack / Epic / Grand Hustle",1,18,232,"730323"
22,"spotify:track:0rTV5WefWd1J3OwIheTzxM","Khalid, Disclosure","Talk","Right Hand Music Group, LLC/RCA Records",12,19,44,"698550"
23,"spotify:track:2drEUEg0TYQR6dDEHkpuPE","Tame Impala","Patience","Universal Music Australia Pty. Ltd.",23,-1,1,"678171"
24,"spotify:track:3KLo7ByvjCNyBrfz5DZ2mO","Rich The Kid","Splashin","Interscope Records",24,39,102,"669983"
25,"spotify:track:4txc3txsIt81diMzGhrVPS","Billie Eilish","wish you were gay","Darkroom/Interscope Records",10,22,19,"668941"
26,"spotify:track:5p7ujcrUXASCNwRaWNHR1C","Halsey","Without Me","Capitol Records",5,21,170,"668877"
27,"spotify:track:3Ol2xnObFdKV9pmRD2t9x8","A Boogie Wit da Hoodie","Look Back at It","Highbridge the Label / Atlantic Records",8,25,106,"662209"
28,"spotify:track:1DUSuNhF8P5vUGNPpQiZa5","Khalid","My Bad","Right Hand Music Group, LLC/RCA Records",16,24,16,"651202"
29,"spotify:track:0FZ4Dmg8jJJAPJnvBIzD9z","Kodak Black, Offset, Travis Scott","ZEZE (feat. Travis Scott & Offset)","Atlantic Records",1,26,162,"648755"
30,"spotify:track:2dpaYNEQHiRxtZbfNsse99","Marshmello, Bastille","Happier","Astralwerks",5,27,218,"644679"
31,"spotify:track:6MjNilJCVKJq0LfFvo5jWJ","Juice WRLD","Fast","Grade A Productions/Interscope Records",6,20,15,"643794"
32,"spotify:track:0PG9fbaaHFHfre2gUVo7AN","Cardi B, Bruno Mars","Please Me","Atlantic/KSR",10,28,36,"640139"
33,"spotify:track:4NzMOnvSJVNKF7nw5NkXIP","Billie Eilish","bury a friend","Darkroom/Interscope Records",3,29,52,"635966"
34,"spotify:track:6Qs4SXO9dwPj5GKvVOv8Ki","Sam Smith, Normani","Dancing With A Stranger (with Normani)","Capitol",10,30,71,"596688"
35,"spotify:track:285pBltuF7vW8TeWk8hdRR","Juice WRLD","Lucid Dreams","Juice WRLD Mixtape / ISR P&D",1,32,320,"594868"
36,"spotify:track:1ThmUihH9dF8EV08ku5AXN","Ski Mask The Slump God","Faucet Failure","Republic Records",35,35,108,"588198"
37,"spotify:track:2VxeLyX666F8uXCJ0dZF8B","Lady Gaga, Bradley Cooper","Shallow","A Star is Born OST",6,33,174,"585517"
38,"spotify:track:4ZT9FnbFu1PaBfV3itxiqT","Lil Skies","I","All We Got Ent.",13,31,22,"578122"
39,"spotify:track:1xzBco0xcoJEDXktl7Jxrr","Sheck Wes","Mo Bamba","Cactus Jack Records/ G.O.O.D. Music/ Interscope Records",1,37,239,"575241"
40,"spotify:track:6zeeWid2sgw4lap2jV61PZ","Khalid","Better","Right Hand Music Group, LLC/RCA Records",7,34,190,"568493"
41,"spotify:track:05t7JMip6JrLuSrMV5yYjX","Calboy","Envy Me","Polo Grounds Music/RCA Records",36,36,86,"561496"
42,"spotify:track:7dt6x5M1jzdTEt8oCbisTK","Post Malone","Better Now","Republic Records",1,40,330,"544487"
43,"spotify:track:7FGq80cy8juXBCD2nrqdWU","benny blanco, Halsey, Khalid","Eastside (with Halsey & Khalid)","Friends Keep Secrets/Interscope Records",7,38,253,"540213"
44,"spotify:track:7COXchtUOMd6uIT6HvmRaI","Lauv, Troye Sivan","i'm so tired...","Lauv",22,44,57,"539898"
45,"spotify:track:2G1tXoGBaEMJ7FKGnkf6ud","Gucci Mane, Bruno Mars, Kodak Black","Wake Up in the Sky","Guwop Enterprises/Atlantic",6,42,190,"533656"
46,"spotify:track:2GGMabyHXnJmjY6CXhhB2e","Cardi B","Money","Atlantic/KSR",9,45,151,"526867"
47,"spotify:track:5w9c2J52mkdntKOmRLeM2m","Daddy Yankee, Snow","Con Calma","El Cartel Records (EC3)",46,48,43,"524382"
48,"spotify:track:1xkMNjOFNCw3OCI7Gtjpjb","NAV, Meek Mill","Tap (feat. Meek Mill)","XO Records, LLC and Republic Records",48,-1,1,"521319"
49,"spotify:track:3ee8Jmje8o58CHK66QrVC2","XXXTENTACION","SAD!","Bad Vibes Forever, LLC",1,43,386,"516791"
50,"spotify:track:4bi9YrkOvmg4Eb7h00AW2c","Rich The Kid, Young Thug, Gunna","Fall Threw (feat. Young Thug & Gunna)","Interscope Records",50,-1,1,"507371"
51,"spotify:track:4dTiQezDWmEOWcdCbWVWMp","ScHoolboy Q","Numb Numb Juice","Top Dawg Entertainment/Interscope Records",10,47,9,"505885"
52,"spotify:track:13ZyrkCDmRz5xY3seuAWYk","Juice WRLD","Hear Me Calling","Grade A Productions/Interscope Records",11,41,22,"502811"
53,"spotify:track:3iKALqmeWDBWRlQU8z03kA","NAV","To My Grave","XO Records, LLC and Republic Records",53,-1,1,"482138"
54,"spotify:track:14mHfNsSHN0FbLftyjrV9g","Flipp Dinero","Leave Me Alone","Cinematic/Epic/We The Best",10,54,223,"469801"
55,"spotify:track:1NJcg626wLln4pGHpiV7mf","Billie Eilish, Khalid","lovely (with Khalid)","Darkroom",18,52,337,"469346"
56,"spotify:track:6eiztdXRkooWsBt2xToMWI","Juice WRLD","Make Believe","Grade A Productions/Interscope Records",20,50,15,"463464"
57,"spotify:track:5wujBwqG7INdStqGd4tRMX","Juice WRLD","Armed And Dangerous","Juice WRLD Mixtape / ISR P&D",9,53,134,"462059"
58,"spotify:track:5kfNriitmkNE8mUbZ7gbq8","Khalid","Saturday Nights","Right Hand Music Group, LLC/RCA Records",13,51,149,"459658"
59,"spotify:track:41MCdlvXOl62B7Kv86Bb1v","Juice WRLD","Empty","Grade A Productions/Interscope Records",10,49,15,"456325"
60,"spotify:track:14JzyD6FlBD5z0wV5P07YI","Billie Eilish","when the party's over","Darkroom/Interscope Records",10,56,157,"451855"
61,"spotify:track:0JP9xo3adEtGSdUEISiszL","XXXTENTACION","Moonlight","Bad Vibes Forever, LLC",2,57,372,"449274"
62,"spotify:track:6JqpFboOH2bq9pzaYbkKBn","Sofía Reyes, Rita Ora, Anitta","R.I.P. (feat. Rita Ora & Anitta)","WEA Latina",55,55,8,"448993"
63,"spotify:track:0fcq51a3gOI6gPvzc0YLsk","Post Malone, Roddy Ricch, Tyga","Wow. - Remix","Republic Records",58,87,8,"442295"
64,"spotify:track:1WSGTYKLEpKfNQYYW5Oymt","benny blanco, Selena Gomez, J Balvin, Tainy","I Can’t Get Enough (benny blanco, Selena Gomez, J Balvin, Tainy)","NEON16/Friends Keep Secrets/Interscope Records",21,46,22,"434401"
65,"spotify:track:4TWflhgevIGo448fWc6mQq","Offset","Red Room","Quality Control Music/Motown Records",14,60,37,"433820"
66,"spotify:track:577YBGuskWkVDCxZrLRB4v","Lil Baby","Pure Cocaine","Quality Control Music/Motown Records/Capitol Records",21,58,111,"433022"
67,"spotify:track:1rqqCSm0Qe4I9rUvWncaom","Panic! At The Disco","High Hopes","DCD2 / Fueled By Ramen",12,63,284,"431490"
68,"spotify:track:0e7ipj03S05BNilyu5bRzt","Post Malone, 21 Savage","rockstar (feat. 21 Savage)","Republic Records",1,66,554,"423332"
69,"spotify:track:2qxmye6gAegTMjLKEBoR3d","Alec Benjamin","Let Me Down Slowly","2018",40,59,77,"421448"
70,"spotify:track:4SPu0Ql902hTVXkBoNIYtq","Ariana Grande","NASA","Republic Records",3,64,43,"419313"
71,"spotify:track:3npzogdOEiVsieXmmhBepL","Maren Morris","The Bones","Columbia Nashville",51,62,15,"418364"
72,"spotify:track:1TEL6MlSSVLSdhOSddidlJ","Ariana Grande","needy","Republic Records",3,65,43,"410964"
73,"spotify:track:0TlLq3lA83rQOYtrqBqSct","Drake","Nonstop","Cash Money/Drake LP6",1,69,267,"406792"
74,"spotify:track:3HP3VodiF28Bcr3dlProO4","NAV","Taking Chances","XO Records, LLC and Republic Records",74,-1,1,"405669"
75,"spotify:track:2H4gf1wLxvYreMj1jcaN0k","Dean Lewis","Be Alright","Universal Music Australia Pty. Ltd.",19,77,232,"403872"
76,"spotify:track:2eevcC9gSoo9wdynZkUXPz","NAV","I'm Ready","XO Records, LLC and Republic Records",76,-1,1,"403567"
77,"spotify:track:116H0KvKr2Zl4RPuVBruDO","Bad Bunny, Drake","MIA (feat. Drake)","OVO Sound/Warner Records",2,71,163,"402728"
78,"spotify:track:1fewSx2d5KIZ04wsooEBOz","Metro Boomin, Gunna","Space Cadet (feat. Gunna)","Republic Records",15,61,141,"402388"
79,"spotify:track:0jAfdqv18goRTUxm3ilRjb","A Boogie Wit da Hoodie, Tyga, Offset","Startender (feat. Offset and Tyga)","Highbridge the Label / Atlantic Records",15,70,99,"397663"
80,"spotify:track:0nA2zH7QBV92QkSuwdCZbi","NAV, Gunna","Hold Your Breath (feat. Gunna)","XO Records, LLC and Republic Records",80,-1,1,"397537"
81,"spotify:track:25sgk305KZfyuqVBQIahim","Ava Max","Sweet but Psycho","Atlantic Records",30,75,165,"396696"
82,"spotify:track:7tFiyTwD0nx5a1eklYtX2J","Queen","Bohemian Rhapsody - Remastered 2011","Hollywood Records",36,76,151,"395899"
83,"spotify:track:6ZRuF2n1CQxyxxAAWsKJOy","Kehlani, Ty Dolla $ign","Nights Like This (feat. Ty Dolla $ign)","TSNMI / Atlantic",19,67,71,"394461"
84,"spotify:track:40T5GIqQ1CegGm2PTEl8Bu","Billie Eilish","idontwannabeyouanymore","Darkroom",40,72,243,"391641"
85,"spotify:track:58q2HKrzhC3ozto2nDdN4z","Cardi B, Bad Bunny, J Balvin","I Like It","Atlantic/KSR",2,83,351,"387442"
86,"spotify:track:5IaHrVsrferBYDm0bDyABy","Tyga, Offset","Taste (feat. Offset)","Last Kings Music / EMPIRE",3,78,309,"385992"
87,"spotify:track:7m9OqQk4RVRkw9JJdeAw96","XXXTENTACION","Jocelyn Flores","Bad Vibes Forever / EMPIRE",2,73,575,"384908"
88,"spotify:track:5WHTFyqSii0lmT9R21abT8","Mabel","Don't Call Me Up","Polydor Records",62,74,42,"384312"
89,"spotify:track:28yESWw8HvQoZlyGpyH5Va","NAV, Young Thug","Tussin (feat. Young Thug)","XO Records, LLC and Republic Records",89,-1,1,"377090"
90,"spotify:track:5LuQkwfggW5ibdkSMA4sDT","NAV","Tension","XO Records, LLC and Republic Records",90,-1,1,"375061"
91,"spotify:track:3swc6WTsr7rl9DqQKQA55C","Post Malone, Ty Dolla $ign","Psycho (feat. Ty Dolla $ign)","Republic Records",1,82,393,"373617"
92,"spotify:track:6vN77lE9LK6HP2DewaN6HZ","Lil Baby, Drake","Yes Indeed","Quality Control Music, LLC",2,80,312,"373417"
93,"spotify:track:2MShy1GSSgbmGUxADNIao5","Kodak Black","Calling My Spirit","Atlantic Records",27,79,113,"371439"
94,"spotify:track:0NJp8GyCOWnQh71xKSPfuV","Tory Lanez","Freaky","Mad Love/Interscope Records",67,99,8,"369890"
95,"spotify:track:75ZvA4QfFiZvzhj2xkaWAh","Post Malone","I Fall Apart","Universal Records",2,81,553,"362937"
96,"spotify:track:7sO5G9EABYOXQKNPNiE9NR","Offset, Metro Boomin","Ric Flair Drip (with Metro Boomin)","Slaughter Gang, LLC/Epic/Quality Control Music/Motown/Capitol/Boominati Worldwide/Republic",4,85,507,"361428"
97,"spotify:track:4VXIryQMWpIdGgYR4TrjT1","Juice WRLD","All Girls Are The Same","Juice WRLD Mixtape / ISR P&D",12,84,336,"361285"
98,"spotify:track:6JQvHMSaR8flFsN53ypOfP","Lil Mosey","Noticed","Mogul Vision/Interscope Records",17,86,218,"359604"
99,"spotify:track:4eIT2gZ0WZyJpgfmoD6saJ","City Girls","Act Up","Quality Control Music/Motown Records",87,90,20,"357068"
100,"spotify:track:4gJUBncw0XCMTBHneTjqGx","Rich The Kid, Jay Critch, A Boogie Wit da Hoodie","Like Mike (feat. Jay Critch & A Boogie wit da Hoodie)","Interscope Records",100,-1,1,"353815"
101,"spotify:track:0W5Nkn9oyRvZhW6nXdDyNJ","NAV","Ralo","XO Records, LLC and Republic Records",101,-1,1,"352117"
102,"spotify:track:11cDEev79fPKi6uJCjUhu8","The Chainsmokers, 5 Seconds of Summer","Who Do You Love","Disruptor Records/Columbia",28,88,43,"351107"
103,"spotify:track:2iUXsYOEPhVqEBwsqP70rE","5 Seconds of Summer","Youngblood","Capitol",12,89,342,"350370"
104,"spotify:track:5SHhPFh68OhUmuRPymKX9d","FLETCHER","Undrunk","Capitol Records",90,93,12,"349487"
105,"spotify:track:4mUIe9gfsdtsVP2zFIl74x","Juice WRLD","Maze","Grade A Productions/Interscope Records",14,68,15,"348887"
106,"spotify:track:5JEx7HbmvHQQswJCsoo9rA","Ellie Goulding, Diplo, Swae Lee","Close To Me (with Diplo) (feat. Swae Lee)","Polydor Records",30,91,147,"342697"
107,"spotify:track:25F6MWrnFBCXVnpN4n76EK","Logic","Keanu Reeves","Def Jam Recordings",13,105,64,"337613"
108,"spotify:track:39LmTF9RgyakzSYX8txrow","Ariana Grande","imagine","Republic Records",2,92,99,"335914"
109,"spotify:track:45ZGEdLxCZvdMX9jWlsAAx","Why Don't We, Macklemore","I Don't Belong In This Club","Atlantic Records",109,-1,1,"333782"
110,"spotify:track:2rxQMGVafnNaRaXlRMWPde","Luke Combs","Beautiful Crazy","River House Artists/Columbia Nashville",100,110,254,"333780"
111,"spotify:track:2hloaUoRonYssMuqLCBLTX","Ariana Grande","bloodline","Republic Records",5,94,43,"332723"
112,"spotify:track:4UxYkWi636UMaEjCw5n0JX","NAV","Snap","XO Records, LLC and Republic Records",112,-1,1,"331505"
113,"spotify:track:5W83ErFkO3aKAIS1WMi6u0","Anuel AA, KAROL G","Secreto","Anuel AA & Karol G - Secreto",88,101,66,"330781"
114,"spotify:track:7uH27oIt4a6cIFCA8ZPcyG","Ozuna","Baila Baila Baila","Aura Music Corp.",96,111,51,"329455"
115,"spotify:track:2VGD6mGeuv6aORaU0vKsHB","Rich The Kid, Tory Lanez","Tic Toc (with Tory Lanez)","Interscope Records",75,-1,6,"325817"
116,"spotify:track:7AQim7LbvFVZJE3O8TYgf2","XXXTENTACION, Trippie Redd","Fuck Love (feat. Trippie Redd)","Bad Vibes Forever / EMPIRE",5,96,575,"324567"
117,"spotify:track:7EQpvVujgytLVY8vKiDHAg","Ariana Grande","bad idea","Republic Records",5,97,43,"323822"
118,"spotify:track:4w8niZpiMy6qz1mntFA5uM","DJ Snake, Selena Gomez, Ozuna, Cardi B","Taki Taki (with Selena Gomez, Ozuna & Cardi B)","DJ Snake Music Productions Limited, under exclusive license to Geffen Records",4,108,176,"322919"
119,"spotify:track:0i0wnv9UoFdZ5MfuFGQzMy","Bebe Rexha","Last Hurrah","Warner Records",56,102,33,"322343"
120,"spotify:track:0rKtyWc8bvkriBthvHKY8d","Joji","SLOW DANCING IN THE DARK","88rising Music/Warner Records",26,98,182,"319282"
121,"spotify:track:2P91MQbaiQOfbiz9VqhqKQ","Lauv","I Like Me Better","Lauv",30,103,647,"316869"
122,"spotify:track:7pMRoGLEJuFM2wl5pt0R99","Offset, Travis Scott, 21 Savage","Legacy (feat. Travis Scott & 21 Savage)","Quality Control Music/Motown Records",12,100,29,"316176"
123,"spotify:track:14SaZBTjxlorHJQxXh01Hu","Summer Walker, Drake","Girls Need Love (with Drake) - Remix","LVRN/Interscope Records",40,95,23,"316047"
124,"spotify:track:6DCZcSspjsKoFjzjrWoCdn","Drake","God's Plan","Cash Money/Drake LP6",1,109,427,"315989"
125,"spotify:track:51NFxnQvaosfDDutk0tams","Billie Eilish","bellyache","Darkroom",39,115,140,"314318"
126,"spotify:track:3a1lNhkSLSkpJE4MSHpDu9","Post Malone, Quavo","Congratulations","Universal Records",5,114,810,"313472"
127,"spotify:track:2uIX8YMNjGMD7441kqyyNU","Billie Eilish","ocean eyes","Darkroom",61,112,267,"312100"
128,"spotify:track:7GX5flRQZVHRAGd6B4TmDO","Lil Uzi Vert","XO Tour Llif3","Generation Now/Atlantic",1,113,729,"310785"
129,"spotify:track:4NBTZtAt1F13VvlSKe6KTl","The Chainsmokers, Kelsea Ballerini","This Feeling","Disruptor Records/Columbia",21,104,170,"310519"
130,"spotify:track:4e4fqjx0Izh4svvTef1z7e","Bebe Rexha, Florida Georgia Line","Meant to Be (feat. Florida Georgia Line)","Warner Bros.",15,118,557,"308480"
131,"spotify:track:74lnM5V6ecvoTPV0fvptx9","Ski Mask The Slump God, Juice WRLD","Nuketown (feat. Juice WRLD)","Republic Records",13,107,113,"308376"
132,"spotify:track:4qKcDkK6siZ7Jp1Jb4m0aL","BlocBoy JB, Drake","Look Alive (feat. Drake)","OVO Sound/Warner Records",2,116,407,"305677"
133,"spotify:track:4OBZT9EnhYIV17t4pGw7ig","H.E.R., Daniel Caesar","Best Part (feat. Daniel Caesar)","MBK Entertainment/RCA Records",53,106,278,"299719"
134,"spotify:track:0AluA5RNsa4Cx6XRhf2hWZ","Metro Boomin, 21 Savage","10 Freaky Girls (with 21 Savage)","Republic Records",7,117,141,"299700"
135,"spotify:track:5T8EDUDqKcs6OSOwEsfqG7","Queen","Don't Stop Me Now - Remastered 2011","Hollywood Records",69,122,115,"299523"
136,"spotify:track:2U8SmeukrDYVbRe8Ig03Fo","NAV","Why You Crying Mama","XO Records, LLC and Republic Records",136,-1,1,"297991"
137,"spotify:track:2BSbCCbaSCzkOEZa6N5901","Juice WRLD","Flaws And Sins","Grade A Productions/Interscope Records",28,119,15,"297470"
138,"spotify:track:4XiGKQqbmnMVxDzUj6j3f2","YK Osiris","Worth It","Def Jam Recordings",120,120,20,"293323"
139,"spotify:track:5Z3GHaZ6ec9bsiI5BenrbY","Khalid","Young Dumb & Broke","Right Hand Music Group, LLC/RCA Records",5,124,709,"292584"
140,"spotify:track:7AFASza1mXqntmGtbxXprO","XXXTENTACION","changes","Bad Vibes Forever, LLC",4,121,386,"292081"
141,"spotify:track:0AtY4uFaYBIl6tAjONkk1Z","Jacquees, Lil Baby","Your Peace (feat. Lil Baby)","Cash Money Records Inc.",141,-1,1,"291608"
142,"spotify:track:3oDkdAySo1VQQG0ptV7uwa","Juice WRLD","Lean Wit Me","Juice WRLD Mixtape / ISR P&D",25,127,304,"289145"
143,"spotify:track:3wFLWP0FcIqHK1wb1CPthQ","Ariana Grande","fake smile","Republic Records",7,125,43,"288153"
144,"spotify:track:42fw0rxRO2xbesF6mJfd4Y","Dan + Shay","Tequila","Warner Records",48,128,382,"287357"
145,"spotify:track:4Y0FFtE3pFwfHwz20qum7b","NAV, Lil Durk","Time Piece (feat. Lil Durk)","XO Records, LLC and Republic Records",145,-1,1,"286702"
146,"spotify:track:7lAK3oHbfEnvUQWosrMMpR","Travis Scott","YOSEMITE","Cactus Jack / Epic / Grand Hustle",7,126,232,"285594"
147,"spotify:track:5274I4mUMnYczyeXkGDWZN","Future, Juice WRLD","Fine China","Epic/Freebandz/Grade A/Interscope",2,129,158,"283681"
148,"spotify:track:51w9Jbat1pLeWINGCpnQUR","Tory Lanez, Rich The Kid, Lil Wayne","TAlk tO Me (with Rich The Kid feat. Lil Wayne) - Remix","Mad Love/Interscope Records",115,133,72,"283431"
149,"spotify:track:62vpWI1CHwFy7tMIcSStl8","J. Cole","No Role Modelz","Roc Nation Records LLC",64,132,670,"282008"
150,"spotify:track:2qT1uLXPVPzGgFOx4jtEuo","Ariana Grande","no tears left to cry","Republic Records",6,136,336,"279569"
151,"spotify:track:4LRKHjC3WH5AKZSGZzlnGk","Lizzo, Missy Elliott","Tempo (feat. Missy Elliott)","Atlantic Records",151,-1,1,"279399"
152,"spotify:track:1KVczjazCcCCgM3gXXUl47","benny blanco, Juice WRLD, Brendon Urie","Roses (with Juice WRLD feat. Brendon Urie)","Friends Keep Secrets/Interscope Records",41,123,106,"279134"
153,"spotify:track:4VUwkH455At9kENOfzTqmF","Bazzi, Camila Cabello","Beautiful (feat. Camila Cabello)","iamcosmic",28,131,231,"276858"
154,"spotify:track:4KXDT3pmPDB9IB6hTUoGpd","PnB Rock, Lil Skies","I Like Girls (feat. Lil Skies)","Atlantic Records",154,-1,1,"276047"
155,"spotify:track:3GJ4hzg4lrGwU51Y3VARbF","Dan + Shay","Speechless","Warner Records",77,135,213,"275526"
156,"spotify:track:7KXjTSCq5nL1LoYtL7XAwS","Kendrick Lamar","HUMBLE.","Aftermath",1,139,720,"272644"
157,"spotify:track:6gBFPUFcJLzWGx4lenP6h2","Travis Scott","goosebumps","Epic/Grand Hustle",16,137,809,"272409"
158,"spotify:track:7r62wx5N1cOQxYr6b0p2Bi","Rich The Kid, Offset, Big Sean","Two Cups (feat. Offset & Big Sean)","Interscope Records",158,-1,1,"272074"
159,"spotify:track:6GSkLS2y4ZnnZsuRAj975K","Marshmello, Roddy Ricch","Project Dreams","Warner Records",72,130,87,"270363"
160,"spotify:track:152lZdxL1OR0ZMW6KquMif","Khalid","Location","Right Hand Music Group, LLC/RCA Records",9,138,800,"268041"
161,"spotify:track:7fa9MBXhVfQ8P8Df9OEbD8","Maroon 5, Cardi B","Girls Like You (feat. Cardi B) - Cardi B Version","Interscope Records*",6,144,293,"263114"
162,"spotify:track:67fNrBUMc7iWMofdCaoJV9","Blueface","Bleed It","Cash Money Records Inc.",71,134,64,"263067"
163,"spotify:track:2G7V7zsVDxg1yRsu7Ew9RJ","Drake","In My Feelings","Cash Money/Drake LP6",1,146,267,"263063"
164,"spotify:track:0ZNrc4kNeQYD9koZ3KvCsy","YG, 2 Chainz, Big Sean, Nicki Minaj","BIG BANK (feat. 2 Chainz, Big Sean, Nicki Minaj)","Def Jam Recordings",21,142,302,"262453"
165,"spotify:track:5DlwNPXzsWiPrNFaK6PnsJ","NAV","Vicodin","XO Records, LLC and Republic Records",165,-1,1,"260509"
166,"spotify:track:3CA9pLiwRIGtUBiMjbZmRw","Drake","Nice For What","Cash Money/Drake LP6",1,148,348,"258544"
167,"spotify:track:04MLEeAMuV9IlHEsD8vF6A","French Montana, Drake","No Stylist (feat. Drake)","Epic",14,141,183,"257977"
168,"spotify:track:09IStsImFySgyp0pIQdqAc","Zedd, Maren Morris, Grey","The Middle","UMGRI Interscope",5,147,410,"257589"
169,"spotify:track:3Pqw8MreEUo4Z8ktO5ilkD","NAV","Know Me","XO Records, LLC and Republic Records",169,-1,2,"256657"
170,"spotify:track:7uzmGiiJyRfuViKKK3lVmR","Bazzi","Mine","iamcosmic",3,145,427,"255956"
171,"spotify:track:2qGfZAgDe1pV2y5xJAhi6R","YoungBoy Never Broke Again","Slime Belief","Never Broke Again, LLC",150,150,33,"252563"
172,"spotify:track:4n7jnSxVLd8QioibtTDBDq","Alan Walker, Sabrina Carpenter, Farruko","On My Way","MER Recordings",172,-1,1,"252489"
173,"spotify:track:32lItqlMi4LBhb4k0BaSaC","Post Malone","Candy Paint","Republic Records",4,155,658,"251046"
174,"spotify:track:4QIyEq7TcTdAcxjI2AFlAK","6ix9ine, Nicki Minaj, Murda Beatz","FEFE","Scumgang Records/TenThousand Projects, LLC",2,154,244,"250416"
175,"spotify:track:6kQtZRfVpMV1XsPkyjjzLa","NAV","Dior Runners","XO Records, LLC and Republic Records",175,-1,1,"249174"
176,"spotify:track:2Jh3UqxnHJMyzMzku4uOtE","Juice WRLD","Feeling","Grade A Productions/Interscope Records",34,140,15,"249172"
177,"spotify:track:1iPBD72u3nAyFEeardYuBV","Lil Mosey","Kamikaze","Mogul Vision/Interscope Records",73,158,148,"247065"
178,"spotify:track:6PfI6EeLNiNGVAVg11nv7D","Gunna","Speed It Up","300 Entertainment",49,149,39,"246794"
179,"spotify:track:1ZAyjvIk9YiD76yYy0TEG6","Rich The Kid","Plug Walk","Rich The Kid / (TDE/ISR PS)",6,169,404,"246540"
180,"spotify:track:7uttm8Iurm5uK67Vr9G2Sp","Hozier","Almost (Sweet Music)","Columbia",75,143,36,"246081"
181,"spotify:track:7oJrVhiTPZGBXWPwhxjy9S","Lil Skies","Lust","All We Got Ent.",75,161,408,"245929"
182,"spotify:track:5vdp5UmvTsnMEMESIF2Ym7","Queen","Another One Bites The Dust - Remastered 2011","Hollywood Records",88,162,65,"245868"
183,"spotify:track:3GVkPk8mqxz0itaAriG1L7","XXXTENTACION","Everybody Dies In Their Nightmares","Bad Vibes Forever / EMPIRE",6,152,570,"245476"
184,"spotify:track:4jvjzW7Hm0yK4LvvE0Paz9","Lil Peep, XXXTENTACION","Falling Down - Bonus Track","Columbia",1,151,185,"245043"
185,"spotify:track:22An65gG31JLf9n18qjdhZ","XXXTENTACION","BAD!","Bad Vibes Forever / EMPIRE",2,163,134,"241677"
186,"spotify:track:6vsV4D8BM6PioRr1UOx0n2","Billie Eilish","you should see me in a crown","Darkroom/Interscope Records",25,160,149,"241551"
187,"spotify:track:35l8ivgXiWiDCv7TCZ50Da","Comethazine, A$AP Rocky","Walk - Remix","Alamo",187,-1,1,"240755"
188,"spotify:track:5aXgz1oKK8Q9z9xvTmSnrO","Trippie Redd","Topanga","TenThousand Projects, LLC",10,166,152,"240649"
189,"spotify:track:45Egmo7icyopuzJN0oMEdk","Khalid, Normani","Love Lies (with Normani)","RCA Records Label",8,156,397,"239960"
190,"spotify:track:7pdF27mSDuPWhppnHAmWHa","XXXTENTACION","whoa (mind in awe)","Bad Vibes Forever / EMPIRE",1,157,106,"239108"
191,"spotify:track:6Yx181fZzA0YE2EkUsYruq","Why Don't We","Big Plans","Atlantic Records",168,184,23,"238796"
192,"spotify:track:7DHApOHsIFo7EyfieArYGE","P!nk","Walk Me Home","RCA Records Label",121,164,25,"238446"
193,"spotify:track:4lD7gHKF1e8Y9stQuVezZB","Ariana Grande","ghostin","Republic Records",8,153,43,"237765"
194,"spotify:track:79esEXlqqmq0GPz0xQSZTV","Shawn Mendes","Lost In Japan","Island Records",16,170,115,"237111"
195,"spotify:track:6foY66mWZN0pSRjZ408c00","Morgan Wallen","Whiskey Glasses","Big Loud Records",174,179,10,"236521"
196,"spotify:track:0FQhAHyHGsrbSHvDURmFPn","Billie Eilish","my boy","Darkroom",137,176,73,"236122"
197,"spotify:track:6wWaVoUOzLQJHd3bWAUpdZ","Lil Baby, Gunna, Drake","Never Recover (Lil Baby & Gunna, Drake)","Quality Control Music/Young Stoner Life Records, a 300 Entertainment Label/Motown Records/Capitol Records",1,165,169,"234876"
198,"spotify:track:6rz0dTA0PdhXImFV5EjM0w","Juice WRLD, Seezyn","Hide (feat. Seezyn)","Universal Records",90,159,96,"234856"
199,"spotify:track:5nzhL67GpF9szXWg5y509A","Lil Baby","Close Friends (Lil Baby & Gunna)","Quality Control Music/Young Stoner Life Records, a 300 Entertainment Label/Motown Records/Capitol Records",41,172,146,"234187"
200,"spotify:track:4T652DlATVHe0jdLKaN3Bw","Ariana Grande","in my head","Republic Records",10,168,43,"231356"
