rank,uri,artist_names,track_name,source,peak_rank,previous_rank,days_on_chart,streams
1,"spotify:track:3eekarcy7kvN4yt5ZFzltW","Travis Scott","HIGHEST IN THE ROOM","Cactus Jack / Epic",1,2,29,"1507531"
2,"spotify:track:1HfMVBKM75vxSfsQ5VefZ5","Selena Gomez","Lose You To Love Me","Interscope Records",1,1,10,"1399006"
3,"spotify:track:21jGcNKet2qwijlDFuPiPb","Post Malone","Circles","Republic Records",1,4,64,"1375925"
4,"spotify:track:6Gg1gjgKi2AK4e0qzsR7sd","Juice WRLD, YoungBoy Never Broke Again","Bandit (with YoungBoy Never Broke Again)","Grade A Productions/Interscope Records",3,5,29,"1303534"
5,"spotify:track:2QpGZOhTCHHiKmpSO9FW4h","Kanye West","Follow God","Getting Out Our Dreams II / Def Jam Recordings",1,3,8,"1200464"
6,"spotify:track:6WrI0LAC5M1Rw2MnX2ZvEg","Dua Lipa","Don't Start Now","Warner Records",6,-1,1,"968604"
7,"spotify:track:4IO8X9W69dIQe0EC5ALXhq","21 Savage","Immortal","Slaughter Gang, LLC/Epic Records",7,110,2,"915688"
8,"spotify:track:7aiClxsDWFRQ0Kzk5KI5ku","blackbear","hot girl bummer","Alamo",5,8,71,"904815"
9,"spotify:track:1ZPWWSwCkxKfqdp4H0RFCo","Arizona Zervas","ROXANNE","Arizona Zervas",9,9,7,"881230"
10,"spotify:track:7qEHsqek33rTcFNT9PFqLf","Lewis Capaldi","Someone You Loved","Vertigo Berlin",5,7,187,"880014"
11,"spotify:track:2b8fOow8UzyDFAE27YhOZM","Maroon 5","Memories","Interscope Records*",6,6,43,"867246"
12,"spotify:track:56AMYGJzxBO6p8v0wEe9de","Young Thug, Travis Scott, Gunna","Hot (Remix) [feat. Gunna and Travis Scott]","300 Entertainment/Atl",12,-1,1,"832735"
13,"spotify:track:4sjiIpEv617LDXaidKioOI","YNW Melly, 9lokknine","223's (feat. 9lokknine)","300 Entertainment",4,14,81,"819872"
14,"spotify:track:4sWuPniHClkInYAnzXAYUF","NLE Choppa","Camelot","Warner Records",7,24,50,"785089"
15,"spotify:track:0RiRZpuVRbi7oqRdSMwhQY","Post Malone, Swae Lee","Sunflower - Spider-Man: Into the Spider-Verse","Republic Records",1,12,380,"768112"
16,"spotify:track:2wrJq5XKLnmhRXHIAf9xBa","Dan + Shay, Justin Bieber","10,000 Hours (with Justin Bieber)","Warner Music Nashville",2,18,29,"766276"
17,"spotify:track:1rgnBhdG2JDFTbYkYRZAku","Tones And I","Dance Monkey","Elektra (NEK)",10,10,94,"761458"
18,"spotify:track:5hDAT527wXWNBnJlujhuUs","Lil Mosey, Gunna","Stuck In A Dream (feat. Gunna)","Mogul Vision/Interscope Records",18,38,43,"755653"
19,"spotify:track:5qmq61DAAOUaW8AUo8xKhh","Lizzo","Truth Hurts","Nice Life/Atlantic",2,20,195,"749068"
20,"spotify:track:4yI3HpbSFSgFZtJP2kDe5m","Selena Gomez","Look At Her Now","Interscope Records",5,16,9,"708626"
21,"spotify:track:1lOe9qE0vR9zwWQAOk6CoO","Lil Tecca","Ransom","Republic Records",1,30,162,"695503"
22,"spotify:track:0fySG6A6qLE8IvDpayb5bM","DaBaby","VIBEZ","South Coast Music Group/Interscope Records",4,36,36,"692063"
23,"spotify:track:7vJS1DPc3FzBtqBs8n3mW5","Ariana Grande, Normani, Nicki Minaj","Bad To You (with Normani & Nicki Minaj)","Silver Cloud/Charlie's Angels",23,-1,1,"691732"
24,"spotify:track:2plLJpUcYPFrl1sW2pMG63","Harry Styles","Lights Up","Columbia",2,23,22,"663601"
25,"spotify:track:7CZyCXKG6d5ALeq41sLzbw","Post Malone, Ozzy Osbourne, Travis Scott","Take What You Want (feat. Ozzy Osbourne & Travis Scott)","Republic Records",2,26,57,"660896"
26,"spotify:track:5Z8HZM6iQMhhqyPcCGY5g9","Young Thug, Gunna","Hot (feat. Gunna)","300 Entertainment/Atl",8,11,78,"657422"
27,"spotify:track:07Oz5StQ7GRoygNLaXs2pd","Lizzo, Ariana Grande","Good as Hell (feat. Ariana Grande) - Remix","Nice Life/Atlantic",21,25,8,"655363"
28,"spotify:track:6vBdBCoOhKHiYDDOcorfNo","Post Malone, Young Thug","Goodbyes (feat. Young Thug)","Republic Records",1,33,120,"654322"
29,"spotify:track:5ry2OE6R2zPQFDO85XkgRb","Drake, Rick Ross","Money In The Grave (Drake ft. Rick Ross)","Republic Records",1,32,140,"652954"
30,"spotify:track:6XHVuErjQ4XNm6nDPVCxVX","Chris Brown, Drake","No Guidance (feat. Drake)","Chris Brown Entertainment/RCA Records",3,34,147,"645057"
31,"spotify:track:2Fxmhks0bxGSBdJ92vM42m","Billie Eilish","bad guy","Darkroom/Interscope Records",1,21,218,"632550"
32,"spotify:track:2SasoXZyv82yYgHiVOvxQn","Kanye West","On God","Getting Out Our Dreams II / Def Jam Recordings",3,19,8,"629948"
33,"spotify:track:6Ozh9Ok6h4Oi1wUSLtBseN","DaBaby","BOP","South Coast Music Group/Interscope Records",1,39,36,"628429"
34,"spotify:track:6klLvorLoo1sxvZcjJIY8I","YoungBoy Never Broke Again","Make No Sense","Never Broke Again, LLC",33,44,22,"613453"
35,"spotify:track:1000nHvUdawXuUHgBod4Wv","Lil Nas X","Panini","Columbia",1,37,135,"607458"
36,"spotify:track:3JWiDGQX2eTlFvKj3Yssj3","Kanye West","Closed On Sunday","Getting Out Our Dreams II / Def Jam Recordings",2,22,8,"595600"
37,"spotify:track:5MPPttjfGap2C6j6eKcO6J","Quality Control, Lil Baby, DaBaby","Baby (Lil Baby feat. DaBaby)","Quality Control Music/Motown Records",14,41,108,"593980"
38,"spotify:track:2gwkD6igEhQbDQegRCcdoB","DaBaby","Suge","South Coast Music Group/Interscope Records",3,46,217,"554873"
39,"spotify:track:2NSWi83peog6gHerzlMCqU","Trippie Redd","Love Me More","TenThousand Projects, LLC",39,-1,1,"549032"
40,"spotify:track:1iQDltZqI7BXnHrFy4Qo1k","SHAED, ZAYN","Trampoline (with ZAYN)","Photo Finish Records",30,35,30,"547430"
41,"spotify:track:39JRmdKFka1Oe09FoOCPI4","Kanye West","Selah","Getting Out Our Dreams II / Def Jam Recordings",3,29,8,"540389"
42,"spotify:track:6v3KW9xbzN5yKLt9YKDYA2","Shawn Mendes, Camila Cabello","Señorita","Island Records",1,40,134,"536050"
43,"spotify:track:0oPOuDmmkVp3h6puekhs6P","Kanye West, Clipse, Kenny G","Use This Gospel","Getting Out Our Dreams II / Def Jam Recordings",7,27,8,"530614"
44,"spotify:track:0RLLvYBopDwooCyvnTwgYu","Lil Tjay","F.N","Columbia",23,50,84,"528120"
45,"spotify:track:0Xek5rqai2jcOWCYWJfVCF","Post Malone, DaBaby","Enemies (feat. DaBaby)","Republic Records",3,47,57,"519576"
46,"spotify:track:24bnCCysWnbNRNUT4LpHcP","Kanye West, Ty Dolla $ign, Ant Clemons","Everything We Need","Getting Out Our Dreams II / Def Jam Recordings",6,31,8,"518279"
47,"spotify:track:3QzAOrNlsabgbMwlZt7TAY","Mustard, Roddy Ricch","Ballin' (with Roddy Ricch)","10 Summers Records/Interscope Records",37,51,92,"516116"
48,"spotify:track:70eFcWOvlMObDhURTqT4Fv","Ed Sheeran, Khalid","Beautiful People (feat. Khalid)","Atlantic Records UK",3,48,127,"511002"
49,"spotify:track:00ko9WaS4jOX1kEk3gvHjf","Chance the Rapper, MadeinTYO, DaBaby","Hot Shower","Chance the Rapper",6,56,99,"510386"
50,"spotify:track:1GeNui6m825V8jP4uKiIaH","Young Thug, Lil Baby","Bad Bad Bad (feat. Lil Baby)","300 Entertainment/Atl",7,60,78,"505192"
51,"spotify:track:6V9fHiv84WlVTg7CSnIVY2","Halsey","Graveyard","Capitol Records",12,45,50,"503891"
52,"spotify:track:3s4mrPrEFFPF0LmAfutW0n","Young Thug, J. Cole, Travis Scott","The London (feat. J. Cole & Travis Scott)","300 Entertainment/Atl",1,54,163,"501114"
53,"spotify:track:6b2RcmUt1g9N9mQ3CbjX2Y","Sam Smith","How Do You Sleep?","Capitol",10,43,106,"495990"
54,"spotify:track:3fx31TjnwvwZIyAGHhOhA1","NLE Choppa","Forever","Warner Records",54,-1,1,"470098"
55,"spotify:track:0c7K73roy6RW4ebDkf4yGh","24kGoldn","VALENTINO","Records/Columbia",43,69,48,"467835"
56,"spotify:track:4guBZjUyrGoHsTahO3IHdj","Lil Tecca","Did It Again","Republic Records",18,63,88,"461328"
57,"spotify:track:2JvzF1RMd7lE3KmFlsyZD8","J. Cole","MIDDLE CHILD","Dreamville, Inc., Under exclusive license to Roc Nation Records",1,68,282,"455265"
58,"spotify:track:05mDaV9Vb3wrzjF6OPZnhq","Post Malone","Saint-Tropez","Republic Records",2,61,57,"448598"
59,"spotify:track:6kls8cSlUyHW2BUOkDJIZE","Ellie Goulding, Juice WRLD","Hate Me (with Juice WRLD)","Polydor Records",34,67,119,"438542"
60,"spotify:track:6xRWoYwfwIKnT8bQGzKbxR","Kanye West","God Is","Getting Out Our Dreams II / Def Jam Recordings",10,42,8,"438243"
61,"spotify:track:5ravc2aiNoYmu9m37diYXW","Roddy Ricch, Gunna","Start Wit Me (feat. Gunna)","Atlantic Records",61,77,8,"433905"
62,"spotify:track:0Z26mbSHJ1dkUu7g9DDgif","Major Lazer, Khalid, Death Stranding: Timefall, Diplo","Trigger","Right Hand Music Group, LLC/RCA Records",32,53,8,"432334"
63,"spotify:track:7LzouaWGFCy4tkXDOOnEyM","Camila Cabello","Liar","Syco Music/Epic",26,55,58,"426757"
64,"spotify:track:735RSTb2xbtWbDtKD9XDYi","Internet Money, Lil Tecca, A Boogie Wit da Hoodie","Somebody","Internet Money Records / TenThousand Projects, LLC",59,73,22,"421988"
65,"spotify:track:6uFn47ACjqYkc0jADwEdj1","Polo G, Lil Tjay","Pop Out (feat. Lil Tjay)","Columbia",8,72,224,"420656"
66,"spotify:track:5aUSEPNd3m5xliFK4pn5mU","Zedd, Kehlani","Good Thing (with Kehlani)","Interscope Records",38,57,36,"419140"
67,"spotify:track:2xLMifQCjDGFmkHkpNLD9h","Travis Scott","SICKO MODE","Cactus Jack / Epic / Grand Hustle",1,62,456,"413520"
68,"spotify:track:7xQAfvXzm3AkraOtGPWIZg","Post Malone","Wow.","Republic Records",1,75,313,"409219"
69,"spotify:track:454Epa1vrCGFddHXKyC1kb","Kanye West, Ant Clemons","Water","Getting Out Our Dreams II / Def Jam Recordings",8,52,8,"406286"
70,"spotify:track:3S2R0EVwBSAVMd5UMgKTL0","Michael Jackson","Thriller","Epic/Legacy",11,15,13,"393906"
71,"spotify:track:6TqXcAFInzjp0bODyvrWEq","Khalid, Disclosure","Talk (feat. Disclosure)","Right Hand Music Group, LLC/RCA Records",5,70,268,"382999"
72,"spotify:track:51Fjme0JiitpyXKuyQiCDo","Y2K, bbno$","Lalala","Columbia",11,80,139,"382623"
73,"spotify:track:2P0NiuAfypaw5UZJoo0n0o","Tame Impala","It Might Be Time","Universal Music Australia Pty. Ltd.",49,-1,4,"379408"
74,"spotify:track:0rFQ5cKYJ9WtHSKp9sxVYt","Diplo, Morgan Wallen","Heartless (feat. Morgan Wallen)","Columbia",53,78,77,"373485"
75,"spotify:track:78QR3Wp35dqAhFEc2qAGjE","Lil Baby, Gunna","Drip Too Hard (Lil Baby & Gunna)","Quality Control Music/Young Stoner Life Records, a 300 Entertainment Label/Motown Records/Capitol Records",1,85,416,"372334"
76,"spotify:track:4vUmTMuQqjdnvlZmAH61Qk","Ed Sheeran, Camila Cabello, Cardi B","South of the Border (feat. Camila Cabello & Cardi B)","Atlantic Records UK",9,76,65,"371957"
77,"spotify:track:7r6aR2f57resC5r93LwMfK","Kanye West, Fred Hammond","Hands On","Getting Out Our Dreams II / Def Jam Recordings",12,58,8,"369591"
78,"spotify:track:4B7fTyj1FIPvP9tT5X3DnR","Drake","Behind Barz - Bonus","OVO Sound/Warner Records",31,102,50,"365517"
79,"spotify:track:4vSoyDfL0uZyUoWu5NNNsQ","YoungBoy Never Broke Again","Self Control","Never Broke Again, LLC",43,88,57,"364736"
80,"spotify:track:7eBqSVxrzQZtK2mmgRG6lC","YNW Melly","Murder On My Mind","P2018",4,86,402,"363662"
81,"spotify:track:1WnqWQcWcuQbVzgE7ecfCY","Kanye West, Sunday Service Choir","Every Hour","Getting Out Our Dreams II / Def Jam Recordings",7,59,8,"362032"
82,"spotify:track:285pBltuF7vW8TeWk8hdRR","Juice WRLD","Lucid Dreams","Juice WRLD Mixtape / ISR P&D",1,87,544,"360155"
83,"spotify:track:4SDgTLDYrJ2UrHbkRkg7MD","Lil Nas X, DaBaby","Panini - DaBaby Remix","Columbia",27,99,50,"359294"
84,"spotify:track:2IRZnDFmlqMuOrYOLnZZyc","Meek Mill, Drake","Going Bad (feat. Drake)","MMG/Atlantic",2,93,337,"359239"
85,"spotify:track:7sWRlDoTDX8geTR8zzr2vt","Post Malone","Hollywood's Bleeding","Republic Records",4,79,57,"358714"
86,"spotify:track:2WsuSYJNXGKXVYkHPnq2yp","Lil Tecca, Juice WRLD","Ransom (with Juice WRLD) - Remix","Republic Records",24,91,79,"358427"
87,"spotify:track:3cphb8kdsjElYR7r5icK3H","Niall Horan","Nice To Meet Ya","Capitol Records",52,65,26,"358362"
88,"spotify:track:0xxZY5C9xxij3D1HkzbnfC","Bobby ""Boris"" Pickett, The Crypt-Kickers","Monster Mash","Decca Music Group Ltd.",13,13,7,"355537"
89,"spotify:track:1wJRveJZLSb1rjhnUHQiv6","A Boogie Wit da Hoodie, 6ix9ine","Swervin (feat. 6ix9ine)","Highbridge the Label / Atlantic Records",6,94,316,"351908"
90,"spotify:track:0rIAC4PXANcKmitJfoqmVm","Normani","Motivation","Keep Cool/RCA Records",26,84,78,"351713"
91,"spotify:track:2YpeDb67231RjR0MgVLzsG","Lil Nas X, Billy Ray Cyrus","Old Town Road - Remix","Columbia",1,71,211,"351629"
92,"spotify:track:6moU77g9RQyMzHNuKEaQKq","Ali Gatie","It's You","Warner Records",15,90,141,"351299"
93,"spotify:track:7pWK1kMgHy5lNNiIfuRbkP","Martin Garrix, Dean Lewis","Used To Love (with Dean Lewis)","Epic Amsterdam",93,-1,1,"344763"
94,"spotify:track:3Yh9lZcWyKrK9GjbhuS0hR","Lizzo","Good as Hell","Nice Life/Atlantic",19,106,140,"340427"
95,"spotify:track:5N1o6d8zGcSZSeMFkOUQOk","Megan Thee Stallion, Ty Dolla $ign, Nicki Minaj","Hot Girl Summer (feat. Nicki Minaj & Ty Dolla $ign)","300 Entertainment",2,116,85,"335302"
96,"spotify:track:4a6q8CR2hzLk2plDkSxkfD","Bazzi","I.F.L.Y.","iamcosmic",26,92,106,"334946"
97,"spotify:track:3eeyKNIBrt5TH4y0y3QkOu","YoungBoy Never Broke Again","Hot Now","Never Broke Again, LLC",97,-1,21,"333331"
98,"spotify:track:5PIB8aoUJoCRh1O5TEGdOj","Ray Parker Jr.","Ghostbusters","Arista/Legacy",14,17,10,"329484"
99,"spotify:track:6Hj9jySrnFppAI0sEMCZpJ","Juice WRLD","Robbery","Grade A Productions/Interscope Records",2,104,261,"329061"
100,"spotify:track:46D0hYb1B7qiU33VtXt21W","Camila Cabello","Easy","Syco Music/Epic",37,89,22,"328176"
101,"spotify:track:3XiNC94b4Tq1xwv70sQJGN","Lil Uzi Vert","Sanguine Paradise","Generation Now/Atlantic",6,113,206,"325998"
102,"spotify:track:12Fkyg9lpmaz2zmKOfw2Y2","Post Malone, Meek Mill, Lil Baby","On The Road (feat. Meek Mill & Lil Baby)","Republic Records",7,114,57,"325101"
103,"spotify:track:2tnVG71enUj33Ic2nFN6kZ","Regard","Ride It","Ministry of Sound Recordings",79,97,45,"320942"
104,"spotify:track:0hVXuCcriWRGvwMV1r5Yn9","Ed Sheeran, Justin Bieber","I Don't Care (with Justin Bieber)","Atlantic Records UK",1,115,176,"320215"
105,"spotify:track:2xyx0o4xNOLLjBSbOOdcbA","Summer Walker, Bryson Tiller","Playing Games (with Bryson Tiller) - Extended Version","LVRN/Interscope Records",18,98,29,"319125"
106,"spotify:track:0rKtyWc8bvkriBthvHKY8d","Joji","SLOW DANCING IN THE DARK","88rising Music/Warner Records",26,96,406,"317155"
107,"spotify:track:314ZkcV7oLWG8yWE7LABvH","BTS, Lauv","Make It Right (feat. Lauv)","BIGHIT MUSIC",48,100,15,"314615"
108,"spotify:track:2C6WXnmZ66tHhHlnvwePiK","Post Malone, Halsey, Future","Die For Me (feat. Future & Halsey)","Republic Records",6,105,57,"313361"
109,"spotify:track:43zdsphuZLzwA9k4DJhU0I","Billie Eilish","when the party's over","Darkroom/Interscope Records",5,103,381,"311296"
110,"spotify:track:6wo37KVqFJhtuxPTpLCcfe","The Chainsmokers, ILLENIUM, Lennon Stella","Takeaway","Disruptor Records/Columbia",13,108,100,"310134"
111,"spotify:track:08dFHFTx6r67MTsYn5ilDR","Old Dominion","One Man Band","RCA Records Label Nashville",70,95,20,"308136"
112,"spotify:track:2TH65lNHgvLxCKXM3apjxI","Bad Bunny, Tainy","Callaita","Rimas Entertainment LLC",37,126,155,"304798"
113,"spotify:track:1dGr1c8CrMLDpV6mPbImSI","Taylor Swift","Lover","Taylor Swift",1,117,78,"304441"
114,"spotify:track:5hVghJ4KaYES3BFUATCYn0","Tyler, The Creator","EARFQUAKE","Columbia",1,112,169,"302588"
115,"spotify:track:0bYg9bo50gSsH3LtXe2SQn","Mariah Carey","All I Want for Christmas Is You","Columbia",1,-1,110,"302453"
116,"spotify:track:4e0FYxSROat25pH16zMTZI","Lil Tecca","Love Me","Republic Records",23,119,91,"302332"
117,"spotify:track:2rMAtCaTj16NptyVfEIeAC","Megan Thee Stallion, DaBaby","Cash Shit (feat. DaBaby)","300 Entertainment",56,130,130,"301698"
118,"spotify:track:22vgEDb5hykfaTwLuskFGD","Jonas Brothers","Sucker","Jonas Brothers Recording",1,109,246,"299702"
119,"spotify:track:67XyC1GdSkKb9sbRRkUDXS","NLE Choppa, Blueface","Shotta Flow (Feat. Blueface) [Remix]","No Love Entertainment",18,131,123,"298777"
120,"spotify:track:3j84U36KvLeXNDPv4t5pI8","Mustard, Migos","Pure Water (with Migos)","10 Summers Records/Interscope Records",11,137,288,"298686"
121,"spotify:track:6gBFPUFcJLzWGx4lenP6h2","Travis Scott","goosebumps","Epic/Grand Hustle",16,129,1023,"296628"
122,"spotify:track:0u2P5u6lvoDfwTYjAADbn4","Billie Eilish, Khalid","lovely (with Khalid)","Darkroom",18,111,561,"295028"
123,"spotify:track:5KBARWIxeMGkvUax9VtVC9","Saweetie","My Type","ICY/Artistry Records/Warner Records",43,140,121,"294371"
124,"spotify:track:2zjGJ0dChMR0KxBZS15aqo","Mustard, NAV, Playboi Carti, A Boogie Wit da Hoodie","Baguettes in the Face (feat. NAV, Playboi Carti & A Boogie Wit da Hoodie)","10 Summers Records/Interscope Records",32,127,127,"294270"
125,"spotify:track:0e7ipj03S05BNilyu5bRzt","Post Malone, 21 Savage","rockstar (feat. 21 Savage)","Republic Records",1,136,778,"293836"
126,"spotify:track:3e9HZxeyfWwjeyPAMmWSSQ","Ariana Grande","thank u, next","Republic Records",1,101,363,"292376"
127,"spotify:track:7sBgFMWqDWQgrsNSpIBoe8","Kanye West","Jesus Is Lord","Getting Out Our Dreams II / Def Jam Recordings",15,81,8,"292196"
128,"spotify:track:0BOmhToQ03yOdpzYKMEnAg","Gunna","Baby Birkin","300 Entertainment",107,155,85,"291640"
129,"spotify:track:6ocbgoVGwYJhOv1GgI9NsF","Ariana Grande","7 rings","Republic Records",1,133,288,"291576"
130,"spotify:track:3GJ4hzg4lrGwU51Y3VARbF","Dan + Shay","Speechless","Warner Records",67,128,437,"291502"
131,"spotify:track:0fea68AdmYNygeTGI4RC18","J Balvin, Bad Bunny","LA CANCIÓN","Universal Music Latino / Rimas",30,138,127,"290725"
132,"spotify:track:4Of7rzpRpV1mWRbhp5rAqG","Lewis Capaldi","Bruises","Vertigo Berlin",95,118,50,"288367"
133,"spotify:track:7rvyVWja33WG9R97oeJAjx","Calboy","Envy Me","Polo Grounds Music/RCA Records",22,144,310,"287005"
134,"spotify:track:63y2aL2dT6zzw8FOSLaNrp","The Citizens of Halloween","This Is Halloween - Soundtrack","Walt Disney Records",28,28,5,"286051"
135,"spotify:track:6zeeWid2sgw4lap2jV61PZ","Khalid","Better","Right Hand Music Group, LLC/RCA Records",7,135,414,"285601"
136,"spotify:track:7dt6x5M1jzdTEt8oCbisTK","Post Malone","Better Now","Republic Records",1,141,554,"285432"
137,"spotify:track:3NkJNL3WqO1Lqc3uNDxvCN","Ariana Grande, Miley Cyrus, Lana Del Rey","Don’t Call Me Angel (Charlie’s Angels) (with Miley Cyrus & Lana Del Rey)","Silver Cloud/Charlie's Angels",2,151,50,"284979"
138,"spotify:track:6RRNNciQGZEXnqk8SQ9yv5","Taylor Swift","You Need To Calm Down","Taylor Swift",1,143,141,"284355"
139,"spotify:track:77KMttn3Lic7ZQKDlPqp8v","DaBaby","INTRO","South Coast Music Group/Interscope Records",3,142,43,"283715"
140,"spotify:track:75ZvA4QfFiZvzhj2xkaWAh","Post Malone","I Fall Apart","Universal Records",2,132,777,"280992"
141,"spotify:track:0y675KDleCZEudjoeL1sQQ","Lauv","Feelings","Lauv",55,120,43,"280308"
142,"spotify:track:4hPpVbbakQNv8YTHYaOJP4","Marshmello, Kane Brown","One Thing Right","RCA Records Label Nashville",14,154,134,"279322"
143,"spotify:track:4fwo6czG5nvOQMzhOto1ya","Diplo, Jonas Brothers","Lonely (with Jonas Brothers)","Columbia",54,124,36,"277141"
144,"spotify:track:7FGq80cy8juXBCD2nrqdWU","benny blanco, Halsey, Khalid","Eastside (with Halsey & Khalid)","Friends Keep Secrets/Interscope Records",7,149,477,"274801"
145,"spotify:track:0Ryd8975WihbObpp5cPW1t","Ariana Grande, Social House","boyfriend (with Social House)","Republic Records",1,145,92,"273305"
146,"spotify:track:2dpaYNEQHiRxtZbfNsse99","Marshmello, Bastille","Happier","Astralwerks",5,148,442,"270937"
147,"spotify:track:1CCDIow4pPYyJYzhtTUYz2","DaBaby, Migos","RAW SHIT (feat. Migos)","South Coast Music Group/Interscope Records",7,180,36,"268222"
148,"spotify:track:3ee8Jmje8o58CHK66QrVC2","XXXTENTACION","SAD!","Bad Vibes Forever, LLC",1,150,610,"267653"
149,"spotify:track:6Nle9hKrkL1wQpwNfEkxjh","Frank Ocean","Chanel","Blonded",31,134,52,"265756"
150,"spotify:track:2Xo3rLHjXfdb4avN68aQyi","Russ, BIA","BEST ON EARTH (feat. BIA) - Bonus","Columbia",55,157,14,"265074"
151,"spotify:track:6cy3ki60hLwimwIje7tALf","Black Eyed Peas, J Balvin","RITMO (Bad Boys For Life)","Epic/We The Best",151,156,5,"261104"
152,"spotify:track:7qvsl2pYzrsYgPeFBN5jxp","Doja Cat, Tyga","Juicy","Kemosabe Records/RCA Records",152,185,7,"260649"
153,"spotify:track:2FvD20Z8aoWIePi7PoN8sG","DaBaby, Lil Baby, Moneybagg Yo","TOES (feat. Lil Baby & Moneybagg Yo)","South Coast Music Group/Interscope Records",8,167,36,"259552"
154,"spotify:track:5p7ujcrUXASCNwRaWNHR1C","Halsey","Without Me","Capitol Records",5,158,394,"258733"
155,"spotify:track:3llFXzpLPQmxag3iL35yxg","Earl Sweatshirt, Liv.e","MTOMB (feat. Liv.e)","Warner Records",155,-1,1,"256683"
156,"spotify:track:2rxQMGVafnNaRaXlRMWPde","Luke Combs","Beautiful Crazy","River House Artists/Columbia Nashville",54,170,478,"256136"
157,"spotify:track:51wFQM8W0YfXTmHusXUr5i","Tyga, YG, Santana","MAMACITA","Columbia/Last Kings Records",66,173,8,"254718"
158,"spotify:track:2ksOAxtIxY8yElEWw8RhgK","Anuel AA, Daddy Yankee, KAROL G, J Balvin, Ozuna","China","2019 Real Hasta La Muerte, LLC.",22,168,106,"253846"
159,"spotify:track:7zLYKWcXnYeHHWidalz7rj","Lil Mosey","Noticed","Mogul Vision/Interscope Records",17,169,442,"252660"
160,"spotify:track:6Qs4SXO9dwPj5GKvVOv8Ki","Sam Smith, Normani","Dancing With A Stranger (with Normani)","Capitol",10,139,293,"252377"
161,"spotify:track:3TTMUI5dFcbeNSDTTDY9M8","Summer Walker, Usher","Come Thru (with Usher)","LVRN/Interscope Records",34,147,29,"250870"
162,"spotify:track:2t8yVaLvJ0RenpXUIAC52d","21 Savage","a lot","Slaughter Gang, LLC/Epic Records",2,190,316,"250220"
163,"spotify:track:5K7x78NAL50rhfhm73ePNb","HAIM","Now I'm In It - Bonus Track","Columbia",163,-1,1,"249814"
164,"spotify:track:6K4t31amVTZDgR3sKmwUJJ","Tame Impala","The Less I Know The Better","Universal Music Australia Pty. Ltd.",103,162,76,"249470"
165,"spotify:track:6vN77lE9LK6HP2DewaN6HZ","Lil Baby, Drake","Yes Indeed","Quality Control Music, LLC",2,187,536,"249256"
166,"spotify:track:7m9OqQk4RVRkw9JJdeAw96","XXXTENTACION","Jocelyn Flores","Bad Vibes Forever / EMPIRE",2,163,799,"248299"
167,"spotify:track:2bT1PH7Cw3J9p3t7nlXCdh","Shawn Mendes","If I Can't Have You","Island Records",3,175,183,"248012"
168,"spotify:track:4R8BJggjosTswLxtkw8V7P","Jhay Cortez, J Balvin, Bad Bunny","No Me Conoce - Remix","N&E Entertainment LLC",106,179,143,"247643"
169,"spotify:track:78rFhTXf81WtRS7Ubl2f4V","Chelsea Cutler, Alexander 23","Lucky","Republic Records",169,-1,1,"245877"
170,"spotify:track:3Ol2xnObFdKV9pmRD2t9x8","A Boogie Wit da Hoodie","Look Back at It","Highbridge the Label / Atlantic Records",8,176,330,"244105"
171,"spotify:track:4VXIryQMWpIdGgYR4TrjT1","Juice WRLD","All Girls Are The Same","Juice WRLD Mixtape / ISR P&D",12,174,560,"243685"
172,"spotify:track:5a6pdCHlWS2ekOOQ70QnAr","Noah Cyrus","July","Records/Columbia",129,160,10,"243444"
173,"spotify:track:1ThmUihH9dF8EV08ku5AXN","Ski Mask The Slump God","Faucet Failure","Republic Records",25,189,332,"243376"
174,"spotify:track:4SSnFejRGlZikf02HLewEF","Billie Eilish","bury a friend","Darkroom/Interscope Records",3,107,276,"242738"
175,"spotify:track:2zYzyRzz6pRmhPzyfMEC8s","AC/DC","Highway to Hell","Columbia",39,64,7,"242661"
176,"spotify:track:7GX5flRQZVHRAGd6B4TmDO","Lil Uzi Vert","XO Tour Llif3","Generation Now/Atlantic",1,183,952,"240926"
177,"spotify:track:4HPTladgOGcGzleMR3I0FK","Ski Mask The Slump God","Carbonated Water","Victor/Republic Records",177,-1,1,"240309"
178,"spotify:track:5nCthAh3jt4xKuLJAifAaR","Katy Perry","Harleys In Hawaii","Capitol Records",38,159,15,"240125"
179,"spotify:track:3WyRgi8CzQnhzO0xw79tTS","DaBaby","Goin Baby","South Coast Music Group/Interscope Records",59,193,197,"239708"
180,"spotify:track:26wLOs3ZuHJa2Ihhx6QIE6","5 Seconds of Summer","Teeth","UMGRI Interscope",61,165,72,"238335"
181,"spotify:track:2wUwC1gBJIC05JH87v2hgN","Lil Tjay, Lil Durk","Brothers (feat. Lil Durk) - Remix","Columbia",62,178,42,"237933"
182,"spotify:track:29MOOOmMRPeWyPwKQFoF5t","Sam Smith","I Feel Love","Capitol",182,-1,1,"237286"
183,"spotify:track:0Rx0DJI556Ix5gBny6EWmn","Bazzi","Paradise","iamcosmic",18,184,211,"235456"
184,"spotify:track:6foY66mWZN0pSRjZ408c00","Morgan Wallen","Whiskey Glasses","Big Loud Records",58,200,233,"235184"
185,"spotify:track:0JP9xo3adEtGSdUEISiszL","XXXTENTACION","Moonlight","Bad Vibes Forever, LLC",2,192,596,"232429"
186,"spotify:track:7f1zjZG77S891Uv4O68yfk","DaBaby, Offset","Baby Sitter (feat. Offset)","South Coast Music Group/Interscope Records",55,-1,174,"232325"
187,"spotify:track:2J0NXdHr6MYvKDSxB7k3V2","Post Malone","A Thousand Bad Times","Republic Records",9,182,57,"231523"
188,"spotify:track:5KtuQpmQkNQTWsBF8QuCQb","Earl Sweatshirt","74","Warner Records",188,-1,1,"230786"
189,"spotify:track:4ZT9FnbFu1PaBfV3itxiqT","Lil Skies","I","All We Got Ent.",13,194,244,"230023"
190,"spotify:track:6muOWhMh7Tf0UFUtMDBhUR","Coldplay","Orphans","Parlophone UK",48,161,8,"228749"
191,"spotify:track:6A4Jc8npNo79BOgsrPptLA","Rockwell","Somebody's Watching Me - Single Version","UNI/MOTOWN",49,49,4,"228642"
192,"spotify:track:0TMGV2zMZXOILVtQLtkI3G","Why Don't We","What Am I","Atlantic Records",168,199,13,"228400"
193,"spotify:track:7sO5G9EABYOXQKNPNiE9NR","Offset, Metro Boomin","Ric Flair Drip (with Metro Boomin)","Slaughter Gang, LLC/Epic/Quality Control Music/Motown/Capitol/Boominati Worldwide/Republic",4,-1,707,"228201"
194,"spotify:track:6eSU1exzDvBEXmBRxspeh5","Lil Tecca","Shots","Republic Records",34,-1,62,"227491"
195,"spotify:track:0FZ4Dmg8jJJAPJnvBIzD9z","Kodak Black, Offset, Travis Scott","ZEZE (feat. Travis Scott & Offset)","Atlantic Records",1,-1,384,"226470"
196,"spotify:track:62vpWI1CHwFy7tMIcSStl8","J. Cole","No Role Modelz","Roc Nation Records LLC",64,-1,804,"223331"
197,"spotify:track:5rU6kDNXZLXIinFezpbWbO","NAV, Meek Mill","Tap (feat. Meek Mill)","XO Records, LLC and Republic Records",46,-1,189,"223036"
198,"spotify:track:7AQim7LbvFVZJE3O8TYgf2","XXXTENTACION, Trippie Redd","Fuck Love (feat. Trippie Redd)","Bad Vibes Forever / EMPIRE",5,198,787,"222503"
199,"spotify:track:3a1lNhkSLSkpJE4MSHpDu9","Post Malone, Quavo","Congratulations","Universal Records",5,-1,1033,"222431"
200,"spotify:track:3A2yGHWIzmGEIolwonU69h","City Girls","Act Up","Quality Control Music/Motown Records",61,-1,234,"222378"
