rank,uri,artist_names,track_name,source,peak_rank,previous_rank,days_on_chart,streams
1,"spotify:track:0dbTQYW3Ad1FTzIA9t90E8","Lil Wayne, Kendrick Lamar","Mona Lisa (feat. Kendrick Lamar)","Young Money Records, Inc.",1,1,2,"3086419"
2,"spotify:track:5BQrp63SHCVf4bzCzJePne","Lil Wayne, XXXTENTACION","Don't Cry (feat. XXXTENTACION)","Young Money Records, Inc.",2,2,2,"2472163"
3,"spotify:track:0CBQ0m3mufWH75LTYB3s6h","Lil Wayne, Travis Scott","Let It Fly (feat. Travis Scott)","Young Money Records, Inc.",3,3,2,"2038610"
4,"spotify:track:3wScL5W8H40zzCKN0atfBk","Lil Wayne, Swizz Beatz","Uproar","Young Money Records, Inc.",4,5,2,"1974032"
5,"spotify:track:0Y7di9ZCmB6Elad5WISaPc","Lil Wayne","Dedicate","Young Money Records, Inc.",4,4,2,"1867341"
6,"spotify:track:5cGpjfgAvidLy6znwkCxkP","Lil Wayne","Can't Be Broken","Young Money Records, Inc.",6,6,2,"1717224"
7,"spotify:track:3JX0dOCIAiaR8MP3ryXWuM","Lil Wayne, Sosamann","What About Me (feat. Sosamann)","Young Money Records, Inc.",7,8,2,"1650060"
8,"spotify:track:4S8d14HvHb70ImctNgVzQQ","Kanye West, Lil Pump","I Love It (& Lil Pump)","Getting Out Our Dreams, Inc./Def Jam Recordings",1,17,23,"1414141"
9,"spotify:track:5IvdLxVB8gwwcgnEkXSSW2","Lil Wayne, Nicki Minaj","Dark Side Of The Moon (feat. Nicki Minaj)","Young Money Records, Inc.",7,7,2,"1401921"
10,"spotify:track:2xLMifQCjDGFmkHkpNLD9h","Travis Scott","SICKO MODE","Cactus Jack / Epic / Grand Hustle",1,19,58,"1381483"
11,"spotify:track:2AwyHlbA6f641SEkizD5JG","Lil Wayne, Snoop Dogg","Dope Niggaz (feat. Snoop Dogg)","Young Money Records, Inc.",11,11,2,"1239693"
12,"spotify:track:05r1GGg1Rhs0RcUg27C82a","Lil Wayne, Reginae Carter","Famous (feat. Reginae Carter)","Young Money Records, Inc.",12,12,2,"1237884"
13,"spotify:track:0Dn40gxVCMo5TkgS8Ik18Q","Lil Peep, XXXTENTACION","Falling Down - Bonus Track","Columbia",1,18,11,"1209025"
14,"spotify:track:4w8niZpiMy6qz1mntFA5uM","DJ Snake, Selena Gomez, Ozuna, Cardi B","Taki Taki (with Selena Gomez, Ozuna & Cardi B)","DJ Snake Music Productions Limited, under exclusive license to Geffen Records",14,20,2,"1203847"
15,"spotify:track:2DnH4XlEkghUdE8ymdVom5","Lil Wayne","Open Letter","Young Money Records, Inc.",10,10,2,"1196265"
16,"spotify:track:0s3nnoMeVWz3989MkNQiRf","Juice WRLD","Lucid Dreams","Juice WRLD Mixtape / ISR P&D",1,24,146,"1136468"
17,"spotify:track:3QybPutx0Tjk472bBKjNWn","Sheck Wes","Mo Bamba","Cactus Jack Records/ G.O.O.D. Music/ Interscope Records",5,26,65,"1102622"
18,"spotify:track:0ubdf6zWT1It2saK41SkO0","Lil Wayne","Problems","Young Money Records, Inc.",13,13,2,"1078522"
19,"spotify:track:2E124GmJRnBJuXbTb4cPUB","6ix9ine, Nicki Minaj, Murda Beatz","FEFE","Scumgang Records/TenThousand Projects, LLC",2,28,70,"1074068"
20,"spotify:track:5s6pKnF3ZPtuqvEx1i1V7U","Lil Wayne","Hittas","Young Money Records, Inc.",14,14,2,"1037448"
21,"spotify:track:2dpaYNEQHiRxtZbfNsse99","Marshmello, Bastille","Happier","Astralwerks",7,32,44,"988543"
22,"spotify:track:7EgI0dCaQuHFe3OTj5EpWI","Lil Wayne","Open Safe","Young Money Records, Inc.",15,15,2,"977486"
23,"spotify:track:1Dk3CfJEtqvj7Xg2AWwfEn","Lil Wayne","Took His Time","Young Money Records, Inc.",16,16,2,"938551"
24,"spotify:track:0Fpen1PTuEnCmOJtUU9Iud","Lil Uzi Vert","New Patek","Generation Now/Atlantic",1,31,12,"922602"
25,"spotify:track:0TlLq3lA83rQOYtrqBqSct","Drake","Nonstop","Cash Money/Drake LP6",1,34,93,"893530"
26,"spotify:track:2G7V7zsVDxg1yRsu7Ew9RJ","Drake","In My Feelings","Cash Money/Drake LP6",1,38,93,"888264"
27,"spotify:track:3ee8Jmje8o58CHK66QrVC2","XXXTENTACION","SAD!","Bad Vibes Forever, LLC",1,35,212,"882982"
28,"spotify:track:60SdxE8apGAxMiRrpbmLY0","Eminem, Joyner Lucas","Lucky You (feat. Joyner Lucas)","Aftermath",1,33,30,"862193"
29,"spotify:track:1BxkZE73h9BN3qwuA15TA3","Lil Baby, Gunna","Drip Too Hard (Lil Baby & Gunna)","Quality Control Music/Young Stoner Life Records, a 300 Entertainment Label/Motown Records/Capitol Records",13,36,18,"841171"
30,"spotify:track:3BUWNzPWz2mDbptZmGEXpB","Lil Wayne","Let It All Work Out","Young Money Records, Inc.",27,27,2,"822824"
31,"spotify:track:6y4pOReFqH2wzo4CV91cZC","Lil Wayne","Mess","Young Money Records, Inc.",23,23,2,"805075"
32,"spotify:track:0JP9xo3adEtGSdUEISiszL","XXXTENTACION","Moonlight","Bad Vibes Forever, LLC",2,40,198,"802276"
33,"spotify:track:68lOQPb5tX8U2cQRuas0L2","Lil Wayne","Used 2","Young Money Records, Inc.",25,25,2,"790272"
34,"spotify:track:6wqWfSOZvTK18SAczoYm1L","Lil Wayne, Ashanti, Mack Maine","Start This Shit Off Right (feat. Ashanti & Mack Maine)","Young Money Records, Inc.",21,21,2,"789886"
35,"spotify:track:0QIjsbm2fh1cJ45XO9eGqq","Gucci Mane, Bruno Mars, Kodak Black","Wake Up in the Sky","Guwop Enterprises/Atlantic",6,37,16,"786245"
36,"spotify:track:1kaxyXcAi5ZHF3Q94QXsHK","Lil Wayne","Demon","Young Money Records, Inc.",22,22,2,"785213"
37,"spotify:track:4T3fNx3CgwDRRYgmFCbD4J","Khalid","Better","Right Hand Music Group, LLC/RCA Records",8,39,16,"781157"
38,"spotify:track:7dt6x5M1jzdTEt8oCbisTK","Post Malone","Better Now","Republic Records",1,43,156,"747441"
39,"spotify:track:7d6XJZjnm7iWcKwYL9z5kC","Lil Mosey","Noticed","Mogul Vision/Interscope Records",17,41,44,"739959"
40,"spotify:track:3ZVw1HR1QAQoKBygbhG4CE","Lil Wayne","I Love You Dwayne","Young Money Records, Inc.",9,9,2,"732705"
41,"spotify:track:5IaHrVsrferBYDm0bDyABy","Tyga, Offset","Taste (feat. Offset)","Last Kings Music / EMPIRE",3,45,135,"730331"
42,"spotify:track:0d2iYfpKoM0QCKvcLCkBao","benny blanco, Halsey, Khalid","Eastside (with Halsey & Khalid)","Benny Blanco Solo Album PS",7,47,79,"719785"
43,"spotify:track:4E3qImtJzRqLt8ZZyLceOE","Lil Wayne","Perfect Strangers","Young Money Records, Inc.",30,30,2,"706335"
44,"spotify:track:6vN77lE9LK6HP2DewaN6HZ","Lil Baby, Drake","Yes Indeed","Quality Control Music, LLC",2,42,138,"704791"
45,"spotify:track:7cG6SxmQ24hQWnR8UThrk2","Lil Wayne, Nivea","Dope New Gospel (feat. Nivea)","Young Money Records, Inc.",29,29,2,"693205"
46,"spotify:track:58q2HKrzhC3ozto2nDdN4z","Cardi B, Bad Bunny, J Balvin","I Like It","Atlantic/KSR",2,53,177,"681008"
47,"spotify:track:2uMTscYuCT3BZ0OCzH3MwN","Kodak Black","If I'm Lyin', I'm Flyin'","Atlantic Records",47,48,2,"615002"
48,"spotify:track:1jo3TwNGCXfNdB5uba3ZVv","Eminem","Killshot","Aftermath",16,51,11,"602542"
49,"spotify:track:0ZNrc4kNeQYD9koZ3KvCsy","YG, 2 Chainz, Big Sean, Nicki Minaj","BIG BANK (feat. 2 Chainz, Big Sean, Nicki Minaj)","Def Jam Recordings",21,59,128,"581464"
50,"spotify:track:7m9OqQk4RVRkw9JJdeAw96","XXXTENTACION","Jocelyn Flores","Bad Vibes Forever / EMPIRE",2,57,401,"577934"
51,"spotify:track:04MLEeAMuV9IlHEsD8vF6A","French Montana, Drake","No Stylist (feat. Drake)","Epic",14,62,9,"543658"
52,"spotify:track:7wBJfHzpfI3032CSD7CE2m","Travis Scott","STARGAZING","Cactus Jack / Epic / Grand Hustle",1,61,58,"536053"
53,"spotify:track:6DCZcSspjsKoFjzjrWoCdn","Drake","God's Plan","Cash Money/Drake LP6",1,74,253,"517749"
54,"spotify:track:4zIO3ilp5HvTeK3HJHxhMP","Imagine Dragons","Natural","Kid Ina Korner / Interscope",21,71,72,"517163"
55,"spotify:track:7AQim7LbvFVZJE3O8TYgf2","XXXTENTACION, Trippie Redd","Fuck Love (feat. Trippie Redd)","Bad Vibes Forever / EMPIRE",5,65,401,"515324"
56,"spotify:track:5N4erncE7kuUccm7zEmwzk","Silk City, Dua Lipa, Diplo, Mark Ronson","Electricity (with Dua Lipa)","Columbia",25,78,23,"514593"
57,"spotify:track:4OafepJy2teCjYJbvFE60J","Ariana Grande","breathin","Republic Records",4,72,44,"511744"
58,"spotify:track:6VDz4m1vEGHDDqQojf1mpc","Logic, Ghostface Killah, Raekwon, RZA, Method Man, Inspectah Deck, Cappadonna, Jackpot Scotty Wotty, U-God, Masta Killa, GZA","Wu Tang Forever (ft. Ghostface Killah, Raekwon, RZA, Method Man, Inspectah Deck, Cappadonna, Jackpot Scotty Wotty, U-God, Masta Killa, GZA)","Def Jam Recordings",46,46,2,"511053"
59,"spotify:track:15kQGEy89K8deJcZVFEn0N","The Chainsmokers, Kelsea Ballerini","This Feeling","Disruptor Records/Columbia",33,66,9,"511005"
60,"spotify:track:14mHfNsSHN0FbLftyjrV9g","Flipp Dinero","Leave Me Alone","Cinematic/Epic/We The Best",29,68,49,"507903"
61,"spotify:track:0XySogm94T51XF5F2jumXm","Juice WRLD","All Girls Are The Same","Juice WRLD Mixtape / ISR P&D",12,69,162,"505925"
62,"spotify:track:1FmdAhS8FqRoEJ4jcSfuKZ","Logic, Jaden","ICONIC (ft. Jaden Smith)","Def Jam Recordings",54,54,2,"502762"
63,"spotify:track:4CstQ0SUkl0YkoeZkIZlIx","Logic, Wale, John Lindahl","100 Miles and Running (ft. Wale & John Lindahl)","Def Jam Recordings",44,44,2,"500835"
64,"spotify:track:29tc0GbW0pTSBZSCZF3NWk","Juice WRLD","Lean Wit Me","Juice WRLD Mixtape / ISR P&D",25,67,130,"498435"
65,"spotify:track:5WvAo7DNuPRmk4APhdPzi8","DJ Khaled, Justin Bieber, Quavo, Chance the Rapper","No Brainer","Epic/We The Best",3,76,65,"498310"
66,"spotify:track:3swc6WTsr7rl9DqQKQA55C","Post Malone, Ty Dolla $ign","Psycho (feat. Ty Dolla $ign)","Republic Records",1,73,219,"491042"
67,"spotify:track:7AFASza1mXqntmGtbxXprO","XXXTENTACION","changes","Bad Vibes Forever, LLC",4,75,212,"488575"
68,"spotify:track:1Jl21sidRpEdlVBvYbssLx","Young Thug, Jaden","Sin (feat. Jaden Smith)","300 Entertainment/Atl",24,63,6,"485409"
69,"spotify:track:2iUXsYOEPhVqEBwsqP70rE","5 Seconds of Summer","Youngblood","Capitol",12,77,169,"480954"
70,"spotify:track:7fa9MBXhVfQ8P8Df9OEbD8","Maroon 5, Cardi B","Girls Like You (feat. Cardi B) - Cardi B Version","Interscope Records*",6,82,121,"470520"
71,"spotify:track:5OCJzvD7sykQEKHH7qAC3C","Ariana Grande","God is a woman","Republic Records",4,79,79,"469142"
72,"spotify:track:2Egoo3acImq7hV6TfYV90E","Logic","Everybody Dies","Def Jam Recordings",46,50,6,"465817"
73,"spotify:track:0e7ipj03S05BNilyu5bRzt","Post Malone, 21 Savage","rockstar (feat. 21 Savage)","Republic Records",1,80,380,"462561"
74,"spotify:track:3CA9pLiwRIGtUBiMjbZmRw","Drake","Nice For What","Cash Money/Drake LP6",1,91,176,"452887"
75,"spotify:track:3irKogkH8P1B1nONmEcHgY","Logic","YSIV","Def Jam Recordings",56,56,2,"452861"
76,"spotify:track:3obgSF06ki98lYNLNq5vCB","Juice WRLD, Lil Uzi Vert","Wasted (feat. Lil Uzi Vert)","Juice WRLD Mixtape / ISR P&D",20,81,82,"445576"
77,"spotify:track:5N5k9nd479b1xpDZ4usjrg","Calvin Harris, Sam Smith, Jessie Reyez","Promises (with Sam Smith)","Columbia",18,87,44,"442028"
78,"spotify:track:5ZcMWSpUeUPvO87FkSZbJB","Logic","The Return","Def Jam Recordings",37,55,17,"439271"
79,"spotify:track:5qHirGR7M9tdm6C17DlzSY","Aminé","REEL IT IN","Republic Records",52,90,24,"428487"
80,"spotify:track:4qKcDkK6siZ7Jp1Jb4m0aL","BlocBoy JB, Drake","Look Alive (feat. Drake)","OVO Sound/Warner Records",2,93,233,"425698"
81,"spotify:track:7lAK3oHbfEnvUQWosrMMpR","Travis Scott","YOSEMITE","Cactus Jack / Epic / Grand Hustle",7,83,58,"424780"
82,"spotify:track:4VUwkH455At9kENOfzTqmF","Bazzi, Camila Cabello","Beautiful (feat. Camila Cabello)","iamcosmic",28,92,58,"423353"
83,"spotify:track:0OgGn1ofaj55l2PcihQQGV","Bryce Vine","Drew Barrymore","Sire",45,88,44,"412960"
84,"spotify:track:7iMDaY1LnASwCk2uUpMtii","Young Thug, Elton John","High (feat. Elton John)","300 Entertainment/Atl",60,60,6,"407702"
85,"spotify:track:066QkK1heGoXBUPBbcOhEG","Logic","The Glorious Five","Def Jam Recordings",52,52,2,"405702"
86,"spotify:track:5bJ1DrEM4hNCafcDd1oxHx","Mac Miller","Self Care","Warner Records",4,86,38,"399883"
87,"spotify:track:7noud145AHZGg74vpWOsCa","Ella Mai","Trip","10 Summers / Interscope PS",56,94,31,"398170"
88,"spotify:track:0UyljEbX9dqI1K0sqdv6B6","Joji","SLOW DANCING IN THE DARK","88rising Music/Warner Records",26,85,18,"396550"
89,"spotify:track:2qT1uLXPVPzGgFOx4jtEuo","Ariana Grande","no tears left to cry","Republic Records",6,98,163,"394421"
90,"spotify:track:2zIAPysksDdMAiG33qH6kW","Logic, Hailee Steinfeld","Ordinary Day (ft. Hailee Steinfeld)","Def Jam Recordings",64,64,2,"394090"
91,"spotify:track:2jt2WxXMCD4zjACthkJQVE","Eminem","The Ringer","Aftermath",2,89,30,"394082"
92,"spotify:track:7ycWLEP1GsNjVvcjawXz3z","A$AP Rocky, Skepta","Praise The Lord (Da Shine) (feat. Skepta)","A$AP Worldwide/Polo Grounds Music/RCA Records",5,97,128,"392648"
93,"spotify:track:75ZvA4QfFiZvzhj2xkaWAh","Post Malone","I Fall Apart","Universal Records",2,96,379,"385864"
94,"spotify:track:7rKKh8AGVXuNXgLBpTBTFH","Logic, Ryan Tedder","One Day (ft. Ryan Tedder)","Def Jam Recordings",20,70,16,"375342"
95,"spotify:track:5lK18Pt33xNudq4qYDxIm8","Lady Gaga, Bradley Cooper","Shallow","A Star is Born OST",58,58,2,"373617"
96,"spotify:track:3GVkPk8mqxz0itaAriG1L7","XXXTENTACION","Everybody Dies In Their Nightmares","Bad Vibes Forever / EMPIRE",6,103,396,"370628"
97,"spotify:track:45Egmo7icyopuzJN0oMEdk","Khalid, Normani","Love Lies (with Normani)","RCA Records Label",8,99,226,"367699"
98,"spotify:track:3V8UKqhEK5zBkBb6d6ub8i","Nio Garcia, Casper Magico, Bad Bunny, Darell, Ozuna, Nicky Jam","Te Boté - Remix","2018 Flow La Movie, Inc.",35,111,167,"367068"
99,"spotify:track:3EPXxR3ImUwfayaurPi3cm","Dean Lewis","Be Alright","Universal Music Australia Pty. Ltd.",19,100,62,"354622"
100,"spotify:track:5a8RPWgKSmcGBGcffmIrUi","Sia, Diplo, Labrinth, LSD","Thunderclouds (feat. Sia, Diplo, and Labrinth)","Records/Columbia",41,106,51,"354546"
101,"spotify:track:7sO5G9EABYOXQKNPNiE9NR","Offset, Metro Boomin","Ric Flair Drip (with Metro Boomin)","Slaughter Gang, LLC/Epic/Quality Control Music/Motown/Capitol/Boominati Worldwide/Republic",4,108,334,"350759"
102,"spotify:track:6jreFSOTUAViWjKyzOC4Kg","Alesso","REMEDY","10:22 pm",58,113,25,"348183"
103,"spotify:track:7GX5flRQZVHRAGd6B4TmDO","Lil Uzi Vert","XO Tour Llif3","Generation Now/Atlantic",1,115,555,"344964"
104,"spotify:track:4ut9fdC5ncgcvCo0KaphNY","Logic, Lucy Rose, The RattPack","Thank You (ft. Lucy Rose & The RattPack)","Def Jam Recordings",49,49,2,"344250"
105,"spotify:track:33tNYw9oMtSkGe27NpgS64","Quavo","WORKIN ME","Quality Control Music/Motown Records/Capitol Records",32,114,51,"343077"
106,"spotify:track:4mHgYpuGHu99Mw69E83CP2","Trippie Redd","Taking A Walk","TenThousand Projects, LLC",6,107,55,"342374"
107,"spotify:track:7IBSffWIu7P2MC7kMwy2FM","Wiz Khalifa, Swae Lee","Hopeless Romantic (feat. Swae Lee)","Taylor Gang/Atlantic",29,105,88,"339560"
108,"spotify:track:7ATATJztoWLcqDAcVVof0C","6ix9ine, Anuel AA","BEBE","Scumgang Records/TenThousand Projects, LLC",34,116,30,"339151"
109,"spotify:track:6eYxmK9fdL4hwLnXG2zY3s","XXXTENTACION","Look At Me!","Bad Vibes Forever / EMPIRE",20,123,470,"331175"
110,"spotify:track:2ZRo7axmMPeSVUvDbGkJah","XXXTENTACION","Hope","Bad Vibes Forever, LLC",10,124,139,"331078"
111,"spotify:track:0u2P5u6lvoDfwTYjAADbn4","Billie Eilish, Khalid","lovely (with Khalid)","Darkroom",18,101,163,"330791"
112,"spotify:track:4kWO6O1BUXcZmaxitpVUwp","Tiësto, Dzeko, Preme, Post Malone","Jackie Chan","Universal Music, a division of Universal International Music BV",18,122,135,"330005"
113,"spotify:track:1ZAyjvIk9YiD76yYy0TEG6","Rich The Kid","Plug Walk","Rich The Kid / (TDE/ISR PS)",6,121,233,"323578"
114,"spotify:track:0Me3TlqFkaIzoZzAGU1EDh","Logic","Street Dreams II","Def Jam Recordings",84,84,2,"315718"
115,"spotify:track:6Hgh47WXVKtXN5zGOu0hjI","Khalid, 6LACK, Ty Dolla $ign","OTW","Right Hand Music Group, LLC/RCA Records",17,119,163,"315700"
116,"spotify:track:7oJrVhiTPZGBXWPwhxjy9S","Lil Skies","Lust","All We Got Ent.",75,125,237,"310872"
117,"spotify:track:1rqqCSm0Qe4I9rUvWncaom","Panic! At The Disco","High Hopes","DCD2 / Fueled By Ramen",33,109,110,"310065"
118,"spotify:track:43TP6JCWXgkc2D7Xjz5hBr","Machine Gun Kelly","RAP DEVIL","Bad Boy / Interscope",36,118,21,"309066"
119,"spotify:track:2P91MQbaiQOfbiz9VqhqKQ","Lauv","I Like Me Better","Lauv",30,126,478,"302164"
120,"spotify:track:4UKCKdYiLN6IMA5ZESUTL7","XXXTENTACION","the remedy for a broken heart (why am I so in love)","Bad Vibes Forever, LLC",8,131,165,"300802"
121,"spotify:track:1RagpNpkD3KcjXMLGMe99V","Wiz Khalifa, Lil Skies","Fr Fr (feat. Lil Skies)","Taylor Gang/Atlantic",45,120,63,"295361"
122,"spotify:track:2Yer0p7uB2lVBUAtANuuQp","Social House, Lil Yachty","Magic In The Hamptons (feat. Lil Yachty)","Silent Records / Social House",76,130,45,"295157"
123,"spotify:track:4e4fqjx0Izh4svvTef1z7e","Bebe Rexha, Florida Georgia Line","Meant to Be (feat. Florida Georgia Line)","Warner Bros.",15,129,386,"294659"
124,"spotify:track:5xE8cBcKRjKEDdJwmh1ixN","Logic, Kajo, Slaydro, Big Lenbo","The Adventures Of Stoney Bob (ft. Kajo, Slaydro, Big Lenbo)","Def Jam Recordings",95,95,2,"292268"
125,"spotify:track:7rC5Pl8rQSX4myONQHYPBK","Drake","Mob Ties","Cash Money/Drake LP6",5,133,93,"291086"
126,"spotify:track:3qN5qMTKyEEmiTZD38BNTT","Drake","I'm Upset","Cash Money/Drake LP6",4,134,126,"287667"
127,"spotify:track:3a1lNhkSLSkpJE4MSHpDu9","Post Malone, Quavo","Congratulations","Universal Records",5,132,637,"287435"
128,"spotify:track:58QhkbaAkLFnn7JwAnAato","Eminem","Fall","Aftermath",8,128,30,"286088"
129,"spotify:track:48zFZh27QU5qsrBjn4C2FA","Ozuna, Manuel Turizo","Vaina Loca","VP Records Corp/Dimelo Vi",49,143,40,"284948"
130,"spotify:track:7KXjTSCq5nL1LoYtL7XAwS","Kendrick Lamar","HUMBLE.","Aftermath",1,137,548,"284890"
131,"spotify:track:28FGV3ORH14MYORd7s5dlU","Eminem, Royce Da 5'9""","Not Alike (feat. Royce Da 5'9)","Aftermath",5,127,30,"284252"
132,"spotify:track:6IaieqiCVvsNvEt6Y7yOFa","Post Malone, Nicki Minaj","Ball For Me (feat. Nicki Minaj)","Republic Records",8,136,156,"279781"
133,"spotify:track:0At2qAoaVjIwWNAqrscXli","Ella Mai","Boo'd Up","10 Summers / Interscope PS",24,139,141,"279124"
134,"spotify:track:7uzmGiiJyRfuViKKK3lVmR","Bazzi","Mine","iamcosmic",3,140,258,"276117"
135,"spotify:track:6n4U3TlzUGhdSFbUUhTvLP","Migos, Drake","Walk It Talk It","Quality Control Music, LLC",3,149,247,"275888"
136,"spotify:track:1Knctxx9vGZxpZfF66BIEa","Juice WRLD","Legends","Juice WRLD / Interscope PS",67,138,100,"273264"
137,"spotify:track:5Z3GHaZ6ec9bsiI5BenrbY","Khalid","Young Dumb & Broke","Right Hand Music Group, LLC/RCA Records",5,141,543,"272910"
138,"spotify:track:5PTG6rrL6EPFD9E2QMI2pl","Famous Dex","JAPAN","300 Entertainment",11,142,198,"272369"
139,"spotify:track:32lItqlMi4LBhb4k0BaSaC","Post Malone","Candy Paint","Republic Records",4,144,492,"270740"
140,"spotify:track:1co0puPTYvqAdUEjFOjne9","Florida Georgia Line","Simple","BMLG Records",50,152,121,"269716"
141,"spotify:track:5mJAediEZEv8KKpWxrNIqf","Logic","Legacy","Def Jam Recordings",102,102,2,"266471"
142,"spotify:track:2u7mxWSeoqTXndK5e08jMp","Lil Skies, Landon Cube","Nowadays (feat. Landon Cube)","All We Got Ent.",24,147,274,"264375"
143,"spotify:track:09IStsImFySgyp0pIQdqAc","Zedd, Maren Morris, Grey","The Middle","UMGRI Interscope",5,154,248,"262885"
144,"spotify:track:4hQ6UGyWQIGJmHSo0J88JW","Selena Gomez","Back To You - From 13 Reasons Why – Season 2 Soundtrack","UMGRI Interscope",15,148,142,"261741"
145,"spotify:track:6gBFPUFcJLzWGx4lenP6h2","Travis Scott","goosebumps","Epic/Grand Hustle",16,151,637,"259078"
146,"spotify:track:40oKW22ZNNkEdZLJTScaQI","Kodak Black, XXXTENTACION","Roll in Peace (feat. XXXTENTACION)","Atlantic Records",21,150,399,"255819"
147,"spotify:track:1zB4vmk8tFRmM9UULNzbLB","Imagine Dragons","Thunder","Kid Ina Korner / Interscope",16,169,520,"255478"
148,"spotify:track:7K7MUBCnzgBAvMVW2RTWNs","Loud Luxury, Brando","Body","Armada Music",22,168,107,"253488"
149,"spotify:track:6xcJyGpfZbuuiequtnlKt4","Travis Scott","BUTTERFLY EFFECT","Cactus Jack / Epic / Grand Hustle",9,153,498,"252631"
150,"spotify:track:1BuZAIO8WZpavWVbbq3Lci","Rae Sremmurd, Swae Lee, Slim Jxmmi, Juicy J","Powerglide (feat. Juicy J) - From SR3MM","Mike WiLL Made-It",15,159,213,"252091"
151,"spotify:track:4eUsMWZO1Dpc0lQp4JsKXa","Kevin Gates","Money Long","Bread Winners' Association",151,-1,1,"250747"
152,"spotify:track:202RUoPIUYZLyg6VtosWci","Logic","Last Call","Def Jam Recordings",104,104,2,"250049"
153,"spotify:track:55GiOwtxNajXVbpjjIzMnD","Tyga","SWISH","Last Kings Music / EMPIRE",23,167,66,"249633"
154,"spotify:track:575NJxNUVDqwJGdzBrlLbv","Shawn Mendes, Zedd","Lost In Japan - Remix","Island Records",16,112,52,"248912"
155,"spotify:track:2XTquzYQAdT1Hk78bOUwsv","Eminem","Greatest","Aftermath",3,146,30,"248638"
156,"spotify:track:3qnoOm4fwZPBS116f5hpgF","Kanye West","All Mine","Getting Out Our Dreams, Inc./Def Jam Recordings",1,175,120,"246054"
157,"spotify:track:0E9ZjEAyAwOXZ7wJC0PD33","Dynoro, Gigi D'Agostino","In My Mind","Columbia/B1 Recordings",50,165,68,"245889"
158,"spotify:track:0kCBorRrKZkSztd9m0QI3r","Young Thug, Young Stoner Life, Gunna, Lil Baby","Chanel (Go Get It) [feat. Gunna & Lil Baby]","300 Entertainment/Atl",30,160,44,"245136"
159,"spotify:track:2UVbBKQOdFAekPTRsnkzcf","Migos","Stir Fry","Quality Control Music, LLC",2,179,282,"244260"
160,"spotify:track:0ibOcbkp2XG46Do8jcy0bL","Smokepurpp, Lil Pump","Nephew (feat. Lil Pump)","Alamo",75,164,64,"243816"
161,"spotify:track:0dSIrRkA4PadGll16TgbnV","Famous Dex, A$AP Rocky","PICK IT UP (feat. A$AP Rocky)","300 Entertainment",13,162,338,"243435"
162,"spotify:track:2iicKPnvOKfbJZJZtuQnjy","Juicy J, Travis Scott","Neighbor (feat. Travis Scott)","Columbia",117,117,2,"242664"
163,"spotify:track:0pqnGHJpmpxLKifKRmU6WP","Imagine Dragons","Believer","Kid Ina Korner / Interscope",9,182,605,"241150"
164,"spotify:track:6f5i916F3jU6BhOOD7iGqf","MadeinTYO, A$AP Ferg","Ned Flanders (feat. A$AP Ferg)","Commission/BMG",64,157,78,"240979"
165,"spotify:track:1HXy5I3HTWq8OvxCn0z7G7","Kane Brown","Heaven","RCA Records Label Nashville",51,180,258,"240844"
166,"spotify:track:2rxQMGVafnNaRaXlRMWPde","Luke Combs","Beautiful Crazy","River House Artists/Columbia Nashville",103,181,118,"240816"
167,"spotify:track:0wbnC9AUenxp613TYaJsGK","Migos","Narcos","Quality Control Music, LLC",2,183,208,"239631"
168,"spotify:track:5gQcxYXqnofyocKgEbGYKt","YBN Nahmir","Bounce Out With That","2018",27,158,240,"239148"
169,"spotify:track:04ZTP5KsCypmtCmQg5tH9R","Bebe Rexha","I'm a Mess","Warner Bros.",63,170,100,"239097"
170,"spotify:track:3ZhTT6yjZwpPph5MIJ53XY","Lil Skies, Landon Cube","Red Roses (feat. Landon Cube)","All We Got Ent.",36,163,271,"239082"
171,"spotify:track:152lZdxL1OR0ZMW6KquMif","Khalid","Location","Right Hand Music Group, LLC/RCA Records",9,171,636,"236934"
172,"spotify:track:2SL6oP2YAEQbqsrkOzRGO4","Eminem","Venom - Music From The Motion Picture","Aftermath",17,156,30,"236043"
173,"spotify:track:4DTpngLjoHj5gFxEZFeD3J","Kodak Black, Lil Wayne","Codeine Dreaming (feat. Lil Wayne)","Atlantic Records",10,135,215,"235263"
174,"spotify:track:1rfofaqEpACxVEHIZBJe6W","Camila Cabello, Young Thug","Havana (feat. Young Thug)","Syco Music/Epic",2,194,421,"233309"
175,"spotify:track:1gm616Plq4ScqNi7TVkZ5N","The Weeknd","Call Out My Name","Universal Republic Records",1,166,184,"231902"
176,"spotify:track:5Xn4IyTtW6FUGIUyWjbUHG","Jason Derulo, David Guetta, Nicki Minaj, Willy William","Goodbye (feat. Nicki Minaj & Willy William)","Beluga Heights/Warner Records",85,177,23,"231130"
177,"spotify:track:6KBYefIoo7KydImq1uUQlL","Cardi B","Bodak Yellow","Atlantic/KSR",2,200,432,"231124"
178,"spotify:track:2374M0fQpWi3dLnB54qaLX","TOTO","Africa","Columbia",126,199,164,"230146"
179,"spotify:track:6yz0Jndhv0QjKdpcEMbOjz","Trippie Redd","Shake It Up","TenThousand Projects, LLC",42,155,51,"227617"
180,"spotify:track:42fw0rxRO2xbesF6mJfd4Y","Dan + Shay","Tequila","Warner Records",48,176,218,"226907"
181,"spotify:track:7eBqSVxrzQZtK2mmgRG6lC","YNW Melly","Murder On My Mind","P2018",111,173,9,"226152"
182,"spotify:track:51rXHuKN8Loc4sUlKPODgH","Jay Rock, Kendrick Lamar, Future, James Blake","King's Dead (with Kendrick Lamar, Future & James Blake)","Black Panther (TDE/DMG) PS",7,189,261,"224736"
183,"spotify:track:2fQrGHiQOvpL9UgPvtYy6G","21 Savage","Bank Account","Slaughter Gang, LLC/Epic Records",1,192,450,"222853"
184,"spotify:track:5tz69p7tJuGPeMGwNTxYuV","Logic, Alessia Cara, Khalid","1-800-273-8255","Def Jam Recordings",1,178,519,"220427"
185,"spotify:track:2gsNpSn7VvvJuSrIDfRoYy","Eminem","Kamikaze","Aftermath",8,172,30,"220183"
186,"spotify:track:6ScJMrlpiLfZUGtWp4QIVt","Lil Wayne","A Milli","CM/Republic",145,145,2,"219037"
187,"spotify:track:4dVpf9jZjcORqGTLUaeYj9","A$AP Ferg","Plain Jane","RCA Records Label",6,198,397,"218498"
188,"spotify:track:2BJSMvOGABRxokHKB0OI8i","Playboi Carti, Lil Uzi Vert","Shoota (feat. Lil Uzi Vert)","AWGE Label",23,185,142,"217285"
189,"spotify:track:3GCdLUSnKSMJhs4Tj6CV3s","Kendrick Lamar, SZA","All The Stars (with SZA)","Black Panther (TDE/DMG) PS",2,196,269,"217229"
190,"spotify:track:3ngc7rGlfeFaskU90EWl4R","Lauren Daigle","You Say","Centricity Music/Warner Records",116,174,13,"214513"
191,"spotify:track:2hnxrRNzF74mdDzpQZQukQ","Lauv, Julia Michaels","There's No Way (feat. Julia Michaels)","Lauv",110,110,2,"213906"
192,"spotify:track:5S1IUPueD0xE0vj4zU3nSf","2 Chainz, Drake, Quavo","Bigger Than You (feat. Drake & Quavo)","Def Jam Recordings",14,187,107,"212966"
193,"spotify:track:2bSk87AVkCIIC3Bcligq1z","Lil Baby, Gunna, Lil Uzi Vert","Life Goes On","Quality Control Music, LLC",87,186,135,"212853"
194,"spotify:track:52okn5MNA47tk87PeZJLEL","NF","Let You Down","NF Real Music",9,195,356,"211800"
195,"spotify:track:2eAZfqOm4EnOF9VvN50Tyc","Lil Uzi Vert, Oh Wonder","The Way Life Goes (feat. Oh Wonder)","Generation Now/Atlantic",4,197,396,"211433"
196,"spotify:track:10Igtw8bSDyyFs7KIsKngZ","Lil Dicky, Chris Brown","Freaky Friday (feat. Chris Brown)","Commission/BMG",5,-1,191,"211124"
197,"spotify:track:0chpIFSjgfd1CPrAxM7PWp","Lil Skies","No Rest","All We Got Ent.",103,188,44,"210991"
198,"spotify:track:4vaxvNDaLSoD36iZX515ug","Lil Xan","Betrayed","Columbia",21,190,349,"210067"
199,"spotify:track:0tgVpDi06FyKpA1z0VMD4v","Ed Sheeran","Perfect","Atlantic Records UK",11,-1,460,"209850"
200,"spotify:track:08bNPGLD8AhKpnnERrAc6G","Marshmello, Anne-Marie","FRIENDS","Atlantic Records UK",15,-1,216,"209806"
