rank,uri,artist_names,track_name,source,peak_rank,previous_rank,days_on_chart,streams
1,"spotify:track:0dbTQYW3Ad1FTzIA9t90E8","Lil Wayne, Kendrick Lamar","Mona Lisa (feat. Kendrick Lamar)","Young Money Records, Inc.",1,-1,1,"4444027"
2,"spotify:track:5BQrp63SHCVf4bzCzJePne","Lil Wayne, XXXTENTACION","Don't Cry (feat. XXXTENTACION)","Young Money Records, Inc.",2,-1,1,"4213664"
3,"spotify:track:0CBQ0m3mufWH75LTYB3s6h","Lil Wayne, Travis Scott","Let It Fly (feat. Travis Scott)","Young Money Records, Inc.",3,-1,1,"3532426"
4,"spotify:track:0Y7di9ZCmB6Elad5WISaPc","Lil Wayne","Dedicate","Young Money Records, Inc.",4,-1,1,"3432739"
5,"spotify:track:3wScL5W8H40zzCKN0atfBk","Lil Wayne, Swizz Beatz","Uproar","Young Money Records, Inc.",5,-1,1,"3113147"
6,"spotify:track:5cGpjfgAvidLy6znwkCxkP","Lil Wayne","Can't Be Broken","Young Money Records, Inc.",6,-1,1,"2887237"
7,"spotify:track:5IvdLxVB8gwwcgnEkXSSW2","Lil Wayne, Nicki Minaj","Dark Side Of The Moon (feat. Nicki Minaj)","Young Money Records, Inc.",7,-1,1,"2517931"
8,"spotify:track:3JX0dOCIAiaR8MP3ryXWuM","Lil Wayne, Sosamann","What About Me (feat. Sosamann)","Young Money Records, Inc.",8,-1,1,"2456457"
9,"spotify:track:3ZVw1HR1QAQoKBygbhG4CE","Lil Wayne","I Love You Dwayne","Young Money Records, Inc.",9,-1,1,"2171707"
10,"spotify:track:2DnH4XlEkghUdE8ymdVom5","Lil Wayne","Open Letter","Young Money Records, Inc.",10,-1,1,"2023336"
11,"spotify:track:2AwyHlbA6f641SEkizD5JG","Lil Wayne, Snoop Dogg","Dope Niggaz (feat. Snoop Dogg)","Young Money Records, Inc.",11,-1,1,"1967578"
12,"spotify:track:05r1GGg1Rhs0RcUg27C82a","Lil Wayne, Reginae Carter","Famous (feat. Reginae Carter)","Young Money Records, Inc.",12,-1,1,"1927800"
13,"spotify:track:0ubdf6zWT1It2saK41SkO0","Lil Wayne","Problems","Young Money Records, Inc.",13,-1,1,"1797773"
14,"spotify:track:5s6pKnF3ZPtuqvEx1i1V7U","Lil Wayne","Hittas","Young Money Records, Inc.",14,-1,1,"1715308"
15,"spotify:track:7EgI0dCaQuHFe3OTj5EpWI","Lil Wayne","Open Safe","Young Money Records, Inc.",15,-1,1,"1537167"
16,"spotify:track:1Dk3CfJEtqvj7Xg2AWwfEn","Lil Wayne","Took His Time","Young Money Records, Inc.",16,-1,1,"1497655"
17,"spotify:track:4S8d14HvHb70ImctNgVzQQ","Kanye West, Lil Pump","I Love It (& Lil Pump)","Getting Out Our Dreams, Inc./Def Jam Recordings",1,2,22,"1472745"
18,"spotify:track:0Dn40gxVCMo5TkgS8Ik18Q","Lil Peep, XXXTENTACION","Falling Down - Bonus Track","Columbia",1,1,10,"1426914"
19,"spotify:track:2xLMifQCjDGFmkHkpNLD9h","Travis Scott","SICKO MODE","Cactus Jack / Epic / Grand Hustle",1,3,57,"1381073"
20,"spotify:track:4w8niZpiMy6qz1mntFA5uM","DJ Snake, Selena Gomez, Ozuna, Cardi B","Taki Taki (with Selena Gomez, Ozuna & Cardi B)","DJ Snake Music Productions Limited, under exclusive license to Geffen Records",20,-1,1,"1308756"
21,"spotify:track:6wqWfSOZvTK18SAczoYm1L","Lil Wayne, Ashanti, Mack Maine","Start This Shit Off Right (feat. Ashanti & Mack Maine)","Young Money Records, Inc.",21,-1,1,"1256903"
22,"spotify:track:1kaxyXcAi5ZHF3Q94QXsHK","Lil Wayne","Demon","Young Money Records, Inc.",22,-1,1,"1241992"
23,"spotify:track:6y4pOReFqH2wzo4CV91cZC","Lil Wayne","Mess","Young Money Records, Inc.",23,-1,1,"1216954"
24,"spotify:track:0s3nnoMeVWz3989MkNQiRf","Juice WRLD","Lucid Dreams","Juice WRLD Mixtape / ISR P&D",1,4,145,"1209155"
25,"spotify:track:68lOQPb5tX8U2cQRuas0L2","Lil Wayne","Used 2","Young Money Records, Inc.",25,-1,1,"1187791"
26,"spotify:track:3QybPutx0Tjk472bBKjNWn","Sheck Wes","Mo Bamba","Cactus Jack Records/ G.O.O.D. Music/ Interscope Records",5,5,64,"1155579"
27,"spotify:track:3BUWNzPWz2mDbptZmGEXpB","Lil Wayne","Let It All Work Out","Young Money Records, Inc.",27,-1,1,"1145876"
28,"spotify:track:2E124GmJRnBJuXbTb4cPUB","6ix9ine, Nicki Minaj, Murda Beatz","FEFE","Scumgang Records/TenThousand Projects, LLC",2,7,69,"1120641"
29,"spotify:track:7cG6SxmQ24hQWnR8UThrk2","Lil Wayne, Nivea","Dope New Gospel (feat. Nivea)","Young Money Records, Inc.",29,-1,1,"1102557"
30,"spotify:track:4E3qImtJzRqLt8ZZyLceOE","Lil Wayne","Perfect Strangers","Young Money Records, Inc.",30,-1,1,"1081091"
31,"spotify:track:0Fpen1PTuEnCmOJtUU9Iud","Lil Uzi Vert","New Patek","Generation Now/Atlantic",1,6,11,"1074845"
32,"spotify:track:2dpaYNEQHiRxtZbfNsse99","Marshmello, Bastille","Happier","Astralwerks",7,9,43,"1035378"
33,"spotify:track:60SdxE8apGAxMiRrpbmLY0","Eminem, Joyner Lucas","Lucky You (feat. Joyner Lucas)","Aftermath",1,8,29,"995698"
34,"spotify:track:0TlLq3lA83rQOYtrqBqSct","Drake","Nonstop","Cash Money/Drake LP6",1,10,92,"946964"
35,"spotify:track:3ee8Jmje8o58CHK66QrVC2","XXXTENTACION","SAD!","Bad Vibes Forever, LLC",1,11,211,"933662"
36,"spotify:track:1BxkZE73h9BN3qwuA15TA3","Lil Baby, Gunna","Drip Too Hard (Lil Baby & Gunna)","Quality Control Music/Young Stoner Life Records, a 300 Entertainment Label/Motown Records/Capitol Records",13,13,17,"925719"
37,"spotify:track:0QIjsbm2fh1cJ45XO9eGqq","Gucci Mane, Bruno Mars, Kodak Black","Wake Up in the Sky","Guwop Enterprises/Atlantic",6,12,15,"872494"
38,"spotify:track:2G7V7zsVDxg1yRsu7Ew9RJ","Drake","In My Feelings","Cash Money/Drake LP6",1,15,92,"865168"
39,"spotify:track:4T3fNx3CgwDRRYgmFCbD4J","Khalid","Better","Right Hand Music Group, LLC/RCA Records",8,14,15,"864699"
40,"spotify:track:0JP9xo3adEtGSdUEISiszL","XXXTENTACION","Moonlight","Bad Vibes Forever, LLC",2,16,197,"837537"
41,"spotify:track:7d6XJZjnm7iWcKwYL9z5kC","Lil Mosey","Noticed","Mogul Vision/Interscope Records",17,17,43,"800876"
42,"spotify:track:6vN77lE9LK6HP2DewaN6HZ","Lil Baby, Drake","Yes Indeed","Quality Control Music, LLC",2,18,137,"795793"
43,"spotify:track:7dt6x5M1jzdTEt8oCbisTK","Post Malone","Better Now","Republic Records",1,19,155,"795337"
44,"spotify:track:4CstQ0SUkl0YkoeZkIZlIx","Logic, Wale, John Lindahl","100 Miles and Running (ft. Wale & John Lindahl)","Def Jam Recordings",44,-1,1,"780151"
45,"spotify:track:5IaHrVsrferBYDm0bDyABy","Tyga, Offset","Taste (feat. Offset)","Last Kings Music / EMPIRE",3,20,134,"772632"
46,"spotify:track:6VDz4m1vEGHDDqQojf1mpc","Logic, Ghostface Killah, Raekwon, RZA, Method Man, Inspectah Deck, Cappadonna, Jackpot Scotty Wotty, U-God, Masta Killa, GZA","Wu Tang Forever (ft. Ghostface Killah, Raekwon, RZA, Method Man, Inspectah Deck, Cappadonna, Jackpot Scotty Wotty, U-God, Masta Killa, GZA)","Def Jam Recordings",46,-1,1,"771137"
47,"spotify:track:0d2iYfpKoM0QCKvcLCkBao","benny blanco, Halsey, Khalid","Eastside (with Halsey & Khalid)","Benny Blanco Solo Album PS",7,21,78,"760139"
48,"spotify:track:2uMTscYuCT3BZ0OCzH3MwN","Kodak Black","If I'm Lyin', I'm Flyin'","Atlantic Records",48,-1,1,"750240"
49,"spotify:track:4ut9fdC5ncgcvCo0KaphNY","Logic, Lucy Rose, The RattPack","Thank You (ft. Lucy Rose & The RattPack)","Def Jam Recordings",49,-1,1,"733562"
50,"spotify:track:2Egoo3acImq7hV6TfYV90E","Logic","Everybody Dies","Def Jam Recordings",46,-1,5,"732508"
51,"spotify:track:1jo3TwNGCXfNdB5uba3ZVv","Eminem","Killshot","Aftermath",16,22,10,"719100"
52,"spotify:track:066QkK1heGoXBUPBbcOhEG","Logic","The Glorious Five","Def Jam Recordings",52,-1,1,"697564"
53,"spotify:track:58q2HKrzhC3ozto2nDdN4z","Cardi B, Bad Bunny, J Balvin","I Like It","Atlantic/KSR",2,23,176,"695380"
54,"spotify:track:1FmdAhS8FqRoEJ4jcSfuKZ","Logic, Jaden","ICONIC (ft. Jaden Smith)","Def Jam Recordings",54,-1,1,"679076"
55,"spotify:track:5ZcMWSpUeUPvO87FkSZbJB","Logic","The Return","Def Jam Recordings",37,-1,16,"677750"
56,"spotify:track:3irKogkH8P1B1nONmEcHgY","Logic","YSIV","Def Jam Recordings",56,-1,1,"659191"
57,"spotify:track:7m9OqQk4RVRkw9JJdeAw96","XXXTENTACION","Jocelyn Flores","Bad Vibes Forever / EMPIRE",2,25,400,"633937"
58,"spotify:track:5lK18Pt33xNudq4qYDxIm8","Lady Gaga, Bradley Cooper","Shallow","A Star is Born OST",58,-1,1,"625806"
59,"spotify:track:0ZNrc4kNeQYD9koZ3KvCsy","YG, 2 Chainz, Big Sean, Nicki Minaj","BIG BANK (feat. 2 Chainz, Big Sean, Nicki Minaj)","Def Jam Recordings",21,27,127,"623539"
60,"spotify:track:7iMDaY1LnASwCk2uUpMtii","Young Thug, Elton John","High (feat. Elton John)","300 Entertainment/Atl",60,69,5,"622522"
61,"spotify:track:7wBJfHzpfI3032CSD7CE2m","Travis Scott","STARGAZING","Cactus Jack / Epic / Grand Hustle",1,26,57,"594965"
62,"spotify:track:04MLEeAMuV9IlHEsD8vF6A","French Montana, Drake","No Stylist (feat. Drake)","Epic",14,28,8,"594504"
63,"spotify:track:1Jl21sidRpEdlVBvYbssLx","Young Thug, Jaden","Sin (feat. Jaden Smith)","300 Entertainment/Atl",24,24,5,"592030"
64,"spotify:track:2zIAPysksDdMAiG33qH6kW","Logic, Hailee Steinfeld","Ordinary Day (ft. Hailee Steinfeld)","Def Jam Recordings",64,-1,1,"589398"
65,"spotify:track:7AQim7LbvFVZJE3O8TYgf2","XXXTENTACION, Trippie Redd","Fuck Love (feat. Trippie Redd)","Bad Vibes Forever / EMPIRE",5,32,400,"566519"
66,"spotify:track:15kQGEy89K8deJcZVFEn0N","The Chainsmokers, Kelsea Ballerini","This Feeling","Disruptor Records/Columbia",33,36,8,"561982"
67,"spotify:track:29tc0GbW0pTSBZSCZF3NWk","Juice WRLD","Lean Wit Me","Juice WRLD Mixtape / ISR P&D",25,30,129,"561676"
68,"spotify:track:14mHfNsSHN0FbLftyjrV9g","Flipp Dinero","Leave Me Alone","Cinematic/Epic/We The Best",29,29,48,"555192"
69,"spotify:track:0XySogm94T51XF5F2jumXm","Juice WRLD","All Girls Are The Same","Juice WRLD Mixtape / ISR P&D",12,33,161,"554079"
70,"spotify:track:7rKKh8AGVXuNXgLBpTBTFH","Logic, Ryan Tedder","One Day (ft. Ryan Tedder)","Def Jam Recordings",20,-1,15,"551281"
71,"spotify:track:4zIO3ilp5HvTeK3HJHxhMP","Imagine Dragons","Natural","Kid Ina Korner / Interscope",21,35,71,"547879"
72,"spotify:track:4OafepJy2teCjYJbvFE60J","Ariana Grande","breathin","Republic Records",4,31,43,"545689"
73,"spotify:track:3swc6WTsr7rl9DqQKQA55C","Post Malone, Ty Dolla $ign","Psycho (feat. Ty Dolla $ign)","Republic Records",1,38,218,"532973"
74,"spotify:track:6DCZcSspjsKoFjzjrWoCdn","Drake","God's Plan","Cash Money/Drake LP6",1,39,252,"528486"
75,"spotify:track:7AFASza1mXqntmGtbxXprO","XXXTENTACION","changes","Bad Vibes Forever, LLC",4,41,211,"525088"
76,"spotify:track:5WvAo7DNuPRmk4APhdPzi8","DJ Khaled, Justin Bieber, Quavo, Chance the Rapper","No Brainer","Epic/We The Best",3,46,64,"524725"
77,"spotify:track:2iUXsYOEPhVqEBwsqP70rE","5 Seconds of Summer","Youngblood","Capitol",12,42,168,"522064"
78,"spotify:track:5N4erncE7kuUccm7zEmwzk","Silk City, Dua Lipa, Diplo, Mark Ronson","Electricity (with Dua Lipa)","Columbia",25,47,22,"508374"
79,"spotify:track:5OCJzvD7sykQEKHH7qAC3C","Ariana Grande","God is a woman","Republic Records",4,43,78,"506504"
80,"spotify:track:0e7ipj03S05BNilyu5bRzt","Post Malone, 21 Savage","rockstar (feat. 21 Savage)","Republic Records",1,44,379,"504776"
81,"spotify:track:3obgSF06ki98lYNLNq5vCB","Juice WRLD, Lil Uzi Vert","Wasted (feat. Lil Uzi Vert)","Juice WRLD Mixtape / ISR P&D",20,37,81,"503034"
82,"spotify:track:7fa9MBXhVfQ8P8Df9OEbD8","Maroon 5, Cardi B","Girls Like You (feat. Cardi B) - Cardi B Version","Interscope Records*",6,48,120,"501188"
83,"spotify:track:7lAK3oHbfEnvUQWosrMMpR","Travis Scott","YOSEMITE","Cactus Jack / Epic / Grand Hustle",7,34,57,"493814"
84,"spotify:track:0Me3TlqFkaIzoZzAGU1EDh","Logic","Street Dreams II","Def Jam Recordings",84,-1,1,"485972"
85,"spotify:track:0UyljEbX9dqI1K0sqdv6B6","Joji","SLOW DANCING IN THE DARK","88rising Music/Warner Records",26,45,17,"469230"
86,"spotify:track:5bJ1DrEM4hNCafcDd1oxHx","Mac Miller","Self Care","Warner Records",4,40,37,"468347"
87,"spotify:track:5N5k9nd479b1xpDZ4usjrg","Calvin Harris, Sam Smith, Jessie Reyez","Promises (with Sam Smith)","Columbia",18,50,43,"466036"
88,"spotify:track:0OgGn1ofaj55l2PcihQQGV","Bryce Vine","Drew Barrymore","Sire",45,57,43,"464655"
89,"spotify:track:2jt2WxXMCD4zjACthkJQVE","Eminem","The Ringer","Aftermath",2,49,29,"461502"
90,"spotify:track:5qHirGR7M9tdm6C17DlzSY","Aminé","REEL IT IN","Republic Records",52,52,23,"460515"
91,"spotify:track:3CA9pLiwRIGtUBiMjbZmRw","Drake","Nice For What","Cash Money/Drake LP6",1,51,175,"459219"
92,"spotify:track:4VUwkH455At9kENOfzTqmF","Bazzi, Camila Cabello","Beautiful (feat. Camila Cabello)","iamcosmic",28,55,57,"454841"
93,"spotify:track:4qKcDkK6siZ7Jp1Jb4m0aL","BlocBoy JB, Drake","Look Alive (feat. Drake)","OVO Sound/Warner Records",2,54,232,"444190"
94,"spotify:track:7noud145AHZGg74vpWOsCa","Ella Mai","Trip","10 Summers / Interscope PS",56,56,30,"442657"
95,"spotify:track:5xE8cBcKRjKEDdJwmh1ixN","Logic, Kajo, Slaydro, Big Lenbo","The Adventures Of Stoney Bob (ft. Kajo, Slaydro, Big Lenbo)","Def Jam Recordings",95,-1,1,"437442"
96,"spotify:track:75ZvA4QfFiZvzhj2xkaWAh","Post Malone","I Fall Apart","Universal Records",2,58,378,"429973"
97,"spotify:track:7ycWLEP1GsNjVvcjawXz3z","A$AP Rocky, Skepta","Praise The Lord (Da Shine) (feat. Skepta)","A$AP Worldwide/Polo Grounds Music/RCA Records",5,59,127,"412865"
98,"spotify:track:2qT1uLXPVPzGgFOx4jtEuo","Ariana Grande","no tears left to cry","Republic Records",6,61,162,"406566"
99,"spotify:track:45Egmo7icyopuzJN0oMEdk","Khalid, Normani","Love Lies (with Normani)","RCA Records Label",8,64,225,"405824"
100,"spotify:track:3EPXxR3ImUwfayaurPi3cm","Dean Lewis","Be Alright","Universal Music Australia Pty. Ltd.",19,53,61,"401693"
101,"spotify:track:0u2P5u6lvoDfwTYjAADbn4","Billie Eilish, Khalid","lovely (with Khalid)","Darkroom",18,65,162,"401382"
102,"spotify:track:5mJAediEZEv8KKpWxrNIqf","Logic","Legacy","Def Jam Recordings",102,-1,1,"399211"
103,"spotify:track:3GVkPk8mqxz0itaAriG1L7","XXXTENTACION","Everybody Dies In Their Nightmares","Bad Vibes Forever / EMPIRE",6,62,395,"398886"
104,"spotify:track:202RUoPIUYZLyg6VtosWci","Logic","Last Call","Def Jam Recordings",104,-1,1,"388519"
105,"spotify:track:7IBSffWIu7P2MC7kMwy2FM","Wiz Khalifa, Swae Lee","Hopeless Romantic (feat. Swae Lee)","Taylor Gang/Atlantic",29,63,87,"387337"
106,"spotify:track:5a8RPWgKSmcGBGcffmIrUi","Sia, Diplo, Labrinth, LSD","Thunderclouds (feat. Sia, Diplo, and Labrinth)","Records/Columbia",41,68,50,"386587"
107,"spotify:track:4mHgYpuGHu99Mw69E83CP2","Trippie Redd","Taking A Walk","TenThousand Projects, LLC",6,60,54,"386390"
108,"spotify:track:7sO5G9EABYOXQKNPNiE9NR","Offset, Metro Boomin","Ric Flair Drip (with Metro Boomin)","Slaughter Gang, LLC/Epic/Quality Control Music/Motown/Capitol/Boominati Worldwide/Republic",4,71,333,"374170"
109,"spotify:track:1rqqCSm0Qe4I9rUvWncaom","Panic! At The Disco","High Hopes","DCD2 / Fueled By Ramen",33,70,109,"372431"
110,"spotify:track:2hnxrRNzF74mdDzpQZQukQ","Lauv, Julia Michaels","There's No Way (feat. Julia Michaels)","Lauv",110,-1,1,"372374"
111,"spotify:track:3V8UKqhEK5zBkBb6d6ub8i","Nio Garcia, Casper Magico, Bad Bunny, Darell, Ozuna, Nicky Jam","Te Boté - Remix","2018 Flow La Movie, Inc.",35,75,166,"371592"
112,"spotify:track:575NJxNUVDqwJGdzBrlLbv","Shawn Mendes, Zedd","Lost In Japan - Remix","Island Records",16,-1,51,"370246"
113,"spotify:track:6jreFSOTUAViWjKyzOC4Kg","Alesso","REMEDY","10:22 pm",58,67,24,"366444"
114,"spotify:track:33tNYw9oMtSkGe27NpgS64","Quavo","WORKIN ME","Quality Control Music/Motown Records/Capitol Records",32,66,50,"365386"
115,"spotify:track:7GX5flRQZVHRAGd6B4TmDO","Lil Uzi Vert","XO Tour Llif3","Generation Now/Atlantic",1,72,554,"364721"
116,"spotify:track:7ATATJztoWLcqDAcVVof0C","6ix9ine, Anuel AA","BEBE","Scumgang Records/TenThousand Projects, LLC",34,80,29,"359418"
117,"spotify:track:2iicKPnvOKfbJZJZtuQnjy","Juicy J, Travis Scott","Neighbor (feat. Travis Scott)","Columbia",117,-1,1,"358212"
118,"spotify:track:43TP6JCWXgkc2D7Xjz5hBr","Machine Gun Kelly","RAP DEVIL","Bad Boy / Interscope",36,73,20,"353248"
119,"spotify:track:6Hgh47WXVKtXN5zGOu0hjI","Khalid, 6LACK, Ty Dolla $ign","OTW","Right Hand Music Group, LLC/RCA Records",17,76,162,"347348"
120,"spotify:track:1RagpNpkD3KcjXMLGMe99V","Wiz Khalifa, Lil Skies","Fr Fr (feat. Lil Skies)","Taylor Gang/Atlantic",45,74,62,"345488"
121,"spotify:track:1ZAyjvIk9YiD76yYy0TEG6","Rich The Kid","Plug Walk","Rich The Kid / (TDE/ISR PS)",6,78,232,"344390"
122,"spotify:track:4kWO6O1BUXcZmaxitpVUwp","Tiësto, Dzeko, Preme, Post Malone","Jackie Chan","Universal Music, a division of Universal International Music BV",18,84,134,"343071"
123,"spotify:track:6eYxmK9fdL4hwLnXG2zY3s","XXXTENTACION","Look At Me!","Bad Vibes Forever / EMPIRE",20,86,469,"342200"
124,"spotify:track:2ZRo7axmMPeSVUvDbGkJah","XXXTENTACION","Hope","Bad Vibes Forever, LLC",10,82,138,"339491"
125,"spotify:track:7oJrVhiTPZGBXWPwhxjy9S","Lil Skies","Lust","All We Got Ent.",75,81,236,"337194"
126,"spotify:track:2P91MQbaiQOfbiz9VqhqKQ","Lauv","I Like Me Better","Lauv",30,85,477,"333459"
127,"spotify:track:28FGV3ORH14MYORd7s5dlU","Eminem, Royce Da 5'9""","Not Alike (feat. Royce Da 5'9)","Aftermath",5,77,29,"328757"
128,"spotify:track:58QhkbaAkLFnn7JwAnAato","Eminem","Fall","Aftermath",8,79,29,"328704"
129,"spotify:track:4e4fqjx0Izh4svvTef1z7e","Bebe Rexha, Florida Georgia Line","Meant to Be (feat. Florida Georgia Line)","Warner Bros.",15,88,385,"328615"
130,"spotify:track:2Yer0p7uB2lVBUAtANuuQp","Social House, Lil Yachty","Magic In The Hamptons (feat. Lil Yachty)","Silent Records / Social House",76,89,44,"326420"
131,"spotify:track:4UKCKdYiLN6IMA5ZESUTL7","XXXTENTACION","the remedy for a broken heart (why am I so in love)","Bad Vibes Forever, LLC",8,87,164,"322011"
132,"spotify:track:3a1lNhkSLSkpJE4MSHpDu9","Post Malone, Quavo","Congratulations","Universal Records",5,92,636,"309981"
133,"spotify:track:7rC5Pl8rQSX4myONQHYPBK","Drake","Mob Ties","Cash Money/Drake LP6",5,83,92,"307948"
134,"spotify:track:3qN5qMTKyEEmiTZD38BNTT","Drake","I'm Upset","Cash Money/Drake LP6",4,90,125,"305742"
135,"spotify:track:4DTpngLjoHj5gFxEZFeD3J","Kodak Black, Lil Wayne","Codeine Dreaming (feat. Lil Wayne)","Atlantic Records",10,-1,214,"305638"
136,"spotify:track:6IaieqiCVvsNvEt6Y7yOFa","Post Malone, Nicki Minaj","Ball For Me (feat. Nicki Minaj)","Republic Records",8,99,155,"304547"
137,"spotify:track:7KXjTSCq5nL1LoYtL7XAwS","Kendrick Lamar","HUMBLE.","Aftermath",1,94,547,"300526"
138,"spotify:track:1Knctxx9vGZxpZfF66BIEa","Juice WRLD","Legends","Juice WRLD / Interscope PS",67,91,99,"300071"
139,"spotify:track:0At2qAoaVjIwWNAqrscXli","Ella Mai","Boo'd Up","10 Summers / Interscope PS",24,102,140,"295323"
140,"spotify:track:7uzmGiiJyRfuViKKK3lVmR","Bazzi","Mine","iamcosmic",3,98,257,"294662"
141,"spotify:track:5Z3GHaZ6ec9bsiI5BenrbY","Khalid","Young Dumb & Broke","Right Hand Music Group, LLC/RCA Records",5,101,542,"294473"
142,"spotify:track:5PTG6rrL6EPFD9E2QMI2pl","Famous Dex","JAPAN","300 Entertainment",11,100,197,"293545"
143,"spotify:track:48zFZh27QU5qsrBjn4C2FA","Ozuna, Manuel Turizo","Vaina Loca","VP Records Corp/Dimelo Vi",49,103,39,"292011"
144,"spotify:track:32lItqlMi4LBhb4k0BaSaC","Post Malone","Candy Paint","Republic Records",4,105,491,"291241"
145,"spotify:track:6ScJMrlpiLfZUGtWp4QIVt","Lil Wayne","A Milli","CM/Republic",145,-1,1,"290548"
146,"spotify:track:2XTquzYQAdT1Hk78bOUwsv","Eminem","Greatest","Aftermath",3,93,29,"287386"
147,"spotify:track:2u7mxWSeoqTXndK5e08jMp","Lil Skies, Landon Cube","Nowadays (feat. Landon Cube)","All We Got Ent.",24,106,273,"285481"
148,"spotify:track:4hQ6UGyWQIGJmHSo0J88JW","Selena Gomez","Back To You - From 13 Reasons Why – Season 2 Soundtrack","UMGRI Interscope",15,110,141,"283995"
149,"spotify:track:6n4U3TlzUGhdSFbUUhTvLP","Migos, Drake","Walk It Talk It","Quality Control Music, LLC",3,111,246,"281144"
150,"spotify:track:40oKW22ZNNkEdZLJTScaQI","Kodak Black, XXXTENTACION","Roll in Peace (feat. XXXTENTACION)","Atlantic Records",21,118,398,"279168"
151,"spotify:track:6gBFPUFcJLzWGx4lenP6h2","Travis Scott","goosebumps","Epic/Grand Hustle",16,108,636,"278525"
152,"spotify:track:1co0puPTYvqAdUEjFOjne9","Florida Georgia Line","Simple","BMLG Records",50,115,120,"277414"
153,"spotify:track:6xcJyGpfZbuuiequtnlKt4","Travis Scott","BUTTERFLY EFFECT","Cactus Jack / Epic / Grand Hustle",9,104,497,"277337"
154,"spotify:track:09IStsImFySgyp0pIQdqAc","Zedd, Maren Morris, Grey","The Middle","UMGRI Interscope",5,122,247,"276636"
155,"spotify:track:6yz0Jndhv0QjKdpcEMbOjz","Trippie Redd","Shake It Up","TenThousand Projects, LLC",42,96,50,"274440"
156,"spotify:track:2SL6oP2YAEQbqsrkOzRGO4","Eminem","Venom - Music From The Motion Picture","Aftermath",17,123,29,"268974"
157,"spotify:track:6f5i916F3jU6BhOOD7iGqf","MadeinTYO, A$AP Ferg","Ned Flanders (feat. A$AP Ferg)","Commission/BMG",64,114,77,"268701"
158,"spotify:track:5gQcxYXqnofyocKgEbGYKt","YBN Nahmir","Bounce Out With That","2018",27,126,239,"268638"
159,"spotify:track:1BuZAIO8WZpavWVbbq3Lci","Rae Sremmurd, Swae Lee, Slim Jxmmi, Juicy J","Powerglide (feat. Juicy J) - From SR3MM","Mike WiLL Made-It",15,121,212,"268253"
160,"spotify:track:0kCBorRrKZkSztd9m0QI3r","Young Thug, Young Stoner Life, Gunna, Lil Baby","Chanel (Go Get It) [feat. Gunna & Lil Baby]","300 Entertainment/Atl",30,97,43,"267782"
161,"spotify:track:0z5ZPs57J2KERwM1tBM2GF","Lil Wayne, Cory Gunz","6 Foot 7 Foot","CM/Republic",161,-1,1,"267738"
162,"spotify:track:0dSIrRkA4PadGll16TgbnV","Famous Dex, A$AP Rocky","PICK IT UP (feat. A$AP Rocky)","300 Entertainment",13,127,337,"265469"
163,"spotify:track:3ZhTT6yjZwpPph5MIJ53XY","Lil Skies, Landon Cube","Red Roses (feat. Landon Cube)","All We Got Ent.",36,124,270,"264913"
164,"spotify:track:0ibOcbkp2XG46Do8jcy0bL","Smokepurpp, Lil Pump","Nephew (feat. Lil Pump)","Alamo",75,120,63,"264233"
165,"spotify:track:0E9ZjEAyAwOXZ7wJC0PD33","Dynoro, Gigi D'Agostino","In My Mind","Columbia/B1 Recordings",50,109,67,"263666"
166,"spotify:track:1gm616Plq4ScqNi7TVkZ5N","The Weeknd","Call Out My Name","Universal Republic Records",1,117,183,"262037"
167,"spotify:track:55GiOwtxNajXVbpjjIzMnD","Tyga","SWISH","Last Kings Music / EMPIRE",23,128,65,"261261"
168,"spotify:track:7K7MUBCnzgBAvMVW2RTWNs","Loud Luxury, Brando","Body","Armada Music",22,133,106,"259585"
169,"spotify:track:1zB4vmk8tFRmM9UULNzbLB","Imagine Dragons","Thunder","Kid Ina Korner / Interscope",16,141,519,"258654"
170,"spotify:track:04ZTP5KsCypmtCmQg5tH9R","Bebe Rexha","I'm a Mess","Warner Bros.",63,134,99,"258161"
171,"spotify:track:152lZdxL1OR0ZMW6KquMif","Khalid","Location","Right Hand Music Group, LLC/RCA Records",9,131,635,"257070"
172,"spotify:track:2gsNpSn7VvvJuSrIDfRoYy","Eminem","Kamikaze","Aftermath",8,125,29,"256855"
173,"spotify:track:7eBqSVxrzQZtK2mmgRG6lC","YNW Melly","Murder On My Mind","P2018",111,130,8,"256812"
174,"spotify:track:3ngc7rGlfeFaskU90EWl4R","Lauren Daigle","You Say","Centricity Music/Warner Records",116,116,12,"255557"
175,"spotify:track:3qnoOm4fwZPBS116f5hpgF","Kanye West","All Mine","Getting Out Our Dreams, Inc./Def Jam Recordings",1,137,119,"254532"
176,"spotify:track:42fw0rxRO2xbesF6mJfd4Y","Dan + Shay","Tequila","Warner Records",48,142,217,"253227"
177,"spotify:track:5Xn4IyTtW6FUGIUyWjbUHG","Jason Derulo, David Guetta, Nicki Minaj, Willy William","Goodbye (feat. Nicki Minaj & Willy William)","Beluga Heights/Warner Records",85,113,22,"251974"
178,"spotify:track:5tz69p7tJuGPeMGwNTxYuV","Logic, Alessia Cara, Khalid","1-800-273-8255","Def Jam Recordings",1,160,518,"250136"
179,"spotify:track:2UVbBKQOdFAekPTRsnkzcf","Migos","Stir Fry","Quality Control Music, LLC",2,143,281,"250075"
180,"spotify:track:1HXy5I3HTWq8OvxCn0z7G7","Kane Brown","Heaven","RCA Records Label Nashville",51,139,257,"249878"
181,"spotify:track:2rxQMGVafnNaRaXlRMWPde","Luke Combs","Beautiful Crazy","River House Artists/Columbia Nashville",103,132,117,"249022"
182,"spotify:track:0pqnGHJpmpxLKifKRmU6WP","Imagine Dragons","Believer","Kid Ina Korner / Interscope",9,150,604,"248918"
183,"spotify:track:0wbnC9AUenxp613TYaJsGK","Migos","Narcos","Quality Control Music, LLC",2,140,207,"248101"
184,"spotify:track:4dASQiO1Eoo3RJvt74FtXB","Lil Wayne, Wiz Khalifa, Imagine Dragons, X Ambassadors, Logic, Ty Dolla $ign","Sucker for Pain (with Wiz Khalifa, Imagine Dragons, Logic & Ty Dolla $ign feat. X Ambassadors)","Atlantic Records",59,-1,154,"246623"
185,"spotify:track:2BJSMvOGABRxokHKB0OI8i","Playboi Carti, Lil Uzi Vert","Shoota (feat. Lil Uzi Vert)","AWGE Label",23,136,141,"243622"
186,"spotify:track:2bSk87AVkCIIC3Bcligq1z","Lil Baby, Gunna, Lil Uzi Vert","Life Goes On","Quality Control Music, LLC",87,138,134,"241514"
187,"spotify:track:5S1IUPueD0xE0vj4zU3nSf","2 Chainz, Drake, Quavo","Bigger Than You (feat. Drake & Quavo)","Def Jam Recordings",14,147,106,"241321"
188,"spotify:track:0chpIFSjgfd1CPrAxM7PWp","Lil Skies","No Rest","All We Got Ent.",103,135,43,"240630"
189,"spotify:track:51rXHuKN8Loc4sUlKPODgH","Jay Rock, Kendrick Lamar, Future, James Blake","King's Dead (with Kendrick Lamar, Future & James Blake)","Black Panther (TDE/DMG) PS",7,154,260,"239287"
190,"spotify:track:4vaxvNDaLSoD36iZX515ug","Lil Xan","Betrayed","Columbia",21,145,348,"237423"
191,"spotify:track:41zXlQxzTi6cGAjpOXyLYH","Billie Eilish","idontwannabeyouanymore","Darkroom",129,146,73,"236789"
192,"spotify:track:2fQrGHiQOvpL9UgPvtYy6G","21 Savage","Bank Account","Slaughter Gang, LLC/Epic Records",1,155,449,"236329"
193,"spotify:track:3GJ4hzg4lrGwU51Y3VARbF","Dan + Shay","Speechless","Warner Records",132,174,44,"235504"
194,"spotify:track:1rfofaqEpACxVEHIZBJe6W","Camila Cabello, Young Thug","Havana (feat. Young Thug)","Syco Music/Epic",2,165,420,"234984"
195,"spotify:track:52okn5MNA47tk87PeZJLEL","NF","Let You Down","NF Real Music",9,152,355,"231824"
196,"spotify:track:3GCdLUSnKSMJhs4Tj6CV3s","Kendrick Lamar, SZA","All The Stars (with SZA)","Black Panther (TDE/DMG) PS",2,156,268,"231709"
197,"spotify:track:2eAZfqOm4EnOF9VvN50Tyc","Lil Uzi Vert, Oh Wonder","The Way Life Goes (feat. Oh Wonder)","Generation Now/Atlantic",4,148,395,"231559"
198,"spotify:track:4dVpf9jZjcORqGTLUaeYj9","A$AP Ferg","Plain Jane","RCA Records Label",6,158,396,"231374"
199,"spotify:track:2374M0fQpWi3dLnB54qaLX","TOTO","Africa","Columbia",126,178,163,"231067"
200,"spotify:track:6KBYefIoo7KydImq1uUQlL","Cardi B","Bodak Yellow","Atlantic/KSR",2,176,431,"229371"
