rank,uri,artist_names,track_name,source,peak_rank,previous_rank,days_on_chart,streams
1,"spotify:track:4Oun2ylbjFKMPTiaSbbCih","Cardi B, Megan Thee Stallion","WAP (feat. Megan Thee Stallion)","Atlantic/KSR",1,1,30,"2583856"
2,"spotify:track:2SAqBLGA283SUiwJ3xOUVI","Drake, Lil Durk","Laugh Now Cry Later (feat. Lil Durk)","OVO",2,3,23,"1570585"
3,"spotify:track:3tjFYV6RSFtuktYl3ZtYcq","24kGoldn, iann dior","Mood (feat. iann dior)","Records/Columbia",2,2,30,"1563445"
4,"spotify:track:0PvFJmanyNQMseIFrU708S","Pop Smoke, Lil Baby, DaBaby","For The Night (feat. Lil Baby & DaBaby)","Victor Victor Worldwide",2,4,65,"1124489"
5,"spotify:track:7ytR5pFWmSjzHJIeQkgog4","DaBaby, Roddy Ricch","ROCKSTAR (feat. Roddy Ricch)","South Coast Music Group/Interscope Records",1,6,142,"1051487"
6,"spotify:track:2DQNYMRjisN3KAPj1bEwOI","Internet Money, Gunna, Don Toliver, NAV","Lemonade (feat. Gunna, Don Toliver & NAV)","Internet Money Records/ TenThousand Projects",6,7,23,"942927"
7,"spotify:track:2MbdDtCv5LUVjYy9RuGTgC","Jack Harlow, Tory Lanez, DaBaby, Lil Wayne","WHATS POPPIN (feat. DaBaby, Tory Lanez & Lil Wayne) - Remix","Generation Now/Atlantic",2,8,74,"929003"
8,"spotify:track:2U5WueTLIK5WJLD7mvDODv","Juice WRLD","Wishing Well","Grade A Productions/Interscope Records",1,9,58,"866279"
9,"spotify:track:6UelLqGlWMcVH1E5c4H7lY","Harry Styles","Watermelon Sugar","Columbia",3,13,294,"851189"
10,"spotify:track:2Y0wPrPQBrGhoLn14xRYCG","Juice WRLD, Marshmello","Come & Go (with Marshmello)","Grade A Productions/Interscope Records",1,11,59,"840914"
11,"spotify:track:4xqrdfXkTW4T0RauPLv3WA","Conan Gray","Heather","Republic Records",10,10,60,"824170"
12,"spotify:track:0VjIjW4GlUZAMYd2vXMi3b","The Weeknd","Blinding Lights","Republic Records",1,15,282,"812922"
13,"spotify:track:5rZlwNFl01HqLWBQGryKSm","Pop Smoke, Lil Tjay","Mood Swings (feat. Lil Tjay)","Victor Victor Worldwide",9,16,65,"795824"
14,"spotify:track:6EDO9iiTtwNv6waLwa1UUq","DJ Khaled, Drake","POPSTAR (feat. Drake)","OVO/We The Best/Epic",1,20,51,"786777"
15,"spotify:track:0t1kP63rueHleOhQkYSXFY","BTS","Dynamite","BIGHIT MUSIC",3,14,16,"782973"
16,"spotify:track:6wQlQrTY5mVS8EGaFZVwVF","Juice WRLD, The Weeknd","Smile (with The Weeknd)","Grade A Productions/Interscope Records",2,18,30,"732989"
17,"spotify:track:7Bar1kLTmsRmH6FCKKMEyU","SZA, The Neptunes, Pharrell Williams, Ty Dolla $ign","Hit Different","Top Dawg Entertainment/RCA Records",5,5,2,"728457"
18,"spotify:track:22LAwLoDA5b4AaGSkg6bKW","Lil Mosey","Blueberry Faygo","Mogul Vision/Interscope Records",2,19,212,"687401"
19,"spotify:track:1xQ6trAsedVPCdbtDAmk0c","Jawsh 685, Jason Derulo","Savage Love (Laxed - Siren Beat)","Columbia",7,21,84,"666242"
20,"spotify:track:4VLTxHOyFX5FRtkpsFm5Pc","Big Sean, Travis Scott","Lithuania (feat. Travis Scott)","Getting Out Our Dreams, Inc./Def Jam Recordings",12,12,2,"639605"
21,"spotify:track:33gwZOGJWEZ7dRWPqPxBEZ","Big Sean, Post Malone","Wolves (feat. Post Malone)","Getting Out Our Dreams, Inc./Def Jam Recordings",17,17,2,"617591"
22,"spotify:track:35RJhm1pEovTBwnNR0zWad","DJ Khaled, Drake","GREECE (feat. Drake)","OVO/We The Best/Epic",9,29,51,"597796"
23,"spotify:track:1IIKrJVP1C9N7iPtG6eOsK","Chris Brown, Young Thug","Go Crazy","Chris Brown Entertainment/300 Entertainment/RCA Records",20,27,96,"597434"
24,"spotify:track:2Wo6QQD1KMDWeFkkjLqwx5","SAINt JHN, Imanbek","Roses - Imanbek Remix","HITCO",5,30,195,"591350"
25,"spotify:track:70rFIfYN7lU6iTgUIVP42w","Machine Gun Kelly, blackbear","my ex's best friend (with blackbear)","Bad Boy/Interscope Records",21,24,30,"576479"
26,"spotify:track:2J4P46vCFm1rPkNkp9pZWX","BLACKPINK, Selena Gomez","Ice Cream (with Selena Gomez)","YG Entertainment/Interscope Records",5,23,9,"562750"
27,"spotify:track:1H7KnK26kc1YyellpbINEn","Pop Smoke, 50 Cent, Roddy Ricch","The Woo (feat. 50 Cent & Roddy Ricch)","Victor Victor Worldwide",3,28,65,"562250"
28,"spotify:track:1yoMvmasuxZfqHEipJhRbp","Maluma","Hawái","Sony Music Latin",27,37,17,"530403"
29,"spotify:track:0Z0kNthq0sS4lvGz9SSlBF","Morgan Wallen","7 Summers","Big Loud / Republic",3,33,23,"527233"
30,"spotify:track:27ycaQnQAxaPiyeg3nr2aB","Miley Cyrus","Midnight Sky","RCA Records Label",5,34,23,"518383"
31,"spotify:track:0nbXyq5TXYPCO7pr3N8S4I","Roddy Ricch","The Box","Atlantic Records",1,40,275,"504411"
32,"spotify:track:5f1joOtoMeyppIcJGZQvqJ","Kane Brown, Swae Lee, Khalid","Be Like That - feat. Swae Lee & Khalid","RCA Records Label Nashville",27,38,58,"503367"
33,"spotify:track:2rFsFjq0D9JAmc0APpCO6P","Internet Money, Trippie Redd, Diplo, Juice WRLD","Blastoff (feat. Juice Wrld & Trippie Redd)","Internet Money Records/ TenThousand Projects",13,32,9,"500109"
34,"spotify:track:3IJYUaN3tx04S4TYyZHKoP","StaySolidRocky","Party Girl","Columbia",2,39,119,"493060"
35,"spotify:track:285pBltuF7vW8TeWk8hdRR","Juice WRLD","Lucid Dreams","Juice WRLD Mixtape / ISR P&D",1,45,853,"477654"
36,"spotify:track:21jGcNKet2qwijlDFuPiPb","Post Malone","Circles","Republic Records",1,44,373,"477340"
37,"spotify:track:0RiRZpuVRbi7oqRdSMwhQY","Post Malone, Swae Lee","Sunflower - Spider-Man: Into the Spider-Verse","Republic Records",1,50,689,"470067"
38,"spotify:track:3nS9a01VvXHQriLqJYwRqG","Gunna, Young Thug","DOLLAZ ON MY HEAD (feat. Young Thug)","300 Entertainment",10,46,107,"467960"
39,"spotify:track:6Hj9jySrnFppAI0sEMCZpJ","Juice WRLD","Robbery","Grade A Productions/Interscope Records",2,47,570,"460174"
40,"spotify:track:45bE4HXI0AwGZXfZtMp8JR","Tate McRae","you broke me first","RCA Records Label",37,42,52,"454602"
41,"spotify:track:6gxKUmycQX7uyMwJcweFjp","Lil Baby, 42 Dugg","We Paid (feat. 42 Dugg)","Quality Control/Motown Records",9,59,100,"444673"
42,"spotify:track:25zlnOAzbVoOzIeXSvQFf1","Pop Smoke","Got It On Me","Victor Victor Worldwide",14,56,65,"443706"
43,"spotify:track:4VXIryQMWpIdGgYR4TrjT1","Juice WRLD","All Girls Are The Same","Juice WRLD Mixtape / ISR P&D",5,54,863,"442580"
44,"spotify:track:4K06PO78fW4mnBVenxGNob","Juice WRLD","Conversations","Grade A Productions/Interscope Records",1,52,58,"435004"
45,"spotify:track:0ada5XsQGLPUVbmTCkAP49","Juice WRLD, Marshmello, The Kid LAROI, Polo G","Hate The Other Side (with Marshmello & The Kid Laroi)","Grade A Productions/Interscope Records",4,53,58,"434956"
46,"spotify:track:1VLtjHwRWOVJiE5Py7JxoQ","Polo G","Martin & Gina","Columbia",46,55,36,"433908"
47,"spotify:track:7ju97lgwC2rKQ6wwsf9no9","Lady Gaga, Ariana Grande","Rain On Me (with Ariana Grande)","Interscope",1,57,107,"432495"
48,"spotify:track:0wYOlCybpxFc2azWLyYj0S","WhoHeem","Lets Link","Arista Records/Columbia Records",37,49,8,"432468"
49,"spotify:track:0z36JaXXoFXuPuQucKEsdx","Big Sean","ZTFO","Getting Out Our Dreams, Inc./Def Jam Recordings",35,35,2,"430814"
50,"spotify:track:4Hpib09wXgD84w4uwTPnYD","Saweetie","Tap In","ICY/Artistry Records/Warner Records",25,68,59,"428736"
51,"spotify:track:7eJMfftS33KTjuF7lTsMCx","Powfu, beabadoobee","death bed (coffee for your head)","Columbia",9,60,206,"427610"
52,"spotify:track:2GiJYvgVaD2HtM8GqD9EgQ","BØRNS","Electric Love","UMGRI Interscope",39,58,73,"424398"
53,"spotify:track:6WbTTAGKrQtCQvmc5BuYfh","Megan Thee Stallion","Girls in the Hood","300 Entertainment",23,66,72,"420926"
54,"spotify:track:58AGoOGbwsQMhBbH0eFLRR","Calvin Harris, The Weeknd","Over Now (with The Weeknd)","Columbia",4,48,9,"419576"
55,"spotify:track:3H7ihDc1dqLriiWXwsc2po","Topic, A7S","Breaking Me","Virgin",51,67,108,"414323"
56,"spotify:track:527k23H0A4Q0UJN3vGs0Da","Don Toliver","After Party","We Run It Ent./Cactus Jack/Atlantic",11,65,155,"413606"
57,"spotify:track:3JKgcAa7r07ocVWcV8bS0H","Polo G","21","Columbia",37,64,111,"411153"
58,"spotify:track:466cKvZn1j45IpxDdYZqdA","Drake","Toosie Slide","OVO",1,73,156,"410526"
59,"spotify:track:5woaU1FNkqCwg6WzWiQPW5","Saweetie, Post Malone, DaBaby, Jack Harlow","Tap In (feat. Post Malone, DaBaby & Jack Harlow)","ICY/Artistry Records/Warner Records",25,25,8,"408968"
60,"spotify:track:5dOxHHMOFAbG3VH23t0xNm","Juice WRLD","Righteous","Grade A Productions/Interscope Records",2,61,135,"407925"
61,"spotify:track:6N22FZs2ZhPBYi3b9XPajV","Labrinth","Still Don't Know My Name","Masterworks",51,63,30,"395383"
62,"spotify:track:2CDcXWYWilHTXrsOXJza8n","Big Sean, Nipsey Hussle","Deep Reverence (feat. Nipsey Hussle)","Getting Out Our Dreams, Inc./Def Jam Recordings",26,26,9,"393211"
63,"spotify:track:0EhpEsp4L0oRGM0vmeaN5e","J Balvin, Dua Lipa, Bad Bunny, Tainy","UN DIA (ONE DAY) (Feat. Tainy)","Universal Music Latino/ NEON16",36,75,44,"390776"
64,"spotify:track:5v4GgrXPMghOnBBLmveLac","Megan Thee Stallion, Beyoncé","Savage Remix (feat. Beyoncé)","300 Entertainment",2,80,130,"389871"
65,"spotify:track:5cpJFiNwYyWwFLH0V6B3N8","Ozuna, Doja Cat, Sia","Del Mar","Aura Music Corp.",51,51,2,"389613"
66,"spotify:track:2gMXnyrvIjhVBUZwvLZDMP","Lewis Capaldi","Before You Go","Vertigo Berlin",40,62,289,"385925"
67,"spotify:track:3jjujdWJ72nww5eGnfs2E7","Harry Styles","Adore You","Columbia",1,70,275,"384264"
68,"spotify:track:0xUvi7wldroBzaZCengPa5","Money Man, Lil Baby","24 (feat. Lil Baby)","Black Circle / EMPIRE",67,76,23,"378063"
69,"spotify:track:1jaTQ3nqY3oAAYyCTbIvnM","Jack Harlow","WHATS POPPIN","Generation Now/Atlantic",6,78,226,"376429"
70,"spotify:track:1K5KBOgreBi5fkEHvg5ap3","Future, Drake","Life Is Good (feat. Drake)","Epic/Freebandz",2,85,240,"374393"
71,"spotify:track:2rPHUAeUPbNgTmK18FPTiZ","The Kid LAROI, Juice WRLD","GO (feat. Juice WRLD)","Columbia",12,71,86,"374151"
72,"spotify:track:1Cv1YLb4q0RzL6pybtaMLo","Surfaces","Sunday Best","Surfaces, LLC / TenThousand Projects, LLC",13,87,232,"371784"
73,"spotify:track:6foY66mWZN0pSRjZ408c00","Morgan Wallen","Whiskey Glasses","Big Loud Records",58,90,514,"366950"
74,"spotify:track:0qJeyYAgv6UpvewUxRXAhb","Rod Wave, Lil Baby","Rags2Riches 2 (feat. Lil Baby)","Alamo",22,79,30,"363278"
75,"spotify:track:7qEHsqek33rTcFNT9PFqLf","Lewis Capaldi","Someone You Loved","Vertigo Berlin",5,74,496,"361900"
76,"spotify:track:2mt1IqcFyY1zmYZT8Q3xw9","blackbear","hot girl bummer","Alamo",5,83,380,"357911"
77,"spotify:track:6gBFPUFcJLzWGx4lenP6h2","Travis Scott","goosebumps","Epic/Grand Hustle",8,92,1326,"355304"
78,"spotify:track:46hDiH4YvAWXE04GskkIHS","Big Sean","Why Would I Stop?","Getting Out Our Dreams, Inc./Def Jam Recordings",22,22,2,"354952"
79,"spotify:track:2QqJTIlGKRLJC3onkavYEz","Polo G, Juice WRLD","Flex (feat. Juice WRLD)","Columbia",18,84,114,"353678"
80,"spotify:track:79s5XnCN4TJKTVMSmOx8Ep","Pop Smoke","Dior","Victor Victor Worldwide/Republic Records",15,98,186,"353129"
81,"spotify:track:6FniJZn4agmDtPx1pKZQsa","Morgan Wallen","More Than My Hometown","Big Loud / Republic",39,88,134,"352317"
82,"spotify:track:44gRhRi2OhEf7moAUj6MD1","Lil Baby","The Bigger Picture","Quality Control Music/Motown Records",3,93,86,"350573"
83,"spotify:track:39Yp9wwQiSRIDOvrVg7mbk","THE SCOTTS, Travis Scott, Kid Cudi","THE SCOTTS","Cactus Jack / Epic",1,97,135,"349366"
84,"spotify:track:4R2kfaDFhslZEMJqAFNpdd","Taylor Swift","cardigan","Taylor Swift",1,72,44,"346556"
85,"spotify:track:696DnlkuDOXcMAnKlTgXXK","Arizona Zervas","ROXANNE","Arizona Zervas",1,106,316,"338980"
86,"spotify:track:2D0dj3hVkRQJCp63cxCPEx","Curtis Waters, Harm Franklin","Stunnin' (feat. Harm Franklin)","BMG Rights Management (US) LLC",57,101,79,"337424"
87,"spotify:track:23XTYrwfHXY8H1PuQYJbDA","Big Sean","Harder Than My Demons","Getting Out Our Dreams, Inc./Def Jam Recordings",31,31,5,"332178"
88,"spotify:track:3QzAOrNlsabgbMwlZt7TAY","Mustard, Roddy Ricch","Ballin' (with Roddy Ricch)","10 Summers Records/Interscope Records",10,104,401,"329940"
89,"spotify:track:3eekarcy7kvN4yt5ZFzltW","Travis Scott","HIGHEST IN THE ROOM","Cactus Jack / Epic",1,110,338,"329734"
90,"spotify:track:2rRJrJEo19S2J82BDsQ3F7","Trevor Daniel","Falling","Alamo",4,100,299,"328178"
91,"spotify:track:6Gg1gjgKi2AK4e0qzsR7sd","Juice WRLD, YoungBoy Never Broke Again","Bandit (with YoungBoy Never Broke Again)","Grade A Productions/Interscope Records",2,105,338,"328085"
92,"spotify:track:2ygvZOXrIeVL4xZmAWJT2C","Billie Eilish","my future","Darkroom/Interscope Records",1,95,37,"325190"
93,"spotify:track:5MwynWK9s4hlyKHqhkNn4A","Morgan Wallen","Chasin' You","Big Loud Records",47,109,194,"324360"
94,"spotify:track:1Z0cZI0UzNbP9L8MzzGxqf","NLE Choppa, Roddy Ricch","Walk Em Down (feat. Roddy Ricch)","Warner Records",12,112,170,"324084"
95,"spotify:track:1ENdcyhqdylaLsPVgB83qq","Rod Wave, ATR Son Son","Rags2Riches (feat. ATR Son Son)","Alamo",13,108,70,"323379"
96,"spotify:track:4iHSE5R1U8jf84tRn52xRt","iann dior, Lil Baby","Prospect (ft. Lil Baby)","TenThousand Projects, LLC",31,103,94,"319641"
97,"spotify:track:2HbKqm4o0w5wEeEFXm2sD4","Kendrick Lamar, Jay Rock","Money Trees","Aftermath",84,107,36,"316609"
98,"spotify:track:7aGyRfJWtLqgJaZoG9lJhE","salem ilese","Mad at Disney","Homemade Projects, LLC / TenThousand Projects",98,118,3,"314617"
99,"spotify:track:4wVOKKEHUJxHCFFNUWDn0B","Drake, Giveon","Chicago Freestyle (feat. Giveon)","OVO",4,119,128,"312082"
100,"spotify:track:4pvb0WLRcMtbPGmtejJJ6y","Taylor Swift, Bon Iver","exile (feat. Bon Iver)","Taylor Swift",2,89,44,"308118"
101,"spotify:track:57RA3JGafJm5zRtKJiKPIm","Wallows, Clairo","Are You Bored Yet? (feat. Clairo)","Atlantic Records",54,111,117,"306655"
102,"spotify:track:1rgnBhdG2JDFTbYkYRZAku","Tones And I","Dance Monkey","Elektra (NEK)",6,125,403,"306409"
103,"spotify:track:4umIPjkehX1r7uhmGvXiSV","Justin Bieber, Quavo","Intentions (feat. Quavo)","RBMG/Def Jam",2,114,212,"304951"
104,"spotify:track:2xLMifQCjDGFmkHkpNLD9h","Travis Scott","SICKO MODE","Cactus Jack / Epic / Grand Hustle",1,127,764,"304127"
105,"spotify:track:0Jlcvv8IykzHaSmj49uNW8","Taylor Swift","the 1","Taylor Swift",1,96,44,"302157"
106,"spotify:track:6cx06DFPPHchuUAcTxznu9","Joel Corry, MNEK","Head & Heart (feat. MNEK)","Atlantic Records UK",97,124,29,"301987"
107,"spotify:track:6wVnQMRXd1z2iPEo24f9db","Big Sean","Lucky Me","Getting Out Our Dreams, Inc./Def Jam Recordings",36,36,2,"299624"
108,"spotify:track:6XHVuErjQ4XNm6nDPVCxVX","Chris Brown, Drake","No Guidance (feat. Drake)","Chris Brown Entertainment/RCA Records",3,132,456,"297862"
109,"spotify:track:3Dv1eDb0MEgF93GpLXlucZ","Doja Cat","Say So","Kemosabe Records/RCA Records",2,170,264,"296736"
110,"spotify:track:017PF4Q3l4DBUiWoXk4OWT","Dua Lipa","Break My Heart","Warner Records",7,123,164,"295194"
111,"spotify:track:3Z8FwOEN59mRMxDCtb8N0A","Marshmello, Halsey","Be Kind (with Halsey)","Astralwerks",13,122,128,"293599"
112,"spotify:track:6FXsrAH7Zol1jusSeJIoYA","Big Sean, Ty Dolla $ign, Jhené Aiko","Body Language (feat. Ty Dolla $ign, and Jhené Aiko)","Getting Out Our Dreams, Inc./Def Jam Recordings",43,43,2,"292184"
113,"spotify:track:7JDWhC422Gtk1Bq0mL3OTC","Bea Miller","feel something","Hollywood Records",113,138,13,"291972"
114,"spotify:track:5wWAwzGp2OaaoIkwcz6wZs","Juice WRLD, Halsey","Life's A Mess (feat. Halsey)","Grade A Productions/Interscope Records",3,121,62,"291330"
115,"spotify:track:3FU6urUVsgXa6RBuV2PdRk","Diplo, Morgan Wallen","Heartless (feat. Morgan Wallen)","Columbia",53,129,377,"290639"
116,"spotify:track:07KXEDMj78x68D884wgVEm","Roddy Ricch, Mustard","High Fashion (feat. Mustard)","Atlantic Records",4,133,254,"290023"
117,"spotify:track:3PfIrDoz19wz7qK7tYeu62","Dua Lipa","Don't Start Now","Warner Records",4,134,310,"289866"
118,"spotify:track:14GwnOeC9qYEKEA6uOZepa","Lee Brice","One Of Them Girls","Curb Records",118,145,23,"289737"
119,"spotify:track:0mb3uDw5vfFUcZfJYFOMRu","Cordae, Roddy Ricch","Gifted (feat. Roddy Ricch)","Art@War/Atlantic Records",23,113,9,"288050"
120,"spotify:track:6Ozh9Ok6h4Oi1wUSLtBseN","DaBaby","BOP","South Coast Music Group/Interscope Records",1,141,345,"287501"
121,"spotify:track:4adrh1YMaPAhtqalhG8hIH","A Boogie Wit da Hoodie, Don Q, Trap Manny","Vroom Vroom","Highbridge the Label / Atlantic Records",91,91,2,"287304"
122,"spotify:track:7x4ASXYEKfQBCewcZhK776","KAROL G","Ay, DiOs Mío!","UMLE - Latino",110,149,14,"285589"
123,"spotify:track:2kJwzbxV2ppxnQoYw4GLBZ","JP Saxe, Julia Michaels","If the World Was Ending (feat. Julia Michaels)","Arista Records",43,115,296,"284357"
124,"spotify:track:7m9OqQk4RVRkw9JJdeAw96","XXXTENTACION","Jocelyn Flores","Bad Vibes Forever / EMPIRE",2,130,1106,"283536"
125,"spotify:track:195gauSXE6Q2IKmCrarHut","Lil Durk","The Voice","Alamo",94,94,2,"283350"
126,"spotify:track:5EzL7hGT9g2Tvqsy158Lu9","City Girls, Doja Cat","Pussy Talk","Quality Control Music/Motown Records",125,142,23,"283061"
127,"spotify:track:78QR3Wp35dqAhFEc2qAGjE","Lil Baby, Gunna","Drip Too Hard (Lil Baby & Gunna)","Quality Control Music/Young Stoner Life Records, a 300 Entertainment Label/Motown Records/Capitol Records",1,143,725,"279139"
128,"spotify:track:7FIWs0pqAYbP91WWM0vlTQ","Eminem, Juice WRLD","Godzilla (feat. Juice WRLD)","Shady/Aftermath/Interscope Records",2,137,233,"275508"
129,"spotify:track:23T0OX7QOiIUFShSzbJ5Uo","Gabby Barrett","I Hope","Warner Music Nashville",69,131,210,"273994"
130,"spotify:track:4HBZA5flZLE435QTztThqH","Ariana Grande, Justin Bieber","Stuck with U (with Justin Bieber)","Ariana Grande & Justin Bieber ""Stuck With U""- Charity",1,136,121,"273464"
131,"spotify:track:0GO8y8jQk1PkHzS31d699N","Grouplove","Tongue Tied","Canvasback/ATL",113,151,148,"271583"
132,"spotify:track:2kY2ROHIGdp3aA6ahqaUKm","Big Sean, Tee Grizzley, Kash Doll, Cash Kidd, Payroll, 42 Dugg, Boldy James, Drego, Sada Baby, Royce Da 5'9"", Eminem","Friday Night Cypher (feat. Tee Grizzley, Kash Doll, Cash Kidd, Payroll, 42 Dugg, Boldy James, Drego, Sada Baby, Royce Da 5'9"", and Eminem)","Getting Out Our Dreams, Inc./Def Jam Recordings",69,69,2,"271255"
133,"spotify:track:2rxQMGVafnNaRaXlRMWPde","Luke Combs","Beautiful Crazy","River House Artists/Columbia Nashville",54,147,770,"270618"
134,"spotify:track:2h4cmbyb6S7e8igDZIITJU","Lil Durk, Lil Baby, Polo G","3 Headed Goat (feat. Lil Baby & Polo G)","Alamo",39,146,80,"270408"
135,"spotify:track:3DA4SE262k6rdEtlHteNyq","Maddie & Tae","Die From A Broken Heart","Mercury Nashville",97,117,63,"269040"
136,"spotify:track:0e7ipj03S05BNilyu5bRzt","Post Malone, 21 Savage","rockstar (feat. 21 Savage)","Republic Records",1,157,1086,"268937"
137,"spotify:track:0rKtyWc8bvkriBthvHKY8d","Joji","SLOW DANCING IN THE DARK","88rising Music/Warner Records",26,140,714,"265819"
138,"spotify:track:6mtjo5kIHKlboGE84lf1FJ","Migos, YoungBoy Never Broke Again","Need It","Quality Control Music/Motown Records",54,161,58,"265650"
139,"spotify:track:2JvzF1RMd7lE3KmFlsyZD8","J. Cole","MIDDLE CHILD","Dreamville, Inc., Under exclusive license to Roc Nation Records",1,150,591,"263127"
140,"spotify:track:62aP9fBQKYKxi7PDXwcUAS","Surf Mesa, Emilee","ily (i love you baby) (feat. Emilee)","Astralwerks",46,166,157,"260969"
141,"spotify:track:6bvfJf4KjonPMuPfGfy3S2","Nio Garcia, Anuel AA, Myke Towers, Brray, Juanka","La Jeepeta - Remix","Flow La Movie, Inc.",119,191,46,"260963"
142,"spotify:track:3ee8Jmje8o58CHK66QrVC2","XXXTENTACION","SAD!","Bad Vibes Forever, LLC",1,160,919,"258041"
143,"spotify:track:59qrUpoplZxbIZxk6X0Bm3","Jason Derulo","Take You Dancing","Atlantic Records",143,165,19,"255215"
144,"spotify:track:57Oi4yqY27uJzCyqFWIP5q","NextYoungin, ppcocaine","3 Musketeers","Columbia",98,155,27,"255031"
145,"spotify:track:5FmvaZGd6fulojSToozLRD","HARDY, Lauren Alaina, Devin Dawson","ONE BEER (feat. Lauren Alaina & Devin Dawson)","Big Loud Records",143,163,18,"254974"
146,"spotify:track:2T5NBwKRySiCR78vVk08vr","DaBaby, Young Thug","BLIND (feat. Young Thug)","South Coast Music Group/Interscope Records",34,154,29,"254964"
147,"spotify:track:0fCwrjKfWxF3xQhZrYUw4T","Juice WRLD","Blood On My Jeans","Grade A Productions/Interscope Records",8,158,58,"254129"
148,"spotify:track:7xQAfvXzm3AkraOtGPWIZg","Post Malone","Wow.","Republic Records",1,176,622,"252555"
149,"spotify:track:0uxSUdBrJy9Un0EYoBowng","Lil Uzi Vert","20 Min","Generation Now/Atlantic",86,168,201,"252423"
150,"spotify:track:1Y3TlYJNhIa7k4YAvFkJAB","Luke Bryan","One Margarita","Capitol Records Nashville",93,175,47,"252147"
151,"spotify:track:2r6OAV3WsYtXuXjvJ1lIDi","Pop Smoke, A Boogie Wit da Hoodie","Hello (feat. A Boogie Wit da Hoodie)","Victor Victor Worldwide",97,179,11,"251122"
152,"spotify:track:3HWzoMvoF3TQfYg4UPszDq","Lizzo","Truth Hurts","Nice Life/Atlantic",2,188,504,"250836"
153,"spotify:track:62vpWI1CHwFy7tMIcSStl8","J. Cole","No Role Modelz","Roc Nation Records LLC",64,172,999,"250604"
154,"spotify:track:76nqCfJOcFFWBJN32PAksn","Ava Max","Kings & Queens","Atlantic Records",115,171,76,"249651"
155,"spotify:track:3jT2LKH0RSbQ8jIUNFzXm5","G Herbo, Lil Uzi Vert, Juice WRLD, Chance the Rapper","PTSD","Machine Entertainment Group - G Herbo",29,173,191,"249330"
156,"spotify:track:6qiiDtFAJjyEhoZVcf6ovL","6ix9ine","GOOBA","Scumgang Records",3,116,110,"248587"
157,"spotify:track:1ZMiCix7XSAbfAJlEZWMCp","Harry Styles","Falling","Columbia",4,152,263,"247057"
158,"spotify:track:3ZCTVFBt2Brf31RLEnCkWJ","Billie Eilish","everything i wanted","Darkroom/Interscope Records",1,159,297,"246662"
159,"spotify:track:3fqwjXwUGN6vbzIwvyFMhx","Chris Stapleton","Tennessee Whiskey","Mercury Nashville",147,-1,35,"246212"
160,"spotify:track:6K4t31amVTZDgR3sKmwUJJ","Tame Impala","The Less I Know The Better","Universal Music Australia Pty. Ltd.",103,185,365,"246206"
161,"spotify:track:21CkzgKCBCq5V4XKjiGSIj","Juice WRLD","Stay High","Grade A Productions/Interscope Records",11,162,58,"245247"
162,"spotify:track:2Yer0p7uB2lVBUAtANuuQp","Social House, Lil Yachty","Magic In The Hamptons (feat. Lil Yachty)","Silent Records / Social House",76,184,206,"243844"
163,"spotify:track:4bHsxqR3GMrXTxEPLuK5ue","Journey","Don't Stop Believin'","Columbia",132,-1,102,"241810"
164,"spotify:track:6J2LdBN97cDWn0MLxYh9HB","Noah Cyrus","July","Records/Columbia",56,156,306,"240593"
165,"spotify:track:2Fxmhks0bxGSBdJ92vM42m","Billie Eilish","bad guy","Darkroom/Interscope Records",1,187,527,"238707"
166,"spotify:track:30bqVoKjX479ab90a8Pafp","Lil Peep","Star Shopping","Lil Peep",106,164,10,"238437"
167,"spotify:track:0u2P5u6lvoDfwTYjAADbn4","Billie Eilish, Khalid","lovely (with Khalid)","Darkroom",18,169,869,"238284"
168,"spotify:track:6wXgnhpmOPEJ7cUweSyy2B","Diplo, Thomas Rhett, Young Thug","Dance with Me (feat. Thomas Rhett & Young Thug)","Columbia",113,-1,10,"238024"
169,"spotify:track:0mCiEhtdRn5YYhefLXcxI7","NLE Choppa, Lil Baby","Narrow Road (feat. Lil Baby)","Warner Records",43,178,37,"237906"
170,"spotify:track:003vvx7Niy0yvhvHt4a68B","The Killers","Mr. Brightside","Island Records",83,-1,120,"237097"
171,"spotify:track:45npF3MKvCa1sO7s4y7qBf","Moneybagg Yo","Said Sum","N-Less Entertainment, LLC distributed by Interscope Records. With Epic Records and CMG Enterprises.",145,-1,49,"236537"
172,"spotify:track:4QqTDl0Po7cbaZMcGsZmBg","Big Sean, Hit-Boy, Young Thug","Respect It (with Hit-Boy feat. Young Thug)","Getting Out Our Dreams, Inc./Def Jam Recordings",77,77,2,"236302"
173,"spotify:track:3tLhjMOfbdRGQNudmIABp4","G-Eazy, Latto","Down (feat. Latto)","BPG/RVG/RCA Records",120,120,2,"235786"
174,"spotify:track:12hVQgYR254ZziANtiKVWQ","Cochise","Hatchback","Columbia",174,-1,3,"235398"
175,"spotify:track:6uFn47ACjqYkc0jADwEdj1","Polo G, Lil Tjay","Pop Out (feat. Lil Tjay)","Columbia",8,194,533,"234558"
176,"spotify:track:0ofHAoxe9vBkTCp2UQIavz","Fleetwood Mac","Dreams - 2004 Remaster","Rhino/Warner Records",156,-1,24,"234428"
177,"spotify:track:7Mu3sCvXdMSlBLrUPOhWAG","6ix9ine, Akon","LOCKED UP PT. 2","Scumgang Records",41,41,2,"233913"
178,"spotify:track:75ZvA4QfFiZvzhj2xkaWAh","Post Malone","I Fall Apart","Universal Records",2,186,1084,"232582"
179,"spotify:track:5wujBwqG7INdStqGd4tRMX","Juice WRLD","Armed And Dangerous","Juice WRLD Mixtape / ISR P&D",9,193,619,"232562"
180,"spotify:track:5Jm4w8jmPEBTLjI9vH4fXo","Ozuna","Caramelo","Aura Music Corp.",130,177,3,"231950"
181,"spotify:track:6KfoDhO4XUWSbnyKjNp9c4","Conan Gray","Maniac","Republic Records",66,182,259,"231513"
182,"spotify:track:7GX5flRQZVHRAGd6B4TmDO","Lil Uzi Vert","XO Tour Llif3","Generation Now/Atlantic",1,195,1254,"230749"
183,"spotify:track:7dmD4eaEb5UCBYcEJkLke9","YoungBoy Never Broke Again","Kacey Talk","Never Broke Again, LLC",96,196,23,"230563"
184,"spotify:track:2wrJq5XKLnmhRXHIAf9xBa","Dan + Shay, Justin Bieber","10,000 Hours (with Justin Bieber)","Warner Music Nashville",2,190,336,"229825"
185,"spotify:track:7LYgVPxRvlN7OavmyrnOGe","Big Sean, Anderson .Paak, Earlly Mac, Wale","Guard Your Heart (feat. Anderson .Paak, Earlly Mac, and Wale)","Getting Out Our Dreams, Inc./Def Jam Recordings",86,86,2,"229546"
186,"spotify:track:1E3VQQWFQAPJkXfYHjqWoI","Megan Thee Stallion","Captain Hook","300 Entertainment",71,199,105,"229206"
187,"spotify:track:7aEtlGHoiPAfRB084NiDmx","Luke Combs","Beer Never Broke My Heart","River House Artists/Columbia Nashville",32,-1,236,"227581"
188,"spotify:track:1mMLMZYXkMueg65jRRWG1l","Luke Combs","When It Rains It Pours","River House Artists/Columbia Nashville",110,-1,436,"226459"
189,"spotify:track:5lxQ9BW2xOzgRIxQAZzHSK","Big Sean, Lil Wayne","Don Life (feat. Lil Wayne)","Getting Out Our Dreams, Inc./Def Jam Recordings",102,102,2,"226243"
190,"spotify:track:5ry2OE6R2zPQFDO85XkgRb","Drake, Rick Ross","Money In The Grave (Drake ft. Rick Ross)","Republic Records",1,-1,448,"226239"
191,"spotify:track:6hLZzCS4E7AWo3PRBWy6az","Sada Baby","Whole Lotta Choppas","Asylum Worldwide LLC",191,-1,1,"225365"
192,"spotify:track:7dt6x5M1jzdTEt8oCbisTK","Post Malone","Better Now","Republic Records",1,-1,848,"223909"
193,"spotify:track:56uXDJRCuoS7abX3SkzHKQ","Lil Uzi Vert","Myron","Generation Now/Atlantic",1,-1,176,"223015"
194,"spotify:track:76MjtLfZoTNc3BDqUVjuRH","Future, Lil Uzi Vert","Patek","Generation Now/Atlantic",51,198,36,"222530"
195,"spotify:track:5JAYDuLRkODlVt6dgoalKk","Juice WRLD, Trippie Redd","Tell Me U Luv Me (with Trippie Redd)","Grade A Productions/Interscope Records",4,-1,96,"222434"
196,"spotify:track:4EivmOT13NMpNSfTKn9p4s","Doja Cat, Gucci Mane","Like That (feat. Gucci Mane)","Kemosabe Records/RCA Records",78,-1,144,"222131"
