rank,uri,artist_names,track_name,source,peak_rank,previous_rank,days_on_chart,streams
1,"spotify:track:7l3E7lcozEodtVsSTCkcaA","Kodak Black, Offset, Travis Scott","ZEZE (feat. Travis Scott & Offset)","Atlantic Records",1,1,7,"2152670"
2,"spotify:track:78QR3Wp35dqAhFEc2qAGjE","Lil Baby, Gunna","Drip Too Hard (Lil Baby & Gunna)","Quality Control Music/Young Stoner Life Records, a 300 Entertainment Label/Motown Records/Capitol Records",1,2,37,"1555078"
3,"spotify:track:1xzBco0xcoJEDXktl7Jxrr","Sheck Wes","Mo Bamba","Cactus Jack Records/ G.O.O.D. Music/ Interscope Records",3,4,84,"1479216"
4,"spotify:track:116H0KvKr2Zl4RPuVBruDO","Bad Bunny, Drake","MIA (feat. Drake)","OVO Sound/Warner Records",2,3,8,"1419736"
5,"spotify:track:2xLMifQCjDGFmkHkpNLD9h","Travis Scott","SICKO MODE","Cactus Jack / Epic / Grand Hustle",1,5,77,"1303370"
6,"spotify:track:5p7ujcrUXASCNwRaWNHR1C","Halsey","Without Me","Capitol Records",6,6,15,"1176769"
7,"spotify:track:0s3nnoMeVWz3989MkNQiRf","Juice WRLD","Lucid Dreams","Juice WRLD Mixtape / ISR P&D",1,8,165,"1103240"
8,"spotify:track:4w8niZpiMy6qz1mntFA5uM","DJ Snake, Selena Gomez, Ozuna, Cardi B","Taki Taki (with Selena Gomez, Ozuna & Cardi B)","DJ Snake Music Productions Limited, under exclusive license to Geffen Records",4,7,21,"1102458"
9,"spotify:track:2dpaYNEQHiRxtZbfNsse99","Marshmello, Bastille","Happier","Astralwerks",5,9,63,"1042924"
10,"spotify:track:6wWaVoUOzLQJHd3bWAUpdZ","Lil Baby, Gunna, Drake","Never Recover (Lil Baby & Gunna, Drake)","Quality Control Music/Young Stoner Life Records, a 300 Entertainment Label/Motown Records/Capitol Records",1,10,14,"1028207"
11,"spotify:track:2VxeLyX666F8uXCJ0dZF8B","Lady Gaga, Bradley Cooper","Shallow","A Star is Born OST",10,11,21,"963310"
12,"spotify:track:0JP9xo3adEtGSdUEISiszL","XXXTENTACION","Moonlight","Bad Vibes Forever, LLC",2,12,217,"962989"
13,"spotify:track:0Dn40gxVCMo5TkgS8Ik18Q","Lil Peep, XXXTENTACION","Falling Down - Bonus Track","Columbia",1,13,30,"960725"
14,"spotify:track:3ee8Jmje8o58CHK66QrVC2","XXXTENTACION","SAD!","Bad Vibes Forever, LLC",1,14,231,"928785"
15,"spotify:track:0TlLq3lA83rQOYtrqBqSct","Drake","Nonstop","Cash Money/Drake LP6",1,15,112,"900370"
16,"spotify:track:2E124GmJRnBJuXbTb4cPUB","6ix9ine, Nicki Minaj, Murda Beatz","FEFE","Scumgang Records/TenThousand Projects, LLC",2,17,89,"837630"
17,"spotify:track:4T3fNx3CgwDRRYgmFCbD4J","Khalid","Better","Right Hand Music Group, LLC/RCA Records",8,16,35,"826451"
18,"spotify:track:4S8d14HvHb70ImctNgVzQQ","Kanye West, Lil Pump","I Love It (& Lil Pump)","Getting Out Our Dreams, Inc./Def Jam Recordings",1,18,42,"816868"
19,"spotify:track:7dt6x5M1jzdTEt8oCbisTK","Post Malone","Better Now","Republic Records",1,20,175,"810504"
20,"spotify:track:04MLEeAMuV9IlHEsD8vF6A","French Montana, Drake","No Stylist (feat. Drake)","Epic",14,19,28,"805522"
21,"spotify:track:0QIjsbm2fh1cJ45XO9eGqq","Gucci Mane, Bruno Mars, Kodak Black","Wake Up in the Sky","Guwop Enterprises/Atlantic",6,22,35,"759790"
22,"spotify:track:0dbTQYW3Ad1FTzIA9t90E8","Lil Wayne, Kendrick Lamar","Mona Lisa (feat. Kendrick Lamar)","Young Money Records, Inc.",1,21,21,"755093"
23,"spotify:track:1jQvUmf16VE9WQCPuK2e8K","6ix9ine, Bobby Shmurda","STOOPID","Scumgang Records/TenThousand Projects, LLC",5,23,14,"741907"
24,"spotify:track:6vN77lE9LK6HP2DewaN6HZ","Lil Baby, Drake","Yes Indeed","Quality Control Music, LLC",2,24,157,"731905"
25,"spotify:track:14JzyD6FlBD5z0wV5P07YI","Billie Eilish","when the party's over","Darkroom/Interscope Records",25,42,2,"722826"
26,"spotify:track:2NRGaA1GyCmTYfm2GRPkUe","Future, Juice WRLD","Fine China","Epic/Freebandz/Grade A/Interscope",26,31,3,"705186"
27,"spotify:track:15kQGEy89K8deJcZVFEn0N","The Chainsmokers, Kelsea Ballerini","This Feeling","Disruptor Records/Columbia",21,27,28,"690820"
28,"spotify:track:0d2iYfpKoM0QCKvcLCkBao","benny blanco, Halsey, Khalid","Eastside (with Halsey & Khalid)","Benny Blanco Solo Album PS",7,26,98,"686477"
29,"spotify:track:3edzl4zvKFi0D3iuF6cs2f","Quavo, 21 Savage","PASS OUT (feat. 21 Savage)","Quality Control Music/Motown Records/Capitol Records",3,25,7,"682308"
30,"spotify:track:5IaHrVsrferBYDm0bDyABy","Tyga, Offset","Taste (feat. Offset)","Last Kings Music / EMPIRE",3,28,154,"666288"
31,"spotify:track:7d6XJZjnm7iWcKwYL9z5kC","Lil Mosey","Noticed","Mogul Vision/Interscope Records",17,29,63,"656770"
32,"spotify:track:2G7V7zsVDxg1yRsu7Ew9RJ","Drake","In My Feelings","Cash Money/Drake LP6",1,30,112,"652989"
33,"spotify:track:14mHfNsSHN0FbLftyjrV9g","Flipp Dinero","Leave Me Alone","Cinematic/Epic/We The Best",29,34,68,"647976"
34,"spotify:track:0Fpen1PTuEnCmOJtUU9Iud","Lil Uzi Vert","New Patek","Generation Now/Atlantic",1,32,31,"644156"
35,"spotify:track:7m9OqQk4RVRkw9JJdeAw96","XXXTENTACION","Jocelyn Flores","Bad Vibes Forever / EMPIRE",2,33,420,"639386"
36,"spotify:track:60SdxE8apGAxMiRrpbmLY0","Eminem, Joyner Lucas","Lucky You (feat. Joyner Lucas)","Aftermath",1,35,49,"606305"
37,"spotify:track:58q2HKrzhC3ozto2nDdN4z","Cardi B, Bad Bunny, J Balvin","I Like It","Atlantic/KSR",2,36,196,"582039"
38,"spotify:track:7AQim7LbvFVZJE3O8TYgf2","XXXTENTACION, Trippie Redd","Fuck Love (feat. Trippie Redd)","Bad Vibes Forever / EMPIRE",5,38,420,"562968"
39,"spotify:track:29tc0GbW0pTSBZSCZF3NWk","Juice WRLD","Lean Wit Me","Juice WRLD Mixtape / ISR P&D",25,39,149,"560540"
40,"spotify:track:6CTWathupIiDs7U4InHnDA","Ella Mai","Trip","10 Summers / Interscope PS",35,37,50,"554492"
41,"spotify:track:4MAsYGSgxsaj73dC2lvFC4","Quavo","WORKIN ME","Quality Control Music/Motown Records/Capitol Records",27,43,70,"549535"
42,"spotify:track:0XySogm94T51XF5F2jumXm","Juice WRLD","All Girls Are The Same","Juice WRLD Mixtape / ISR P&D",12,40,181,"548972"
43,"spotify:track:3wScL5W8H40zzCKN0atfBk","Lil Wayne, Swizz Beatz","Uproar","Young Money Records, Inc.",3,41,21,"539755"
44,"spotify:track:7AFASza1mXqntmGtbxXprO","XXXTENTACION","changes","Bad Vibes Forever, LLC",4,44,231,"525309"
45,"spotify:track:3swc6WTsr7rl9DqQKQA55C","Post Malone, Ty Dolla $ign","Psycho (feat. Ty Dolla $ign)","Republic Records",1,46,238,"523069"
46,"spotify:track:0ZNrc4kNeQYD9koZ3KvCsy","YG, 2 Chainz, Big Sean, Nicki Minaj","BIG BANK (feat. 2 Chainz, Big Sean, Nicki Minaj)","Def Jam Recordings",21,45,147,"520685"
47,"spotify:track:5qHirGR7M9tdm6C17DlzSY","Aminé","REEL IT IN","Republic Records",47,50,43,"511976"
48,"spotify:track:0e7ipj03S05BNilyu5bRzt","Post Malone, 21 Savage","rockstar (feat. 21 Savage)","Republic Records",1,51,399,"504761"
49,"spotify:track:5BQrp63SHCVf4bzCzJePne","Lil Wayne, XXXTENTACION","Don't Cry (feat. XXXTENTACION)","Young Money Records, Inc.",2,49,21,"496074"
50,"spotify:track:2iUXsYOEPhVqEBwsqP70rE","5 Seconds of Summer","Youngblood","Capitol",12,48,188,"493526"
51,"spotify:track:74iZuPGwyL33VlTr6jTnab","Lady Gaga","Always Remember Us This Way","A Star is Born OST",41,47,12,"491149"
52,"spotify:track:6DCZcSspjsKoFjzjrWoCdn","Drake","God's Plan","Cash Money/Drake LP6",1,53,272,"473688"
53,"spotify:track:7wBJfHzpfI3032CSD7CE2m","Travis Scott","STARGAZING","Cactus Jack / Epic / Grand Hustle",1,52,77,"471159"
54,"spotify:track:75ZvA4QfFiZvzhj2xkaWAh","Post Malone","I Fall Apart","Universal Records",2,55,398,"467103"
55,"spotify:track:4VUwkH455At9kENOfzTqmF","Bazzi, Camila Cabello","Beautiful (feat. Camila Cabello)","iamcosmic",28,54,77,"458120"
56,"spotify:track:6rrTr2HEAzlpC4KWZxF3S1","Little Mix, Nicki Minaj","Woman Like Me (feat. Nicki Minaj)","Syco Music",56,77,6,"453792"
57,"spotify:track:4zIO3ilp5HvTeK3HJHxhMP","Imagine Dragons","Natural","Kid Ina Korner / Interscope",21,57,91,"443426"
58,"spotify:track:7fa9MBXhVfQ8P8Df9OEbD8","Maroon 5, Cardi B","Girls Like You (feat. Cardi B) - Cardi B Version","Interscope Records*",6,58,140,"440464"
59,"spotify:track:5nzhL67GpF9szXWg5y509A","Lil Baby","Close Friends (Lil Baby & Gunna)","Quality Control Music/Young Stoner Life Records, a 300 Entertainment Label/Motown Records/Capitol Records",41,59,14,"438987"
60,"spotify:track:0u2P5u6lvoDfwTYjAADbn4","Billie Eilish, Khalid","lovely (with Khalid)","Darkroom",18,61,182,"434126"
61,"spotify:track:25sgk305KZfyuqVBQIahim","Ava Max","Sweet but Psycho","Atlantic Records",60,60,17,"429769"
62,"spotify:track:1jo3TwNGCXfNdB5uba3ZVv","Eminem","Killshot","Aftermath",16,62,30,"426420"
63,"spotify:track:3obgSF06ki98lYNLNq5vCB","Juice WRLD, Lil Uzi Vert","Wasted (feat. Lil Uzi Vert)","Juice WRLD Mixtape / ISR P&D",20,63,101,"425352"
64,"spotify:track:0UyljEbX9dqI1K0sqdv6B6","Joji","SLOW DANCING IN THE DARK","88rising Music/Warner Records",26,56,37,"422136"
65,"spotify:track:4qKcDkK6siZ7Jp1Jb4m0aL","BlocBoy JB, Drake","Look Alive (feat. Drake)","OVO Sound/Warner Records",2,66,252,"419204"
66,"spotify:track:2SL6oP2YAEQbqsrkOzRGO4","Eminem","Venom - Music From The Motion Picture","Aftermath",17,64,49,"417753"
67,"spotify:track:3GVkPk8mqxz0itaAriG1L7","XXXTENTACION","Everybody Dies In Their Nightmares","Bad Vibes Forever / EMPIRE",6,69,415,"408655"
68,"spotify:track:0CBQ0m3mufWH75LTYB3s6h","Lil Wayne, Travis Scott","Let It Fly (feat. Travis Scott)","Young Money Records, Inc.",3,65,21,"406345"
69,"spotify:track:3CA9pLiwRIGtUBiMjbZmRw","Drake","Nice For What","Cash Money/Drake LP6",1,72,195,"405836"
70,"spotify:track:1Jl21sidRpEdlVBvYbssLx","Young Thug, Jaden","Sin (feat. Jaden Smith)","300 Entertainment/Atl",24,68,25,"405721"
71,"spotify:track:1rqqCSm0Qe4I9rUvWncaom","Panic! At The Disco","High Hopes","DCD2 / Fueled By Ramen",33,67,129,"403790"
72,"spotify:track:6xtcFXSo8H9BZN637BMVKS","Rita Ora","Let You Love Me","Atlantic Records UK",72,75,15,"402150"
73,"spotify:track:7lAK3oHbfEnvUQWosrMMpR","Travis Scott","YOSEMITE","Cactus Jack / Epic / Grand Hustle",7,74,77,"399439"
74,"spotify:track:69PkhA9q3xCWU2CzoZnLAu","Quavo, Lil Baby","LOSE IT (feat. Lil Baby)","Quality Control Music/Motown Records/Capitol Records",36,80,7,"396933"
75,"spotify:track:5OCJzvD7sykQEKHH7qAC3C","Ariana Grande","God is a woman","Republic Records",4,73,98,"382720"
76,"spotify:track:5N5k9nd479b1xpDZ4usjrg","Calvin Harris, Sam Smith, Jessie Reyez","Promises (with Sam Smith)","Columbia",18,81,63,"382281"
77,"spotify:track:45Egmo7icyopuzJN0oMEdk","Khalid, Normani","Love Lies (with Normani)","RCA Records Label",8,76,245,"374553"
78,"spotify:track:7sO5G9EABYOXQKNPNiE9NR","Offset, Metro Boomin","Ric Flair Drip (with Metro Boomin)","Slaughter Gang, LLC/Epic/Quality Control Music/Motown/Capitol/Boominati Worldwide/Republic",4,84,353,"372597"
79,"spotify:track:1rlIrbWboTRGeKfHhgbJRZ","Quavo, Drake","FLIP THE SWITCH (feat. Drake)","Quality Control Music/Motown Records/Capitol Records",12,71,7,"369123"
80,"spotify:track:7GX5flRQZVHRAGd6B4TmDO","Lil Uzi Vert","XO Tour Llif3","Generation Now/Atlantic",1,82,574,"364016"
81,"spotify:track:4OafepJy2teCjYJbvFE60J","Ariana Grande","breathin","Republic Records",4,70,63,"360936"
82,"spotify:track:2qT1uLXPVPzGgFOx4jtEuo","Ariana Grande","no tears left to cry","Republic Records",6,79,182,"350634"
83,"spotify:track:2ZRo7axmMPeSVUvDbGkJah","XXXTENTACION","Hope","Bad Vibes Forever, LLC",10,89,158,"343056"
84,"spotify:track:6eYxmK9fdL4hwLnXG2zY3s","XXXTENTACION","Look At Me!","Bad Vibes Forever / EMPIRE",20,91,489,"342719"
85,"spotify:track:3V8UKqhEK5zBkBb6d6ub8i","Nio Garcia, Casper Magico, Bad Bunny, Darell, Ozuna, Nicky Jam","Te Boté - Remix","2018 Flow La Movie, Inc.",35,90,186,"342403"
86,"spotify:track:2hnxrRNzF74mdDzpQZQukQ","Lauv, Julia Michaels","There's No Way (feat. Julia Michaels)","Lauv",78,87,18,"339344"
87,"spotify:track:5bJ1DrEM4hNCafcDd1oxHx","Mac Miller","Self Care","Warner Records",4,88,57,"339299"
88,"spotify:track:1ZAyjvIk9YiD76yYy0TEG6","Rich The Kid","Plug Walk","Rich The Kid / (TDE/ISR PS)",6,92,252,"338253"
89,"spotify:track:3EPXxR3ImUwfayaurPi3cm","Dean Lewis","Be Alright","Universal Music Australia Pty. Ltd.",19,85,81,"337647"
90,"spotify:track:3a1lNhkSLSkpJE4MSHpDu9","Post Malone, Quavo","Congratulations","Universal Records",5,99,656,"334220"
91,"spotify:track:4UKCKdYiLN6IMA5ZESUTL7","XXXTENTACION","the remedy for a broken heart (why am I so in love)","Bad Vibes Forever, LLC",8,93,184,"333613"
92,"spotify:track:0OgGn1ofaj55l2PcihQQGV","Bryce Vine","Drew Barrymore","Sire",45,86,63,"332774"
93,"spotify:track:5N4erncE7kuUccm7zEmwzk","Silk City, Dua Lipa, Diplo, Mark Ronson","Electricity (with Dua Lipa)","Columbia",25,78,42,"332571"
94,"spotify:track:2P91MQbaiQOfbiz9VqhqKQ","Lauv","I Like Me Better","Lauv",30,83,497,"331348"
95,"spotify:track:4mHgYpuGHu99Mw69E83CP2","Trippie Redd","Taking A Walk","TenThousand Projects, LLC",6,96,74,"325403"
96,"spotify:track:5HeKOKc4phmLn8e4I7EkzD","Twenty One Pilots","My Blood","Fueled By Ramen",50,94,18,"322291"
97,"spotify:track:7oJrVhiTPZGBXWPwhxjy9S","Lil Skies","Lust","All We Got Ent.",75,98,256,"321843"
98,"spotify:track:7rC5Pl8rQSX4myONQHYPBK","Drake","Mob Ties","Cash Money/Drake LP6",5,103,112,"319361"
99,"spotify:track:5WvAo7DNuPRmk4APhdPzi8","DJ Khaled, Justin Bieber, Quavo, Chance the Rapper","No Brainer","Epic/We The Best",3,95,84,"315658"
100,"spotify:track:6Hgh47WXVKtXN5zGOu0hjI","Khalid, 6LACK, Ty Dolla $ign","OTW","Right Hand Music Group, LLC/RCA Records",17,97,182,"314694"
101,"spotify:track:7IBSffWIu7P2MC7kMwy2FM","Wiz Khalifa, Swae Lee","Hopeless Romantic (feat. Swae Lee)","Taylor Gang/Atlantic",29,104,107,"309223"
102,"spotify:track:4e4fqjx0Izh4svvTef1z7e","Bebe Rexha, Florida Georgia Line","Meant to Be (feat. Florida Georgia Line)","Warner Bros.",15,101,405,"308953"
103,"spotify:track:7ycWLEP1GsNjVvcjawXz3z","A$AP Rocky, Skepta","Praise The Lord (Da Shine) (feat. Skepta)","A$AP Worldwide/Polo Grounds Music/RCA Records",5,102,147,"308851"
104,"spotify:track:0ibOcbkp2XG46Do8jcy0bL","Smokepurpp, Lil Pump","Nephew (feat. Lil Pump)","Alamo",75,105,83,"306595"
105,"spotify:track:0Y7di9ZCmB6Elad5WISaPc","Lil Wayne","Dedicate","Young Money Records, Inc.",4,100,21,"306128"
106,"spotify:track:1Knctxx9vGZxpZfF66BIEa","Juice WRLD","Legends","Juice WRLD / Interscope PS",67,107,119,"303371"
107,"spotify:track:2jt2WxXMCD4zjACthkJQVE","Eminem","The Ringer","Aftermath",2,109,49,"300011"
108,"spotify:track:1ArLnG0bHaHPXqf08sEKM0","Camila Cabello","Consequences - orchestra","Syco Music/Epic",108,108,2,"299805"
109,"spotify:track:40oKW22ZNNkEdZLJTScaQI","Kodak Black, XXXTENTACION","Roll in Peace (feat. XXXTENTACION)","Atlantic Records",21,113,418,"298242"
110,"spotify:track:7KXjTSCq5nL1LoYtL7XAwS","Kendrick Lamar","HUMBLE.","Aftermath",1,114,567,"297386"
111,"spotify:track:5Z3GHaZ6ec9bsiI5BenrbY","Khalid","Young Dumb & Broke","Right Hand Music Group, LLC/RCA Records",5,106,562,"296769"
112,"spotify:track:6yz0Jndhv0QjKdpcEMbOjz","Trippie Redd","Shake It Up","TenThousand Projects, LLC",42,111,70,"296241"
113,"spotify:track:2u7mxWSeoqTXndK5e08jMp","Lil Skies, Landon Cube","Nowadays (feat. Landon Cube)","All We Got Ent.",24,116,293,"293827"
114,"spotify:track:32lItqlMi4LBhb4k0BaSaC","Post Malone","Candy Paint","Republic Records",4,117,511,"293089"
115,"spotify:track:7eBqSVxrzQZtK2mmgRG6lC","YNW Melly","Murder On My Mind","P2018",110,115,28,"291680"
116,"spotify:track:6gBFPUFcJLzWGx4lenP6h2","Travis Scott","goosebumps","Epic/Grand Hustle",16,121,656,"291622"
117,"spotify:track:1A6OTy97kk0mMdm78rHsm8","Post Malone, Swae Lee","Sunflower - Spider-Man: Into the Spider-Verse","Republic Records",117,-1,1,"291194"
118,"spotify:track:7uzmGiiJyRfuViKKK3lVmR","Bazzi","Mine","iamcosmic",3,112,277,"289004"
119,"spotify:track:0kCBorRrKZkSztd9m0QI3r","Young Thug, Young Stoner Life, Gunna, Lil Baby","Chanel (Go Get It) [feat. Gunna & Lil Baby]","300 Entertainment/Atl",30,110,63,"288665"
120,"spotify:track:7ATATJztoWLcqDAcVVof0C","6ix9ine, Anuel AA","BEBE","Scumgang Records/TenThousand Projects, LLC",34,119,49,"286755"
121,"spotify:track:1R0Ig5KYrSGWvIoPzY4T3l","Juice WRLD","Black & White","Juice WRLD Mixtape / ISR P&D",121,124,116,"285318"
122,"spotify:track:5PTG6rrL6EPFD9E2QMI2pl","Famous Dex","JAPAN","300 Entertainment",11,138,217,"284733"
123,"spotify:track:2uMTscYuCT3BZ0OCzH3MwN","Kodak Black","If I'm Lyin', I'm Flyin'","Atlantic Records",39,120,21,"280923"
124,"spotify:track:41zXlQxzTi6cGAjpOXyLYH","Billie Eilish","idontwannabeyouanymore","Darkroom",124,134,88,"278926"
125,"spotify:track:4kWO6O1BUXcZmaxitpVUwp","Tiësto, Dzeko, Preme, Post Malone","Jackie Chan","Universal Music, a division of Universal International Music BV",18,126,154,"278135"
126,"spotify:track:09IStsImFySgyp0pIQdqAc","Zedd, Maren Morris, Grey","The Middle","UMGRI Interscope",5,118,267,"277627"
127,"spotify:track:3qN5qMTKyEEmiTZD38BNTT","Drake","I'm Upset","Cash Money/Drake LP6",4,131,145,"272438"
128,"spotify:track:3GJ4hzg4lrGwU51Y3VARbF","Dan + Shay","Speechless","Warner Records",127,127,62,"270871"
129,"spotify:track:4hQ6UGyWQIGJmHSo0J88JW","Selena Gomez","Back To You - From 13 Reasons Why – Season 2 Soundtrack","UMGRI Interscope",15,128,161,"270679"
130,"spotify:track:5cGpjfgAvidLy6znwkCxkP","Lil Wayne","Can't Be Broken","Young Money Records, Inc.",6,125,21,"270464"
131,"spotify:track:0At2qAoaVjIwWNAqrscXli","Ella Mai","Boo'd Up","10 Summers / Interscope PS",24,129,160,"270458"
132,"spotify:track:5a8RPWgKSmcGBGcffmIrUi","Sia, Diplo, Labrinth, LSD","Thunderclouds (feat. Sia, Diplo, and Labrinth)","Records/Columbia",41,122,70,"268397"
133,"spotify:track:6IaieqiCVvsNvEt6Y7yOFa","Post Malone, Nicki Minaj","Ball For Me (feat. Nicki Minaj)","Republic Records",8,136,175,"267669"
134,"spotify:track:2bSk87AVkCIIC3Bcligq1z","Lil Baby, Gunna, Lil Uzi Vert","Life Goes On","Quality Control Music, LLC",87,130,154,"266056"
135,"spotify:track:4at3d5QWnlibMVN75ECDrp","6LACK, J. Cole","Pretty Little Fears (feat. J. Cole)","LVRN Records",29,133,17,"265539"
136,"spotify:track:6xcJyGpfZbuuiequtnlKt4","Travis Scott","BUTTERFLY EFFECT","Cactus Jack / Epic / Grand Hustle",9,141,517,"263167"
137,"spotify:track:152lZdxL1OR0ZMW6KquMif","Khalid","Location","Right Hand Music Group, LLC/RCA Records",9,135,655,"262706"
138,"spotify:track:1N7YeVU0ZwAFbOhwM61ef6","Avril Lavigne","Head Above Water","BMG Rights Management (US) LLC",130,132,5,"259561"
139,"spotify:track:6n4U3TlzUGhdSFbUUhTvLP","Migos, Drake","Walk It Talk It","Quality Control Music, LLC",3,145,266,"258203"
140,"spotify:track:3ZhTT6yjZwpPph5MIJ53XY","Lil Skies, Landon Cube","Red Roses (feat. Landon Cube)","All We Got Ent.",36,143,290,"258004"
141,"spotify:track:5BbdKBZO0TH0GhfxUfyhL9","Lil Baby","Freestyle","Quality Control Music (Caroline)",137,137,22,"255604"
142,"spotify:track:48zFZh27QU5qsrBjn4C2FA","Ozuna, Manuel Turizo","Vaina Loca","VP Records Corp/Dimelo Vi",49,144,59,"255342"
143,"spotify:track:0dSIrRkA4PadGll16TgbnV","Famous Dex, A$AP Rocky","PICK IT UP (feat. A$AP Rocky)","300 Entertainment",13,146,357,"255203"
144,"spotify:track:5gQcxYXqnofyocKgEbGYKt","YBN Nahmir","Bounce Out With That","2018",27,147,259,"253814"
145,"spotify:track:1gm616Plq4ScqNi7TVkZ5N","The Weeknd","Call Out My Name","Universal Republic Records",1,139,203,"252641"
146,"spotify:track:3ngc7rGlfeFaskU90EWl4R","Lauren Daigle","You Say","Centricity Music/Warner Records",115,140,29,"250891"
147,"spotify:track:1zB4vmk8tFRmM9UULNzbLB","Imagine Dragons","Thunder","Kid Ina Korner / Interscope",16,152,539,"250503"
148,"spotify:track:3JX0dOCIAiaR8MP3ryXWuM","Lil Wayne, Sosamann","What About Me (feat. Sosamann)","Young Money Records, Inc.",7,123,21,"249991"
149,"spotify:track:1HXy5I3HTWq8OvxCn0z7G7","Kane Brown","Heaven","RCA Records Label Nashville",51,150,275,"249109"
150,"spotify:track:52okn5MNA47tk87PeZJLEL","NF","Let You Down","NF Real Music",9,149,375,"248284"
151,"spotify:track:6f5i916F3jU6BhOOD7iGqf","MadeinTYO, A$AP Ferg","Ned Flanders (feat. A$AP Ferg)","Commission/BMG",64,155,97,"247085"
152,"spotify:track:42fw0rxRO2xbesF6mJfd4Y","Dan + Shay","Tequila","Warner Records",48,153,237,"245848"
153,"spotify:track:04ZTP5KsCypmtCmQg5tH9R","Bebe Rexha","I'm a Mess","Warner Bros.",63,142,119,"245404"
154,"spotify:track:2BJSMvOGABRxokHKB0OI8i","Playboi Carti, Lil Uzi Vert","Shoota (feat. Lil Uzi Vert)","AWGE Label",23,157,161,"244515"
155,"spotify:track:2uIX8YMNjGMD7441kqyyNU","Billie Eilish","ocean eyes","Darkroom",65,164,114,"243925"
156,"spotify:track:2eAZfqOm4EnOF9VvN50Tyc","Lil Uzi Vert, Oh Wonder","The Way Life Goes (feat. Oh Wonder)","Generation Now/Atlantic",4,158,413,"243918"
157,"spotify:track:0pqnGHJpmpxLKifKRmU6WP","Imagine Dragons","Believer","Kid Ina Korner / Interscope",9,156,624,"242304"
158,"spotify:track:4OBZT9EnhYIV17t4pGw7ig","H.E.R., Daniel Caesar","Best Part (feat. Daniel Caesar)","MBK Entertainment/RCA Records",127,160,137,"240379"
159,"spotify:track:6Q36XucqrejMId3RydVhch","Quavo","BIGGEST ALLEY OOP","Quality Control Music/Motown Records/Capitol Records",23,148,7,"234830"
160,"spotify:track:2fQrGHiQOvpL9UgPvtYy6G","21 Savage","Bank Account","Slaughter Gang, LLC/Epic Records",1,169,469,"234267"
161,"spotify:track:3GCdLUSnKSMJhs4Tj6CV3s","Kendrick Lamar, SZA","All The Stars (with SZA)","Black Panther (TDE/DMG) PS",2,168,287,"234078"
162,"spotify:track:1BuZAIO8WZpavWVbbq3Lci","Rae Sremmurd, Swae Lee, Slim Jxmmi, Juicy J","Powerglide (feat. Juicy J) - From SR3MM","Mike WiLL Made-It",15,172,232,"233197"
163,"spotify:track:5gFmgXPCLu9xIfMUXSbRru","Joji","YEAH RIGHT","88rising Music/Warner Records",141,151,11,"231208"
164,"spotify:track:23OXdR7YuUBVWh5hSnYJau","Twenty One Pilots","Chlorine","Fueled By Ramen",45,154,14,"230870"
165,"spotify:track:6PoKfDY78ih5OveWirggRX","Lil Baby, Gunna, Lil Durk, NAV","Off White VLONE (Lil Baby & Gunna feat. Lil Durk & NAV)","Quality Control Music/Young Stoner Life Records, a 300 Entertainment Label/Motown Records/Capitol Records",16,162,14,"230112"
166,"spotify:track:1rfofaqEpACxVEHIZBJe6W","Camila Cabello, Young Thug","Havana (feat. Young Thug)","Syco Music/Epic",2,167,439,"230086"
167,"spotify:track:5tz69p7tJuGPeMGwNTxYuV","Logic, Alessia Cara, Khalid","1-800-273-8255","Def Jam Recordings",1,170,537,"229767"
168,"spotify:track:28FGV3ORH14MYORd7s5dlU","Eminem, Royce Da 5'9""","Not Alike (feat. Royce Da 5'9)","Aftermath",5,163,49,"229444"
169,"spotify:track:4H7WNRErSbONkM06blBoGc","Post Malone","Stay","Republic Records",4,173,168,"229233"
170,"spotify:track:51rXHuKN8Loc4sUlKPODgH","Jay Rock, Kendrick Lamar, Future, James Blake","King's Dead (with Kendrick Lamar, Future & James Blake)","Black Panther (TDE/DMG) PS",7,176,280,"228706"
171,"spotify:track:7vGuf3Y35N4wmASOKLUVVU","Marshmello, Khalid","Silence","Joytime Collective/RCA Records",7,165,395,"228690"
172,"spotify:track:0JYAsQJWIuaYUvZGF1qapT","Quavo, Travis Scott","RERUN (feat. Travis Scott)","Quality Control Music/Motown Records/Capitol Records",28,159,7,"226436"
173,"spotify:track:1l9G7M8gNyQsgOGWZGoQsT","Lady Gaga","Look What I Found","A Star is Born OST",161,161,4,"226083"
174,"spotify:track:58QhkbaAkLFnn7JwAnAato","Eminem","Fall","Aftermath",8,175,49,"225951"
175,"spotify:track:55GiOwtxNajXVbpjjIzMnD","Tyga","SWISH","Last Kings Music / EMPIRE",23,174,85,"225701"
176,"spotify:track:4vaxvNDaLSoD36iZX515ug","Lil Xan","Betrayed","Columbia",21,179,366,"224262"
177,"spotify:track:2UVbBKQOdFAekPTRsnkzcf","Migos","Stir Fry","Quality Control Music, LLC",2,183,298,"219995"
178,"spotify:track:0tgVpDi06FyKpA1z0VMD4v","Ed Sheeran","Perfect","Atlantic Records UK",11,177,476,"219940"
179,"spotify:track:6nO3tr47nr2P7f3hXb8JIo","NAV, Travis Scott","Champion (feat. Travis Scott)","Republic Records",47,185,143,"219809"
180,"spotify:track:6PGoSes0D9eUDeeAafB2As","Kendrick Lamar, Zacari","LOVE. FEAT. ZACARI.","Aftermath",5,181,538,"219509"
181,"spotify:track:62vpWI1CHwFy7tMIcSStl8","J. Cole","No Role Modelz","Roc Nation Records LLC",64,190,584,"219215"
182,"spotify:track:2rxQMGVafnNaRaXlRMWPde","Luke Combs","Beautiful Crazy","River House Artists/Columbia Nashville",103,182,134,"218977"
183,"spotify:track:5W1DiMUBM2vAcXhXieeVD6","Joji","TEST DRIVE","88rising Music/Warner Records",166,166,2,"218010"
184,"spotify:track:7K7MUBCnzgBAvMVW2RTWNs","Loud Luxury, Brando","Body","Armada Music",22,180,126,"217346"
185,"spotify:track:01TnVDiet1DFTsyWKUKovl","XXXTENTACION","NUMB","Bad Vibes Forever, LLC",9,187,153,"216799"
186,"spotify:track:4dVpf9jZjcORqGTLUaeYj9","A$AP Ferg","Plain Jane","RCA Records Label",6,191,408,"216079"
187,"spotify:track:01vv2AjxgP4uUyb8waYO5Y","Twenty One Pilots","Morph","Fueled By Ramen",22,171,14,"215696"
188,"spotify:track:0wbnC9AUenxp613TYaJsGK","Migos","Narcos","Quality Control Music, LLC",2,184,225,"213000"
189,"spotify:track:5uCax9HTNlzGybIStD3vDh","James Arthur","Say You Won't Let Go","Columbia",14,178,521,"212381"
190,"spotify:track:6G8kHiVZ1jW7vHMPVRNZU0","Drake, Michael Jackson","Don’t Matter To Me (with Michael Jackson)","Cash Money/Drake LP6",2,186,101,"211222"
191,"spotify:track:6jreFSOTUAViWjKyzOC4Kg","Alesso","REMEDY","10:22 pm",58,188,43,"211012"
192,"spotify:track:1co0puPTYvqAdUEjFOjne9","Florida Georgia Line","Simple","BMLG Records",50,192,137,"209982"
193,"spotify:track:6vsV4D8BM6PioRr1UOx0n2","Billie Eilish","you should see me in a crown","Darkroom/Interscope Records",25,-1,52,"209976"
194,"spotify:track:2DQ1ITjI0YoLFzuADN1ZBW","G-Eazy, A$AP Rocky, Cardi B","No Limit","BPG/RVG/RCA Records",2,-1,373,"207457"
195,"spotify:track:6KBYefIoo7KydImq1uUQlL","Cardi B","Bodak Yellow","Atlantic/KSR",2,200,439,"207314"
196,"spotify:track:2374M0fQpWi3dLnB54qaLX","TOTO","Africa","Columbia",126,197,174,"207178"
197,"spotify:track:3qnoOm4fwZPBS116f5hpgF","Kanye West","All Mine","Getting Out Our Dreams, Inc./Def Jam Recordings",1,199,137,"206703"
198,"spotify:track:2Yer0p7uB2lVBUAtANuuQp","Social House, Lil Yachty","Magic In The Hamptons (feat. Lil Yachty)","Silent Records / Social House",76,195,64,"206284"
199,"spotify:track:575NJxNUVDqwJGdzBrlLbv","Shawn Mendes, Zedd","Lost In Japan - Remix","Island Records",16,193,67,"206015"
200,"spotify:track:05r1GGg1Rhs0RcUg27C82a","Lil Wayne, Reginae Carter","Famous (feat. Reginae Carter)","Young Money Records, Inc.",12,189,21,"205562"
