rank,uri,artist_names,track_name,source,peak_rank,previous_rank,days_on_chart,streams
1,"spotify:track:0TK2YIli7K1leLovkQiNik","Shawn Mendes, Camila Cabello","Señorita","Island Records",1,1,31,"1347055"
2,"spotify:track:6vBdBCoOhKHiYDDOcorfNo","Post Malone, Young Thug","Goodbyes (feat. Young Thug)","Republic Records",1,2,17,"1240568"
3,"spotify:track:5qmq61DAAOUaW8AUo8xKhh","Lizzo","Truth Hurts","Nice Life/Atlantic",3,3,92,"1158028"
4,"spotify:track:5ry2OE6R2zPQFDO85XkgRb","Drake, Rick Ross","Money In The Grave (Drake ft. Rick Ross)","Republic Records",1,4,37,"1123856"
5,"spotify:track:6fTt0CH2t0mdeB2N9XFG5r","Lil Nas X","Panini","Columbia",1,5,32,"1101096"
6,"spotify:track:1kBbgxAUc4HQv7cgIayIDH","Lil Tecca","Ransom","Republic Records",6,6,59,"1063183"
7,"spotify:track:3KkXRkHbMCARz0aVfEt68P","Post Malone, Swae Lee","Sunflower - Spider-Man: Into the Spider-Verse","Universal Records",1,8,277,"893271"
8,"spotify:track:70eFcWOvlMObDhURTqT4Fv","Ed Sheeran, Khalid","Beautiful People (feat. Khalid)","Atlantic Records UK",3,7,24,"886970"
9,"spotify:track:2gwkD6igEhQbDQegRCcdoB","DaBaby","Suge","South Coast Music Group/Interscope Records",3,9,114,"855145"
10,"spotify:track:2Fxmhks0bxGSBdJ92vM42m","Billie Eilish","bad guy","Darkroom/Interscope Records",1,12,115,"735911"
11,"spotify:track:7DcvwMAiqKJQD1rrdfxSDx","Young Thug, J. Cole, Travis Scott","The London (feat. J. Cole & Travis Scott)","300 Entertainment/Atl",1,10,60,"718227"
12,"spotify:track:51Fjme0JiitpyXKuyQiCDo","Y2K, bbno$","Lalala","Columbia",12,15,36,"692234"
13,"spotify:track:1DhRbox3xkceP64k3JeYfW","Ed Sheeran, Travis Scott","Antisocial (with Travis Scott)","Atlantic Records UK",5,11,10,"684594"
14,"spotify:track:6b2RcmUt1g9N9mQ3CbjX2Y","Sam Smith","How Do You Sleep?","Capitol",11,13,3,"673380"
15,"spotify:track:4hPpVbbakQNv8YTHYaOJP4","Marshmello, Kane Brown","One Thing Right","RCA Records Label Nashville",14,16,31,"660860"
16,"spotify:track:6u7jPi22kF8CTQ3rb9DHE7","Lil Nas X, Billy Ray Cyrus","Old Town Road - Remix","Columbia",1,14,108,"658126"
17,"spotify:track:0hVXuCcriWRGvwMV1r5Yn9","Ed Sheeran, Justin Bieber","I Don't Care (with Justin Bieber)","Atlantic Records UK",1,17,73,"644665"
18,"spotify:track:6uFn47ACjqYkc0jADwEdj1","Polo G, Lil Tjay","Pop Out (feat. Lil Tjay)","Columbia",8,19,121,"629407"
19,"spotify:track:3yNZ5r3LKfdmjoS3gkhUCT","Billie Eilish, Justin Bieber","bad guy (with Justin Bieber)","Darkroom/Interscope Records",3,18,10,"624595"
20,"spotify:track:6XHVuErjQ4XNm6nDPVCxVX","Chris Brown, Drake","No Guidance (feat. Drake)","Chris Brown Entertainment/RCA Records",3,20,44,"598663"
21,"spotify:track:4ak7xjvBeBOcJGWFDX9w5n","Lil Nas X, Cardi B","Rodeo","Columbia",7,21,31,"595865"
22,"spotify:track:6TqXcAFInzjp0bODyvrWEq","Khalid, Disclosure","Talk (feat. Disclosure)","Right Hand Music Group, LLC/RCA Records",5,22,165,"572299"
23,"spotify:track:1kK6DwzyXJSp58u5HYWwuD","YG, Tyga, Jon Z","Go Loko (feat. Tyga, Jon Z)","Def Jam Recordings",14,23,80,"558014"
24,"spotify:track:6moU77g9RQyMzHNuKEaQKq","Ali Gatie","It's You","Warner Records",15,25,38,"549799"
25,"spotify:track:2nKYHpmwjLaEOXS3o7QMiz","Quality Control, Lil Baby, DaBaby","Baby","Quality Control Music/Motown Records",24,24,5,"535001"
26,"spotify:track:5hVghJ4KaYES3BFUATCYn0","Tyler, The Creator","EARFQUAKE","Columbia",1,26,66,"532272"
27,"spotify:track:6MWtB6iiXyIwun0YzU6DFP","Post Malone","Wow.","Republic Records",1,27,210,"508885"
28,"spotify:track:2JvzF1RMd7lE3KmFlsyZD8","J. Cole","MIDDLE CHILD","Dreamville, Inc., Under exclusive license to Roc Nation Records",1,28,179,"505363"
29,"spotify:track:67XyC1GdSkKb9sbRRkUDXS","NLE Choppa, Blueface","Shotta Flow (Feat. Blueface) [Remix]","No Love Entertainment",29,30,20,"503246"
30,"spotify:track:6uAm7pG66O1XesXS9bpHSF","Lizzo","Good as Hell","Nice Life/Atlantic",30,31,37,"476657"
31,"spotify:track:7qEHsqek33rTcFNT9PFqLf","Lewis Capaldi","Someone You Loved","Vertigo Berlin",30,37,84,"461185"
32,"spotify:track:6LsAAHotRLMOHfCsSfYCsz","Shawn Mendes","If I Can't Have You","Island Records",3,33,80,"457459"
33,"spotify:track:5dW1VZPcFqB4n0P08rGDgm","Blanco Brown","The Git Up","Broken Bow Records",33,34,39,"454397"
34,"spotify:track:29fRTIKsJhLUJoldM89GZS","Taylor Swift","You Need To Calm Down","Taylor Swift",1,32,38,"452089"
35,"spotify:track:2zjGJ0dChMR0KxBZS15aqo","Mustard, NAV, Playboi Carti, A Boogie Wit da Hoodie","Baguettes in the Face (feat. NAV, Playboi Carti & A Boogie Wit da Hoodie)","10 Summers Records/Interscope Records",35,36,24,"447558"
36,"spotify:track:7oqftogUN82Q7VNy2TmTJW","Beyoncé, JAY-Z, Childish Gambino, Oumou Sangaré","MOOD 4 EVA (feat. Oumou Sangaré)","Parkwood Entertainment/Columbia",22,29,3,"443513"
37,"spotify:track:3XiNC94b4Tq1xwv70sQJGN","Lil Uzi Vert","Sanguine Paradise","Generation Now/Atlantic",6,39,103,"441142"
38,"spotify:track:6jmZlyf9DxcIoRrjw02YXm","Lil Nas X, Billy Ray Cyrus, Mason Ramsey, Young Thug","Old Town Road - Remix","Columbia",18,35,10,"433181"
39,"spotify:track:1wJRveJZLSb1rjhnUHQiv6","A Boogie Wit da Hoodie, 6ix9ine","Swervin (feat. 6ix9ine)","Highbridge the Label / Atlantic Records",6,42,213,"432897"
40,"spotify:track:2TH65lNHgvLxCKXM3apjxI","Bad Bunny, Tainy","Callaita","Rimas Entertainment LLC",37,40,52,"430538"
41,"spotify:track:2IRZnDFmlqMuOrYOLnZZyc","Meek Mill, Drake","Going Bad (feat. Drake)","MMG/Atlantic",2,43,234,"420900"
42,"spotify:track:22vgEDb5hykfaTwLuskFGD","Jonas Brothers","Sucker","Jonas Brothers Recording",1,44,143,"415627"
43,"spotify:track:3j84U36KvLeXNDPv4t5pI8","Mustard, Migos","Pure Water (with Migos)","10 Summers Records/Interscope Records",11,45,185,"411697"
44,"spotify:track:4wuCQX7JvAZLlrcmH4AeZF","Ed Sheeran, Chance the Rapper, PnB Rock","Cross Me (feat. Chance the Rapper & PnB Rock)","Atlantic Records UK",8,41,59,"405408"
45,"spotify:track:43zdsphuZLzwA9k4DJhU0I","Billie Eilish","when the party's over","Darkroom/Interscope Records",5,48,278,"403741"
46,"spotify:track:4vUmTMuQqjdnvlZmAH61Qk","Ed Sheeran, Camila Cabello, Cardi B","South of the Border (feat. Camila Cabello & Cardi B)","Atlantic Records UK",9,38,10,"399660"
47,"spotify:track:05CwHjIk71RXVU40boRMnR","The Chainsmokers, Bebe Rexha","Call You Mine","Disruptor Records/Columbia",20,47,52,"393024"
48,"spotify:track:5rU6kDNXZLXIinFezpbWbO","NAV, Meek Mill","Tap (feat. Meek Mill)","XO Records, LLC and Republic Records",48,50,89,"390072"
49,"spotify:track:6ocbgoVGwYJhOv1GgI9NsF","Ariana Grande","7 rings","Republic Records",1,49,185,"386961"
50,"spotify:track:78QR3Wp35dqAhFEc2qAGjE","Lil Baby, Gunna","Drip Too Hard (Lil Baby & Gunna)","Quality Control Music/Young Stoner Life Records, a 300 Entertainment Label/Motown Records/Capitol Records",1,53,313,"379018"
51,"spotify:track:7eBqSVxrzQZtK2mmgRG6lC","YNW Melly","Murder On My Mind","P2018",4,57,299,"371189"
52,"spotify:track:6CcJMwBtXByIz4zQLzFkKc","Billie Eilish","i love you","Darkroom/Interscope Records",14,61,115,"364624"
53,"spotify:track:0qc4QlcCxVTGyShurEv1UU","Sam Feldt, RANI","Post Malone (feat. RANI)","Spinnin' Records",34,51,32,"360723"
54,"spotify:track:0u2P5u6lvoDfwTYjAADbn4","Billie Eilish, Khalid","lovely (with Khalid)","Darkroom",18,62,458,"358658"
55,"spotify:track:2gTdDMpNxIRFSiu7HutMCg","Machine Gun Kelly, YUNGBLUD, Travis Barker","I Think I'm OKAY (with YUNGBLUD & Travis Barker)","Bad Boy/Interscope Records",29,52,45,"357786"
56,"spotify:track:0B3FovCVaGKS5w1FTidEUP","Blue Ivy, SAINt JHN, Beyoncé, WizKid","BROWN SKIN GIRL","Parkwood Entertainment/Columbia",32,46,3,"353363"
57,"spotify:track:285pBltuF7vW8TeWk8hdRR","Juice WRLD","Lucid Dreams","Juice WRLD Mixtape / ISR P&D",1,64,441,"351560"
58,"spotify:track:5PYQUBXc7NYeI1obMKSJK0","Katy Perry","Never Really Over","Capitol Records",10,55,52,"350005"
59,"spotify:track:56JyMaElW79S7TDWh1Zw1m","Ashley O","On A Roll","RCA Records Label",27,54,37,"349779"
60,"spotify:track:7ILEWkpfdK6AjH2D7jppWk","Chris Brown, Justin Bieber, Ink","Don't Check On Me (feat. Justin Bieber & Ink)","Chris Brown Entertainment/RCA Records",20,58,25,"349102"
61,"spotify:track:2xLMifQCjDGFmkHkpNLD9h","Travis Scott","SICKO MODE","Cactus Jack / Epic / Grand Hustle",1,60,353,"346608"
62,"spotify:track:5WnfnSpuNEGXyEt78PBA6d","Dreamville, Bas, JID, Guapdad 4000, Reese LAFLARE, Jace, Mez, Smokepurpp, Buddy, Ski Mask The Slump God","Costa Rica (with Bas & JID feat. Guapdad 4000, Reese LAFLARE, Jace, Mez, Smokepurpp, Buddy & Ski Mask The Slump God)","Dreamville/Interscope Records",20,59,19,"346425"
63,"spotify:track:6kls8cSlUyHW2BUOkDJIZE","Ellie Goulding, Juice WRLD","Hate Me (with Juice WRLD)","Polydor Records",46,65,24,"345608"
64,"spotify:track:7rvyVWja33WG9R97oeJAjx","Calboy","Envy Me","Polo Grounds Music/RCA Records",22,73,207,"341329"
65,"spotify:track:6zeeWid2sgw4lap2jV61PZ","Khalid","Better","Right Hand Music Group, LLC/RCA Records",7,71,311,"340517"
66,"spotify:track:7FGq80cy8juXBCD2nrqdWU","benny blanco, Halsey, Khalid","Eastside (with Halsey & Khalid)","Friends Keep Secrets/Interscope Records",7,68,374,"335801"
67,"spotify:track:6Hj9jySrnFppAI0sEMCZpJ","Juice WRLD","Robbery","Grade A Productions/Interscope Records",2,78,158,"331434"
68,"spotify:track:4SSnFejRGlZikf02HLewEF","Billie Eilish","bury a friend","Darkroom/Interscope Records",3,76,173,"331052"
69,"spotify:track:7njKgVl3AnLflRad38o7AG","Bazzi","Paradise","iamcosmic",18,69,108,"329467"
70,"spotify:track:53CJANUxooaqGOtdsBTh7O","Lil Nas X","Old Town Road","Columbia",1,72,142,"328932"
71,"spotify:track:2dpaYNEQHiRxtZbfNsse99","Marshmello, Bastille","Happier","Astralwerks",5,74,339,"328771"
72,"spotify:track:4R9ATNRRl1uth17i5qDCc0","Bazzi","I.F.L.Y.","iamcosmic",54,63,3,"327577"
73,"spotify:track:5KBARWIxeMGkvUax9VtVC9","Saweetie","My Type","ICY/Artistry Records/Warner Records",67,67,18,"325784"
74,"spotify:track:7dt6x5M1jzdTEt8oCbisTK","Post Malone","Better Now","Republic Records",1,77,451,"321065"
75,"spotify:track:40OMBMYRk5IQL6xCzGM0JA","Martin Garrix, Macklemore, Fall Out Boy","Summer Days (feat. Macklemore & Patrick Stump of Fall Out Boy)","Epic Amsterdam",27,75,83,"314588"
76,"spotify:track:6oJ6le65B3SEqPwMRNXWjY","Kygo, Whitney Houston","Higher Love","Kygo/RCA Records",22,70,24,"313793"
77,"spotify:track:0AtP8EkGPn6SwxKDaUuXec","Ed Sheeran, Eminem, 50 Cent","Remember The Name (feat. Eminem & 50 Cent)","Atlantic Records UK",13,56,10,"312843"
78,"spotify:track:0DiDStADDVh3SvAsoJAFMk","Jonas Brothers","Only Human","Jonas Brothers Recording",6,79,45,"309859"
79,"spotify:track:0e7ipj03S05BNilyu5bRzt","Post Malone, 21 Savage","rockstar (feat. 21 Savage)","Republic Records",1,81,675,"304214"
80,"spotify:track:1c0hsvHLELX6y8qymnpLKL","Lunay, Daddy Yankee, Bad Bunny","Soltera - Remix","La Familia",52,80,73,"297591"
81,"spotify:track:2ksOAxtIxY8yElEWw8RhgK","Anuel AA, Daddy Yankee, KAROL G, J Balvin, Ozuna","China","2019 Real Hasta La Muerte, LLC.",81,107,3,"295260"
82,"spotify:track:3AEgic4yp82NxMWUjHtxnO","Ambjaay","Uno","Columbia",82,93,14,"294248"
83,"spotify:track:5p7ujcrUXASCNwRaWNHR1C","Halsey","Without Me","Capitol Records",5,88,291,"292861"
84,"spotify:track:3ee8Jmje8o58CHK66QrVC2","XXXTENTACION","SAD!","Bad Vibes Forever, LLC",1,95,507,"291534"
85,"spotify:track:3Ol2xnObFdKV9pmRD2t9x8","A Boogie Wit da Hoodie","Look Back at It","Highbridge the Label / Atlantic Records",8,89,227,"291420"
86,"spotify:track:6MF4tRr5lU8qok8IKaFOBE","Dreamville, J. Cole, Lute, DaBaby","Under The Sun (with J. Cole & Lute feat. DaBaby)","Dreamville/Interscope Records",10,82,17,"290347"
87,"spotify:track:59ywHNwwchG4nZJMLyxSzd","Offset, Cardi B","Clout (feat. Cardi B)","Quality Control Music/Motown Records",41,84,101,"287958"
88,"spotify:track:4XiGKQqbmnMVxDzUj6j3f2","YK Osiris","Worth It","Def Jam Recordings",68,94,141,"285027"
89,"spotify:track:3Fj47GNK2kUF0uaEDgXLaD","Billie Eilish","wish you were gay","Darkroom/Interscope Records",2,104,140,"282807"
90,"spotify:track:1Ej96GIBCTvgH7tNX1r3qr","Sech, Darell","Otro Trago","Rich Music/Ingrooves Records",64,87,66,"282494"
91,"spotify:track:3TpBefRZ1vFcOH6z57PQRI","Bryce Vine, YG","La La Land (feat. YG)","Sire",73,91,52,"282489"
92,"spotify:track:7f1zjZG77S891Uv4O68yfk","DaBaby, Offset","Baby Sitter (feat. Offset)","South Coast Music Group/Interscope Records",55,96,72,"281825"
93,"spotify:track:6foY66mWZN0pSRjZ408c00","Morgan Wallen","Whiskey Glasses","Big Loud Records",58,97,130,"281319"
94,"spotify:track:68Vm2W4oURsPV3121vUZgB","NF","Time - Edit","NF Real Music",60,92,10,"280961"
95,"spotify:track:3WyRgi8CzQnhzO0xw79tTS","DaBaby","Goin Baby","South Coast Music Group/Interscope Records",59,100,94,"280066"
96,"spotify:track:7nfmK6oHPDlAd68A11d7AN","Luke Combs","Beer Never Broke My Heart","River House Artists/Columbia Nashville",32,86,75,"279920"
97,"spotify:track:2rxQMGVafnNaRaXlRMWPde","Luke Combs","Beautiful Crazy","River House Artists/Columbia Nashville",54,101,375,"278524"
98,"spotify:track:0k664IuFwVP557Gnx7RhIl","Lizzo","Juice","Nice Life/Atlantic",57,83,94,"278105"
99,"spotify:track:36J0iaPDGbYGsHvYpaYs3k","Dreamville, JID, Bas, J. Cole, EARTHGANG, Young Nudy","Down Bad (feat. JID, Bas, J. Cole, EARTHGANG & Young Nudy)","Dreamville/Interscope Records",12,90,39,"277763"
100,"spotify:track:6Qs4SXO9dwPj5GKvVOv8Ki","Sam Smith, Normani","Dancing With A Stranger (with Normani)","Capitol",10,85,192,"277287"
101,"spotify:track:2t8yVaLvJ0RenpXUIAC52d","21 Savage","a lot","Slaughter Gang, LLC/Epic Records",2,105,213,"276429"
102,"spotify:track:3GJ4hzg4lrGwU51Y3VARbF","Dan + Shay","Speechless","Warner Records",77,106,334,"276203"
103,"spotify:track:3e9HZxeyfWwjeyPAMmWSSQ","Ariana Grande","thank u, next","Republic Records",1,98,260,"276082"
104,"spotify:track:3A2yGHWIzmGEIolwonU69h","City Girls","Act Up","Quality Control Music/Motown Records",61,102,141,"274778"
105,"spotify:track:6XkLPzkKzPhpr3hrvl1TUq","Blueface, Rich The Kid","Daddy (feat. Rich The Kid)","Cash Money Records Inc.",105,113,16,"271781"
106,"spotify:track:2wZjsbwmWfNVslgV5afl1L","Lil Baby, Future","Out The Mud","Quality Control/Motown Records",41,99,31,"270545"
107,"spotify:track:6G0FACzGN80Dj2v4ass5rq","iann dior, Trippie Redd","gone girl","TenThousand Projects, LLC",89,112,10,"268613"
108,"spotify:track:0OTBOHjEaoqroFlfut1ZsH","XXXTENTACION, Ky-Mani Marley, Stefflon Don, Vybz Kartel","Royalty (feat. Ky-Mani Marley, Stefflon Don & Vybz Kartel)","Bad Vibes Forever / EMPIRE",44,66,3,"267716"
109,"spotify:track:4u7EnebtmKWzUH433cf5Qv","Queen","Bohemian Rhapsody - Remastered 2011","Hollywood Records",36,115,272,"265495"
110,"spotify:track:0fea68AdmYNygeTGI4RC18","J Balvin, Bad Bunny","LA CANCIÓN","Universal Music Latino / Rimas",30,103,24,"264379"
111,"spotify:track:4dAMdQ6g4kGmnc1MDHsg77","NLE Choppa","Shotta Flow","No Love Entertainment",43,116,125,"264091"
112,"spotify:track:0rKtyWc8bvkriBthvHKY8d","Joji","SLOW DANCING IN THE DARK","88rising Music/Warner Records",26,123,303,"261828"
113,"spotify:track:4kV4N9D1iKVxx1KLvtTpjS","Ariana Grande","break up with your girlfriend, i'm bored","Republic Records",1,109,164,"261169"
114,"spotify:track:1dyxS3YzBbL0t8rEVwVQ1K","Blake Shelton","God's Country","Warner Records",59,114,77,"259980"
115,"spotify:track:0FZ4Dmg8jJJAPJnvBIzD9z","Kodak Black, Offset, Travis Scott","ZEZE (feat. Travis Scott & Offset)","Atlantic Records",1,120,283,"256744"
116,"spotify:track:0JP9xo3adEtGSdUEISiszL","XXXTENTACION","Moonlight","Bad Vibes Forever, LLC",2,124,493,"255948"
117,"spotify:track:7M2tXmeS15NAzEn7ABFeBg","Logic, Eminem","Homicide (feat. Eminem)","Def Jam Recordings",1,119,80,"255343"
118,"spotify:track:75ZvA4QfFiZvzhj2xkaWAh","Post Malone","I Fall Apart","Universal Records",2,125,674,"253342"
119,"spotify:track:58q2HKrzhC3ozto2nDdN4z","Cardi B, Bad Bunny, J Balvin","I Like It","Atlantic/KSR",2,111,472,"252539"
120,"spotify:track:5kfNriitmkNE8mUbZ7gbq8","Khalid","Saturday Nights","Right Hand Music Group, LLC/RCA Records",13,122,270,"252534"
121,"spotify:track:25ZAibhr3bdlMCLmubZDVt","J Balvin, Bad Bunny","QUE PRETENDES","Universal Music Latino / Rimas",16,110,24,"250534"
122,"spotify:track:2VxeLyX666F8uXCJ0dZF8B","Lady Gaga, Bradley Cooper","Shallow","A Star is Born OST",6,127,295,"249121"
123,"spotify:track:2rMAtCaTj16NptyVfEIeAC","Megan Thee Stallion, DaBaby","Cash Shit (feat. DaBaby)","300 Entertainment",117,117,27,"247458"
124,"spotify:track:1rqqCSm0Qe4I9rUvWncaom","Panic! At The Disco","High Hopes","DCD2 / Fueled By Ramen",12,121,405,"247379"
125,"spotify:track:1f38Gx6xQz6r4H1jGVNBJo","DJ Snake, J Balvin, Tyga","Loco Contigo (feat. J. Balvin & Tyga)","DJ Snake Music Productions Limited",53,118,38,"245483"
126,"spotify:track:7m9OqQk4RVRkw9JJdeAw96","XXXTENTACION","Jocelyn Flores","Bad Vibes Forever / EMPIRE",2,141,696,"243324"
127,"spotify:track:1ThmUihH9dF8EV08ku5AXN","Ski Mask The Slump God","Faucet Failure","Republic Records",25,140,229,"242410"
128,"spotify:track:0TlLq3lA83rQOYtrqBqSct","Drake","Nonstop","Cash Money/Drake LP6",1,128,388,"239662"
129,"spotify:track:4tNXntkAzQ5A2dfYRYGIIQ","5 Seconds of Summer","Easier","5 Seconds Of Summer/Interscope",18,135,59,"238028"
130,"spotify:track:2iUXsYOEPhVqEBwsqP70rE","5 Seconds of Summer","Youngblood","Capitol",12,129,463,"238011"
131,"spotify:track:5Z3GHaZ6ec9bsiI5BenrbY","Khalid","Young Dumb & Broke","Right Hand Music Group, LLC/RCA Records",5,139,830,"237733"
132,"spotify:track:3swc6WTsr7rl9DqQKQA55C","Post Malone, Ty Dolla $ign","Psycho (feat. Ty Dolla $ign)","Republic Records",1,133,514,"237389"
133,"spotify:track:4MsUsFfWseB9M2plGJyuIw","Taylor Swift, Brendon Urie, Panic! At The Disco","ME! (feat. Brendon Urie of Panic! At The Disco)","Taylor Swift",1,126,87,"237087"
134,"spotify:track:3XF5xLJHOQQRbWya6hBp7d","Billie Eilish","you should see me in a crown","Darkroom/Interscope Records",7,142,270,"236059"
135,"spotify:track:0oVxGuRMnawFgA8aduocfc","Tory Lanez","Forever","Mad Love/Interscope Records",82,108,3,"235633"
136,"spotify:track:2WyRfGeHo97VC5mP1BBSzr","Miley Cyrus","Mother's Daughter","RCA Records Label",9,131,52,"234575"
137,"spotify:track:42fw0rxRO2xbesF6mJfd4Y","Dan + Shay","Tequila","Warner Records",48,144,503,"233831"
138,"spotify:track:2uIX8YMNjGMD7441kqyyNU","Billie Eilish","ocean eyes","Darkroom",61,149,388,"232952"
139,"spotify:track:2toVe5hfuIi97ytDPDbQFt","Tyga, Offset","Taste (feat. Offset)","Last Kings Music / EMPIRE",3,136,430,"232819"
140,"spotify:track:22oEJW6r2rMb9z4IntfyEa","Panic! At The Disco","Hey Look Ma, I Made It","DCD2 / Fueled By Ramen",47,143,107,"232737"
141,"spotify:track:4e4fqjx0Izh4svvTef1z7e","Bebe Rexha, Florida Georgia Line","Meant to Be (feat. Florida Georgia Line)","Warner Bros.",15,130,678,"232716"
142,"spotify:track:4VXIryQMWpIdGgYR4TrjT1","Juice WRLD","All Girls Are The Same","Juice WRLD Mixtape / ISR P&D",12,150,457,"232662"
143,"spotify:track:5w9c2J52mkdntKOmRLeM2m","Daddy Yankee, Snow","Con Calma","El Cartel Records (EC3)",43,132,164,"231439"
144,"spotify:track:6vN77lE9LK6HP2DewaN6HZ","Lil Baby, Drake","Yes Indeed","Quality Control Music, LLC",2,145,433,"231092"
145,"spotify:track:5Uw7Dut2lZfexn3Y09swpf","Mark Ronson, Camila Cabello","Find U Again (feat. Camila Cabello)","Columbia",21,137,52,"230600"
146,"spotify:track:4R8BJggjosTswLxtkw8V7P","Jhay Cortez, J Balvin, Bad Bunny","No Me Conoce - Remix","N&E Entertainment LLC",134,134,40,"229935"
147,"spotify:track:4qQwGRtGT7l6ckQtdPEFd4","Florida Georgia Line","Talk You Out Of It","BMLG Records",140,146,64,"229902"
148,"spotify:track:3a1lNhkSLSkpJE4MSHpDu9","Post Malone, Quavo","Congratulations","Universal Records",5,147,931,"227729"
149,"spotify:track:4dV3okcjbQwTcg4ObIGr4N","Shordie Shordie","Bitchuary","Warner Records",137,151,22,"226104"
150,"spotify:track:2Jh3UqxnHJMyzMzku4uOtE","Juice WRLD","Feeling","Grade A Productions/Interscope Records",34,148,117,"225583"
151,"spotify:track:14mHfNsSHN0FbLftyjrV9g","Flipp Dinero","Leave Me Alone","Cinematic/Epic/We The Best",10,156,344,"224506"
152,"spotify:track:7GX5flRQZVHRAGd6B4TmDO","Lil Uzi Vert","XO Tour Llif3","Generation Now/Atlantic",1,157,850,"224480"
153,"spotify:track:1xzBco0xcoJEDXktl7Jxrr","Sheck Wes","Mo Bamba","Cactus Jack Records/ G.O.O.D. Music/ Interscope Records",1,155,360,"222502"
154,"spotify:track:7AQim7LbvFVZJE3O8TYgf2","XXXTENTACION, Trippie Redd","Fuck Love (feat. Trippie Redd)","Bad Vibes Forever / EMPIRE",5,162,696,"222136"
155,"spotify:track:6vWEAOUSxohKxhp0K1BsxL","YNW Melly, Kanye West","Mixed Personalities (feat. Kanye West)","P2019",12,154,184,"222006"
156,"spotify:track:4ZT9FnbFu1PaBfV3itxiqT","Lil Skies","I","All We Got Ent.",13,159,143,"220658"
157,"spotify:track:2KqJC0koTBUyDlsMt5ok1V","Thomas Rhett","Look What God Gave Her","The Valory Music Co.",57,152,80,"218329"
158,"spotify:track:40T5GIqQ1CegGm2PTEl8Bu","Billie Eilish","idontwannabeyouanymore","Darkroom",40,166,364,"218063"
159,"spotify:track:6DCZcSspjsKoFjzjrWoCdn","Drake","God's Plan","Cash Money/Drake LP6",1,153,548,"218027"
160,"spotify:track:7zLYKWcXnYeHHWidalz7rj","Lil Mosey","Noticed","Mogul Vision/Interscope Records",17,169,339,"217835"
161,"spotify:track:5wujBwqG7INdStqGd4tRMX","Juice WRLD","Armed And Dangerous","Juice WRLD Mixtape / ISR P&D",9,171,255,"216668"
162,"spotify:track:2P91MQbaiQOfbiz9VqhqKQ","Lauv","I Like Me Better","Lauv",30,158,768,"215485"
163,"spotify:track:56eGOeSsqdg3FLxdo83TwV","Lee Brice","Rumor","Curb Records",115,163,65,"215211"
164,"spotify:track:2G1tXoGBaEMJ7FKGnkf6ud","Gucci Mane, Bruno Mars, Kodak Black","Wake Up in the Sky","Guwop Enterprises/Atlantic",6,165,311,"214597"
165,"spotify:track:7COXchtUOMd6uIT6HvmRaI","Lauv, Troye Sivan","i'm so tired...","Lauv",22,164,178,"213937"
166,"spotify:track:25sgk305KZfyuqVBQIahim","Ava Max","Sweet but Psycho","Atlantic Records",30,160,286,"211604"
167,"spotify:track:2j7mcsEz4n5XxMMqqjjB6p","Future, Doe Boy, Meek Mill","100 Shooters (feat. Meek Mill)","Epic/Freebandz",82,138,10,"210579"
168,"spotify:track:6ERR6e7h6wCqGoz1TjiUJb","Luke Bryan","Knockin' Boots","Capitol Records Nashville",143,167,21,"209159"
169,"spotify:track:6gBFPUFcJLzWGx4lenP6h2","Travis Scott","goosebumps","Epic/Grand Hustle",16,179,926,"208901"
170,"spotify:track:152lZdxL1OR0ZMW6KquMif","Khalid","Location","Right Hand Music Group, LLC/RCA Records",9,181,921,"208836"
171,"spotify:track:0yFvWTLs3iIwDbc91noXGT","Chance the Rapper, TisaKorean, Murda Beatz","GRoCERIES","Chance the Rapper",35,161,66,"208455"
172,"spotify:track:18uwL0vNUanqZH0ro2QcOP","Jeremy Zucker","comethru","Republic Records",148,184,30,"207875"
173,"spotify:track:7sO5G9EABYOXQKNPNiE9NR","Offset, Metro Boomin","Ric Flair Drip (with Metro Boomin)","Slaughter Gang, LLC/Epic/Quality Control Music/Motown/Capitol/Boominati Worldwide/Republic",4,182,628,"205712"
174,"spotify:track:7mldq42yDuxiUNn08nvzHO","Sam Hunt","Body Like A Back Road","MCA Nashville",12,173,601,"205078"
175,"spotify:track:5T8EDUDqKcs6OSOwEsfqG7","Queen","Don't Stop Me Now - Remastered 2011","Hollywood Records",69,180,215,"204729"
176,"spotify:track:4pCEIQ6wBVuaJdER5bALtO","Lil Uzi Vert","That's a Rack","Generation Now/Atlantic",33,176,102,"204214"
177,"spotify:track:5qrSlOut2rNAWv3ubArkNy","Dean Lewis","Be Alright","Universal Music Australia Pty. Ltd.",19,191,349,"203360"
178,"spotify:track:4bHsxqR3GMrXTxEPLuK5ue","Journey","Don't Stop Believin'","Columbia",157,172,35,"202973"
179,"spotify:track:7KXjTSCq5nL1LoYtL7XAwS","Kendrick Lamar","HUMBLE.","Aftermath",1,178,841,"202166"
180,"spotify:track:3pZO6GoVPeSYDxxsH6vCdj","Dreamville, J. Cole, Young Nudy","Sunset (with J. Cole feat. Young Nudy)","Dreamville/Interscope Records",28,170,17,"200847"
181,"spotify:track:09IStsImFySgyp0pIQdqAc","Zedd, Maren Morris, Grey","The Middle","UMGRI Interscope",5,168,531,"200745"
182,"spotify:track:5icOoE6VgqFKohjWWNp0Ac","Marshmello, CHVRCHES","Here With Me","Marshmello/Republic",15,174,136,"200472"
183,"spotify:track:2tOOcDDYkh0PSjr6GwPEAJ","MAX, Quinn XCII","Love Me Less (feat. Quinn XCII)","Colour Vision Records/Sony Music Entertainment",61,188,76,"200079"
184,"spotify:track:116H0KvKr2Zl4RPuVBruDO","Bad Bunny, Drake","MIA (feat. Drake)","OVO Sound/Warner Records",2,186,280,"198286"
185,"spotify:track:1mMLMZYXkMueg65jRRWG1l","Luke Combs","When It Rains It Pours","River House Artists/Columbia Nashville",110,177,329,"197370"
186,"spotify:track:08tq1XcHwVt5PHXUo87i0D","Dan + Shay","All To Myself","Warner Records",126,193,19,"195823"
187,"spotify:track:1ZDmxwg7Lywlx68b7SsJjj","Nicki Minaj","MEGATRON","Young Money/Cash Money Records",21,175,30,"194123"
188,"spotify:track:2GGMabyHXnJmjY6CXhhB2e","Cardi B","Money","Atlantic/KSR",9,183,265,"193955"
189,"spotify:track:3CA9pLiwRIGtUBiMjbZmRw","Drake","Nice For What","Cash Money/Drake LP6",1,189,459,"193776"
190,"spotify:track:2374M0fQpWi3dLnB54qaLX","TOTO","Africa","Columbia",126,196,190,"192111"
191,"spotify:track:6K4t31amVTZDgR3sKmwUJJ","Tame Impala","The Less I Know The Better","Universal Music Australia Pty. Ltd.",182,-1,11,"191586"
192,"spotify:track:3Tc57t9l2O8FwQZtQOvPXK","Billie Eilish","my strange addiction","Darkroom/Interscope Records",9,-1,111,"190721"
193,"spotify:track:7oK9VyNzrYvRFo7nQEYkWN","The Killers","Mr. Brightside","Island Records",83,198,62,"189941"
194,"spotify:track:6dPyzkyZwoj9LqjQXOFdVv","Cardi B","Press","Atlantic/KSR",7,190,50,"189803"
195,"spotify:track:4OBZT9EnhYIV17t4pGw7ig","H.E.R., Daniel Caesar","Best Part (feat. Daniel Caesar)","MBK Entertainment/RCA Records",53,-1,377,"189546"
196,"spotify:track:3oh6SCCeLuXhFpEyepla6G","Blueface","Thotiana","Fifth Amendment Entertainment/eOne Music",6,-1,175,"188860"
197,"spotify:track:36TO60sxDduIsO3xH8IcUh","Joyner Lucas, Logic","Isis","Twenty Nine Music Group (Joyner Lucas)",13,195,59,"188685"
198,"spotify:track:5nzhL67GpF9szXWg5y509A","Lil Baby","Close Friends (Lil Baby & Gunna)","Quality Control Music/Young Stoner Life Records, a 300 Entertainment Label/Motown Records/Capitol Records",41,-1,200,"188682"
199,"spotify:track:340UVheS8z3ncW9TTUhAbc","Halsey","Nightmare","Capitol Records",10,197,64,"188396"
200,"spotify:track:51NFxnQvaosfDDutk0tams","Billie Eilish","bellyache","Darkroom",39,-1,255,"188147"
