rank,uri,artist_names,track_name,source,peak_rank,previous_rank,days_on_chart,streams
1,"spotify:track:1ZPWWSwCkxKfqdp4H0RFCo","Arizona Zervas","ROXANNE","Arizona Zervas",1,1,15,"1420518"
2,"spotify:track:3eekarcy7kvN4yt5ZFzltW","Travis Scott","HIGHEST IN THE ROOM","Cactus Jack / Epic",1,2,37,"1257998"
3,"spotify:track:21jGcNKet2qwijlDFuPiPb","Post Malone","Circles","Republic Records",1,3,72,"1204645"
4,"spotify:track:6Gg1gjgKi2AK4e0qzsR7sd","Juice WRLD, YoungBoy Never Broke Again","Bandit (with YoungBoy Never Broke Again)","Grade A Productions/Interscope Records",3,4,37,"1183179"
5,"spotify:track:1HfMVBKM75vxSfsQ5VefZ5","Selena Gomez","Lose You To Love Me","Interscope Records",1,5,18,"983847"
6,"spotify:track:4sjiIpEv617LDXaidKioOI","YNW Melly, 9lokknine","223's (feat. 9lokknine)","300 Entertainment",4,8,89,"912664"
7,"spotify:track:7iHHxY2NLlJRAmlAmC4ahQ","Lil Mosey, Gunna","Stuck In A Dream (feat. Gunna)","Mogul Vision/Interscope Records",6,6,51,"848548"
8,"spotify:track:7qEHsqek33rTcFNT9PFqLf","Lewis Capaldi","Someone You Loved","Vertigo Berlin",5,7,195,"825276"
9,"spotify:track:7aiClxsDWFRQ0Kzk5KI5ku","blackbear","hot girl bummer","Alamo",5,9,79,"824348"
10,"spotify:track:2b8fOow8UzyDFAE27YhOZM","Maroon 5","Memories","Interscope Records*",6,11,51,"793370"
11,"spotify:track:56AMYGJzxBO6p8v0wEe9de","Young Thug, Travis Scott, Gunna","Hot (Remix) [feat. Gunna and Travis Scott]","300 Entertainment/Atl",6,10,9,"788603"
12,"spotify:track:2QpGZOhTCHHiKmpSO9FW4h","Kanye West","Follow God","Getting Out Our Dreams II / Def Jam Recordings",1,13,16,"758079"
13,"spotify:track:4sWuPniHClkInYAnzXAYUF","NLE Choppa","Camelot","Warner Records",7,15,58,"753348"
14,"spotify:track:598yNsG1JFrGd4n2kMoz7F","Lil Baby","Woah","Quality Control/Motown Records",14,14,2,"747109"
15,"spotify:track:1lOe9qE0vR9zwWQAOk6CoO","Lil Tecca","Ransom","Republic Records",1,19,170,"725841"
16,"spotify:track:1rgnBhdG2JDFTbYkYRZAku","Tones And I","Dance Monkey","Elektra (NEK)",10,16,102,"717377"
17,"spotify:track:6WrI0LAC5M1Rw2MnX2ZvEg","Dua Lipa","Don't Start Now","Warner Records",6,12,9,"693962"
18,"spotify:track:0RiRZpuVRbi7oqRdSMwhQY","Post Malone, Swae Lee","Sunflower - Spider-Man: Into the Spider-Verse","Republic Records",1,18,388,"691895"
19,"spotify:track:2wrJq5XKLnmhRXHIAf9xBa","Dan + Shay, Justin Bieber","10,000 Hours (with Justin Bieber)","Warner Music Nashville",2,17,37,"661559"
20,"spotify:track:5qmq61DAAOUaW8AUo8xKhh","Lizzo","Truth Hurts","Nice Life/Atlantic",2,22,203,"650070"
21,"spotify:track:6XHVuErjQ4XNm6nDPVCxVX","Chris Brown, Drake","No Guidance (feat. Drake)","Chris Brown Entertainment/RCA Records",3,20,155,"623455"
22,"spotify:track:0fySG6A6qLE8IvDpayb5bM","DaBaby","VIBEZ","South Coast Music Group/Interscope Records",4,21,44,"619916"
23,"spotify:track:5ry2OE6R2zPQFDO85XkgRb","Drake, Rick Ross","Money In The Grave (Drake ft. Rick Ross)","Republic Records",1,26,148,"602253"
24,"spotify:track:6vBdBCoOhKHiYDDOcorfNo","Post Malone, Young Thug","Goodbyes (feat. Young Thug)","Republic Records",1,23,128,"592260"
25,"spotify:track:6klLvorLoo1sxvZcjJIY8I","YoungBoy Never Broke Again","Make No Sense","Never Broke Again, LLC",25,29,30,"567753"
26,"spotify:track:7CZyCXKG6d5ALeq41sLzbw","Post Malone, Ozzy Osbourne, Travis Scott","Take What You Want (feat. Ozzy Osbourne & Travis Scott)","Republic Records",2,25,65,"566078"
27,"spotify:track:2gwkD6igEhQbDQegRCcdoB","DaBaby","Suge","South Coast Music Group/Interscope Records",3,34,225,"543733"
28,"spotify:track:5MPPttjfGap2C6j6eKcO6J","Quality Control, Lil Baby, DaBaby","Baby (Lil Baby feat. DaBaby)","Quality Control Music/Motown Records",14,30,116,"542493"
29,"spotify:track:20JtELGPfOAMq7FpUt8eSM","Ant Saunders","Yellow Hearts","Arista Records",28,28,7,"541681"
30,"spotify:track:3QzAOrNlsabgbMwlZt7TAY","Mustard, Roddy Ricch","Ballin' (with Roddy Ricch)","10 Summers Records/Interscope Records",30,35,100,"535292"
31,"spotify:track:4IO8X9W69dIQe0EC5ALXhq","21 Savage","Immortal","Slaughter Gang, LLC/Epic Records",7,24,10,"531646"
32,"spotify:track:2plLJpUcYPFrl1sW2pMG63","Harry Styles","Lights Up","Columbia",2,27,30,"531443"
33,"spotify:track:6Ozh9Ok6h4Oi1wUSLtBseN","DaBaby","BOP","South Coast Music Group/Interscope Records",1,33,44,"522890"
34,"spotify:track:2Fxmhks0bxGSBdJ92vM42m","Billie Eilish","bad guy","Darkroom/Interscope Records",1,37,226,"521879"
35,"spotify:track:1000nHvUdawXuUHgBod4Wv","Lil Nas X","Panini","Columbia",1,41,143,"516265"
36,"spotify:track:1iQDltZqI7BXnHrFy4Qo1k","SHAED, ZAYN","Trampoline (with ZAYN)","Photo Finish Records",28,31,38,"513286"
37,"spotify:track:0RLLvYBopDwooCyvnTwgYu","Lil Tjay","F.N","Columbia",23,40,92,"506482"
38,"spotify:track:4yI3HpbSFSgFZtJP2kDe5m","Selena Gomez","Look At Her Now","Interscope Records",5,32,17,"494489"
39,"spotify:track:6v3KW9xbzN5yKLt9YKDYA2","Shawn Mendes, Camila Cabello","Señorita","Island Records",1,46,142,"490796"
40,"spotify:track:00ko9WaS4jOX1kEk3gvHjf","Chance the Rapper, MadeinTYO, DaBaby","Hot Shower","Chance the Rapper",6,44,107,"486096"
41,"spotify:track:0c7K73roy6RW4ebDkf4yGh","24kGoldn","VALENTINO","Records/Columbia",41,53,56,"467617"
42,"spotify:track:0Xek5rqai2jcOWCYWJfVCF","Post Malone, DaBaby","Enemies (feat. DaBaby)","Republic Records",3,47,65,"461446"
43,"spotify:track:4guBZjUyrGoHsTahO3IHdj","Lil Tecca","Did It Again","Republic Records",18,57,96,"452548"
44,"spotify:track:70eFcWOvlMObDhURTqT4Fv","Ed Sheeran, Khalid","Beautiful People (feat. Khalid)","Atlantic Records UK",3,50,135,"451479"
45,"spotify:track:5Z8HZM6iQMhhqyPcCGY5g9","Young Thug, Gunna","Hot (feat. Gunna)","300 Entertainment/Atl",8,52,86,"445446"
46,"spotify:track:3s4mrPrEFFPF0LmAfutW0n","Young Thug, J. Cole, Travis Scott","The London (feat. J. Cole & Travis Scott)","300 Entertainment/Atl",1,54,171,"445441"
47,"spotify:track:6b2RcmUt1g9N9mQ3CbjX2Y","Sam Smith","How Do You Sleep?","Capitol",10,49,114,"442891"
48,"spotify:track:1tSGw3h54aHModEHHL1HGK","Luke Combs","Better Together","River House Artists/Columbia Nashville",36,36,2,"435957"
49,"spotify:track:07Oz5StQ7GRoygNLaXs2pd","Lizzo, Ariana Grande","Good as Hell (feat. Ariana Grande) - Remix","Nice Life/Atlantic",21,51,16,"432413"
50,"spotify:track:6uFn47ACjqYkc0jADwEdj1","Polo G, Lil Tjay","Pop Out (feat. Lil Tjay)","Columbia",8,68,232,"416891"
51,"spotify:track:2JvzF1RMd7lE3KmFlsyZD8","J. Cole","MIDDLE CHILD","Dreamville, Inc., Under exclusive license to Roc Nation Records",1,60,290,"413332"
52,"spotify:track:5aZQrb2TXWEh9uZR4HEY3r","Luke Combs","Even Though I'm Leaving","River House Artists/Columbia Nashville",42,42,9,"410803"
53,"spotify:track:1GeNui6m825V8jP4uKiIaH","Young Thug, Lil Baby","Bad Bad Bad (feat. Lil Baby)","300 Entertainment/Atl",7,61,86,"410784"
54,"spotify:track:3RzcoFkZ0AOp2nH71jP504","Luke Combs","Beer Never Broke My Heart","River House Artists/Columbia Nashville",32,48,174,"407261"
55,"spotify:track:735RSTb2xbtWbDtKD9XDYi","Internet Money, Lil Tecca, A Boogie Wit da Hoodie","Somebody","Internet Money Records / TenThousand Projects, LLC",51,63,30,"399483"
56,"spotify:track:5ravc2aiNoYmu9m37diYXW","Roddy Ricch, Gunna","Start Wit Me (feat. Gunna)","Atlantic Records",56,66,16,"398237"
57,"spotify:track:6V9fHiv84WlVTg7CSnIVY2","Halsey","Graveyard","Capitol Records",12,59,58,"397092"
58,"spotify:track:1xIgz2QjA85ZpXiIoj6mMo","Luke Combs","What You See Is What You Get","River House Artists/Columbia Nashville",45,45,2,"394778"
59,"spotify:track:7xQAfvXzm3AkraOtGPWIZg","Post Malone","Wow.","Republic Records",1,71,321,"391369"
60,"spotify:track:05mDaV9Vb3wrzjF6OPZnhq","Post Malone","Saint-Tropez","Republic Records",2,65,65,"391348"
61,"spotify:track:51Fjme0JiitpyXKuyQiCDo","Y2K, bbno$","Lalala","Columbia",11,85,147,"388227"
62,"spotify:track:7eBqSVxrzQZtK2mmgRG6lC","YNW Melly","Murder On My Mind","P2018",4,77,410,"381466"
63,"spotify:track:285pBltuF7vW8TeWk8hdRR","Juice WRLD","Lucid Dreams","Juice WRLD Mixtape / ISR P&D",1,82,552,"374694"
64,"spotify:track:6kls8cSlUyHW2BUOkDJIZE","Ellie Goulding, Juice WRLD","Hate Me (with Juice WRLD)","Polydor Records",34,76,127,"367148"
65,"spotify:track:2xLMifQCjDGFmkHkpNLD9h","Travis Scott","SICKO MODE","Cactus Jack / Epic / Grand Hustle",1,87,464,"365801"
66,"spotify:track:17TSJlshgQ5zu0e8dedAla","Luke Combs, Eric Church","Does To Me (feat. Eric Church)","River House Artists/Columbia Nashville",38,38,2,"363655"
67,"spotify:track:7LzouaWGFCy4tkXDOOnEyM","Camila Cabello","Liar","Syco Music/Epic",26,75,66,"361090"
68,"spotify:track:78QR3Wp35dqAhFEc2qAGjE","Lil Baby, Gunna","Drip Too Hard (Lil Baby & Gunna)","Quality Control Music/Young Stoner Life Records, a 300 Entertainment Label/Motown Records/Capitol Records",1,83,424,"360417"
69,"spotify:track:4S4Mfvv03M1cHgIOJcbUCL","Frank Ocean","In My Room","Blonded",34,39,8,"357595"
70,"spotify:track:7f5trao56t7sB7f14QDTmp","Doja Cat, Tyga","Juicy","Kemosabe Records/RCA Records",70,84,15,"353719"
71,"spotify:track:2IRZnDFmlqMuOrYOLnZZyc","Meek Mill, Drake","Going Bad (feat. Drake)","MMG/Atlantic",2,86,345,"351597"
72,"spotify:track:5aUSEPNd3m5xliFK4pn5mU","Zedd, Kehlani","Good Thing (with Kehlani)","Interscope Records",38,74,44,"348595"
73,"spotify:track:4vSoyDfL0uZyUoWu5NNNsQ","YoungBoy Never Broke Again","Self Control","Never Broke Again, LLC",43,92,65,"346955"
74,"spotify:track:2WsuSYJNXGKXVYkHPnq2yp","Lil Tecca, Juice WRLD","Ransom (with Juice WRLD) - Remix","Republic Records",24,100,87,"341486"
75,"spotify:track:5DqdesEfbRyOlSS3Tf6c29","Ali Gatie","It's You","Warner Records",15,79,149,"339543"
76,"spotify:track:4T6QFouj6rIQObxgwt9ELL","Luke Combs","Reasons","River House Artists/Columbia Nashville",43,43,2,"339474"
77,"spotify:track:1wJRveJZLSb1rjhnUHQiv6","A Boogie Wit da Hoodie, 6ix9ine","Swervin (feat. 6ix9ine)","Highbridge the Label / Atlantic Records",6,90,324,"336680"
78,"spotify:track:4SDgTLDYrJ2UrHbkRkg7MD","Lil Nas X, DaBaby","Panini - DaBaby Remix","Columbia",27,103,58,"334882"
79,"spotify:track:6TqXcAFInzjp0bODyvrWEq","Khalid, Disclosure","Talk (feat. Disclosure)","Right Hand Music Group, LLC/RCA Records",5,91,276,"333771"
80,"spotify:track:4vUmTMuQqjdnvlZmAH61Qk","Ed Sheeran, Camila Cabello, Cardi B","South of the Border (feat. Camila Cabello & Cardi B)","Atlantic Records UK",9,88,73,"328300"
81,"spotify:track:6Hj9jySrnFppAI0sEMCZpJ","Juice WRLD","Robbery","Grade A Productions/Interscope Records",2,101,269,"327986"
82,"spotify:track:3Yh9lZcWyKrK9GjbhuS0hR","Lizzo","Good as Hell","Nice Life/Atlantic",19,106,148,"323999"
83,"spotify:track:0bYg9bo50gSsH3LtXe2SQn","Mariah Carey","All I Want for Christmas Is You","Columbia",1,108,118,"319953"
84,"spotify:track:1VJwtWR6z7SpZRwipI12be","Doja Cat","Candy","MAU Records",84,116,2,"317114"
85,"spotify:track:7vJS1DPc3FzBtqBs8n3mW5","Ariana Grande, Normani, Nicki Minaj","Bad To You (with Normani & Nicki Minaj)","Silver Cloud/Charlie's Angels",23,81,9,"315373"
86,"spotify:track:6pgN3d6oBrhmrSAKBfWNsf","Luke Combs, Brooks & Dunn","1, 2 Many","River House Artists/Columbia Nashville",72,72,3,"314340"
87,"spotify:track:0mTKJnVf6GcujyDr1PZn0Q","Tory Lanez, T-Pain","Jerry Sprunger (with T-Pain)","Mad Love/Interscope Records",62,62,2,"314049"
88,"spotify:track:0KtxdSPi1ZbDc3wwD2IGF0","Luke Combs","Blue Collar Boys","River House Artists/Columbia Nashville",56,56,2,"313079"
89,"spotify:track:7sWRlDoTDX8geTR8zzr2vt","Post Malone","Hollywood's Bleeding","Republic Records",4,96,65,"312808"
90,"spotify:track:0rKtyWc8bvkriBthvHKY8d","Joji","SLOW DANCING IN THE DARK","88rising Music/Warner Records",26,94,414,"309153"
91,"spotify:track:4hPpVbbakQNv8YTHYaOJP4","Marshmello, Kane Brown","One Thing Right","RCA Records Label Nashville",14,120,142,"308676"
92,"spotify:track:67XyC1GdSkKb9sbRRkUDXS","NLE Choppa, Blueface","Shotta Flow (Feat. Blueface) [Remix]","No Love Entertainment",18,134,131,"307341"
93,"spotify:track:0hVXuCcriWRGvwMV1r5Yn9","Ed Sheeran, Justin Bieber","I Don't Care (with Justin Bieber)","Atlantic Records UK",1,102,184,"307254"
94,"spotify:track:4a6q8CR2hzLk2plDkSxkfD","Bazzi","I.F.L.Y.","iamcosmic",26,95,114,"307005"
95,"spotify:track:4e0FYxSROat25pH16zMTZI","Lil Tecca","Love Me","Republic Records",23,123,99,"306951"
96,"spotify:track:08dFHFTx6r67MTsYn5ilDR","Old Dominion","One Man Band","RCA Records Label Nashville",70,111,28,"305913"
97,"spotify:track:3XiNC94b4Tq1xwv70sQJGN","Lil Uzi Vert","Sanguine Paradise","Generation Now/Atlantic",6,110,214,"304361"
98,"spotify:track:0Z26mbSHJ1dkUu7g9DDgif","Major Lazer, Khalid, Death Stranding: Timefall, Diplo","Trigger","Right Hand Music Group, LLC/RCA Records",32,97,16,"304251"
99,"spotify:track:43zdsphuZLzwA9k4DJhU0I","Billie Eilish","when the party's over","Darkroom/Interscope Records",5,98,389,"303904"
100,"spotify:track:4B7fTyj1FIPvP9tT5X3DnR","Drake","Behind Barz - Bonus","OVO Sound/Warner Records",31,109,58,"301301"
101,"spotify:track:2YpeDb67231RjR0MgVLzsG","Lil Nas X, Billy Ray Cyrus","Old Town Road - Remix","Columbia",1,155,219,"299796"
102,"spotify:track:2TH65lNHgvLxCKXM3apjxI","Bad Bunny, Tainy","Callaita","Rimas Entertainment LLC",37,129,163,"298787"
103,"spotify:track:0rIAC4PXANcKmitJfoqmVm","Normani","Motivation","Keep Cool/RCA Records",26,104,86,"297283"
104,"spotify:track:3cphb8kdsjElYR7r5icK3H","Niall Horan","Nice To Meet Ya","Capitol Records",52,99,34,"297233"
105,"spotify:track:0u2P5u6lvoDfwTYjAADbn4","Billie Eilish, Khalid","lovely (with Khalid)","Darkroom",18,112,569,"296249"
106,"spotify:track:12Fkyg9lpmaz2zmKOfw2Y2","Post Malone, Meek Mill, Lil Baby","On The Road (feat. Meek Mill & Lil Baby)","Republic Records",7,107,65,"295911"
107,"spotify:track:0bNVNlZSHj3xSuMJWfzxuT","Luke Combs","All Over Again","River House Artists/Columbia Nashville",69,69,2,"295779"
108,"spotify:track:5hVghJ4KaYES3BFUATCYn0","Tyler, The Creator","EARFQUAKE","Columbia",1,117,177,"295599"
109,"spotify:track:5ppDdMho96v8gdDm7HKEbK","Luke Combs","Nothing Like You","River House Artists/Columbia Nashville",67,67,2,"294598"
110,"spotify:track:3eeyKNIBrt5TH4y0y3QkOu","YoungBoy Never Broke Again","Hot Now","Never Broke Again, LLC",75,126,29,"293409"
111,"spotify:track:0e7ipj03S05BNilyu5bRzt","Post Malone, 21 Savage","rockstar (feat. 21 Savage)","Republic Records",1,132,786,"291760"
112,"spotify:track:1rLhKgfBTu7qGEz98IpQxo","Luke Combs","Refrigerator Door","River House Artists/Columbia Nashville",73,73,6,"291323"
113,"spotify:track:7rvyVWja33WG9R97oeJAjx","Calboy","Envy Me","Polo Grounds Music/RCA Records",22,138,318,"290546"
114,"spotify:track:6gBFPUFcJLzWGx4lenP6h2","Travis Scott","goosebumps","Epic/Grand Hustle",16,128,1031,"290158"
115,"spotify:track:6cy3ki60hLwimwIje7tALf","Black Eyed Peas, J Balvin","RITMO (Bad Boys For Life)","Epic/We The Best",115,141,13,"290047"
116,"spotify:track:5NwCPmFHJAoKe0PSw2ltJD","Luke Combs","New Every Day","River House Artists/Columbia Nashville",58,58,2,"289238"
117,"spotify:track:7BxpObs6K7Yio5lVb3sMYX","Lil Mosey, Chris Brown","G Walk (with Chris Brown)","Mogul Vision/Interscope Records",117,119,2,"288965"
118,"spotify:track:3ee8Jmje8o58CHK66QrVC2","XXXTENTACION","SAD!","Bad Vibes Forever, LLC",1,150,618,"287592"
119,"spotify:track:6ocbgoVGwYJhOv1GgI9NsF","Ariana Grande","7 rings","Republic Records",1,137,296,"285797"
120,"spotify:track:2rMAtCaTj16NptyVfEIeAC","Megan Thee Stallion, DaBaby","Cash Shit (feat. DaBaby)","300 Entertainment",56,139,138,"285790"
121,"spotify:track:3GJ4hzg4lrGwU51Y3VARbF","Dan + Shay","Speechless","Warner Records",67,113,445,"285406"
122,"spotify:track:3JWiDGQX2eTlFvKj3Yssj3","Kanye West","Closed On Sunday","Getting Out Our Dreams II / Def Jam Recordings",2,114,16,"284805"
123,"spotify:track:0fea68AdmYNygeTGI4RC18","J Balvin, Bad Bunny","LA CANCIÓN","Universal Music Latino / Rimas",30,140,135,"284080"
124,"spotify:track:7j3aRaky6Xr1fpuqmB3s4w","Luke Combs","Dear Today","River House Artists/Columbia Nashville",70,70,2,"283418"
125,"spotify:track:3APKvzQ6xiu7Fcu9Y1EKni","Luke Combs","Every Little Bit Helps","River House Artists/Columbia Nashville",64,64,2,"282195"
126,"spotify:track:6wo37KVqFJhtuxPTpLCcfe","The Chainsmokers, ILLENIUM, Lennon Stella","Takeaway","Disruptor Records/Columbia",13,105,108,"281891"
127,"spotify:track:5KBARWIxeMGkvUax9VtVC9","Saweetie","My Type","ICY/Artistry Records/Warner Records",43,151,129,"281643"
128,"spotify:track:3j84U36KvLeXNDPv4t5pI8","Mustard, Migos","Pure Water (with Migos)","10 Summers Records/Interscope Records",11,144,296,"279489"
129,"spotify:track:7dt6x5M1jzdTEt8oCbisTK","Post Malone","Better Now","Republic Records",1,135,562,"277929"
130,"spotify:track:2a3dopgTF1q4rMVDJ1rwBU","The Chainsmokers","Push My Luck","Disruptor Records/Columbia",55,55,2,"276648"
131,"spotify:track:2tnVG71enUj33Ic2nFN6kZ","Regard","Ride It","Ministry of Sound Recordings",79,130,53,"276491"
132,"spotify:track:2AxR3AIQxTf6xjxrb9UkH2","Luke Combs","Lovin' On You","River House Artists/Columbia Nashville",78,78,6,"275977"
133,"spotify:track:1dGr1c8CrMLDpV6mPbImSI","Taylor Swift","Lover","Taylor Swift",1,121,86,"275368"
134,"spotify:track:2dpaYNEQHiRxtZbfNsse99","Marshmello, Bastille","Happier","Astralwerks",5,153,450,"274949"
135,"spotify:track:6zeeWid2sgw4lap2jV61PZ","Khalid","Better","Right Hand Music Group, LLC/RCA Records",7,124,422,"274293"
136,"spotify:track:22vgEDb5hykfaTwLuskFGD","Jonas Brothers","Sucker","Jonas Brothers Recording",1,149,254,"272333"
137,"spotify:track:75ZvA4QfFiZvzhj2xkaWAh","Post Malone","I Fall Apart","Universal Records",2,127,785,"271915"
138,"spotify:track:6Nle9hKrkL1wQpwNfEkxjh","Frank Ocean","Chanel","Blonded",31,118,60,"270739"
139,"spotify:track:7FGq80cy8juXBCD2nrqdWU","benny blanco, Halsey, Khalid","Eastside (with Halsey & Khalid)","Friends Keep Secrets/Interscope Records",7,143,485,"268635"
140,"spotify:track:5N1o6d8zGcSZSeMFkOUQOk","Megan Thee Stallion, Ty Dolla $ign, Nicki Minaj","Hot Girl Summer (feat. Nicki Minaj & Ty Dolla $ign)","300 Entertainment",2,148,93,"266703"
141,"spotify:track:2C6WXnmZ66tHhHlnvwePiK","Post Malone, Halsey, Future","Die For Me (feat. Future & Halsey)","Republic Records",6,136,65,"266521"
142,"spotify:track:2zjGJ0dChMR0KxBZS15aqo","Mustard, NAV, Playboi Carti, A Boogie Wit da Hoodie","Baguettes in the Face (feat. NAV, Playboi Carti & A Boogie Wit da Hoodie)","10 Summers Records/Interscope Records",32,142,135,"266357"
143,"spotify:track:2rxQMGVafnNaRaXlRMWPde","Luke Combs","Beautiful Crazy","River House Artists/Columbia Nashville",54,133,486,"265687"
144,"spotify:track:2SasoXZyv82yYgHiVOvxQn","Kanye West","On God","Getting Out Our Dreams II / Def Jam Recordings",3,115,16,"264442"
145,"spotify:track:6RRNNciQGZEXnqk8SQ9yv5","Taylor Swift","You Need To Calm Down","Taylor Swift",1,146,149,"264373"
146,"spotify:track:7zLYKWcXnYeHHWidalz7rj","Lil Mosey","Noticed","Mogul Vision/Interscope Records",17,164,450,"264065"
147,"spotify:track:7m9OqQk4RVRkw9JJdeAw96","XXXTENTACION","Jocelyn Flores","Bad Vibes Forever / EMPIRE",2,163,807,"263450"
148,"spotify:track:54QmQd9Nc2EUDha6dD8V9X","Luke Combs","Moon Over Mexico","River House Artists/Columbia Nashville",89,89,4,"262952"
149,"spotify:track:5p7ujcrUXASCNwRaWNHR1C","Halsey","Without Me","Capitol Records",5,162,402,"255248"
150,"spotify:track:2Xo3rLHjXfdb4avN68aQyi","Russ, BIA","BEST ON EARTH (feat. BIA) - Bonus","Columbia",55,156,22,"255154"
151,"spotify:track:0Ryd8975WihbObpp5cPW1t","Ariana Grande, Social House","boyfriend (with Social House)","Republic Records",1,159,100,"254025"
152,"spotify:track:0JP9xo3adEtGSdUEISiszL","XXXTENTACION","Moonlight","Bad Vibes Forever, LLC",2,188,604,"253016"
153,"spotify:track:5fmTiyocDfiXbUZ4SpdXRm","Lil Mosey","Live This Wild","Mogul Vision/Interscope Records",80,80,2,"252868"
154,"spotify:track:3e9HZxeyfWwjeyPAMmWSSQ","Ariana Grande","thank u, next","Republic Records",1,168,371,"252028"
155,"spotify:track:2NSWi83peog6gHerzlMCqU","Trippie Redd","Love Me More","TenThousand Projects, LLC",39,122,9,"250825"
156,"spotify:track:2ksOAxtIxY8yElEWw8RhgK","Anuel AA, Daddy Yankee, KAROL G, J Balvin, Ozuna","China","2019 Real Hasta La Muerte, LLC.",22,177,114,"249259"
157,"spotify:track:6K4t31amVTZDgR3sKmwUJJ","Tame Impala","The Less I Know The Better","Universal Music Australia Pty. Ltd.",103,161,84,"247528"
158,"spotify:track:46D0hYb1B7qiU33VtXt21W","Camila Cabello","Easy","Syco Music/Epic",37,145,30,"245816"
159,"spotify:track:77KMttn3Lic7ZQKDlPqp8v","DaBaby","INTRO","South Coast Music Group/Interscope Records",3,170,51,"245249"
160,"spotify:track:3iH29NcCxYgI5shlkZrUoB","iann dior, Trippie Redd","gone girl","TenThousand Projects, LLC",79,125,37,"245155"
161,"spotify:track:4VXIryQMWpIdGgYR4TrjT1","Juice WRLD","All Girls Are The Same","Juice WRLD Mixtape / ISR P&D",12,176,568,"244758"
162,"spotify:track:39JRmdKFka1Oe09FoOCPI4","Kanye West","Selah","Getting Out Our Dreams II / Def Jam Recordings",3,147,16,"244453"
163,"spotify:track:2kJwzbxV2ppxnQoYw4GLBZ","JP Saxe, Julia Michaels","If the World Was Ending (feat. Julia Michaels)","Arista Records",163,167,2,"242108"
164,"spotify:track:6vN77lE9LK6HP2DewaN6HZ","Lil Baby, Drake","Yes Indeed","Quality Control Music, LLC",2,175,544,"240381"
165,"spotify:track:1ThmUihH9dF8EV08ku5AXN","Ski Mask The Slump God","Faucet Failure","Republic Records",25,178,340,"240299"
166,"spotify:track:2bT1PH7Cw3J9p3t7nlXCdh","Shawn Mendes","If I Can't Have You","Island Records",3,172,191,"240233"
167,"spotify:track:0y675KDleCZEudjoeL1sQQ","Lauv","Feelings","Lauv",55,154,51,"240020"
168,"spotify:track:0BOmhToQ03yOdpzYKMEnAg","Gunna","Baby Birkin","300 Entertainment",107,171,93,"238642"
169,"spotify:track:0rFQ5cKYJ9WtHSKp9sxVYt","Diplo, Morgan Wallen","Heartless (feat. Morgan Wallen)","Columbia",53,131,85,"238214"
170,"spotify:track:7GX5flRQZVHRAGd6B4TmDO","Lil Uzi Vert","XO Tour Llif3","Generation Now/Atlantic",1,187,960,"237734"
171,"spotify:track:2xyx0o4xNOLLjBSbOOdcbA","Summer Walker, Bryson Tiller","Playing Games (with Bryson Tiller) - Extended Version","LVRN/Interscope Records",18,169,37,"236762"
172,"spotify:track:4Of7rzpRpV1mWRbhp5rAqG","Lewis Capaldi","Bruises","Vertigo Berlin",95,152,58,"235894"
173,"spotify:track:4R8BJggjosTswLxtkw8V7P","Jhay Cortez, J Balvin, Bad Bunny","No Me Conoce - Remix","N&E Entertainment LLC",106,189,151,"235771"
174,"spotify:track:24bnCCysWnbNRNUT4LpHcP","Kanye West, Ty Dolla $ign, Ant Clemons","Everything We Need","Getting Out Our Dreams II / Def Jam Recordings",6,160,16,"235726"
175,"spotify:track:0oPOuDmmkVp3h6puekhs6P","Kanye West, Clipse, Kenny G","Use This Gospel","Getting Out Our Dreams II / Def Jam Recordings",7,157,16,"235222"
176,"spotify:track:2FvD20Z8aoWIePi7PoN8sG","DaBaby, Lil Baby, Moneybagg Yo","TOES (feat. Lil Baby & Moneybagg Yo)","South Coast Music Group/Interscope Records",8,179,44,"234918"
177,"spotify:track:314ZkcV7oLWG8yWE7LABvH","BTS, Lauv","Make It Right (feat. Lauv)","BIGHIT MUSIC",48,165,23,"234764"
178,"spotify:track:3Ol2xnObFdKV9pmRD2t9x8","A Boogie Wit da Hoodie","Look Back at It","Highbridge the Label / Atlantic Records",8,181,338,"234423"
179,"spotify:track:2t8yVaLvJ0RenpXUIAC52d","21 Savage","a lot","Slaughter Gang, LLC/Epic Records",2,182,324,"232956"
180,"spotify:track:7dRPUAYfMGZmZ7L3fZAJKp","Luke Combs","Angels Workin' Overtime","River House Artists/Columbia Nashville",93,93,2,"232854"
181,"spotify:track:7AQim7LbvFVZJE3O8TYgf2","XXXTENTACION, Trippie Redd","Fuck Love (feat. Trippie Redd)","Bad Vibes Forever / EMPIRE",5,192,795,"229949"
182,"spotify:track:6foY66mWZN0pSRjZ408c00","Morgan Wallen","Whiskey Glasses","Big Loud Records",58,184,241,"229258"
183,"spotify:track:3TTMUI5dFcbeNSDTTDY9M8","Summer Walker, Usher","Come Thru (with Usher)","LVRN/Interscope Records",34,183,37,"227729"
184,"spotify:track:4fwo6czG5nvOQMzhOto1ya","Diplo, Jonas Brothers","Lonely (with Jonas Brothers)","Columbia",54,173,44,"227060"
185,"spotify:track:0FZ4Dmg8jJJAPJnvBIzD9z","Kodak Black, Offset, Travis Scott","ZEZE (feat. Travis Scott & Offset)","Atlantic Records",1,-1,390,"226864"
186,"spotify:track:4ZT9FnbFu1PaBfV3itxiqT","Lil Skies","I","All We Got Ent.",13,191,252,"223260"
187,"spotify:track:3a1lNhkSLSkpJE4MSHpDu9","Post Malone, Quavo","Congratulations","Universal Records",5,-1,1040,"222726"
188,"spotify:track:1CCDIow4pPYyJYzhtTUYz2","DaBaby, Migos","RAW SHIT (feat. Migos)","South Coast Music Group/Interscope Records",7,194,44,"222692"
189,"spotify:track:0Rx0DJI556Ix5gBny6EWmn","Bazzi","Paradise","iamcosmic",18,185,219,"222630"
190,"spotify:track:4u7EnebtmKWzUH433cf5Qv","Queen","Bohemian Rhapsody - Remastered 2011","Hollywood Records",36,-1,371,"222186"
191,"spotify:track:3WyRgi8CzQnhzO0xw79tTS","DaBaby","Goin Baby","South Coast Music Group/Interscope Records",59,-1,204,"220440"
192,"spotify:track:2wUwC1gBJIC05JH87v2hgN","Lil Tjay, Lil Durk","Brothers (feat. Lil Durk) - Remix","Columbia",62,-1,49,"219236"
193,"spotify:track:5a6pdCHlWS2ekOOQ70QnAr","Noah Cyrus","July","Records/Columbia",115,166,18,"218447"
194,"spotify:track:1kK6DwzyXJSp58u5HYWwuD","YG, Tyga, Jon Z","Go Loko (feat. Tyga, Jon Z)","Def Jam Recordings",14,-1,181,"217334"
195,"spotify:track:62vpWI1CHwFy7tMIcSStl8","J. Cole","No Role Modelz","Roc Nation Records LLC",64,195,812,"216935"
196,"spotify:track:7sO5G9EABYOXQKNPNiE9NR","Offset, Metro Boomin","Ric Flair Drip (with Metro Boomin)","Slaughter Gang, LLC/Epic/Quality Control Music/Motown/Capitol/Boominati Worldwide/Republic",4,-1,711,"215410"
197,"spotify:track:1rqqCSm0Qe4I9rUvWncaom","Panic! At The Disco","High Hopes","DCD2 / Fueled By Ramen",12,-1,507,"214743"
198,"spotify:track:5wujBwqG7INdStqGd4tRMX","Juice WRLD","Armed And Dangerous","Juice WRLD Mixtape / ISR P&D",9,-1,346,"214723"
199,"spotify:track:5qDsijQM75KTdv3RtSPx91","Lil Tjay","Hold On","Columbia",61,-1,26,"214634"
200,"spotify:track:7f1zjZG77S891Uv4O68yfk","DaBaby, Offset","Baby Sitter (feat. Offset)","South Coast Music Group/Interscope Records",55,-1,181,"213537"
