rank,uri,artist_names,track_name,source,peak_rank,previous_rank,days_on_chart,streams
1,"spotify:track:6u7jPi22kF8CTQ3rb9DHE7","Lil Nas X, Billy Ray Cyrus","Old Town Road - Remix","Columbia",1,1,7,"2707451"
2,"spotify:track:2Fxmhks0bxGSBdJ92vM42m","Billie Eilish","bad guy","Darkroom/Interscope Records",1,2,14,"1802677"
3,"spotify:track:53CJANUxooaqGOtdsBTh7O","Lil Nas X","Old Town Road","Columbia",1,3,41,"1741235"
4,"spotify:track:3KkXRkHbMCARz0aVfEt68P","Post Malone, Swae Lee","Sunflower - Spider-Man: Into the Spider-Verse","Universal Records",1,4,176,"1154123"
5,"spotify:track:2JvzF1RMd7lE3KmFlsyZD8","J. Cole","MIDDLE CHILD","Dreamville, Inc., Under exclusive license to Roc Nation Records",1,5,78,"1104283"
6,"spotify:track:3XiNC94b4Tq1xwv70sQJGN","Lil Uzi Vert","Sanguine Paradise","Generation Now/Atlantic",6,7,2,"1089204"
7,"spotify:track:3Fj47GNK2kUF0uaEDgXLaD","Billie Eilish","wish you were gay","Darkroom/Interscope Records",2,6,39,"1078689"
8,"spotify:track:1wJRveJZLSb1rjhnUHQiv6","A Boogie Wit da Hoodie, 6ix9ine","Swervin (feat. 6ix9ine)","Highbridge the Label / Atlantic Records",7,8,112,"1047587"
9,"spotify:track:6MWtB6iiXyIwun0YzU6DFP","Post Malone","Wow.","Republic Records",1,10,109,"946056"
10,"spotify:track:4SSnFejRGlZikf02HLewEF","Billie Eilish","bury a friend","Darkroom/Interscope Records",3,11,72,"923106"
11,"spotify:track:2IRZnDFmlqMuOrYOLnZZyc","Meek Mill, Drake","Going Bad (feat. Drake)","MMG/Atlantic",2,12,133,"921015"
12,"spotify:track:6TqXcAFInzjp0bODyvrWEq","Khalid, Disclosure","Talk (feat. Disclosure)","Right Hand Music Group, LLC/RCA Records",7,9,64,"905005"
13,"spotify:track:6ocbgoVGwYJhOv1GgI9NsF","Ariana Grande","7 rings","Republic Records",1,14,84,"886707"
14,"spotify:track:7eBqSVxrzQZtK2mmgRG6lC","YNW Melly","Murder On My Mind","P2018",4,16,198,"880284"
15,"spotify:track:09oZ9eXQ2fo6YDrPzJqAoP","Khalid, John Mayer","Outta My Head (with John Mayer)","Right Hand Music Group, LLC/RCA Records",6,13,7,"841767"
16,"spotify:track:6zeeWid2sgw4lap2jV61PZ","Khalid","Better","Right Hand Music Group, LLC/RCA Records",7,15,210,"834082"
17,"spotify:track:4y3OI86AEP6PQoDE6olYhO","Jonas Brothers","Sucker","Jonas Brothers Recording",1,17,42,"832953"
18,"spotify:track:43zdsphuZLzwA9k4DJhU0I","Billie Eilish","when the party's over","Darkroom/Interscope Records",5,19,177,"792293"
19,"spotify:track:63cd4JkwGgYJrbOizbfmsp","Mustard, Migos","Pure Water (with Migos)","10 Summers Records/Interscope Records",11,20,84,"754467"
20,"spotify:track:2XKFnwB6djxrJCjR3PdeRb","Khalid","My Bad","Right Hand Music Group, LLC/RCA Records",5,18,36,"750334"
21,"spotify:track:6Hj9jySrnFppAI0sEMCZpJ","Juice WRLD","Robbery","Grade A Productions/Interscope Records",2,22,57,"712252"
22,"spotify:track:6vWEAOUSxohKxhp0K1BsxL","YNW Melly, Kanye West","Mixed Personalities (feat. Kanye West)","P2019",12,21,83,"710038"
23,"spotify:track:6nDKrPlXdpomGBgAlO7UdP","Avicii, Aloe Blacc","SOS (feat. Aloe Blacc)","Universal Music AB",23,178,2,"691844"
24,"spotify:track:4kV4N9D1iKVxx1KLvtTpjS","Ariana Grande","break up with your girlfriend, i'm bored","Republic Records",1,23,63,"677616"
25,"spotify:track:3Tc57t9l2O8FwQZtQOvPXK","Billie Eilish","my strange addiction","Darkroom/Interscope Records",9,24,14,"661445"
26,"spotify:track:6IRdLKIyS4p7XNiP8r6rsx","Billie Eilish","all the good girls go to hell","Darkroom/Interscope Records",3,26,14,"646417"
27,"spotify:track:3XF5xLJHOQQRbWya6hBp7d","Billie Eilish","you should see me in a crown","Darkroom/Interscope Records",7,27,169,"644661"
28,"spotify:track:78QR3Wp35dqAhFEc2qAGjE","Lil Baby, Gunna","Drip Too Hard (Lil Baby & Gunna)","Quality Control Music/Young Stoner Life Records, a 300 Entertainment Label/Motown Records/Capitol Records",1,30,212,"641757"
29,"spotify:track:4QIo4oxwzzafcBWkKjDpXY","Billie Eilish","xanny","Darkroom/Interscope Records",4,29,14,"633639"
30,"spotify:track:5kfNriitmkNE8mUbZ7gbq8","Khalid","Saturday Nights","Right Hand Music Group, LLC/RCA Records",13,25,169,"633635"
31,"spotify:track:2t8yVaLvJ0RenpXUIAC52d","21 Savage","a lot","Slaughter Gang, LLC/Epic Records",2,31,112,"632703"
32,"spotify:track:6tsOcBnaKgzK22yEiqRh8P","Ariana Grande, Victoria Monét","MONOPOLY (with Victoria Monét)","Republic Records",13,28,11,"609379"
33,"spotify:track:6ya8ejoKgw906Y8LWclqrp","Nipsey Hussle, Roddy Ricch, Hit-Boy","Racks in the Middle (feat. Roddy Ricch and Hit-Boy)","Atlantic Records",21,35,11,"600799"
34,"spotify:track:4pUCKHjJ4Ijewc37rRrvHn","BLACKPINK","Kill This Love","YG Entertainment, distributed through Interscope Records",32,32,8,"592871"
35,"spotify:track:1ThmUihH9dF8EV08ku5AXN","Ski Mask The Slump God","Faucet Failure","Republic Records",26,36,128,"579081"
36,"spotify:track:2qxmye6gAegTMjLKEBoR3d","Alec Benjamin","Let Me Down Slowly","2018",33,34,97,"571486"
37,"spotify:track:1NJcg626wLln4pGHpiV7mf","Billie Eilish, Khalid","lovely (with Khalid)","Darkroom",18,37,357,"563457"
38,"spotify:track:3Ol2xnObFdKV9pmRD2t9x8","A Boogie Wit da Hoodie","Look Back at It","Highbridge the Label / Atlantic Records",8,38,126,"559783"
39,"spotify:track:2xLMifQCjDGFmkHkpNLD9h","Travis Scott","SICKO MODE","Cactus Jack / Epic / Grand Hustle",1,40,252,"549761"
40,"spotify:track:5p7ujcrUXASCNwRaWNHR1C","Halsey","Without Me","Capitol Records",5,39,190,"541945"
41,"spotify:track:05t7JMip6JrLuSrMV5yYjX","Calboy","Envy Me","Polo Grounds Music/RCA Records",32,43,106,"538394"
42,"spotify:track:2dpaYNEQHiRxtZbfNsse99","Marshmello, Bastille","Happier","Astralwerks",5,42,238,"533389"
43,"spotify:track:1E6DEDWDKHoOW0fcFuDghV","Khalid, SAFE","Don't Pretend (feat. SAFE)","Right Hand Music Group, LLC/RCA Records",16,33,8,"532316"
44,"spotify:track:3e9HZxeyfWwjeyPAMmWSSQ","Ariana Grande","thank u, next","Republic Records",1,41,159,"531842"
45,"spotify:track:7FGq80cy8juXBCD2nrqdWU","benny blanco, Halsey, Khalid","Eastside (with Halsey & Khalid)","Friends Keep Secrets/Interscope Records",7,45,273,"514476"
46,"spotify:track:4pCEIQ6wBVuaJdER5bALtO","Lil Uzi Vert","That's a Rack","Generation Now/Atlantic",46,47,2,"510097"
47,"spotify:track:5icOoE6VgqFKohjWWNp0Ac","Marshmello, CHVRCHES","Here With Me","Marshmello/Republic",15,44,35,"509234"
48,"spotify:track:285pBltuF7vW8TeWk8hdRR","Juice WRLD","Lucid Dreams","Juice WRLD Mixtape / ISR P&D",1,50,340,"501127"
49,"spotify:track:6CcJMwBtXByIz4zQLzFkKc","Billie Eilish","i love you","Darkroom/Interscope Records",14,48,14,"485622"
50,"spotify:track:3oh6SCCeLuXhFpEyepla6G","Blueface","Thotiana","Fifth Amendment Entertainment/eOne Music",6,52,96,"479587"
51,"spotify:track:3QmolSZqjjLksTUvZJ6pPS","Jonas Brothers","Cool","Jonas Brothers Recording",29,46,7,"477537"
52,"spotify:track:7njKgVl3AnLflRad38o7AG","Bazzi","Paradise","iamcosmic",51,51,7,"474066"
53,"spotify:track:7qEKqBCD2vE5vIBsrUitpD","Billie Eilish","ilomilo","Darkroom/Interscope Records",12,49,14,"469210"
54,"spotify:track:7dt6x5M1jzdTEt8oCbisTK","Post Malone","Better Now","Republic Records",1,53,350,"463147"
55,"spotify:track:2VxeLyX666F8uXCJ0dZF8B","Lady Gaga, Bradley Cooper","Shallow","A Star is Born OST",6,54,194,"452475"
56,"spotify:track:6Qs4SXO9dwPj5GKvVOv8Ki","Sam Smith, Normani","Dancing With A Stranger (with Normani)","Capitol",10,56,91,"452383"
57,"spotify:track:1xzBco0xcoJEDXktl7Jxrr","Sheck Wes","Mo Bamba","Cactus Jack Records/ G.O.O.D. Music/ Interscope Records",1,61,259,"440790"
58,"spotify:track:0tMSssfxAL2oV8Vri0mFHE","Billie Eilish","listen before i go","Darkroom/Interscope Records",14,55,14,"438582"
59,"spotify:track:0FZ4Dmg8jJJAPJnvBIzD9z","Kodak Black, Offset, Travis Scott","ZEZE (feat. Travis Scott & Offset)","Atlantic Records",1,63,182,"434224"
60,"spotify:track:4ZT9FnbFu1PaBfV3itxiqT","Lil Skies","I","All We Got Ent.",13,62,42,"428847"
61,"spotify:track:01DOm09B2AbiTARAbXVI6g","ScHoolboy Q, Travis Scott","CHopstix (feat. Travis Scott)","Top Dawg Entertainment/Interscope Records",50,58,4,"428709"
62,"spotify:track:0PG9fbaaHFHfre2gUVo7AN","Cardi B, Bruno Mars","Please Me","Atlantic/KSR",10,57,56,"425571"
63,"spotify:track:3ee8Jmje8o58CHK66QrVC2","XXXTENTACION","SAD!","Bad Vibes Forever, LLC",1,67,406,"416971"
64,"spotify:track:5WHTFyqSii0lmT9R21abT8","Mabel","Don't Call Me Up","Polydor Records",61,64,62,"411861"
65,"spotify:track:2rxQMGVafnNaRaXlRMWPde","Luke Combs","Beautiful Crazy","River House Artists/Columbia Nashville",63,65,274,"408515"
66,"spotify:track:7COXchtUOMd6uIT6HvmRaI","Lauv, Troye Sivan","i'm so tired...","Lauv",22,66,77,"402838"
67,"spotify:track:6X29iaaazwho3ab7GNue5r","Billie Eilish","8","Darkroom/Interscope Records",13,69,14,"393308"
68,"spotify:track:14mHfNsSHN0FbLftyjrV9g","Flipp Dinero","Leave Me Alone","Cinematic/Epic/We The Best",10,70,243,"391809"
69,"spotify:track:5A1w94uzc1kO1Zhe8WWxC3","Khalid","Right Back","Right Hand Music Group, LLC/RCA Records",32,59,7,"389243"
70,"spotify:track:2vsuel3g4zaLYSOY0mOMbi","Khalid","Bad Luck","Right Hand Music Group, LLC/RCA Records",21,60,7,"385107"
71,"spotify:track:3KLo7ByvjCNyBrfz5DZ2mO","Rich The Kid","Splashin","Interscope Records",21,73,122,"383526"
72,"spotify:track:1rqqCSm0Qe4I9rUvWncaom","Panic! At The Disco","High Hopes","DCD2 / Fueled By Ramen",12,71,304,"383467"
73,"spotify:track:0e7ipj03S05BNilyu5bRzt","Post Malone, 21 Savage","rockstar (feat. 21 Savage)","Republic Records",1,75,574,"378442"
74,"spotify:track:0JP9xo3adEtGSdUEISiszL","XXXTENTACION","Moonlight","Bad Vibes Forever, LLC",2,76,392,"372571"
75,"spotify:track:5wujBwqG7INdStqGd4tRMX","Juice WRLD","Armed And Dangerous","Juice WRLD Mixtape / ISR P&D",9,77,154,"370695"
76,"spotify:track:2G1tXoGBaEMJ7FKGnkf6ud","Gucci Mane, Bruno Mars, Kodak Black","Wake Up in the Sky","Guwop Enterprises/Atlantic",6,78,210,"370502"
77,"spotify:track:25sgk305KZfyuqVBQIahim","Ava Max","Sweet but Psycho","Atlantic Records",30,80,185,"360762"
78,"spotify:track:2kAIpGWnlFLQh48iut6Zzq","Khalid","Free Spirit","Right Hand Music Group, LLC/RCA Records",23,68,7,"359771"
79,"spotify:track:2GGMabyHXnJmjY6CXhhB2e","Cardi B","Money","Atlantic/KSR",9,79,171,"358919"
80,"spotify:track:3npzogdOEiVsieXmmhBepL","Maren Morris","The Bones","Columbia Nashville",51,72,35,"356155"
81,"spotify:track:2H4gf1wLxvYreMj1jcaN0k","Dean Lewis","Be Alright","Universal Music Australia Pty. Ltd.",19,81,252,"350536"
82,"spotify:track:40T5GIqQ1CegGm2PTEl8Bu","Billie Eilish","idontwannabeyouanymore","Darkroom",40,83,263,"350510"
83,"spotify:track:1fewSx2d5KIZ04wsooEBOz","Metro Boomin, Gunna","Space Cadet (feat. Gunna)","Republic Records",15,84,161,"344179"
84,"spotify:track:577YBGuskWkVDCxZrLRB4v","Lil Baby","Pure Cocaine","Quality Control Music/Motown Records/Capitol Records",21,86,131,"343313"
85,"spotify:track:75ZvA4QfFiZvzhj2xkaWAh","Post Malone","I Fall Apart","Universal Records",2,87,573,"341794"
86,"spotify:track:5w9c2J52mkdntKOmRLeM2m","Daddy Yankee, Snow","Con Calma","El Cartel Records (EC3)",43,90,63,"339772"
87,"spotify:track:13ZyrkCDmRz5xY3seuAWYk","Juice WRLD","Hear Me Calling","Grade A Productions/Interscope Records",11,89,42,"338030"
88,"spotify:track:7m9OqQk4RVRkw9JJdeAw96","XXXTENTACION","Jocelyn Flores","Bad Vibes Forever / EMPIRE",2,92,595,"336117"
89,"spotify:track:5AjINjwKyRvQJhSe2zpPHi","Polo G, Lil Tjay","Pop Out (feat. Lil Tjay)","Columbia",85,95,20,"332365"
90,"spotify:track:0HEckRWFSknIupbGzavk5d","Khalid","Hundred","Right Hand Music Group, LLC/RCA Records",41,74,7,"331452"
91,"spotify:track:3swc6WTsr7rl9DqQKQA55C","Post Malone, Ty Dolla $ign","Psycho (feat. Ty Dolla $ign)","Republic Records",1,93,413,"331085"
92,"spotify:track:116H0KvKr2Zl4RPuVBruDO","Bad Bunny, Drake","MIA (feat. Drake)","OVO Sound/Warner Records",2,94,183,"330665"
93,"spotify:track:5IaHrVsrferBYDm0bDyABy","Tyga, Offset","Taste (feat. Offset)","Last Kings Music / EMPIRE",3,98,329,"330573"
94,"spotify:track:0TlLq3lA83rQOYtrqBqSct","Drake","Nonstop","Cash Money/Drake LP6",1,97,287,"326416"
95,"spotify:track:6vN77lE9LK6HP2DewaN6HZ","Lil Baby, Drake","Yes Indeed","Quality Control Music, LLC",2,96,332,"326237"
96,"spotify:track:0rKtyWc8bvkriBthvHKY8d","Joji","SLOW DANCING IN THE DARK","88rising Music/Warner Records",26,101,202,"325916"
97,"spotify:track:3A2yGHWIzmGEIolwonU69h","City Girls","Act Up","Quality Control Music/Motown Records",79,99,40,"317692"
98,"spotify:track:2uIX8YMNjGMD7441kqyyNU","Billie Eilish","ocean eyes","Darkroom",61,106,287,"315200"
99,"spotify:track:4u7EnebtmKWzUH433cf5Qv","Queen","Bohemian Rhapsody - Remastered 2011","Hollywood Records",36,105,171,"314370"
100,"spotify:track:4hqOmrCCJKyiuwDexd8c2t","NAV, The Weeknd","Price On My Head (feat. The Weeknd)","XO Records, LLC and Republic Records",17,100,21,"313661"
101,"spotify:track:0NJp8GyCOWnQh71xKSPfuV","Tory Lanez","Freaky","Mad Love/Interscope Records",64,107,28,"309676"
102,"spotify:track:0fcq51a3gOI6gPvzc0YLsk","Post Malone, Roddy Ricch, Tyga","Wow. - Remix","Republic Records",58,104,28,"308405"
103,"spotify:track:58q2HKrzhC3ozto2nDdN4z","Cardi B, Bad Bunny, J Balvin","I Like It","Atlantic/KSR",2,111,371,"308132"
104,"spotify:track:7pMRoGLEJuFM2wl5pt0R99","Offset, Travis Scott, 21 Savage","Legacy (feat. Travis Scott & 21 Savage)","Quality Control Music/Motown Records",12,110,49,"306410"
105,"spotify:track:1WqLtczgKdbHFHhefOU0y7","Khalid","Self","Right Hand Music Group, LLC/RCA Records",40,82,14,"305899"
106,"spotify:track:7ql71hBakyMi0Lxiq3Mugs","The Chainsmokers, 5 Seconds of Summer","Who Do You Love","Disruptor Records/Columbia",28,102,63,"305207"
107,"spotify:track:0jAfdqv18goRTUxm3ilRjb","A Boogie Wit da Hoodie, Tyga, Offset","Startender (feat. Offset and Tyga)","Highbridge the Label / Atlantic Records",15,116,119,"304919"
108,"spotify:track:6JQvHMSaR8flFsN53ypOfP","Lil Mosey","Noticed","Mogul Vision/Interscope Records",17,118,238,"304692"
109,"spotify:track:1NgCWYuBLfqBDA3b8MgSVU","Khalid","Twenty One","Right Hand Music Group, LLC/RCA Records",45,85,7,"303206"
110,"spotify:track:2MShy1GSSgbmGUxADNIao5","Kodak Black","Calling My Spirit","Atlantic Records",27,115,133,"303076"
111,"spotify:track:4TWflhgevIGo448fWc6mQq","Offset","Red Room","Quality Control Music/Motown Records",14,112,57,"302850"
112,"spotify:track:42fw0rxRO2xbesF6mJfd4Y","Dan + Shay","Tequila","Warner Records",48,103,402,"302525"
113,"spotify:track:7sO5G9EABYOXQKNPNiE9NR","Offset, Metro Boomin","Ric Flair Drip (with Metro Boomin)","Slaughter Gang, LLC/Epic/Quality Control Music/Motown/Capitol/Boominati Worldwide/Republic",4,122,527,"300932"
114,"spotify:track:2iUXsYOEPhVqEBwsqP70rE","5 Seconds of Summer","Youngblood","Capitol",12,113,362,"300112"
115,"spotify:track:6MjNilJCVKJq0LfFvo5jWJ","Juice WRLD","Fast","Grade A Productions/Interscope Records",6,121,35,"299927"
116,"spotify:track:5BfMJ6iytQnu1r7iiCYSXe","Khalid","Intro","Right Hand Music Group, LLC/RCA Records",28,88,7,"298959"
117,"spotify:track:6ZRuF2n1CQxyxxAAWsKJOy","Kehlani, Ty Dolla $ign","Nights Like This (feat. Ty Dolla $ign)","TSNMI / Atlantic",19,108,91,"297599"
118,"spotify:track:5JEx7HbmvHQQswJCsoo9rA","Ellie Goulding, Diplo, Swae Lee","Close To Me (with Diplo) (feat. Swae Lee)","Polydor Records",30,109,167,"297300"
119,"spotify:track:6fOOKqQWcSy33ApU1wqkkW","Khalid","Paradise","Right Hand Music Group, LLC/RCA Records",37,91,7,"296880"
120,"spotify:track:5Z3GHaZ6ec9bsiI5BenrbY","Khalid","Young Dumb & Broke","Right Hand Music Group, LLC/RCA Records",5,120,729,"296307"
121,"spotify:track:4VXIryQMWpIdGgYR4TrjT1","Juice WRLD","All Girls Are The Same","Juice WRLD Mixtape / ISR P&D",12,124,356,"295741"
122,"spotify:track:2P91MQbaiQOfbiz9VqhqKQ","Lauv","I Like Me Better","Lauv",30,119,667,"294815"
123,"spotify:track:7GX5flRQZVHRAGd6B4TmDO","Lil Uzi Vert","XO Tour Llif3","Generation Now/Atlantic",1,128,749,"293142"
124,"spotify:track:6eiztdXRkooWsBt2xToMWI","Juice WRLD","Make Believe","Grade A Productions/Interscope Records",20,125,35,"290246"
125,"spotify:track:3LgWsmilsrWXiPYQFRD0T7","Billie Eilish","goodbye","Darkroom/Interscope Records",22,117,14,"289409"
126,"spotify:track:4e4fqjx0Izh4svvTef1z7e","Bebe Rexha, Florida Georgia Line","Meant to Be (feat. Florida Georgia Line)","Warner Bros.",15,126,577,"288210"
127,"spotify:track:4XiGKQqbmnMVxDzUj6j3f2","YK Osiris","Worth It","Def Jam Recordings",116,131,40,"287424"
128,"spotify:track:152lZdxL1OR0ZMW6KquMif","Khalid","Location","Right Hand Music Group, LLC/RCA Records",9,127,820,"287225"
129,"spotify:track:51NFxnQvaosfDDutk0tams","Billie Eilish","bellyache","Darkroom",39,130,160,"287064"
130,"spotify:track:7AQim7LbvFVZJE3O8TYgf2","XXXTENTACION, Trippie Redd","Fuck Love (feat. Trippie Redd)","Bad Vibes Forever / EMPIRE",5,132,595,"284834"
131,"spotify:track:5SHhPFh68OhUmuRPymKX9d","FLETCHER","Undrunk","Capitol Records",60,114,32,"283304"
132,"spotify:track:3a1lNhkSLSkpJE4MSHpDu9","Post Malone, Quavo","Congratulations","Universal Records",5,133,830,"283014"
133,"spotify:track:4dAMdQ6g4kGmnc1MDHsg77","NLE Choppa","Shotta Flow","No Love Entertainment",109,142,24,"280348"
134,"spotify:track:6DCZcSspjsKoFjzjrWoCdn","Drake","God's Plan","Cash Money/Drake LP6",1,134,447,"278164"
135,"spotify:track:3GJ4hzg4lrGwU51Y3VARbF","Dan + Shay","Speechless","Warner Records",77,129,233,"277209"
136,"spotify:track:2gwkD6igEhQbDQegRCcdoB","DaBaby","Suge","South Coast Music Group/Interscope Records",124,138,13,"275026"
137,"spotify:track:6GSkLS2y4ZnnZsuRAj975K","Marshmello, Roddy Ricch","Project Dreams","Warner Records",72,140,107,"271801"
138,"spotify:track:7uH27oIt4a6cIFCA8ZPcyG","Ozuna","Baila Baila Baila","Aura Music Corp.",96,139,71,"269410"
139,"spotify:track:39xWBHPM4E9MwzEy5gbM7p","Nipsey Hussle, YG","Last Time That I Checc'd (feat. YG)","Atlantic Records",33,166,11,"268464"
140,"spotify:track:4SPu0Ql902hTVXkBoNIYtq","Ariana Grande","NASA","Republic Records",3,136,63,"264827"
141,"spotify:track:1WSGTYKLEpKfNQYYW5Oymt","benny blanco, Selena Gomez, J Balvin, Tainy","I Can’t Get Enough (benny blanco, Selena Gomez, J Balvin, Tainy)","NEON16/Friends Keep Secrets/Interscope Records",21,137,42,"263755"
142,"spotify:track:4VUwkH455At9kENOfzTqmF","Bazzi, Camila Cabello","Beautiful (feat. Camila Cabello)","iamcosmic",28,144,251,"262159"
143,"spotify:track:7KXjTSCq5nL1LoYtL7XAwS","Kendrick Lamar","HUMBLE.","Aftermath",1,148,740,"261168"
144,"spotify:track:4qKcDkK6siZ7Jp1Jb4m0aL","BlocBoy JB, Drake","Look Alive (feat. Drake)","OVO Sound/Warner Records",2,149,427,"257401"
145,"spotify:track:1TEL6MlSSVLSdhOSddidlJ","Ariana Grande","needy","Republic Records",3,141,63,"256930"
146,"spotify:track:41MCdlvXOl62B7Kv86Bb1v","Juice WRLD","Empty","Grade A Productions/Interscope Records",10,147,35,"256442"
147,"spotify:track:42w7pX3r1TpLR0i55Ek5ND","Khalid","Bluffin'","Right Hand Music Group, LLC/RCA Records",55,123,7,"254975"
148,"spotify:track:7hzlzoOwCZ4D3Ow5YZK4kj","Daya","Insomnia","Interscope Records",138,143,11,"254924"
149,"spotify:track:4w8niZpiMy6qz1mntFA5uM","DJ Snake, Selena Gomez, Ozuna, Cardi B","Taki Taki (with Selena Gomez, Ozuna & Cardi B)","DJ Snake Music Productions Limited, under exclusive license to Geffen Records",4,150,196,"254406"
150,"spotify:track:6gBFPUFcJLzWGx4lenP6h2","Travis Scott","goosebumps","Epic/Grand Hustle",16,152,829,"254387"
151,"spotify:track:7AFASza1mXqntmGtbxXprO","XXXTENTACION","changes","Bad Vibes Forever, LLC",4,153,406,"252399"
152,"spotify:track:3R9j8urSPiBbapNbyuSYkE","Nipsey Hussle","Grinding All My Life","Atlantic Records",38,177,17,"251869"
153,"spotify:track:7uzmGiiJyRfuViKKK3lVmR","Bazzi","Mine","iamcosmic",3,157,447,"250506"
154,"spotify:track:5T8EDUDqKcs6OSOwEsfqG7","Queen","Don't Stop Me Now - Remastered 2011","Hollywood Records",69,154,135,"250152"
155,"spotify:track:62vpWI1CHwFy7tMIcSStl8","J. Cole","No Role Modelz","Roc Nation Records LLC",64,155,690,"249547"
156,"spotify:track:4OBZT9EnhYIV17t4pGw7ig","H.E.R., Daniel Caesar","Best Part (feat. Daniel Caesar)","MBK Entertainment/RCA Records",53,151,298,"247837"
157,"spotify:track:74lnM5V6ecvoTPV0fvptx9","Ski Mask The Slump God, Juice WRLD","Nuketown (feat. Juice WRLD)","Republic Records",13,156,133,"246820"
158,"spotify:track:6fIjnWrv46njJHLDAY2JdC","Nipsey Hussle, Kendrick Lamar","Dedication (feat. Kendrick Lamar)","Atlantic Records",31,195,13,"244984"
159,"spotify:track:25F6MWrnFBCXVnpN4n76EK","Logic","Keanu Reeves","Def Jam Recordings",13,158,84,"242635"
160,"spotify:track:4n7jnSxVLd8QioibtTDBDq","Alan Walker, Sabrina Carpenter, Farruko","On My Way","MER Recordings",157,160,11,"240714"
161,"spotify:track:4NBTZtAt1F13VvlSKe6KTl","The Chainsmokers, Kelsea Ballerini","This Feeling","Disruptor Records/Columbia",21,159,190,"240697"
162,"spotify:track:3CA9pLiwRIGtUBiMjbZmRw","Drake","Nice For What","Cash Money/Drake LP6",1,162,368,"240674"
163,"spotify:track:45Egmo7icyopuzJN0oMEdk","Khalid, Normani","Love Lies (with Normani)","RCA Records Label",8,161,417,"240606"
164,"spotify:track:12VqHHz4wvVcnEdSivjLeQ","Khalid","Alive","Right Hand Music Group, LLC/RCA Records",63,135,7,"240342"
165,"spotify:track:7lAK3oHbfEnvUQWosrMMpR","Travis Scott","YOSEMITE","Cactus Jack / Epic / Grand Hustle",7,163,252,"238164"
166,"spotify:track:7DHApOHsIFo7EyfieArYGE","P!nk","Walk Me Home","RCA Records Label",121,145,43,"236361"
167,"spotify:track:3oDkdAySo1VQQG0ptV7uwa","Juice WRLD","Lean Wit Me","Juice WRLD Mixtape / ISR P&D",25,168,324,"234834"
168,"spotify:track:5W83ErFkO3aKAIS1WMi6u0","Anuel AA, KAROL G","Secreto","Anuel AA & Karol G - Secreto",88,164,86,"234233"
169,"spotify:track:2qT1uLXPVPzGgFOx4jtEuo","Ariana Grande","no tears left to cry","Republic Records",6,167,356,"233959"
170,"spotify:track:7fa9MBXhVfQ8P8Df9OEbD8","Maroon 5, Cardi B","Girls Like You (feat. Cardi B) - Cardi B Version","Interscope Records*",6,169,313,"233754"
171,"spotify:track:32lItqlMi4LBhb4k0BaSaC","Post Malone","Candy Paint","Republic Records",4,171,678,"231532"
172,"spotify:track:09IStsImFySgyp0pIQdqAc","Zedd, Maren Morris, Grey","The Middle","UMGRI Interscope",5,174,430,"230958"
173,"spotify:track:5274I4mUMnYczyeXkGDWZN","Future, Juice WRLD","Fine China","Epic/Freebandz/Grade A/Interscope",2,170,178,"230801"
174,"spotify:track:2G7V7zsVDxg1yRsu7Ew9RJ","Drake","In My Feelings","Cash Money/Drake LP6",1,175,287,"228867"
175,"spotify:track:2qG5sZ7Si6sdK74qLxedYM","ROSALÍA, J Balvin, El Guincho","Con Altura","Columbia",113,165,14,"228867"
176,"spotify:track:1KVczjazCcCCgM3gXXUl47","benny blanco, Juice WRLD, Brendon Urie","Roses (with Juice WRLD feat. Brendon Urie)","Friends Keep Secrets/Interscope Records",41,172,126,"227571"
177,"spotify:track:0Hgqglypzt6Qs5Duqskcqs","Khalid","Heaven","Right Hand Music Group, LLC/RCA Records",70,146,7,"226875"
178,"spotify:track:3wLtYwtqvKK2ewelSVPeDK","Roddy Ricch","Die Young","Bird Vision Entertainment",127,180,14,"225106"
179,"spotify:track:39LmTF9RgyakzSYX8txrow","Ariana Grande","imagine","Republic Records",2,176,119,"221744"
180,"spotify:track:6foY66mWZN0pSRjZ408c00","Morgan Wallen","Whiskey Glasses","Big Loud Records",173,173,29,"221565"
181,"spotify:track:4iVD0fTHGxV9JWloujsL3s","Nipsey Hussle, Belly, Dom Kennedy","Double Up (feat. Belly and Dom Kennedy)","Atlantic Records",43,-1,10,"219801"
182,"spotify:track:51w9Jbat1pLeWINGCpnQUR","Tory Lanez, Rich The Kid, Lil Wayne","TAlk tO Me (with Rich The Kid feat. Lil Wayne) - Remix","Mad Love/Interscope Records",115,186,92,"219202"
183,"spotify:track:4dTiQezDWmEOWcdCbWVWMp","ScHoolboy Q","Numb Numb Juice","Top Dawg Entertainment/Interscope Records",10,179,29,"218820"
184,"spotify:track:0i0wnv9UoFdZ5MfuFGQzMy","Bebe Rexha","Last Hurrah","Warner Records",56,184,49,"215703"
185,"spotify:track:79esEXlqqmq0GPz0xQSZTV","Shawn Mendes","Lost In Japan","Island Records",16,182,132,"214629"
186,"spotify:track:698eQRku24PIYPQPHItKlA","Luke Combs","She Got the Best of Me","River House Artists/Columbia Nashville",146,181,41,"214534"
187,"spotify:track:5uCax9HTNlzGybIStD3vDh","James Arthur","Say You Won't Let Go","Columbia",14,185,629,"214102"
188,"spotify:track:6xHI9KjUjYT0FPtGO8Mxa1","Luke Combs","Hurricane","River House Artists/Columbia Nashville",77,187,317,"213455"
189,"spotify:track:1HXy5I3HTWq8OvxCn0z7G7","Kane Brown","Heaven","RCA Records Label Nashville",51,183,327,"213190"
190,"spotify:track:4QIyEq7TcTdAcxjI2AFlAK","6ix9ine, Nicki Minaj, Murda Beatz","FEFE","Scumgang Records/TenThousand Projects, LLC",2,189,262,"211027"
191,"spotify:track:3GVkPk8mqxz0itaAriG1L7","XXXTENTACION","Everybody Dies In Their Nightmares","Bad Vibes Forever / EMPIRE",6,192,589,"210790"
192,"spotify:track:0pqnGHJpmpxLKifKRmU6WP","Imagine Dragons","Believer","Kid Ina Korner / Interscope",9,190,726,"210370"
193,"spotify:track:4jvjzW7Hm0yK4LvvE0Paz9","Lil Peep, XXXTENTACION","Falling Down - Bonus Track","Columbia",1,191,205,"209889"
194,"spotify:track:7oK9VyNzrYvRFo7nQEYkWN","The Killers","Mr. Brightside","Island Records",83,-1,50,"208950"
195,"spotify:track:7vGuf3Y35N4wmASOKLUVVU","Marshmello, Khalid","Silence","Joytime Collective/RCA Records",7,194,468,"208487"
196,"spotify:track:1zB4vmk8tFRmM9UULNzbLB","Imagine Dragons","Thunder","Kid Ina Korner / Interscope",16,188,669,"208365"
197,"spotify:track:0ZNrc4kNeQYD9koZ3KvCsy","YG, 2 Chainz, Big Sean, Nicki Minaj","BIG BANK (feat. 2 Chainz, Big Sean, Nicki Minaj)","Def Jam Recordings",21,200,322,"207912"
198,"spotify:track:2qGfZAgDe1pV2y5xJAhi6R","YoungBoy Never Broke Again","Slime Belief","Never Broke Again, LLC",145,193,53,"207226"
199,"spotify:track:23OXdR7YuUBVWh5hSnYJau","Twenty One Pilots","Chlorine","Fueled By Ramen",45,196,16,"206158"
200,"spotify:track:0FQhAHyHGsrbSHvDURmFPn","Billie Eilish","my boy","Darkroom",137,198,91,"205648"
