rank,uri,artist_names,track_name,source,peak_rank,previous_rank,days_on_chart,streams
1,"spotify:track:7wGoVu4Dady5GV0Sv4UIsx","Post Malone, 21 Savage","rockstar (feat. 21 Savage)","Republic Records",1,1,119,"1429161"
2,"spotify:track:3Vo4wInECJQuz9BIBMOu8i","Bruno Mars, Cardi B","Finesse - Remix; feat. Cardi B","Atlantic Records",2,2,8,"1208987"
3,"spotify:track:2DQ1ITjI0YoLFzuADN1ZBW","G-Eazy, A$AP Rocky, Cardi B","No Limit","BPG/RVG/RCA Records",2,3,126,"1151926"
4,"spotify:track:75FDPwaULRdYDn4StFN2rT","Cardi B, 21 Savage","Bartier Cardi (feat. 21 Savage)","Atlantic/KSR",3,4,21,"1090293"
5,"spotify:track:75ZvA4QfFiZvzhj2xkaWAh","Post Malone","I Fall Apart","Universal Records",2,5,118,"1014280"
6,"spotify:track:7sO5G9EABYOXQKNPNiE9NR","Offset, Metro Boomin","Ric Flair Drip (with Metro Boomin)","Slaughter Gang, LLC/Epic/Quality Control Music/Motown/Capitol/Boominati Worldwide/Republic",4,6,73,"972350"
7,"spotify:track:66kQ7wr4d2LwwSjr7HXcyr","Kendrick Lamar, SZA","All The Stars (with SZA)","Black Panther (TDE/DMG) PS",6,7,8,"924209"
8,"spotify:track:5k38wzpLb15YgncyWdTZE4","G-Eazy, Halsey","Him & I (with Halsey)","BPG/RVG/RCA Records",3,8,42,"922130"
9,"spotify:track:0ofbQMrRDsUaVKq2mGLEAb","Camila Cabello, Young Thug","Havana (feat. Young Thug)","Syco Music/Epic",3,9,160,"876417"
10,"spotify:track:4DTpngLjoHj5gFxEZFeD3J","Kodak Black, Lil Wayne","Codeine Dreaming (feat. Lil Wayne)","Atlantic Records",10,11,49,"867383"
11,"spotify:track:6PGoSes0D9eUDeeAafB2As","Kendrick Lamar, Zacari","LOVE. FEAT. ZACARI.","Aftermath",5,10,273,"866918"
12,"spotify:track:6mrKP2jyIQmM0rw6fQryjr","NF","Let You Down","NF Real Music",9,12,103,"774529"
13,"spotify:track:5UEnHoDYpsxlfzWLZIc7LD","Eminem, Ed Sheeran","River (feat. Ed Sheeran)","Aftermath",2,14,28,"751575"
14,"spotify:track:42CeaId2XNlxugDvyqHfDf","Post Malone","Candy Paint","Republic Records",4,13,231,"745239"
15,"spotify:track:7GX5flRQZVHRAGd6B4TmDO","Lil Uzi Vert","XO Tour Llif3","Generation Now/Atlantic",1,15,294,"716061"
16,"spotify:track:3ncgNpxLoBQ65ABk4djDyd","Famous Dex, A$AP Rocky","PICK IT UP (feat. A$AP Rocky)","300 Entertainment",13,16,77,"711379"
17,"spotify:track:43ZyHQITOjhciSUUNPVRHc","Lil Pump","Gucci Gang","Warner Records",2,17,131,"693019"
18,"spotify:track:5AEtlRudpgdT5FtNiuly6Y","Hailee Steinfeld, Alesso, Florida Georgia Line, WATT","Let Me Go (with Alesso, Florida Georgia Line & watt)","Universal Records",17,19,126,"674218"
19,"spotify:track:7iDa6hUg2VgEL1o1HjmfBn","Bebe Rexha, Florida Georgia Line","Meant to Be (feat. Florida Georgia Line)","Warner Records",17,18,125,"670987"
20,"spotify:track:1YZfcVLbbJwfizR5cDOp3q","Migos, Nicki Minaj, Cardi B","MotorSport","Quality Control Music, LLC",8,20,77,"666058"
21,"spotify:track:7KXjTSCq5nL1LoYtL7XAwS","Kendrick Lamar","HUMBLE.","Aftermath",1,22,287,"662681"
22,"spotify:track:5WoaF1B5XIEnWfmb5NZikf","Miguel, Travis Scott","Sky Walker (feat. Travis Scott)","ByStorm Entertainment/RCA Records",21,21,140,"658119"
23,"spotify:track:4dVpf9jZjcORqGTLUaeYj9","A$AP Ferg","Plain Jane","RCA Records Label",6,23,139,"653911"
24,"spotify:track:2fQrGHiQOvpL9UgPvtYy6G","21 Savage","Bank Account","Slaughter Gang, LLC/Epic Records",1,25,189,"651459"
25,"spotify:track:7EmGUiUaOSGDnUUQUDrOXC","Selena Gomez, Marshmello","Wolves","Selena Gomez PS",3,26,79,"631785"
26,"spotify:track:6VpQdig9pdpTSIFItgkJV5","Camila Cabello","Never Be the Same","Syco Music/Epic",26,32,35,"619891"
27,"spotify:track:4fndbjoz1qJyK6JcLdKfzm","Migos","Stir Fry","Quality Control Music, LLC",27,35,21,"611321"
28,"spotify:track:6NWl2m8asvH83xjuXVNsuG","Lil Xan","Betrayed","Columbia",22,31,88,"610324"
29,"spotify:track:1L3NV7VrCiuE8C5QlhdeQL","Justin Timberlake","Filthy","RCA Records Label",7,27,7,"609955"
30,"spotify:track:3a1lNhkSLSkpJE4MSHpDu9","Post Malone, Quavo","Congratulations","Universal Records",5,30,376,"609514"
31,"spotify:track:0tgVpDi06FyKpA1z0VMD4v","Ed Sheeran","Perfect","Atlantic Records UK",11,29,232,"605155"
32,"spotify:track:1mXVgsBdtIVeCLJnSnmtdV","Sam Smith","Too Good At Goodbyes","Capitol",2,24,126,"591660"
33,"spotify:track:5Z3GHaZ6ec9bsiI5BenrbY","Khalid","Young Dumb & Broke","Right Hand Music Group, LLC/RCA Records",5,33,282,"584169"
34,"spotify:track:2ekn2ttSfGqwhhate0LSR0","Dua Lipa","New Rules","Warner Records",11,28,185,"582132"
35,"spotify:track:5tz69p7tJuGPeMGwNTxYuV","Logic, Alessia Cara, Khalid","1-800-273-8255","Def Jam Recordings",1,37,259,"547122"
36,"spotify:track:1XRgIKC5TPwo7nWGyKqgG0","Gucci Mane, Migos","I Get the Bag (feat. Migos)","Guwop Enterprises/Atlantic",7,39,147,"546046"
37,"spotify:track:5Htb1uFQ1KrkFXlefS8oGj","Demi Lovato","Tell Me You Love Me","Island Records",35,38,42,"545324"
38,"spotify:track:3hBBKuWJfxlIlnd9QFoC8k","Maroon 5, SZA","What Lovers Do (feat. SZA)","Interscope Records*",7,36,135,"538221"
39,"spotify:track:2Tq2R8sRftNEqdgJK5HadO","Troye Sivan","My My My!","EMI Recorded Music Australia Pty Ltd",39,-1,1,"528388"
40,"spotify:track:630sXRhIcfwr2e4RdNtjKN","Zac Efron, Zendaya","Rewrite The Stars","Atlantic Records",40,50,16,"519114"
41,"spotify:track:2771LMNxwf62FTAdpJMQfM","Cardi B","Bodak Yellow","Atlantic/KSR",2,40,175,"518952"
42,"spotify:track:7vGuf3Y35N4wmASOKLUVVU","Marshmello, Khalid","Silence","Joytime Collective/RCA Records",7,34,154,"517536"
43,"spotify:track:6gBFPUFcJLzWGx4lenP6h2","Travis Scott","goosebumps","Epic/Grand Hustle",16,41,376,"495459"
44,"spotify:track:40oKW22ZNNkEdZLJTScaQI","Kodak Black, XXXTENTACION","Roll in Peace (feat. XXXTENTACION)","Atlantic Records",22,42,147,"490385"
45,"spotify:track:2x0WlnmfG39ZuDmstl9xfX","Taylor Swift, Ed Sheeran, Future","End Game","Big Machine Records, LLC",37,46,42,"483482"
46,"spotify:track:1yxgsra98r3qAtxqiGZPiX","Travis Scott","BUTTERFLY EFFECT","Cactus Jack / Epic / Grand Hustle",9,44,237,"483227"
47,"spotify:track:7y9iMe8SOB6z3NoHE2OfXl","Halsey","Bad At Love","Astralwerks (ASW)",22,43,151,"480280"
48,"spotify:track:2u7mxWSeoqTXndK5e08jMp","Lil Skies, Landon Cube","Nowadays (feat. Landon Cube)","All We Got Ent.",48,57,13,"473354"
49,"spotify:track:0tKcYR2II1VCQWT79i5NrW","Imagine Dragons","Thunder","Kid Ina Korner / Interscope",16,45,259,"473100"
50,"spotify:track:152lZdxL1OR0ZMW6KquMif","Khalid","Location","Right Hand Music Group, LLC/RCA Records",9,48,375,"472116"
51,"spotify:track:790MhTXPFrYkrqCKvpg4t1","NAV, Lil Uzi Vert","Wanted You (feat. Lil Uzi Vert)","XO Records",23,47,63,"469344"
52,"spotify:track:2eAZfqOm4EnOF9VvN50Tyc","Lil Uzi Vert, Oh Wonder","The Way Life Goes (feat. Oh Wonder)","Generation Now/Atlantic",4,49,140,"465147"
53,"spotify:track:2xGjteMU3E1tkEPVFBO08U","Keala Settle, The Greatest Showman Ensemble","This Is Me","Atlantic Records",53,61,16,"458744"
54,"spotify:track:7m9OqQk4RVRkw9JJdeAw96","XXXTENTACION","Jocelyn Flores","Bad Vibes Forever / EMPIRE",3,53,140,"438994"
55,"spotify:track:76cy1WJvNGJTj78UqeA5zr","Dua Lipa","IDGAF","Warner Records",51,55,16,"438753"
56,"spotify:track:2xmrfQpmS2iJExTlklLoAL","Clean Bandit, Julia Michaels","I Miss You (feat. Julia Michaels)","Atlantic Records UK",50,51,76,"435557"
57,"spotify:track:3B54sVLJ402zGa6Xm4YGNe","French Montana, Swae Lee","Unforgettable","Bad Boy Entertainment/Epic Records",1,52,280,"428244"
58,"spotify:track:7AQim7LbvFVZJE3O8TYgf2","XXXTENTACION, Trippie Redd","Fuck Love (feat. Trippie Redd)","Bad Vibes Forever / EMPIRE",7,58,140,"423446"
59,"spotify:track:3m660poUr1chesgkkjQM7P","Demi Lovato","Sorry Not Sorry","Island Records",6,54,185,"411178"
60,"spotify:track:0taOCiup4HNG9LmbduVlJj","YBN Nahmir","Rubbin off the Paint","2018",47,59,81,"410176"
61,"spotify:track:7foypmc7KZyU716Yv63BPe","Huncho Jack, Travis Scott, Quavo","Saint","Quality Control Music - Epic",15,56,21,"408107"
62,"spotify:track:1bhUWB0zJMIKr9yVPrkEuI","Ed Sheeran, Beyoncé","Perfect Duet (Ed Sheeran & Beyoncé)","Atlantic Records UK",3,60,42,"404210"
63,"spotify:track:5u6vkDnOyaf8LsteDAj2ub","21 Savage, Offset, Metro Boomin, Travis Scott","Ghostface Killers (feat. Travis Scott)","Slaughter Gang, LLC/Epic/Quality Control Music/Motown/Capitol/Boominati Worldwide/Republic",2,62,73,"394986"
64,"spotify:track:6p8NuHm8uCGnn2Dtbtf7zE","Migos, Gucci Mane","Slippery (feat. Gucci Mane)","Quality Control Music",17,64,350,"394456"
65,"spotify:track:6HZILIRieu8S0iqY8kIKhj","Kendrick Lamar","DNA.","Aftermath",2,63,273,"384458"
66,"spotify:track:2vjmyyAnDUzilFYxOlTdO1","6ix9ine","GUMMO","Strainge Entertainment",50,65,63,"376878"
67,"spotify:track:1f5cbQtDrykjarZVrShaDI","A Boogie Wit da Hoodie, Kodak Black","Drowning (feat. Kodak Black)","Highbridge The Label",18,66,301,"374783"
68,"spotify:track:4V6MRo0CEAC9MwAm7dkPuL","Camila Cabello","Real Friends","Syco Music/Epic",57,68,34,"371607"
69,"spotify:track:7qiZfU4dY1lWllzX7mPBI3","Ed Sheeran","Shape of You","Atlantic Records UK",1,67,371,"357274"
70,"spotify:track:5yuShbu70mtHXY0yLzCQLQ","Post Malone","Go Flex","Universal Records",19,69,376,"346649"
71,"spotify:track:1zsG4eaZmkA1dvjDDsAGLK","Luis Fonsi, Demi Lovato","Échame La Culpa","UMLE - Latino",47,72,55,"346031"
72,"spotify:track:3ZhTT6yjZwpPph5MIJ53XY","Lil Skies, Landon Cube","Red Roses (feat. Landon Cube)","All We Got Ent.",72,104,10,"343905"
73,"spotify:track:6QgjcU0zLnzq5OrUoSZ3OK","Portugal. The Man","Feel It Still","Atlantic Records",13,73,210,"337588"
74,"spotify:track:6urLjX35oXXRYtcH1b3dCh","Huncho Jack, Travis Scott, Quavo, Offset","Dubai Shit","Quality Control Music - Epic",10,70,21,"334949"
75,"spotify:track:7Ed6BkggCS2KaKY5YlINaF","BTS, Desiigner, Steve Aoki","MIC Drop (feat. Desiigner) [Steve Aoki Remix]","BIGHIT MUSIC",58,78,49,"334861"
76,"spotify:track:0CcQNd8CINkwQfe1RDtGV6","Imagine Dragons","Believer","Kid Ina Korner / Interscope",9,75,344,"334825"
77,"spotify:track:0OI7AFifLSoGzpb8bdBLLV","Machine Gun Kelly, X Ambassadors, Bebe Rexha","Home (with Machine Gun Kelly, X Ambassadors & Bebe Rexha)","Atlantic Records",56,76,51,"332497"
78,"spotify:track:43ay9lQZ5rfNcOOHhRF2cM","Hugh Jackman, Keala Settle, Zac Efron, Zendaya, The Greatest Showman Ensemble","The Greatest Show","Atlantic Records",63,71,16,"331844"
79,"spotify:track:3wAI7MIQtTgwcRmwchPZBc","Big Sean, Metro Boomin, Travis Scott","Go Legend (& Metro Boomin)","Republic/MB/Big Sean",7,74,35,"326554"
80,"spotify:track:7mldq42yDuxiUNn08nvzHO","Sam Hunt","Body Like A Back Road","MCA Nashville",12,77,344,"323570"
81,"spotify:track:3qk4wRMDlaeagZGjSYbsOV","G-Eazy, Charlie Puth","Sober","BPG/RVG/RCA Records",50,80,31,"321110"
82,"spotify:track:0q75NwOoFiARAVp4EXU4Bs","SZA, Travis Scott","Love Galore (feat. Travis Scott)","Top Dawg Entertainment/RCA Records",23,82,253,"319612"
83,"spotify:track:3wdfLVUhmX64lIyWIIEW8s","Quality Control, Quavo, Lil Yachty","Ice Tray","Quality Control Music, LLC",72,85,31,"317165"
84,"spotify:track:4pYZLpX23Vx8rwDpJCpPTA","Rich The Kid, Kendrick Lamar","New Freezer (feat. Kendrick Lamar)","Rich The Kid / (TDE/ISR PS)",59,83,107,"315708"
85,"spotify:track:5hcisvFMidkMJlElTO9Qmw","Bad Bunny, Prince Royce, J Balvin, Mambo Kingz, DJ Luian","Sensualidad","Hear This Music",85,86,50,"315691"
86,"spotify:track:3kxfsdsCpFgN412fpnW85Y","Childish Gambino","Redbone","Glassnote Entertainment Group LLC",8,87,376,"310717"
87,"spotify:track:32DGGj6KlNuBr6WaqRxpxi","Charlie Puth","How Long","Artist Partner",36,88,96,"306685"
88,"spotify:track:5hM6sP0Gh1jD57drszNueC","Liam Payne, Rita Ora","For You (With Rita Ora)","Capitol",70,79,7,"305689"
89,"spotify:track:4knL4iPxPOZjQzTUlELGSY","Yo Gotti, Nicki Minaj","Rake It Up (feat. Nicki Minaj)","Epic/CMG",17,90,205,"304816"
90,"spotify:track:0RoA7ObU6phWpqhlC9zH4Z","Ziv Zaifman, Hugh Jackman, Michelle Williams","A Million Dreams","Atlantic Records",71,81,14,"303567"
91,"spotify:track:0Gl5s8IhMmQE5YQwM8Qx1J","Loren Allred","Never Enough","Atlantic Records",72,84,15,"301531"
92,"spotify:track:1e1JKLEDKP7hEQzJfNAgPl","Playboi Carti","Magnolia","AWGE Label",10,94,266,"301127"
93,"spotify:track:6eT7xZZlB2mwyzJ2sUKG6w","Post Malone","White Iverson","Universal Records",56,91,376,"298336"
94,"spotify:track:1uL78kFWxhz3umTMWJu8n5","Lil Uzi Vert","Sauce It Up","Generation Now/Atlantic",6,92,140,"298203"
95,"spotify:track:0VgkVdmE4gld66l8iyGjgx","Future","Mask Off","Epic/Freebandz/A1",2,95,329,"294904"
96,"spotify:track:4cxMGhkinTocPSVVKWIw0d","Russ","Losin Control","Columbia",58,96,357,"292820"
97,"spotify:track:2cKovq3l6OJjhVVDbVKOsr","Hugh Jackman, Zac Efron","The Other Side","Atlantic Records",81,89,13,"290804"
98,"spotify:track:6gU9OKjOE7ghfEd55oRO57","SZA","The Weekend","Top Dawg Entertainment/RCA Records",75,97,190,"287813"
99,"spotify:track:2YzmfPLqUx5CJOaw5ThsBV","A$AP Ferg, Nicki Minaj","Plain Jane REMIX (feat. Nicki Minaj)","A$AP Worldwide/Polo Grounds Music/RCA Records",73,93,26,"287297"
100,"spotify:track:4iLqG9SeJSnt0cSPICSjxv","Charlie Puth","Attention","Artist Partner",16,99,265,"283332"
101,"spotify:track:1Qg9jWGDkKAGZXj5v2OG59","Maroon 5","Wait","Interscope Records*",38,98,69,"281241"
102,"spotify:track:25oOaleife6E2MIKmFkPvg","Young Thug, Future","Relationship (feat. Future)","Atlantic Records",53,102,210,"280566"
103,"spotify:track:5uCax9HTNlzGybIStD3vDh","James Arthur","Say You Won't Let Go","Columbia",14,106,375,"278691"
104,"spotify:track:2z4pcBLQXF2BXKFvd0BuB6","Jason Derulo, French Montana","Tip Toe (feat. French Montana)","Beluga Heights/Warner Records",74,101,55,"278050"
105,"spotify:track:0P6AWOA4LG1XOctzaVu5tt","SZA, Calvin Harris, Funk Wav","The Weekend - Funk Wav Remix","Top Dawg Entertainment/RCA Records",99,107,15,"277571"
106,"spotify:track:0OlnLZY4cmQzT6ZGttvWBM","Martin Garrix, David Guetta, Jamie Scott, Romy Dya","So Far Away (feat. Jamie Scott & Romy Dya)","Epic Amsterdam",75,108,38,"273285"
107,"spotify:track:0OWZFobGSIW9GrSlQ9C5pc","Thomas Rhett","Marry Me","The Valory Music Co.",95,100,28,"273227"
108,"spotify:track:7zVCrzzEJU7u24sbJPXA5W","Kane Brown, Lauren Alaina","What Ifs (feat. Lauren Alaina)","RCA Records Label Nashville",45,103,225,"272369"
109,"spotify:track:3YeJXuRSNS5FYwOsDu44kD","Trippie Redd, Travis Scott","Dark Knight Dummo (Feat. Travis Scott)","Elliot Grainge Entertainment, LLC",53,105,36,"272364"
110,"spotify:track:1WIZiOuNO3woKfdlSK2gNn","Kodak Black","Transportin'","Atlantic Records",30,110,145,"272063"
111,"spotify:track:6H0AwSQ20mo62jGlPGB8S6","2 Chainz, Ty Dolla $ign, Trey Songz, Jhené Aiko","It's A Vibe","2Chainz PS/Def Jam",35,111,278,"270789"
112,"spotify:track:0KKkJNfGyhkQ5aFogxQAPU","Bruno Mars","That's What I Like","Atlantic Records",3,114,375,"268186"
113,"spotify:track:3GVkPk8mqxz0itaAriG1L7","XXXTENTACION","Everybody Dies In Their Nightmares","Bad Vibes Forever / EMPIRE",15,119,140,"266690"
114,"spotify:track:1j4kHkkpqZRBwE0A4CN4Yv","ZAYN, Sia","Dusk Till Dawn (feat. Sia) - Radio Edit","RCA Records Label",15,117,125,"265372"
115,"spotify:track:2EEeOnHehOozLq4aS0n6SL","KYLE, Lil Yachty","iSpy (feat. Lil Yachty)","independently popular.",2,120,376,"265121"
116,"spotify:track:2m2ZGfJcs3lHWNPzhWH3XH","Ozuna, Cardi B","La Modelo","VP Records Corp/Dimelo Vi",113,113,18,"264186"
117,"spotify:track:6NFyWDv5CjfwuzoCkw47Xf","Taylor Swift","Delicate","Big Machine Records, LLC",77,115,39,"263450"
118,"spotify:track:15EPc80XuFrb2LmOzGjuRg","GoldLink, Brent Faiyaz, Shy Glizzy","Crew (feat. Brent Faiyaz & Shy Glizzy)","Squaaash Club/RCA Records",103,116,173,"261814"
119,"spotify:track:1wjzFQodRWrPcQ0AnYnvQ9","Lauv","I Like Me Better","Lauv",30,112,218,"261704"
120,"spotify:track:5CtI0qwDJkDQGwXD1H1cLb","Luis Fonsi, Daddy Yankee, Justin Bieber","Despacito - Remix","UMLE - Latino",1,121,270,"261498"
121,"spotify:track:0SGkqnVQo9KPytSri1H6cF","Big Sean","Bounce Back","Getting Out Our Dreams Inc. (G.O.O.D.) Music / IDJ",3,123,375,"260597"
122,"spotify:track:2rb5MvYT7ZIxbKW5hfcHx8","J Balvin, Willy William","Mi Gente","UMLE - Latino",7,118,196,"259532"
123,"spotify:track:4Km5HrUvYTaSUfiSGPJeQR","Migos, Lil Uzi Vert","Bad and Boujee (feat. Lil Uzi Vert)","Quality Control Music",1,124,375,"259153"
124,"spotify:track:7hDc8b7IXETo14hHIHdnhd","Drake","Passionfruit","Cash Money Records/Young Money Ent./Universal Rec.",1,126,298,"258237"
125,"spotify:track:3wGXyJGsCf1myH5MooQIqE","Tay-K","The Race","88 Classic",33,130,152,"257524"
126,"spotify:track:3DXncPQOG4VBw3QHh3S817","DJ Khaled, Justin Bieber, Quavo, Chance the Rapper, Lil Wayne","I'm the One (feat. Justin Bieber, Quavo, Chance the Rapper & Lil Wayne)","Epic/We The Best",2,127,258,"256859"
127,"spotify:track:4Q3N4Ct4zCuIHuZ65E3BD4","Kodak Black","Tunnel Vision","Atlantic Records",5,129,329,"255096"
128,"spotify:track:5troof8mcGO3AafoDbk1gc","Taylor Swift","Look What You Made Me Do","Big Machine Records, LLC",1,131,139,"253231"
129,"spotify:track:3Q3myFA7q4Op95DOpHplaY","blackbear","do re mi","Alamo",26,134,291,"251577"
130,"spotify:track:22nyEAEM29tcBRhukR089b","Jaden","Icon","MSFTS/Roc Nation",97,122,34,"250921"
131,"spotify:track:6EpRaXYhGOB3fj4V2uDkMJ","Liam Payne, Quavo","Strip That Down (feat. Quavo)","Capitol",11,128,236,"250813"
132,"spotify:track:6SwRhMLwNqEi6alNPVG00n","Kendrick Lamar, Rihanna","LOYALTY. FEAT. RIHANNA.","Aftermath",4,125,272,"250443"
133,"spotify:track:0AICBlLzFCTpUqmAbtzB2z","Trippie Redd","Love Scars","Strainge Entertainment",128,136,109,"245654"
134,"spotify:track:1LXbv9jiTtdBdHadZ317Gt","Lil Pump","Designer","Warner Records",41,135,9,"244904"
135,"spotify:track:62vpWI1CHwFy7tMIcSStl8","J. Cole","No Role Modelz","Roc Nation Records LLC",64,137,374,"243465"
136,"spotify:track:7J6bnDDitOwfelaJNixHhL","Huncho Jack, Travis Scott, Quavo","Modern Slavery","Quality Control Music - Epic",2,133,21,"242525"
137,"spotify:track:7oJrVhiTPZGBXWPwhxjy9S","Lil Skies","Lust","All We Got Ent.",137,-1,1,"241464"
138,"spotify:track:59J5nzL1KniFHnU120dQzt","Playboi Carti, Lil Uzi Vert","wokeuplikethis*","AWGE Label",52,139,271,"240658"
139,"spotify:track:5xNUR50KxswPRAvx7S163g","Hugh Jackman, Keala Settle, Daniel Everidge, Zendaya, The Greatest Showman Ensemble","Come Alive","Atlantic Records",105,132,10,"237942"
140,"spotify:track:2yLa0QULdQr0qAIvVwN6B5","Taylor Swift","...Ready For It?","Big Machine Records, LLC",1,141,129,"237768"
141,"spotify:track:628Ueb4sRiXApObhcU9iPU","Huncho Jack, Travis Scott, Quavo","Black & Chinese","Quality Control Music - Epic",5,140,21,"230485"
142,"spotify:track:3IkWmgGsXbsafrunwPojXO","Hugh Jackman, The Greatest Showman Ensemble","From Now On","Atlantic Records",116,138,10,"230420"
143,"spotify:track:5gx2E5aIXMRBellPZW1up5","Chris Brown, Yo Gotti, A Boogie Wit da Hoodie, Kodak Black","Pills & Automobiles (feat. Yo Gotti, A Boogie Wit Da Hoodie & Kodak Black)","RCA Records Label",70,143,105,"229748"
144,"spotify:track:5NT0aZqWImC9fTzkW4z48o","6ix9ine","KOODA","Scumgang Records",77,145,37,"228933"
145,"spotify:track:7KOlJ92bu51cltsD9KU5I7","Migos","T-Shirt","Quality Control Music",6,147,362,"228724"
146,"spotify:track:4PpuH4mxL0rD35mOWaLoKS","N.E.R.D, Rihanna, Pharrell Williams","Lemon","Columbia",45,168,60,"227722"
147,"spotify:track:6GNifiuBPrKFpwNBYnooFm","Lil Uzi Vert, Nicki Minaj, Oh Wonder","The Way Life Goes (feat. Nicki Minaj & Oh Wonder) - Remix","Generation Now/Atlantic",58,142,68,"226606"
148,"spotify:track:4vkVvmjIiQibQ6zJnC1Q9z","Matt Terry","Sucker for You","RCA Records Label",140,146,10,"225419"
149,"spotify:track:6eYxmK9fdL4hwLnXG2zY3s","XXXTENTACION","Look At Me!","Bad Vibes Forever / EMPIRE",25,153,316,"225079"
150,"spotify:track:30MM5jWpUmOxtTNd9Ey5LZ","Thomas Rhett","Unforgettable","The Valory Music Co.",35,144,158,"224113"
151,"spotify:track:7BKLCZ1jbUBVqRi2FVlTVw","The Chainsmokers, Halsey","Closer","Disruptor Records/Columbia",4,148,371,"223707"
152,"spotify:track:6RUKPb4LETWmmr3iAEQktW","The Chainsmokers, Coldplay","Something Just Like This","Disruptor Records/Columbia",2,151,316,"223297"
153,"spotify:track:4lESS6vuruP6a79KWRaQou","Maluma, Nego do Borel","Corazón (feat. Nego do Borel)","Sony Music Latin",105,109,23,"220867"
154,"spotify:track:0ESJlaM8CE1jRWaNtwSNj8","Travis Scott","beibs in the trap","Epic/Grand Hustle",95,155,364,"220029"
155,"spotify:track:38yBBH2jacvDxrznF7h08J","Niall Horan","Slow Hands","Capitol Records (US1A)",24,152,250,"217628"
156,"spotify:track:0uxSUdBrJy9Un0EYoBowng","Lil Uzi Vert","20 Min","Generation Now/Atlantic",86,154,23,"217595"
157,"spotify:track:0kdiUZDcLIFw0Buo9r0Q4z","LANCO","Greatest Love Story","Arista Nashville",133,149,79,"217285"
158,"spotify:track:4AtZRwSR8BOTTQg5ihSggt","6LACK","PRBLMS","LVRN Records",93,156,337,"217140"
159,"spotify:track:0jdny0dhgjUwoIp5GkqEaA","Kesha","Praying","Kemosabe Records/RCA Records",15,161,185,"215610"
160,"spotify:track:5yFSF6qQA1rcLsQRnBsZgb","Alan Walker, Noah Cyrus, Digital Farm Animals, Juliander","All Falls Down (feat. Juliander)","MER Recordings",138,150,24,"215360"
161,"spotify:track:343YBumqHu19cGoGARUTsd","Drake","Fake Love","Cash Money Records/Young Money Ent./Universal Rec.",2,163,371,"214385"
162,"spotify:track:5aAx2yezTd8zXrkmtKl66Z","The Weeknd, Daft Punk","Starboy","Universal Republic Records",3,159,374,"214283"
163,"spotify:track:3pXF1nA74528Edde4of9CC","Bryson Tiller","Don't","TrapSoul/RCA Records",77,166,361,"212989"
164,"spotify:track:2LBqCSwhJGcFQeTHMVGwy3","The Weeknd","Die For You","Universal Republic Records",75,158,132,"211993"
165,"spotify:track:79cuOz3SPQTuFrp8WgftAu","Shawn Mendes","There's Nothing Holdin' Me Back","Island Records",26,162,262,"211622"
166,"spotify:track:6RSNKGdv3nDTHqgw4bdzyF","Russell Dickerson","Yours","Sony Music Entertainment",154,160,22,"211526"
167,"spotify:track:5hTpBe8h35rJ67eAWHQsJx","Aminé","Caroline","Universal Records",6,171,372,"211458"
168,"spotify:track:1OAh8uOEOvTDqkKFsKksCi","DJ Khaled, Rihanna, Bryson Tiller","Wild Thoughts (feat. Rihanna & Bryson Tiller)","Epic/We The Best",1,175,208,"211044"
169,"spotify:track:6M0IsaUX4GNyto4niSegfI","Post Malone","No Option","Universal Records",104,167,113,"210190"
170,"spotify:track:1m69ELEgE6k5ZWsap40ozt","Ozuna","Se Preparó","VP Records Corp/Dimelo Vi",118,172,63,"210082"
171,"spotify:track:10M2Ex445zw585Ducldzkw","Brett Young","In Case You Didn't Know","Big Machine Label Group, LLC",94,164,271,"208835"
172,"spotify:track:7vu0JkJh0ldukEYbTVcqd0","Julia Michaels","Issues","J/Republic",11,169,347,"208332"
173,"spotify:track:4fC5jw1TI59GH1emfN1wtk","Trippie Redd, 6ix9ine","Poles 1469","Strainge Entertainment",173,176,9,"207552"
174,"spotify:track:0GVuLQtPXFaL18ijEOqoAa","Michelle Williams","Tightrope","Atlantic Records",139,157,10,"206495"
175,"spotify:track:05nbZ1xxVNwUTcGwLbp7CN","NAV","Myself","XO Records",89,174,250,"206392"
176,"spotify:track:3muBQDekYAg7jm6hDu6R0Z","Tee Grizzley","First Day Out","300 Entertainment",67,180,330,"205932"
177,"spotify:track:0B8QzDH7YWih85V5SEMnyJ","Lil Uzi Vert","Money Longer","Generation Now/Atlantic",61,183,361,"204596"
178,"spotify:track:5jZF1nvKORdaHNjNNMRbFl","Walker Hayes","You Broke Up with Me","Monument Records",152,165,11,"204201"
179,"spotify:track:43PuMrRfbyyuz4QpZ3oAwN","Bryson Tiller","Exchange","TrapSoul/RCA Records",79,177,341,"203652"
180,"spotify:track:7yyRTcZmCiyzzJlNzGC9Ol","Shelley FKA DRAM, Lil Yachty","Broccoli","EMPIRE / Atlantic Recording Corporation",6,187,370,"201715"
181,"spotify:track:6fwdbPMwP1zVStm8FybmkO","21 Savage, Metro Boomin, Future","X (feat. Future)","Slaughter Gang, LLC",14,186,365,"201345"
182,"spotify:track:0CokSRCu5hZgPxcZBaEzVE","Macklemore, Skylar Grey","Glorious (feat. Skylar Grey)","Bendo LLC",19,178,165,"201046"
183,"spotify:track:7EI6Iki24tBHAMxtb4xQN2","Rita Ora","Anywhere","Atlantic Records UK",119,170,30,"200965"
184,"spotify:track:1xznGGDReH1oQq0xzbwXa3","Drake, WizKid, Kyla","One Dance","Cash Money Records/Young Money Ent./Universal Rec.",7,188,344,"200732"
185,"spotify:track:7krbSH3rd8lhIZvuzTV3Bl","James Arthur","Naked","Columbia Local",124,197,11,"200147"
186,"spotify:track:2d48mamATjby7wgPjdrSOQ","Thomas Rhett, Maren Morris","Craving You","The Valory Music Co.",56,173,193,"199496"
187,"spotify:track:0I20rLT2MJDhcF96AjbNYo","Zedd, Alessia Cara","Stay","UMGRI Interscope",9,184,301,"199198"
188,"spotify:track:1mMLMZYXkMueg65jRRWG1l","Luke Combs","When It Rains It Pours","River House Artists/Columbia Nashville",110,182,127,"198871"
189,"spotify:track:248OFOZef6ShXv6DGgbnxU","Khalid","Saved","Right Hand Music Group, LLC/RCA Records",107,185,278,"198240"
190,"spotify:track:0w3Q14i073jLoew1hgJkwD","Jon Pardi","Heartache On The Dance Floor","Capitol Records Nashville",109,181,160,"197891"
191,"spotify:track:2bjwRfXMk4uRgOD9IBYl9h","Drake, Quavo, Travis Scott","Portland","Cash Money Records/Young Money Ent./Universal Rec.",2,193,280,"197404"
192,"spotify:track:2NyrXRn4tancYPW6JwtTl2","Tee Grizzley, Lil Yachty","From The D To The A (feat. Lil Yachty)","300 Entertainment",93,194,266,"196396"
193,"spotify:track:6Za3190Sbw39BBC77WSS1C","Natti Natasha, Ozuna","Criminal","Pina Records",172,189,11,"196299"
194,"spotify:track:3NdDpSvN911VPGivFlV5d0","ZAYN, Taylor Swift","I Don’t Wanna Live Forever (Fifty Shades Darker)","Big Machine Records, LLC",3,191,356,"196151"
195,"spotify:track:4vwfOiyWxXeEdx4ejAJgdx","Huncho Jack, Travis Scott, Quavo, Takeoff","Eye 2 Eye","Quality Control Music - Epic",4,190,20,"193726"
196,"spotify:track:7JNh1cfm0eXjqFVOzKLyau","Becky G, Bad Bunny","Mayores","Kemosabe Records/RCA Records/Sony Music Latin",140,192,24,"190969"
197,"spotify:track:2Nc8Imt04W3ZmcBF8dPQKc","Devin Dawson","All On Me","Atlantic/Warner Music Nashville",174,179,4,"190880"
198,"spotify:track:6yr8GiTHWvFfi4o6Q5ebdT","Eminem, Nate Dogg","'Till I Collapse","Aftermath",112,-1,208,"190331"
199,"spotify:track:1HXy5I3HTWq8OvxCn0z7G7","Kane Brown","Heaven","RCA Records Label Nashville",190,195,4,"190175"
200,"spotify:track:7i2DJ88J7jQ8K7zqFX2fW8","Halsey","Now Or Never","Astralwerks (ASW)",12,200,254,"189389"
