rank,uri,artist_names,track_name,source,peak_rank,previous_rank,days_on_chart,streams
1,"spotify:track:2XW4DbS6NddZxRPm5rMCeY","Drake","God's Plan","Cash Money/Drake LP6",1,1,8,"4084255"
2,"spotify:track:0wbnC9AUenxp613TYaJsGK","Migos","Narcos","Quality Control Music, LLC",2,2,2,"1298222"
3,"spotify:track:2tek8UnoiJdkmpPMqa5KRQ","Migos","Stir Fry","Quality Control Music, LLC",3,4,37,"1283523"
4,"spotify:track:7wGoVu4Dady5GV0Sv4UIsx","Post Malone, 21 Savage","rockstar (feat. 21 Savage)","Republic Records",1,7,135,"1229056"
5,"spotify:track:1jr1BnpXymcf2i97mTR8tJ","Migos, Drake","Walk It Talk It","Quality Control Music, LLC",3,3,2,"1208822"
6,"spotify:track:3g9Mi3kTzzmjBUXN7wnGjI","Migos, Nicki Minaj, Cardi B","MotorSport","Quality Control Music, LLC",6,10,93,"1023374"
7,"spotify:track:4BHzHISX21PYwGXiBEUQ70","Migos, 21 Savage","BBO (Bad Bitches Only)","Quality Control Music, LLC",5,5,2,"985942"
8,"spotify:track:3Vo4wInECJQuz9BIBMOu8i","Bruno Mars, Cardi B","Finesse - Remix; feat. Cardi B","Atlantic Records",2,13,24,"950532"
9,"spotify:track:7sO5G9EABYOXQKNPNiE9NR","Offset, Metro Boomin","Ric Flair Drip (with Metro Boomin)","Slaughter Gang, LLC/Epic/Quality Control Music/Motown/Capitol/Boominati Worldwide/Republic",4,15,89,"942115"
10,"spotify:track:2DQ1ITjI0YoLFzuADN1ZBW","G-Eazy, A$AP Rocky, Cardi B","No Limit","BPG/RVG/RCA Records",2,18,142,"892973"
11,"spotify:track:1rfofaqEpACxVEHIZBJe6W","Camila Cabello, Young Thug","Havana (feat. Young Thug)","Syco Music/Epic",2,20,176,"886761"
12,"spotify:track:75FDPwaULRdYDn4StFN2rT","Cardi B, 21 Savage","Bartier Cardi (feat. 21 Savage)","Atlantic/KSR",3,22,37,"873292"
13,"spotify:track:75ZvA4QfFiZvzhj2xkaWAh","Post Malone","I Fall Apart","Universal Records",2,16,134,"864514"
14,"spotify:track:3tvkzvUTF0yoq3pdBi81I0","Drake","Diplomatic Immunity","Republic Records",2,11,8,"796920"
15,"spotify:track:12SJpYZEdj4kzWZ8FPFg4Y","Kendrick Lamar, SZA","All The Stars (with SZA)","Black Panther (TDE/DMG) PS",6,24,24,"769966"
16,"spotify:track:07W9fL0ee9LsqD9c3kNrdo","Migos, Post Malone","Notice Me","Quality Control Music, LLC",16,17,2,"763370"
17,"spotify:track:3ncgNpxLoBQ65ABk4djDyd","Famous Dex, A$AP Rocky","PICK IT UP (feat. A$AP Rocky)","300 Entertainment",13,26,93,"732155"
18,"spotify:track:0egwbpNUagfbqFuqaPd6jt","Migos","Supastars","Quality Control Music, LLC",6,6,5,"729671"
19,"spotify:track:5k38wzpLb15YgncyWdTZE4","G-Eazy, Halsey","Him & I (with Halsey)","BPG/RVG/RCA Records",3,28,58,"720440"
20,"spotify:track:2KokOIKdw4zZutDil85Ugh","Migos, Travis Scott, Ty Dolla $ign, Big Sean","White Sand","Quality Control Music, LLC",9,9,2,"710321"
21,"spotify:track:4eWQlBRaTjPPUlzacqEeoQ","Camila Cabello","Never Be the Same","Syco Music/Epic",5,27,51,"708495"
22,"spotify:track:0KJEIWTEKMfBL2J7Sn3X5I","Migos","Gang Gang","Quality Control Music, LLC",21,21,2,"696474"
23,"spotify:track:6tHWl8ows5JOZq9Yfaqn3M","Bazzi","Mine","iamcosmic",20,31,13,"692380"
24,"spotify:track:6mrKP2jyIQmM0rw6fQryjr","NF","Let You Down","NF Real Music",9,30,119,"691039"
25,"spotify:track:6PGoSes0D9eUDeeAafB2As","Kendrick Lamar, Zacari","LOVE. FEAT. ZACARI.","Aftermath",5,32,289,"681380"
26,"spotify:track:4DTpngLjoHj5gFxEZFeD3J","Kodak Black, Lil Wayne","Codeine Dreaming (feat. Lil Wayne)","Atlantic Records",10,29,65,"675342"
27,"spotify:track:7GX5flRQZVHRAGd6B4TmDO","Lil Uzi Vert","XO Tour Llif3","Generation Now/Atlantic",1,38,310,"666446"
28,"spotify:track:4dVpf9jZjcORqGTLUaeYj9","A$AP Ferg","Plain Jane","RCA Records Label",6,41,155,"649638"
29,"spotify:track:42CeaId2XNlxugDvyqHfDf","Post Malone","Candy Paint","Republic Records",4,35,247,"641593"
30,"spotify:track:09ts3GnICqYEU5PkQCpJK3","Justin Timberlake, Chris Stapleton","Say Something (feat. Chris Stapleton)","RCA Records Label",23,23,3,"639293"
31,"spotify:track:5WoaF1B5XIEnWfmb5NZikf","Miguel, Travis Scott","Sky Walker (feat. Travis Scott)","ByStorm Entertainment/RCA Records",19,37,156,"631697"
32,"spotify:track:09IStsImFySgyp0pIQdqAc","Zedd, Maren Morris, Grey","The Middle","UMGRI Interscope",32,36,3,"628880"
33,"spotify:track:0G9rmRmQDFk9O2tzZLyRkc","Migos","Emoji A Chain","Quality Control Music, LLC",14,14,2,"622137"
34,"spotify:track:2fQrGHiQOvpL9UgPvtYy6G","21 Savage","Bank Account","Slaughter Gang, LLC/Epic Records",1,46,205,"608894"
35,"spotify:track:7iDa6hUg2VgEL1o1HjmfBn","Bebe Rexha, Florida Georgia Line","Meant to Be (feat. Florida Georgia Line)","Warner Records",17,34,141,"601885"
36,"spotify:track:7KXjTSCq5nL1LoYtL7XAwS","Kendrick Lamar","HUMBLE.","Aftermath",1,49,303,"595822"
37,"spotify:track:5AEtlRudpgdT5FtNiuly6Y","Hailee Steinfeld, Alesso, Florida Georgia Line, WATT","Let Me Go (with Alesso, Florida Georgia Line & watt)","Universal Records",17,40,142,"588863"
38,"spotify:track:3a1lNhkSLSkpJE4MSHpDu9","Post Malone, Quavo","Congratulations","Universal Records",5,47,392,"588661"
39,"spotify:track:76cy1WJvNGJTj78UqeA5zr","Dua Lipa","IDGAF","Warner Records",21,44,32,"584184"
40,"spotify:track:4Kw3CztmD15X1QGDnnHmLD","Migos","Auto Pilot","Quality Control Music, LLC",12,12,2,"581675"
41,"spotify:track:5Z3GHaZ6ec9bsiI5BenrbY","Khalid","Young Dumb & Broke","Right Hand Music Group, LLC/RCA Records",5,53,298,"580875"
42,"spotify:track:43ZyHQITOjhciSUUNPVRHc","Lil Pump","Gucci Gang","Warner Records",2,56,147,"574412"
43,"spotify:track:3kh6liHZ8IHHRFMHXNJ79Y","Migos","Higher We Go - Intro","Quality Control Music, LLC",8,8,2,"571120"
44,"spotify:track:6NWl2m8asvH83xjuXVNsuG","Lil Xan","Betrayed","Columbia",22,52,104,"570121"
45,"spotify:track:630sXRhIcfwr2e4RdNtjKN","Zac Efron, Zendaya","Rewrite The Stars","Atlantic Records",16,43,32,"568796"
46,"spotify:track:35ffVv9x4mtzBh5rF1K9sP","Migos, Gucci Mane","CC","Quality Control Music, LLC",19,19,2,"555293"
47,"spotify:track:7jqDzXJS0K0Re8uphYNit0","The Chainsmokers","Sick Boy","Disruptor Records/Columbia",10,48,10,"538747"
48,"spotify:track:5UEnHoDYpsxlfzWLZIc7LD","Eminem, Ed Sheeran","River (feat. Ed Sheeran)","Aftermath",2,51,44,"533941"
49,"spotify:track:0tgVpDi06FyKpA1z0VMD4v","Ed Sheeran","Perfect","Atlantic Records UK",11,55,248,"518783"
50,"spotify:track:2rIY8S6doGY1SEZIh7siw1","Migos","Too Much Jewelry","Quality Control Music, LLC",25,25,2,"508843"
51,"spotify:track:1XRgIKC5TPwo7nWGyKqgG0","Gucci Mane, Migos","I Get the Bag (feat. Migos)","Guwop Enterprises/Atlantic",7,57,163,"507004"
52,"spotify:track:2771LMNxwf62FTAdpJMQfM","Cardi B","Bodak Yellow","Atlantic/KSR",2,64,191,"503879"
53,"spotify:track:2ekn2ttSfGqwhhate0LSR0","Dua Lipa","New Rules","Warner Records",11,61,201,"482615"
54,"spotify:track:152lZdxL1OR0ZMW6KquMif","Khalid","Location","Right Hand Music Group, LLC/RCA Records",9,63,391,"475010"
55,"spotify:track:7EmGUiUaOSGDnUUQUDrOXC","Selena Gomez, Marshmello","Wolves","Selena Gomez PS",3,59,95,"468042"
56,"spotify:track:40oKW22ZNNkEdZLJTScaQI","Kodak Black, XXXTENTACION","Roll in Peace (feat. XXXTENTACION)","Atlantic Records",22,62,163,"466883"
57,"spotify:track:2u7mxWSeoqTXndK5e08jMp","Lil Skies, Landon Cube","Nowadays (feat. Landon Cube)","All We Got Ent.",34,58,29,"466815"
58,"spotify:track:5tz69p7tJuGPeMGwNTxYuV","Logic, Alessia Cara, Khalid","1-800-273-8255","Def Jam Recordings",1,65,275,"463219"
59,"spotify:track:790MhTXPFrYkrqCKvpg4t1","NAV, Lil Uzi Vert","Wanted You (feat. Lil Uzi Vert)","XO Records",23,72,79,"452268"
60,"spotify:track:51rXHuKN8Loc4sUlKPODgH","Jay Rock, Kendrick Lamar, Future, James Blake","King's Dead (with Kendrick Lamar, Future & James Blake)","Black Panther (TDE/DMG) PS",32,66,16,"450753"
61,"spotify:track:1mXVgsBdtIVeCLJnSnmtdV","Sam Smith","Too Good At Goodbyes","Capitol",2,60,142,"447975"
62,"spotify:track:6gBFPUFcJLzWGx4lenP6h2","Travis Scott","goosebumps","Epic/Grand Hustle",16,70,392,"445706"
63,"spotify:track:0tKcYR2II1VCQWT79i5NrW","Imagine Dragons","Thunder","Kid Ina Korner / Interscope",16,75,275,"445209"
64,"spotify:track:2xGjteMU3E1tkEPVFBO08U","Keala Settle, The Greatest Showman Ensemble","This Is Me","Atlantic Records",37,68,32,"440567"
65,"spotify:track:3BvXHtUdGbfLOVxfRWn6NT","Migos, 2 Chainz","Too Playa","Quality Control Music, LLC",39,39,2,"437814"
66,"spotify:track:0pdW4B6Sq4MMNz1sFtkR5G","Migos","Crown the Kings","Quality Control Music, LLC",33,33,2,"435177"
67,"spotify:track:5Htb1uFQ1KrkFXlefS8oGj","Demi Lovato","Tell Me You Love Me","Island Records",35,71,58,"430195"
68,"spotify:track:4Fj5G5b8MeCrCRDP5JDvpr","Migos","Beast","Quality Control Music, LLC",42,42,2,"416449"
69,"spotify:track:3B54sVLJ402zGa6Xm4YGNe","French Montana, Swae Lee","Unforgettable","Bad Boy Entertainment/Epic Records",1,78,296,"405203"
70,"spotify:track:7vGuf3Y35N4wmASOKLUVVU","Marshmello, Khalid","Silence","Joytime Collective/RCA Records",7,74,170,"404423"
71,"spotify:track:1yxgsra98r3qAtxqiGZPiX","Travis Scott","BUTTERFLY EFFECT","Cactus Jack / Epic / Grand Hustle",9,77,253,"398238"
72,"spotify:track:2LOkdHHNKdEx24cQELBaD8","Migos","Open It Up","Quality Control Music, LLC",50,50,2,"397028"
73,"spotify:track:2eAZfqOm4EnOF9VvN50Tyc","Lil Uzi Vert, Oh Wonder","The Way Life Goes (feat. Oh Wonder)","Generation Now/Atlantic",4,81,156,"391038"
74,"spotify:track:1Qg9jWGDkKAGZXj5v2OG59","Maroon 5","Wait","Interscope Records*",38,76,85,"388152"
75,"spotify:track:0zl3PdjIl320fK0pxBGWNR","6ix9ine, Fetty Wap, A Boogie Wit da Hoodie","KEKE","Scumgang Records",32,80,13,"386054"
76,"spotify:track:2nwp9gU9ZGyKRzMswpfc7k","Migos","Flooded","Quality Control Music, LLC",45,45,2,"384464"
77,"spotify:track:7m9OqQk4RVRkw9JJdeAw96","XXXTENTACION","Jocelyn Flores","Bad Vibes Forever / EMPIRE",3,79,156,"383077"
78,"spotify:track:2x0WlnmfG39ZuDmstl9xfX","Taylor Swift, Ed Sheeran, Future","End Game","Big Machine Records, LLC",21,87,58,"380157"
79,"spotify:track:3m660poUr1chesgkkjQM7P","Demi Lovato","Sorry Not Sorry","Island Records",6,84,201,"378238"
80,"spotify:track:6p8NuHm8uCGnn2Dtbtf7zE","Migos, Gucci Mane","Slippery (feat. Gucci Mane)","Quality Control Music",17,82,366,"377218"
81,"spotify:track:7y9iMe8SOB6z3NoHE2OfXl","Halsey","Bad At Love","Astralwerks (ASW)",22,86,167,"373642"
82,"spotify:track:7AQim7LbvFVZJE3O8TYgf2","XXXTENTACION, Trippie Redd","Fuck Love (feat. Trippie Redd)","Bad Vibes Forever / EMPIRE",7,85,156,"365936"
83,"spotify:track:3hBBKuWJfxlIlnd9QFoC8k","Maroon 5, SZA","What Lovers Do (feat. SZA)","Interscope Records*",7,90,151,"351272"
84,"spotify:track:4jB8tS25Afh6aXC5w2MbXQ","Migos","Movin' Too Fast","Quality Control Music, LLC",54,54,2,"350444"
85,"spotify:track:1f5cbQtDrykjarZVrShaDI","A Boogie Wit da Hoodie, Kodak Black","Drowning (feat. Kodak Black)","Highbridge The Label",18,91,317,"350002"
86,"spotify:track:0taOCiup4HNG9LmbduVlJj","YBN Nahmir","Rubbin off the Paint","2018",47,93,97,"347628"
87,"spotify:track:6HZILIRieu8S0iqY8kIKhj","Kendrick Lamar","DNA.","Aftermath",2,89,289,"346597"
88,"spotify:track:3ZhTT6yjZwpPph5MIJ53XY","Lil Skies, Landon Cube","Red Roses (feat. Landon Cube)","All We Got Ent.",56,88,26,"342698"
89,"spotify:track:7qiZfU4dY1lWllzX7mPBI3","Ed Sheeran","Shape of You","Atlantic Records UK",1,94,387,"342266"
90,"spotify:track:4pYZLpX23Vx8rwDpJCpPTA","Rich The Kid, Kendrick Lamar","New Freezer (feat. Kendrick Lamar)","Rich The Kid / (TDE/ISR PS)",59,95,123,"335664"
91,"spotify:track:0as7lPxkBPctZ7uVmchRNM","Cashmere Cat, Major Lazer, Tory Lanez","Miss You (with Major Lazer & Tory Lanez)","Benny Blanco Major",85,96,8,"334668"
92,"spotify:track:3XAWpSxJMPeIwxXc5g9en1","Migos","Made Men","Quality Control Music, LLC",69,69,2,"331890"
93,"spotify:track:0CcQNd8CINkwQfe1RDtGV6","Imagine Dragons","Believer","Kid Ina Korner / Interscope",9,100,360,"323599"
94,"spotify:track:4knL4iPxPOZjQzTUlELGSY","Yo Gotti, Nicki Minaj","Rake It Up (feat. Nicki Minaj)","Epic/CMG",17,105,221,"321286"
95,"spotify:track:2xmrfQpmS2iJExTlklLoAL","Clean Bandit, Julia Michaels","I Miss You (feat. Julia Michaels)","Atlantic Records UK",50,92,92,"318387"
96,"spotify:track:5UzUZULhZL8bW4BqI1ZNOF","Migos","Work Hard","Quality Control Music, LLC",67,67,2,"317052"
97,"spotify:track:5yuShbu70mtHXY0yLzCQLQ","Post Malone","Go Flex","Universal Records",19,97,392,"311636"
98,"spotify:track:2vjmyyAnDUzilFYxOlTdO1","6ix9ine","GUMMO","Strainge Entertainment",50,103,79,"308238"
99,"spotify:track:3wdfLVUhmX64lIyWIIEW8s","Quality Control, Quavo, Lil Yachty","Ice Tray","Quality Control Music, LLC",67,98,47,"305718"
100,"spotify:track:2ZxTjs4EdJl4Y9YByIiNoo","Jason Aldean","You Make It Easy","Broken Bow Records",100,131,2,"300824"
101,"spotify:track:6QgjcU0zLnzq5OrUoSZ3OK","Portugal. The Man","Feel It Still","Atlantic Records",13,104,226,"300363"
102,"spotify:track:2Tq2R8sRftNEqdgJK5HadO","Troye Sivan","My My My!","EMI Recorded Music Australia Pty Ltd",13,99,17,"299760"
103,"spotify:track:43ay9lQZ5rfNcOOHhRF2cM","Hugh Jackman, Keala Settle, Zac Efron, Zendaya, The Greatest Showman Ensemble","The Greatest Show","Atlantic Records",63,102,32,"298409"
104,"spotify:track:3kxfsdsCpFgN412fpnW85Y","Childish Gambino","Redbone","Glassnote Entertainment Group LLC",8,106,392,"297712"
105,"spotify:track:1zsG4eaZmkA1dvjDDsAGLK","Luis Fonsi, Demi Lovato","Échame La Culpa","UMLE - Latino",47,108,71,"294787"
106,"spotify:track:0VgkVdmE4gld66l8iyGjgx","Future","Mask Off","Epic/Freebandz/A1",2,117,345,"293996"
107,"spotify:track:3Jo2cNQKU6Je7LVClYyJH9","Migos","Top Down On Da NAWF","Quality Control Music, LLC",73,73,2,"287926"
108,"spotify:track:7hDc8b7IXETo14hHIHdnhd","Drake","Passionfruit","Cash Money Records/Young Money Ent./Universal Rec.",1,110,314,"282578"
109,"spotify:track:0q75NwOoFiARAVp4EXU4Bs","SZA, Travis Scott","Love Galore (feat. Travis Scott)","Top Dawg Entertainment/RCA Records",23,109,269,"282228"
110,"spotify:track:1e1JKLEDKP7hEQzJfNAgPl","Playboi Carti","Magnolia","AWGE Label",10,119,282,"280217"
111,"spotify:track:1LXbv9jiTtdBdHadZ317Gt","Lil Pump","Designer","Warner Records",41,130,25,"278012"
112,"spotify:track:4Km5HrUvYTaSUfiSGPJeQR","Migos, Lil Uzi Vert","Bad and Boujee (feat. Lil Uzi Vert)","Quality Control Music",1,115,391,"277746"
113,"spotify:track:5HwnezK198pJCEj1l2Adjy","Camila Cabello","She Loves Control","Syco Music/Epic",77,121,16,"277371"
114,"spotify:track:6eT7xZZlB2mwyzJ2sUKG6w","Post Malone","White Iverson","Universal Records",56,120,392,"275094"
115,"spotify:track:4iLqG9SeJSnt0cSPICSjxv","Charlie Puth","Attention","Artist Partner",16,132,281,"271082"
116,"spotify:track:5hcisvFMidkMJlElTO9Qmw","Bad Bunny, Prince Royce, J Balvin, Mambo Kingz, DJ Luian","Sensualidad","Hear This Music",85,123,66,"270953"
117,"spotify:track:0KKkJNfGyhkQ5aFogxQAPU","Bruno Mars","That's What I Like","Atlantic Records",3,144,391,"269695"
118,"spotify:track:0RoA7ObU6phWpqhlC9zH4Z","Ziv Zaifman, Hugh Jackman, Michelle Williams","A Million Dreams","Atlantic Records",71,114,30,"268449"
119,"spotify:track:5u6vkDnOyaf8LsteDAj2ub","21 Savage, Offset, Metro Boomin, Travis Scott","Ghostface Killers (feat. Travis Scott)","Slaughter Gang, LLC/Epic/Quality Control Music/Motown/Capitol/Boominati Worldwide/Republic",2,107,89,"267118"
120,"spotify:track:2EEeOnHehOozLq4aS0n6SL","KYLE, Lil Yachty","iSpy (feat. Lil Yachty)","independently popular.",2,127,392,"266307"
121,"spotify:track:1bhUWB0zJMIKr9yVPrkEuI","Ed Sheeran, Beyoncé","Perfect Duet (Ed Sheeran & Beyoncé)","Atlantic Records UK",3,113,58,"265559"
122,"spotify:track:32DGGj6KlNuBr6WaqRxpxi","Charlie Puth","How Long","Artist Partner",36,122,112,"263050"
123,"spotify:track:6H0AwSQ20mo62jGlPGB8S6","2 Chainz, Ty Dolla $ign, Trey Songz, Jhené Aiko","It's A Vibe","2Chainz PS/Def Jam",35,126,294,"262655"
124,"spotify:track:0Gl5s8IhMmQE5YQwM8Qx1J","Loren Allred","Never Enough","Atlantic Records",72,116,31,"260836"
125,"spotify:track:0P6AWOA4LG1XOctzaVu5tt","SZA, Calvin Harris, Funk Wav","The Weekend - Funk Wav Remix","Top Dawg Entertainment/RCA Records",88,125,31,"259967"
126,"spotify:track:25oOaleife6E2MIKmFkPvg","Young Thug, Future","Relationship (feat. Future)","Atlantic Records",53,124,226,"259867"
127,"spotify:track:7zVCrzzEJU7u24sbJPXA5W","Kane Brown, Lauren Alaina","What Ifs (feat. Lauren Alaina)","RCA Records Label Nashville",45,129,241,"258854"
128,"spotify:track:0SGkqnVQo9KPytSri1H6cF","Big Sean","Bounce Back","Getting Out Our Dreams Inc. (G.O.O.D.) Music / IDJ",3,138,391,"257308"
129,"spotify:track:4cxMGhkinTocPSVVKWIw0d","Russ","Losin Control","Columbia",58,118,373,"256714"
130,"spotify:track:6EpRaXYhGOB3fj4V2uDkMJ","Liam Payne, Quavo","Strip That Down (feat. Quavo)","Capitol",11,136,252,"256564"
131,"spotify:track:0AcHbiMs86CCgprvc7E1gs","Carnage, Lil Pump","i Shyne","Heavyweight Records",62,111,9,"255991"
132,"spotify:track:2z4pcBLQXF2BXKFvd0BuB6","Jason Derulo, French Montana","Tip Toe (feat. French Montana)","Beluga Heights/Warner Records",74,140,71,"254807"
133,"spotify:track:0Rp0bpWLnQMHXJ6m5y3tps","Migos","Culture National Anthem - Outro","Quality Control Music, LLC",83,83,2,"254713"
134,"spotify:track:7mldq42yDuxiUNn08nvzHO","Sam Hunt","Body Like A Back Road","MCA Nashville",12,135,360,"254321"
135,"spotify:track:2cKovq3l6OJjhVVDbVKOsr","Hugh Jackman, Zac Efron","The Other Side","Atlantic Records",81,128,29,"252239"
136,"spotify:track:0OWZFobGSIW9GrSlQ9C5pc","Thomas Rhett","Marry Me","The Valory Music Co.",83,101,44,"252164"
137,"spotify:track:5CtI0qwDJkDQGwXD1H1cLb","Luis Fonsi, Daddy Yankee, Justin Bieber","Despacito - Remix","UMLE - Latino",1,158,286,"251959"
138,"spotify:track:6gU9OKjOE7ghfEd55oRO57","SZA","The Weekend","Top Dawg Entertainment/RCA Records",75,147,206,"248145"
139,"spotify:track:3YeJXuRSNS5FYwOsDu44kD","Trippie Redd, Travis Scott","Dark Knight Dummo (Feat. Travis Scott)","Elliot Grainge Entertainment, LLC",53,133,52,"247548"
140,"spotify:track:3towKHKVOXCCcL1fHv6xFO","Hailee Steinfeld, BloodPop®","Capital Letters","Republic/Universal/FSF",92,139,8,"246814"
141,"spotify:track:1uL78kFWxhz3umTMWJu8n5","Lil Uzi Vert","Sauce It Up","Generation Now/Atlantic",6,150,156,"246264"
142,"spotify:track:4Q3N4Ct4zCuIHuZ65E3BD4","Kodak Black","Tunnel Vision","Atlantic Records",5,143,345,"246049"
143,"spotify:track:343YBumqHu19cGoGARUTsd","Drake","Fake Love","Cash Money Records/Young Money Ent./Universal Rec.",2,145,387,"243368"
144,"spotify:track:1WIZiOuNO3woKfdlSK2gNn","Kodak Black","Transportin'","Atlantic Records",30,142,161,"243187"
145,"spotify:track:7foypmc7KZyU716Yv63BPe","Huncho Jack, Travis Scott, Quavo","Saint","Quality Control Music - Epic",15,112,37,"242733"
146,"spotify:track:3DXncPQOG4VBw3QHh3S817","DJ Khaled, Justin Bieber, Quavo, Chance the Rapper, Lil Wayne","I'm the One (feat. Justin Bieber, Quavo, Chance the Rapper & Lil Wayne)","Epic/We The Best",2,160,274,"241810"
147,"spotify:track:5uCax9HTNlzGybIStD3vDh","James Arthur","Say You Won't Let Go","Columbia",14,137,391,"240914"
148,"spotify:track:3Q3myFA7q4Op95DOpHplaY","blackbear","do re mi","Alamo",26,152,307,"238003"
149,"spotify:track:1L3NV7VrCiuE8C5QlhdeQL","Justin Timberlake","Filthy","RCA Records Label",7,134,23,"237568"
150,"spotify:track:62vpWI1CHwFy7tMIcSStl8","J. Cole","No Role Modelz","Roc Nation Records LLC",64,154,390,"235113"
151,"spotify:track:7KOlJ92bu51cltsD9KU5I7","Migos","T-Shirt","Quality Control Music",6,141,378,"233586"
152,"spotify:track:1xznGGDReH1oQq0xzbwXa3","Drake, WizKid, Kyla","One Dance","Cash Money Records/Young Money Ent./Universal Rec.",7,155,357,"233529"
153,"spotify:track:3GVkPk8mqxz0itaAriG1L7","XXXTENTACION","Everybody Dies In Their Nightmares","Bad Vibes Forever / EMPIRE",15,148,156,"231867"
154,"spotify:track:2rb5MvYT7ZIxbKW5hfcHx8","J Balvin, Willy William","Mi Gente","UMLE - Latino",7,167,212,"231631"
155,"spotify:track:15EPc80XuFrb2LmOzGjuRg","GoldLink, Brent Faiyaz, Shy Glizzy","Crew (feat. Brent Faiyaz & Shy Glizzy)","Squaaash Club/RCA Records",103,156,189,"229837"
156,"spotify:track:30MM5jWpUmOxtTNd9Ey5LZ","Thomas Rhett","Unforgettable","The Valory Music Co.",35,164,174,"228526"
157,"spotify:track:1wjzFQodRWrPcQ0AnYnvQ9","Lauv","I Like Me Better","Lauv",30,149,234,"227863"
158,"spotify:track:6VrCmhRBFnuGKmtNfk4jDs","Marshmello, Lil Peep","Spotlight","Joytime Collective / Lil Peep",55,146,16,"227452"
159,"spotify:track:3wGXyJGsCf1myH5MooQIqE","Tay-K","The Race","88 Classic",33,161,168,"227342"
160,"spotify:track:6SwRhMLwNqEi6alNPVG00n","Kendrick Lamar, Rihanna","LOYALTY. FEAT. RIHANNA.","Aftermath",4,162,288,"222614"
161,"spotify:track:5CLGzJsGqhCEECcpnFQA8x","Rudimental, Jess Glynne, Macklemore, Dan Caplen","These Days (feat. Jess Glynne, Macklemore & Dan Caplen)","Atlantic Records UK",161,163,4,"222331"
162,"spotify:track:2yQZwi1P8AkkxxFhQ8rMEK","LANCO","Greatest Love Story","Arista Nashville",133,165,93,"220044"
163,"spotify:track:0AICBlLzFCTpUqmAbtzB2z","Trippie Redd","Love Scars","Strainge Entertainment",128,159,125,"219443"
164,"spotify:track:5gx2E5aIXMRBellPZW1up5","Chris Brown, Yo Gotti, A Boogie Wit da Hoodie, Kodak Black","Pills & Automobiles (feat. Yo Gotti, A Boogie Wit Da Hoodie & Kodak Black)","RCA Records Label",70,182,121,"216732"
165,"spotify:track:7BKLCZ1jbUBVqRi2FVlTVw","The Chainsmokers, Halsey","Closer","Disruptor Records/Columbia",4,175,387,"216080"
166,"spotify:track:7vu0JkJh0ldukEYbTVcqd0","Julia Michaels","Issues","J/Republic",11,172,363,"212836"
167,"spotify:track:2bjwRfXMk4uRgOD9IBYl9h","Drake, Quavo, Travis Scott","Portland","Cash Money Records/Young Money Ent./Universal Rec.",2,169,291,"212045"
168,"spotify:track:1j4kHkkpqZRBwE0A4CN4Yv","ZAYN, Sia","Dusk Till Dawn (feat. Sia) - Radio Edit","RCA Records Label",15,166,141,"211701"
169,"spotify:track:6RUKPb4LETWmmr3iAEQktW","The Chainsmokers, Coldplay","Something Just Like This","Disruptor Records/Columbia",2,189,332,"211634"
170,"spotify:track:5troof8mcGO3AafoDbk1gc","Taylor Swift","Look What You Made Me Do","Big Machine Records, LLC",1,183,155,"210956"
171,"spotify:track:3iq9nhbI8fcnNamxMft1uv","Camila Cabello","Real Friends","Syco Music/Epic",34,151,50,"210620"
172,"spotify:track:0B8QzDH7YWih85V5SEMnyJ","Lil Uzi Vert","Money Longer","Generation Now/Atlantic",61,188,376,"210305"
173,"spotify:track:59J5nzL1KniFHnU120dQzt","Playboi Carti, Lil Uzi Vert","wokeuplikethis*","AWGE Label",52,177,287,"209597"
174,"spotify:track:1mMLMZYXkMueg65jRRWG1l","Luke Combs","When It Rains It Pours","River House Artists/Columbia Nashville",110,157,143,"207557"
175,"spotify:track:6fwdbPMwP1zVStm8FybmkO","21 Savage, Metro Boomin, Future","X (feat. Future)","Slaughter Gang, LLC",14,194,381,"207325"
176,"spotify:track:248OFOZef6ShXv6DGgbnxU","Khalid","Saved","Right Hand Music Group, LLC/RCA Records",107,180,292,"206086"
177,"spotify:track:7yyRTcZmCiyzzJlNzGC9Ol","Shelley FKA DRAM, Lil Yachty","Broccoli","EMPIRE / Atlantic Recording Corporation",6,-1,383,"205746"
178,"spotify:track:5NT0aZqWImC9fTzkW4z48o","6ix9ine","KOODA","Scumgang Records",77,178,53,"205287"
179,"spotify:track:6eYxmK9fdL4hwLnXG2zY3s","XXXTENTACION","Look At Me!","Bad Vibes Forever / EMPIRE",25,190,332,"204890"
180,"spotify:track:5xNUR50KxswPRAvx7S163g","Hugh Jackman, Keala Settle, Daniel Everidge, Zendaya, The Greatest Showman Ensemble","Come Alive","Atlantic Records",105,170,26,"204419"
181,"spotify:track:5hTpBe8h35rJ67eAWHQsJx","Aminé","Caroline","Universal Records",6,196,388,"203884"
182,"spotify:track:76DNqvSyzL9VCkhlnByqLf","Ozuna, Cardi B","La Modelo","VP Records Corp/Dimelo Vi",113,199,34,"203264"
183,"spotify:track:4PpuH4mxL0rD35mOWaLoKS","N.E.R.D, Rihanna, Pharrell Williams","Lemon","Columbia",45,-1,74,"202718"
184,"spotify:track:4vkVvmjIiQibQ6zJnC1Q9z","Matt Terry","Sucker for You","RCA Records Label",105,168,20,"202576"
185,"spotify:track:6RSNKGdv3nDTHqgw4bdzyF","Russell Dickerson","Yours","Sony Music Entertainment",154,173,37,"202024"
186,"spotify:track:3pXF1nA74528Edde4of9CC","Bryson Tiller","Don't","TrapSoul/RCA Records",77,179,377,"201318"
187,"spotify:track:5aAx2yezTd8zXrkmtKl66Z","The Weeknd, Daft Punk","Starboy","Universal Republic Records",3,200,390,"201059"
188,"spotify:track:0uxSUdBrJy9Un0EYoBowng","Lil Uzi Vert","20 Min","Generation Now/Atlantic",86,-1,38,"197264"
189,"spotify:track:3IkWmgGsXbsafrunwPojXO","Hugh Jackman, The Greatest Showman Ensemble","From Now On","Atlantic Records",114,181,26,"196557"
190,"spotify:track:6Za3190Sbw39BBC77WSS1C","Natti Natasha, Ozuna","Criminal","Pina Records",164,-1,24,"196257"
191,"spotify:track:6yr8GiTHWvFfi4o6Q5ebdT","Eminem, Nate Dogg","'Till I Collapse","Aftermath",112,192,219,"195764"
192,"spotify:track:2yLa0QULdQr0qAIvVwN6B5","Taylor Swift","...Ready For It?","Big Machine Records, LLC",1,-1,144,"195647"
193,"spotify:track:4AtZRwSR8BOTTQg5ihSggt","6LACK","PRBLMS","LVRN Records",93,185,353,"195515"
194,"spotify:track:1OAh8uOEOvTDqkKFsKksCi","DJ Khaled, Rihanna, Bryson Tiller","Wild Thoughts (feat. Rihanna & Bryson Tiller)","Epic/We The Best",1,-1,222,"195310"
195,"spotify:track:43PuMrRfbyyuz4QpZ3oAwN","Bryson Tiller","Exchange","TrapSoul/RCA Records",79,187,357,"194671"
196,"spotify:track:3wAI7MIQtTgwcRmwchPZBc","Big Sean, Metro Boomin, Travis Scott","Go Legend (& Metro Boomin)","Republic/MB/Big Sean",7,171,51,"194304"
197,"spotify:track:4fC5jw1TI59GH1emfN1wtk","Trippie Redd, 6ix9ine","Poles 1469","Strainge Entertainment",146,193,25,"194175"
198,"spotify:track:79cuOz3SPQTuFrp8WgftAu","Shawn Mendes","There's Nothing Holdin' Me Back","Island Records",26,-1,276,"193602"
199,"spotify:track:4lESS6vuruP6a79KWRaQou","Maluma, Nego do Borel","Corazón (feat. Nego do Borel)","Sony Music Latin",105,-1,34,"193456"
200,"spotify:track:5hM6sP0Gh1jD57drszNueC","Liam Payne, Rita Ora","For You (With Rita Ora)","Capitol",70,184,23,"192311"
