rank,uri,artist_names,track_name,source,peak_rank,previous_rank,days_on_chart,streams
1,"spotify:track:0dbTQYW3Ad1FTzIA9t90E8","Lil Wayne, Kendrick Lamar","Mona Lisa (feat. Kendrick Lamar)","Young Money Records, Inc.",1,1,5,"2163769"
2,"spotify:track:5BQrp63SHCVf4bzCzJePne","Lil Wayne, XXXTENTACION","Don't Cry (feat. XXXTENTACION)","Young Money Records, Inc.",2,2,5,"1607227"
3,"spotify:track:2xLMifQCjDGFmkHkpNLD9h","Travis Scott","SICKO MODE","Cactus Jack / Epic / Grand Hustle",1,5,61,"1410990"
4,"spotify:track:3wScL5W8H40zzCKN0atfBk","Lil Wayne, Swizz Beatz","Uproar","Young Money Records, Inc.",3,3,5,"1343353"
5,"spotify:track:0CBQ0m3mufWH75LTYB3s6h","Lil Wayne, Travis Scott","Let It Fly (feat. Travis Scott)","Young Money Records, Inc.",3,4,5,"1310442"
6,"spotify:track:4S8d14HvHb70ImctNgVzQQ","Kanye West, Lil Pump","I Love It (& Lil Pump)","Getting Out Our Dreams, Inc./Def Jam Recordings",1,6,26,"1305175"
7,"spotify:track:0Dn40gxVCMo5TkgS8Ik18Q","Lil Peep, XXXTENTACION","Falling Down - Bonus Track","Columbia",1,8,14,"1291002"
8,"spotify:track:0Y7di9ZCmB6Elad5WISaPc","Lil Wayne","Dedicate","Young Money Records, Inc.",4,7,5,"1148697"
9,"spotify:track:0s3nnoMeVWz3989MkNQiRf","Juice WRLD","Lucid Dreams","Juice WRLD Mixtape / ISR P&D",1,12,149,"1143579"
10,"spotify:track:3QybPutx0Tjk472bBKjNWn","Sheck Wes","Mo Bamba","Cactus Jack Records/ G.O.O.D. Music/ Interscope Records",5,14,68,"1142926"
11,"spotify:track:4w8niZpiMy6qz1mntFA5uM","DJ Snake, Selena Gomez, Ozuna, Cardi B","Taki Taki (with Selena Gomez, Ozuna & Cardi B)","DJ Snake Music Productions Limited, under exclusive license to Geffen Records",11,11,5,"1119336"
12,"spotify:track:2dpaYNEQHiRxtZbfNsse99","Marshmello, Bastille","Happier","Astralwerks",7,13,47,"1113099"
13,"spotify:track:3JX0dOCIAiaR8MP3ryXWuM","Lil Wayne, Sosamann","What About Me (feat. Sosamann)","Young Money Records, Inc.",7,10,5,"1090129"
14,"spotify:track:5cGpjfgAvidLy6znwkCxkP","Lil Wayne","Can't Be Broken","Young Money Records, Inc.",6,9,5,"1077093"
15,"spotify:track:2E124GmJRnBJuXbTb4cPUB","6ix9ine, Nicki Minaj, Murda Beatz","FEFE","Scumgang Records/TenThousand Projects, LLC",2,15,73,"1000411"
16,"spotify:track:1BxkZE73h9BN3qwuA15TA3","Lil Baby, Gunna","Drip Too Hard (Lil Baby & Gunna)","Quality Control Music/Young Stoner Life Records, a 300 Entertainment Label/Motown Records/Capitol Records",13,16,21,"994718"
17,"spotify:track:0JP9xo3adEtGSdUEISiszL","XXXTENTACION","Moonlight","Bad Vibes Forever, LLC",2,21,201,"987865"
18,"spotify:track:3ee8Jmje8o58CHK66QrVC2","XXXTENTACION","SAD!","Bad Vibes Forever, LLC",1,19,215,"958580"
19,"spotify:track:0TlLq3lA83rQOYtrqBqSct","Drake","Nonstop","Cash Money/Drake LP6",1,22,96,"910313"
20,"spotify:track:0Fpen1PTuEnCmOJtUU9Iud","Lil Uzi Vert","New Patek","Generation Now/Atlantic",1,20,15,"907327"
21,"spotify:track:60SdxE8apGAxMiRrpbmLY0","Eminem, Joyner Lucas","Lucky You (feat. Joyner Lucas)","Aftermath",1,23,33,"844607"
22,"spotify:track:0QIjsbm2fh1cJ45XO9eGqq","Gucci Mane, Bruno Mars, Kodak Black","Wake Up in the Sky","Guwop Enterprises/Atlantic",6,27,19,"831219"
23,"spotify:track:4T3fNx3CgwDRRYgmFCbD4J","Khalid","Better","Right Hand Music Group, LLC/RCA Records",8,25,19,"828841"
24,"spotify:track:05r1GGg1Rhs0RcUg27C82a","Lil Wayne, Reginae Carter","Famous (feat. Reginae Carter)","Young Money Records, Inc.",12,18,5,"773558"
25,"spotify:track:5IvdLxVB8gwwcgnEkXSSW2","Lil Wayne, Nicki Minaj","Dark Side Of The Moon (feat. Nicki Minaj)","Young Money Records, Inc.",7,17,5,"768289"
26,"spotify:track:7dt6x5M1jzdTEt8oCbisTK","Post Malone","Better Now","Republic Records",1,29,159,"754664"
27,"spotify:track:2G7V7zsVDxg1yRsu7Ew9RJ","Drake","In My Feelings","Cash Money/Drake LP6",1,30,96,"750203"
28,"spotify:track:0d2iYfpKoM0QCKvcLCkBao","benny blanco, Halsey, Khalid","Eastside (with Halsey & Khalid)","Benny Blanco Solo Album PS",7,28,82,"746021"
29,"spotify:track:7d6XJZjnm7iWcKwYL9z5kC","Lil Mosey","Noticed","Mogul Vision/Interscope Records",17,31,47,"729202"
30,"spotify:track:6vN77lE9LK6HP2DewaN6HZ","Lil Baby, Drake","Yes Indeed","Quality Control Music, LLC",2,33,141,"705880"
31,"spotify:track:2AwyHlbA6f641SEkizD5JG","Lil Wayne, Snoop Dogg","Dope Niggaz (feat. Snoop Dogg)","Young Money Records, Inc.",11,24,5,"694854"
32,"spotify:track:5IaHrVsrferBYDm0bDyABy","Tyga, Offset","Taste (feat. Offset)","Last Kings Music / EMPIRE",3,35,138,"692246"
33,"spotify:track:7m9OqQk4RVRkw9JJdeAw96","XXXTENTACION","Jocelyn Flores","Bad Vibes Forever / EMPIRE",2,37,404,"672691"
34,"spotify:track:2DnH4XlEkghUdE8ymdVom5","Lil Wayne","Open Letter","Young Money Records, Inc.",10,26,5,"659992"
35,"spotify:track:15kQGEy89K8deJcZVFEn0N","The Chainsmokers, Kelsea Ballerini","This Feeling","Disruptor Records/Columbia",33,43,12,"652222"
36,"spotify:track:1jo3TwNGCXfNdB5uba3ZVv","Eminem","Killshot","Aftermath",16,41,14,"626057"
37,"spotify:track:58q2HKrzhC3ozto2nDdN4z","Cardi B, Bad Bunny, J Balvin","I Like It","Atlantic/KSR",2,42,180,"600095"
38,"spotify:track:7AQim7LbvFVZJE3O8TYgf2","XXXTENTACION, Trippie Redd","Fuck Love (feat. Trippie Redd)","Bad Vibes Forever / EMPIRE",5,45,404,"593859"
39,"spotify:track:0ubdf6zWT1It2saK41SkO0","Lil Wayne","Problems","Young Money Records, Inc.",13,32,5,"581367"
40,"spotify:track:14mHfNsSHN0FbLftyjrV9g","Flipp Dinero","Leave Me Alone","Cinematic/Epic/We The Best",29,51,52,"571758"
41,"spotify:track:0ZNrc4kNeQYD9koZ3KvCsy","YG, 2 Chainz, Big Sean, Nicki Minaj","BIG BANK (feat. 2 Chainz, Big Sean, Nicki Minaj)","Def Jam Recordings",21,47,131,"568472"
42,"spotify:track:7wBJfHzpfI3032CSD7CE2m","Travis Scott","STARGAZING","Cactus Jack / Epic / Grand Hustle",1,49,61,"568317"
43,"spotify:track:2uMTscYuCT3BZ0OCzH3MwN","Kodak Black","If I'm Lyin', I'm Flyin'","Atlantic Records",39,39,5,"558202"
44,"spotify:track:4zIO3ilp5HvTeK3HJHxhMP","Imagine Dragons","Natural","Kid Ina Korner / Interscope",21,48,75,"553829"
45,"spotify:track:3BUWNzPWz2mDbptZmGEXpB","Lil Wayne","Let It All Work Out","Young Money Records, Inc.",27,40,5,"552399"
46,"spotify:track:5s6pKnF3ZPtuqvEx1i1V7U","Lil Wayne","Hittas","Young Money Records, Inc.",14,34,5,"551623"
47,"spotify:track:0XySogm94T51XF5F2jumXm","Juice WRLD","All Girls Are The Same","Juice WRLD Mixtape / ISR P&D",12,50,165,"548630"
48,"spotify:track:7EgI0dCaQuHFe3OTj5EpWI","Lil Wayne","Open Safe","Young Money Records, Inc.",15,36,5,"541114"
49,"spotify:track:7AFASza1mXqntmGtbxXprO","XXXTENTACION","changes","Bad Vibes Forever, LLC",4,55,215,"536650"
50,"spotify:track:29tc0GbW0pTSBZSCZF3NWk","Juice WRLD","Lean Wit Me","Juice WRLD Mixtape / ISR P&D",25,56,133,"528039"
51,"spotify:track:1Dk3CfJEtqvj7Xg2AWwfEn","Lil Wayne","Took His Time","Young Money Records, Inc.",16,38,5,"523147"
52,"spotify:track:4OafepJy2teCjYJbvFE60J","Ariana Grande","breathin","Republic Records",4,54,47,"516047"
53,"spotify:track:04MLEeAMuV9IlHEsD8vF6A","French Montana, Drake","No Stylist (feat. Drake)","Epic",14,53,12,"515959"
54,"spotify:track:0UyljEbX9dqI1K0sqdv6B6","Joji","SLOW DANCING IN THE DARK","88rising Music/Warner Records",26,76,21,"505283"
55,"spotify:track:3swc6WTsr7rl9DqQKQA55C","Post Malone, Ty Dolla $ign","Psycho (feat. Ty Dolla $ign)","Republic Records",1,61,222,"494513"
56,"spotify:track:2iUXsYOEPhVqEBwsqP70rE","5 Seconds of Summer","Youngblood","Capitol",12,57,172,"492231"
57,"spotify:track:7lAK3oHbfEnvUQWosrMMpR","Travis Scott","YOSEMITE","Cactus Jack / Epic / Grand Hustle",7,68,61,"491995"
58,"spotify:track:6y4pOReFqH2wzo4CV91cZC","Lil Wayne","Mess","Young Money Records, Inc.",23,44,5,"487588"
59,"spotify:track:3obgSF06ki98lYNLNq5vCB","Juice WRLD, Lil Uzi Vert","Wasted (feat. Lil Uzi Vert)","Juice WRLD Mixtape / ISR P&D",20,64,85,"485410"
60,"spotify:track:1Jl21sidRpEdlVBvYbssLx","Young Thug, Jaden","Sin (feat. Jaden Smith)","300 Entertainment/Atl",24,59,9,"481314"
61,"spotify:track:6DCZcSspjsKoFjzjrWoCdn","Drake","God's Plan","Cash Money/Drake LP6",1,63,256,"472706"
62,"spotify:track:68lOQPb5tX8U2cQRuas0L2","Lil Wayne","Used 2","Young Money Records, Inc.",25,46,5,"469148"
63,"spotify:track:0e7ipj03S05BNilyu5bRzt","Post Malone, 21 Savage","rockstar (feat. 21 Savage)","Republic Records",1,74,383,"467125"
64,"spotify:track:5OCJzvD7sykQEKHH7qAC3C","Ariana Grande","God is a woman","Republic Records",4,62,82,"465080"
65,"spotify:track:7noud145AHZGg74vpWOsCa","Ella Mai","Trip","10 Summers / Interscope PS",56,71,34,"464100"
66,"spotify:track:4VUwkH455At9kENOfzTqmF","Bazzi, Camila Cabello","Beautiful (feat. Camila Cabello)","iamcosmic",28,65,61,"462249"
67,"spotify:track:0OgGn1ofaj55l2PcihQQGV","Bryce Vine","Drew Barrymore","Sire",45,67,47,"452442"
68,"spotify:track:5WvAo7DNuPRmk4APhdPzi8","DJ Khaled, Justin Bieber, Quavo, Chance the Rapper","No Brainer","Epic/We The Best",3,66,68,"451255"
69,"spotify:track:5N4erncE7kuUccm7zEmwzk","Silk City, Dua Lipa, Diplo, Mark Ronson","Electricity (with Dua Lipa)","Columbia",25,70,26,"445811"
70,"spotify:track:5N5k9nd479b1xpDZ4usjrg","Calvin Harris, Sam Smith, Jessie Reyez","Promises (with Sam Smith)","Columbia",18,73,47,"443662"
71,"spotify:track:7fa9MBXhVfQ8P8Df9OEbD8","Maroon 5, Cardi B","Girls Like You (feat. Cardi B) - Cardi B Version","Interscope Records*",6,72,124,"439330"
72,"spotify:track:5qHirGR7M9tdm6C17DlzSY","Aminé","REEL IT IN","Republic Records",52,75,27,"436916"
73,"spotify:track:75ZvA4QfFiZvzhj2xkaWAh","Post Malone","I Fall Apart","Universal Records",2,79,382,"434979"
74,"spotify:track:1kaxyXcAi5ZHF3Q94QXsHK","Lil Wayne","Demon","Young Money Records, Inc.",22,52,5,"433489"
75,"spotify:track:3GVkPk8mqxz0itaAriG1L7","XXXTENTACION","Everybody Dies In Their Nightmares","Bad Vibes Forever / EMPIRE",6,82,399,"429772"
76,"spotify:track:5bJ1DrEM4hNCafcDd1oxHx","Mac Miller","Self Care","Warner Records",4,78,41,"428006"
77,"spotify:track:3EPXxR3ImUwfayaurPi3cm","Dean Lewis","Be Alright","Universal Music Australia Pty. Ltd.",19,80,65,"425998"
78,"spotify:track:3CA9pLiwRIGtUBiMjbZmRw","Drake","Nice For What","Cash Money/Drake LP6",1,81,179,"424900"
79,"spotify:track:4qKcDkK6siZ7Jp1Jb4m0aL","BlocBoy JB, Drake","Look Alive (feat. Drake)","OVO Sound/Warner Records",2,83,236,"422940"
80,"spotify:track:7ycWLEP1GsNjVvcjawXz3z","A$AP Rocky, Skepta","Praise The Lord (Da Shine) (feat. Skepta)","A$AP Worldwide/Polo Grounds Music/RCA Records",5,88,131,"413795"
81,"spotify:track:4E3qImtJzRqLt8ZZyLceOE","Lil Wayne","Perfect Strangers","Young Money Records, Inc.",30,60,5,"403313"
82,"spotify:track:6wqWfSOZvTK18SAczoYm1L","Lil Wayne, Ashanti, Mack Maine","Start This Shit Off Right (feat. Ashanti & Mack Maine)","Young Money Records, Inc.",21,58,5,"399758"
83,"spotify:track:45Egmo7icyopuzJN0oMEdk","Khalid, Normani","Love Lies (with Normani)","RCA Records Label",8,87,229,"396072"
84,"spotify:track:2qT1uLXPVPzGgFOx4jtEuo","Ariana Grande","no tears left to cry","Republic Records",6,86,166,"390186"
85,"spotify:track:0u2P5u6lvoDfwTYjAADbn4","Billie Eilish, Khalid","lovely (with Khalid)","Darkroom",18,85,166,"390059"
86,"spotify:track:2jt2WxXMCD4zjACthkJQVE","Eminem","The Ringer","Aftermath",2,90,33,"385139"
87,"spotify:track:4mHgYpuGHu99Mw69E83CP2","Trippie Redd","Taking A Walk","TenThousand Projects, LLC",6,91,58,"373429"
88,"spotify:track:1FmdAhS8FqRoEJ4jcSfuKZ","Logic, Jaden","ICONIC (ft. Jaden Smith)","Def Jam Recordings",54,77,5,"369582"
89,"spotify:track:7cG6SxmQ24hQWnR8UThrk2","Lil Wayne, Nivea","Dope New Gospel (feat. Nivea)","Young Money Records, Inc.",29,69,5,"368211"
90,"spotify:track:2ZRo7axmMPeSVUvDbGkJah","XXXTENTACION","Hope","Bad Vibes Forever, LLC",10,98,142,"366141"
91,"spotify:track:5a8RPWgKSmcGBGcffmIrUi","Sia, Diplo, Labrinth, LSD","Thunderclouds (feat. Sia, Diplo, and Labrinth)","Records/Columbia",41,93,54,"360593"
92,"spotify:track:4UKCKdYiLN6IMA5ZESUTL7","XXXTENTACION","the remedy for a broken heart (why am I so in love)","Bad Vibes Forever, LLC",8,99,168,"359911"
93,"spotify:track:7IBSffWIu7P2MC7kMwy2FM","Wiz Khalifa, Swae Lee","Hopeless Romantic (feat. Swae Lee)","Taylor Gang/Atlantic",29,96,91,"358771"
94,"spotify:track:7GX5flRQZVHRAGd6B4TmDO","Lil Uzi Vert","XO Tour Llif3","Generation Now/Atlantic",1,102,558,"355757"
95,"spotify:track:7sO5G9EABYOXQKNPNiE9NR","Offset, Metro Boomin","Ric Flair Drip (with Metro Boomin)","Slaughter Gang, LLC/Epic/Quality Control Music/Motown/Capitol/Boominati Worldwide/Republic",4,104,337,"352217"
96,"spotify:track:7iMDaY1LnASwCk2uUpMtii","Young Thug, Elton John","High (feat. Elton John)","300 Entertainment/Atl",60,92,9,"350813"
97,"spotify:track:33tNYw9oMtSkGe27NpgS64","Quavo","WORKIN ME","Quality Control Music/Motown Records/Capitol Records",32,107,54,"349010"
98,"spotify:track:6Hgh47WXVKtXN5zGOu0hjI","Khalid, 6LACK, Ty Dolla $ign","OTW","Right Hand Music Group, LLC/RCA Records",17,106,166,"346486"
99,"spotify:track:6eYxmK9fdL4hwLnXG2zY3s","XXXTENTACION","Look At Me!","Bad Vibes Forever / EMPIRE",20,109,473,"346034"
100,"spotify:track:3V8UKqhEK5zBkBb6d6ub8i","Nio Garcia, Casper Magico, Bad Bunny, Darell, Ozuna, Nicky Jam","Te Boté - Remix","2018 Flow La Movie, Inc.",35,103,170,"343663"
101,"spotify:track:5lK18Pt33xNudq4qYDxIm8","Lady Gaga, Bradley Cooper","Shallow","A Star is Born OST",58,105,5,"339226"
102,"spotify:track:1rqqCSm0Qe4I9rUvWncaom","Panic! At The Disco","High Hopes","DCD2 / Fueled By Ramen",33,101,113,"338841"
103,"spotify:track:6VDz4m1vEGHDDqQojf1mpc","Logic, Ghostface Killah, Raekwon, RZA, Method Man, Inspectah Deck, Cappadonna, Jackpot Scotty Wotty, U-God, Masta Killa, GZA","Wu Tang Forever (ft. Ghostface Killah, Raekwon, RZA, Method Man, Inspectah Deck, Cappadonna, Jackpot Scotty Wotty, U-God, Masta Killa, GZA)","Def Jam Recordings",46,84,5,"329451"
104,"spotify:track:2P91MQbaiQOfbiz9VqhqKQ","Lauv","I Like Me Better","Lauv",30,108,481,"329003"
105,"spotify:track:1ZAyjvIk9YiD76yYy0TEG6","Rich The Kid","Plug Walk","Rich The Kid / (TDE/ISR PS)",6,116,236,"327300"
106,"spotify:track:4CstQ0SUkl0YkoeZkIZlIx","Logic, Wale, John Lindahl","100 Miles and Running (ft. Wale & John Lindahl)","Def Jam Recordings",44,89,5,"326852"
107,"spotify:track:7oJrVhiTPZGBXWPwhxjy9S","Lil Skies","Lust","All We Got Ent.",75,113,240,"326839"
108,"spotify:track:7ATATJztoWLcqDAcVVof0C","6ix9ine, Anuel AA","BEBE","Scumgang Records/TenThousand Projects, LLC",34,112,33,"320599"
109,"spotify:track:2Yer0p7uB2lVBUAtANuuQp","Social House, Lil Yachty","Magic In The Hamptons (feat. Lil Yachty)","Silent Records / Social House",76,111,48,"313735"
110,"spotify:track:4kWO6O1BUXcZmaxitpVUwp","Tiësto, Dzeko, Preme, Post Malone","Jackie Chan","Universal Music, a division of Universal International Music BV",18,117,138,"310820"
111,"spotify:track:4e4fqjx0Izh4svvTef1z7e","Bebe Rexha, Florida Georgia Line","Meant to Be (feat. Florida Georgia Line)","Warner Bros.",15,115,389,"309275"
112,"spotify:track:7rC5Pl8rQSX4myONQHYPBK","Drake","Mob Ties","Cash Money/Drake LP6",5,122,96,"301979"
113,"spotify:track:3irKogkH8P1B1nONmEcHgY","Logic","YSIV","Def Jam Recordings",56,94,5,"300406"
114,"spotify:track:5ZcMWSpUeUPvO87FkSZbJB","Logic","The Return","Def Jam Recordings",37,97,20,"297758"
115,"spotify:track:2Egoo3acImq7hV6TfYV90E","Logic","Everybody Dies","Def Jam Recordings",46,95,9,"296405"
116,"spotify:track:3a1lNhkSLSkpJE4MSHpDu9","Post Malone, Quavo","Congratulations","Universal Records",5,130,640,"295589"
117,"spotify:track:1Knctxx9vGZxpZfF66BIEa","Juice WRLD","Legends","Juice WRLD / Interscope PS",67,124,103,"294443"
118,"spotify:track:3ngc7rGlfeFaskU90EWl4R","Lauren Daigle","You Say","Centricity Music/Warner Records",116,129,16,"293944"
119,"spotify:track:43TP6JCWXgkc2D7Xjz5hBr","Machine Gun Kelly","RAP DEVIL","Bad Boy / Interscope",36,121,24,"292660"
120,"spotify:track:58QhkbaAkLFnn7JwAnAato","Eminem","Fall","Aftermath",8,125,33,"289438"
121,"spotify:track:48zFZh27QU5qsrBjn4C2FA","Ozuna, Manuel Turizo","Vaina Loca","VP Records Corp/Dimelo Vi",49,127,43,"289090"
122,"spotify:track:7uzmGiiJyRfuViKKK3lVmR","Bazzi","Mine","iamcosmic",3,119,261,"288450"
123,"spotify:track:28FGV3ORH14MYORd7s5dlU","Eminem, Royce Da 5'9""","Not Alike (feat. Royce Da 5'9)","Aftermath",5,126,33,"288262"
124,"spotify:track:7KXjTSCq5nL1LoYtL7XAwS","Kendrick Lamar","HUMBLE.","Aftermath",1,132,551,"288097"
125,"spotify:track:5Z3GHaZ6ec9bsiI5BenrbY","Khalid","Young Dumb & Broke","Right Hand Music Group, LLC/RCA Records",5,123,546,"287933"
126,"spotify:track:0At2qAoaVjIwWNAqrscXli","Ella Mai","Boo'd Up","10 Summers / Interscope PS",24,128,144,"287870"
127,"spotify:track:6jreFSOTUAViWjKyzOC4Kg","Alesso","REMEDY","10:22 pm",58,120,28,"287779"
128,"spotify:track:2u7mxWSeoqTXndK5e08jMp","Lil Skies, Landon Cube","Nowadays (feat. Landon Cube)","All We Got Ent.",24,134,277,"284375"
129,"spotify:track:3qN5qMTKyEEmiTZD38BNTT","Drake","I'm Upset","Cash Money/Drake LP6",4,131,129,"284310"
130,"spotify:track:5PTG6rrL6EPFD9E2QMI2pl","Famous Dex","JAPAN","300 Entertainment",11,137,201,"283290"
131,"spotify:track:32lItqlMi4LBhb4k0BaSaC","Post Malone","Candy Paint","Republic Records",4,139,495,"280574"
132,"spotify:track:4hQ6UGyWQIGJmHSo0J88JW","Selena Gomez","Back To You - From 13 Reasons Why – Season 2 Soundtrack","UMGRI Interscope",15,136,145,"278210"
133,"spotify:track:6yz0Jndhv0QjKdpcEMbOjz","Trippie Redd","Shake It Up","TenThousand Projects, LLC",42,146,54,"277194"
134,"spotify:track:6IaieqiCVvsNvEt6Y7yOFa","Post Malone, Nicki Minaj","Ball For Me (feat. Nicki Minaj)","Republic Records",8,140,159,"276983"
135,"spotify:track:40oKW22ZNNkEdZLJTScaQI","Kodak Black, XXXTENTACION","Roll in Peace (feat. XXXTENTACION)","Atlantic Records",21,141,402,"275318"
136,"spotify:track:6gBFPUFcJLzWGx4lenP6h2","Travis Scott","goosebumps","Epic/Grand Hustle",16,142,640,"273892"
137,"spotify:track:2zIAPysksDdMAiG33qH6kW","Logic, Hailee Steinfeld","Ordinary Day (ft. Hailee Steinfeld)","Def Jam Recordings",64,110,5,"270666"
138,"spotify:track:1gm616Plq4ScqNi7TVkZ5N","The Weeknd","Call Out My Name","Universal Republic Records",1,138,187,"269530"
139,"spotify:track:09IStsImFySgyp0pIQdqAc","Zedd, Maren Morris, Grey","The Middle","UMGRI Interscope",5,135,251,"269280"
140,"spotify:track:6xcJyGpfZbuuiequtnlKt4","Travis Scott","BUTTERFLY EFFECT","Cactus Jack / Epic / Grand Hustle",9,144,501,"267782"
141,"spotify:track:0kCBorRrKZkSztd9m0QI3r","Young Thug, Young Stoner Life, Gunna, Lil Baby","Chanel (Go Get It) [feat. Gunna & Lil Baby]","300 Entertainment/Atl",30,148,47,"267583"
142,"spotify:track:575NJxNUVDqwJGdzBrlLbv","Shawn Mendes, Zedd","Lost In Japan - Remix","Island Records",16,150,55,"264731"
143,"spotify:track:0ibOcbkp2XG46Do8jcy0bL","Smokepurpp, Lil Pump","Nephew (feat. Lil Pump)","Alamo",75,160,67,"263507"
144,"spotify:track:6f5i916F3jU6BhOOD7iGqf","MadeinTYO, A$AP Ferg","Ned Flanders (feat. A$AP Ferg)","Commission/BMG",64,155,81,"262830"
145,"spotify:track:6n4U3TlzUGhdSFbUUhTvLP","Migos, Drake","Walk It Talk It","Quality Control Music, LLC",3,149,250,"261133"
146,"spotify:track:3ZhTT6yjZwpPph5MIJ53XY","Lil Skies, Landon Cube","Red Roses (feat. Landon Cube)","All We Got Ent.",36,153,274,"260808"
147,"spotify:track:3ZVw1HR1QAQoKBygbhG4CE","Lil Wayne","I Love You Dwayne","Young Money Records, Inc.",9,100,5,"260526"
148,"spotify:track:066QkK1heGoXBUPBbcOhEG","Logic","The Glorious Five","Def Jam Recordings",52,114,5,"259874"
149,"spotify:track:7rKKh8AGVXuNXgLBpTBTFH","Logic, Ryan Tedder","One Day (ft. Ryan Tedder)","Def Jam Recordings",20,118,19,"259805"
150,"spotify:track:152lZdxL1OR0ZMW6KquMif","Khalid","Location","Right Hand Music Group, LLC/RCA Records",9,151,639,"259102"
151,"spotify:track:3GJ4hzg4lrGwU51Y3VARbF","Dan + Shay","Speechless","Warner Records",132,167,46,"258910"
152,"spotify:track:1co0puPTYvqAdUEjFOjne9","Florida Georgia Line","Simple","BMLG Records",50,133,124,"258623"
153,"spotify:track:5gQcxYXqnofyocKgEbGYKt","YBN Nahmir","Bounce Out With That","2018",27,159,243,"257405"
154,"spotify:track:0dSIrRkA4PadGll16TgbnV","Famous Dex, A$AP Rocky","PICK IT UP (feat. A$AP Rocky)","300 Entertainment",13,164,341,"255265"
155,"spotify:track:3qnoOm4fwZPBS116f5hpgF","Kanye West","All Mine","Getting Out Our Dreams, Inc./Def Jam Recordings",1,143,123,"254295"
156,"spotify:track:7eBqSVxrzQZtK2mmgRG6lC","YNW Melly","Murder On My Mind","P2018",111,157,12,"253189"
157,"spotify:track:2XTquzYQAdT1Hk78bOUwsv","Eminem","Greatest","Aftermath",3,158,33,"251624"
158,"spotify:track:1RagpNpkD3KcjXMLGMe99V","Wiz Khalifa, Lil Skies","Fr Fr (feat. Lil Skies)","Taylor Gang/Atlantic",45,145,66,"251227"
159,"spotify:track:42fw0rxRO2xbesF6mJfd4Y","Dan + Shay","Tequila","Warner Records",48,156,221,"250232"
160,"spotify:track:1BuZAIO8WZpavWVbbq3Lci","Rae Sremmurd, Swae Lee, Slim Jxmmi, Juicy J","Powerglide (feat. Juicy J) - From SR3MM","Mike WiLL Made-It",15,165,216,"249255"
161,"spotify:track:04ZTP5KsCypmtCmQg5tH9R","Bebe Rexha","I'm a Mess","Warner Bros.",63,147,103,"248759"
162,"spotify:track:55GiOwtxNajXVbpjjIzMnD","Tyga","SWISH","Last Kings Music / EMPIRE",23,169,69,"247258"
163,"spotify:track:2SL6oP2YAEQbqsrkOzRGO4","Eminem","Venom - Music From The Motion Picture","Aftermath",17,168,33,"246395"
164,"spotify:track:2bSk87AVkCIIC3Bcligq1z","Lil Baby, Gunna, Lil Uzi Vert","Life Goes On","Quality Control Music, LLC",87,176,138,"243222"
165,"spotify:track:5Xn4IyTtW6FUGIUyWjbUHG","Jason Derulo, David Guetta, Nicki Minaj, Willy William","Goodbye (feat. Nicki Minaj & Willy William)","Beluga Heights/Warner Records",85,171,26,"243102"
166,"spotify:track:1zB4vmk8tFRmM9UULNzbLB","Imagine Dragons","Thunder","Kid Ina Korner / Interscope",16,170,523,"242587"
167,"spotify:track:2BJSMvOGABRxokHKB0OI8i","Playboi Carti, Lil Uzi Vert","Shoota (feat. Lil Uzi Vert)","AWGE Label",23,174,145,"242382"
168,"spotify:track:0E9ZjEAyAwOXZ7wJC0PD33","Dynoro, Gigi D'Agostino","In My Mind","Columbia/B1 Recordings",50,166,71,"242266"
169,"spotify:track:7K7MUBCnzgBAvMVW2RTWNs","Loud Luxury, Brando","Body","Armada Music",22,162,110,"241345"
170,"spotify:track:0chpIFSjgfd1CPrAxM7PWp","Lil Skies","No Rest","All We Got Ent.",103,177,47,"240926"
171,"spotify:track:41zXlQxzTi6cGAjpOXyLYH","Billie Eilish","idontwannabeyouanymore","Darkroom",129,163,76,"240805"
172,"spotify:track:51rXHuKN8Loc4sUlKPODgH","Jay Rock, Kendrick Lamar, Future, James Blake","King's Dead (with Kendrick Lamar, Future & James Blake)","Black Panther (TDE/DMG) PS",7,186,264,"238039"
173,"spotify:track:0pqnGHJpmpxLKifKRmU6WP","Imagine Dragons","Believer","Kid Ina Korner / Interscope",9,173,608,"237475"
174,"spotify:track:01TnVDiet1DFTsyWKUKovl","XXXTENTACION","NUMB","Bad Vibes Forever, LLC",9,185,140,"236388"
175,"spotify:track:0wbnC9AUenxp613TYaJsGK","Migos","Narcos","Quality Control Music, LLC",2,184,211,"236031"
176,"spotify:track:2hnxrRNzF74mdDzpQZQukQ","Lauv, Julia Michaels","There's No Way (feat. Julia Michaels)","Lauv",110,187,4,"235038"
177,"spotify:track:5tz69p7tJuGPeMGwNTxYuV","Logic, Alessia Cara, Khalid","1-800-273-8255","Def Jam Recordings",1,179,522,"234008"
178,"spotify:track:3GCdLUSnKSMJhs4Tj6CV3s","Kendrick Lamar, SZA","All The Stars (with SZA)","Black Panther (TDE/DMG) PS",2,190,272,"233698"
179,"spotify:track:0n22yqkitWec0PV6tibWEO","Famous Dex, Jay Critch, Lil Baby, Rich The Kid","Nervous (feat. Lil Baby, Jay Critch & Rich the Kid)","300 Entertainment",103,-1,8,"233510"
180,"spotify:track:2UVbBKQOdFAekPTRsnkzcf","Migos","Stir Fry","Quality Control Music, LLC",2,182,285,"232781"
181,"spotify:track:52okn5MNA47tk87PeZJLEL","NF","Let You Down","NF Real Music",9,180,359,"232408"
182,"spotify:track:1HXy5I3HTWq8OvxCn0z7G7","Kane Brown","Heaven","RCA Records Label Nashville",51,154,261,"231374"
183,"spotify:track:25sgk305KZfyuqVBQIahim","Ava Max","Sweet but Psycho","Atlantic Records",183,-1,1,"229903"
184,"spotify:track:2eAZfqOm4EnOF9VvN50Tyc","Lil Uzi Vert, Oh Wonder","The Way Life Goes (feat. Oh Wonder)","Generation Now/Atlantic",4,193,399,"228853"
185,"spotify:track:4vaxvNDaLSoD36iZX515ug","Lil Xan","Betrayed","Columbia",21,192,352,"228693"
186,"spotify:track:0tgVpDi06FyKpA1z0VMD4v","Ed Sheeran","Perfect","Atlantic Records UK",11,178,463,"228437"
187,"spotify:track:4OBZT9EnhYIV17t4pGw7ig","H.E.R., Daniel Caesar","Best Part (feat. Daniel Caesar)","MBK Entertainment/RCA Records",127,175,125,"228041"
188,"spotify:track:2fQrGHiQOvpL9UgPvtYy6G","21 Savage","Bank Account","Slaughter Gang, LLC/Epic Records",1,196,453,"226801"
189,"spotify:track:2gsNpSn7VvvJuSrIDfRoYy","Eminem","Kamikaze","Aftermath",8,191,33,"224933"
190,"spotify:track:7vGuf3Y35N4wmASOKLUVVU","Marshmello, Khalid","Silence","Joytime Collective/RCA Records",7,189,381,"224302"
191,"spotify:track:4zRZAmBQP8vhNPf9i9opXt","Why Don't We","8 Letters","Atlantic Records",93,188,32,"224077"
192,"spotify:track:2rxQMGVafnNaRaXlRMWPde","Luke Combs","Beautiful Crazy","River House Artists/Columbia Nashville",103,152,121,"223229"
193,"spotify:track:4H7WNRErSbONkM06blBoGc","Post Malone","Stay","Republic Records",4,197,155,"223174"
194,"spotify:track:1rfofaqEpACxVEHIZBJe6W","Camila Cabello, Young Thug","Havana (feat. Young Thug)","Syco Music/Epic",2,194,424,"221763"
195,"spotify:track:4dVpf9jZjcORqGTLUaeYj9","A$AP Ferg","Plain Jane","RCA Records Label",6,-1,399,"221287"
196,"spotify:track:0CBFOvHlyqy30Q5tbyNHfQ","Dua Lipa","Want To","Warner Records",161,-1,4,"221071"
197,"spotify:track:6G8kHiVZ1jW7vHMPVRNZU0","Drake, Michael Jackson","Don’t Matter To Me (with Michael Jackson)","Cash Money/Drake LP6",2,195,94,"220723"
198,"spotify:track:6nO3tr47nr2P7f3hXb8JIo","NAV, Travis Scott","Champion (feat. Travis Scott)","Republic Records",47,-1,134,"220150"
199,"spotify:track:27a1mYSG5tYg7dmEjWBcmL","Travis Scott","CAN'T SAY","Cactus Jack / Epic / Grand Hustle",15,199,58,"219914"
200,"spotify:track:4DTpngLjoHj5gFxEZFeD3J","Kodak Black, Lil Wayne","Codeine Dreaming (feat. Lil Wayne)","Atlantic Records",10,183,218,"219200"
